"Index","Telugu Text","Mapped English Text"
"158","నేను చాలాకాలంగా నీ చెత్తనంతా భరిస్తున్నాను.","I put up with your shit for so fucking long."
"159","నువ్వు నా కళ్లలోకి చూడాలి ఎందుకంటే ఇదంతా జరగదని నీకు అర్థం అవుతుంది!","I want you to look me in the eye so you can hear that this is not fucking happening!"
"160","నీకు ఒక అవకాశం కావాలా? నాకు ఉన్న అవకాశాన్ని నీకు చూపిస్తాను.","You want some leverage? I'll show you my fucking leverage."
"161","నేను నా అవకాశాన్ని నీ ముఖాన కొడతాను. నేను సమ్మెకి దిగుతున్నాను!","I'm gonna squirt leverage in your fucking face. I'm going on strike!"
"162","ఏదైనా చేసుకో, బ్రదర్. నువ్వు సమ్మె చేస్తావా?","Fuck you, bro. , you're going on strike?"
"163","నీ వ్యాపారం మీదనే నువ్వు సమ్మె చేస్తావా?","You're going on strike on your business?"
"164","నేను ఖచ్చితంగా సమ్మె చేస్తున్నాను. నేను లేకుండా ఈ దుకాణం ఎలా నడుస్తుందో చూద్దాం, హా?",", I sure as fuck am. Let's see how well this place runs without me around, huh?"
"165","డా బూచ్ వ్యాపారంలో నాకు వాటా ఇచ్చాకే నేను తిరిగొస్తాను.","I will return when I am cut into Daa Booch."
"166","అన్నట్లు, మెజారిటీ షేర్లు ఉన్న యజమానిగా నేను ఇచ్చే మొదటి ఆదేశం, ఆ చెత్త పేరుని నేను మార్చేయబోతున్నాను.","And by the way, my first order of business as majority shareholder, I'm changing that fucking name."
"167","వెళ్లు.","Dick."
"168","అతను తిరిగి వచ్చేస్తాడు.",", he'll be back."
"169","ఒకటి, రెండు, మూడు లెక్క పెట్టేలోగా, నాలుగు.","In one, two, three, four."
"170","ఓహ్, చెత్త.",", shit."
"171","ఒమర్, అతను వెళ్లిపోతే ట్యాంక్ రూమ్ ని నువ్వు చూసుకోగలవా?","Omar, can you take care of the tank room while he's gone?"
"172","అతడిని చూస్తే నమ్మకం కుదరడం లేదు. అంటే, తను చాలా విజయాలు సాధించింది. తను ఎలాంటి బోర్డులలో ఉందో చూడు.","That does not inspire confidence. I mean, she's so accomplished. Look at all the boards she's on."
"173","ఓహ్, దేవుడా. ఆమె ఏ బోర్డులలో ఉందో ఎవరు పట్టించుకుంటారు?",", my God. Who gives a shit what boards she's on?"
"174","ఆమె ఒక క్రేజీ మనిషిలా కనిపిస్తోంది. ఆమె ఏమీ కోనే బారెట్ లాగా కనిపిస్తోంది.","She looks like a crazy person. She looks like Amy Coney Barrett."
"175","నీ ఉద్దేశం, అమెరికాలోనే అత్యంత శక్తిమంతమైన మహిళ మాదిరిగానా?","You mean, one of the most powerful women in America?"
"176","అవును. కానీ నా ఉద్దేశం నీకు అర్థమయ్యే ఉంటుంది.","Yes. But I think you get my point."
"177","అంటే, తను ఇవన్నీ చేయడానికి తగిన సమయం తనకి ఎక్కడ ఉంది? ఆమె నలుగురు పిల్లల తల్లి.","I mean, how does she have time to do all this? She has four kids."
"178","తను భాగస్వామి, ఇంకా ఒక బిడ్డకి జన్మనిచ్చింది.","She's partner, and she literally has a newborn."
"179","ఇంకా ఆ బిడ్డ చాలా ముద్దుగా కూడా ఉంది. అది విచిత్రంగా కనిపించే పసికందు కూడా కాదు.","And it's really cute too. It's not even a weird looking baby."
"180","అవును. తను ఎప్పుడూ వాళ్లని చూడదేమో. తన పిల్లల పెంపకం ఆమె చూసుకోదేమో.","Yeah. She probably never sees it. She probably never sees any of them."
"181","వాళ్లు ఆమె పట్ల ద్వేషంతోనే పెద్ద అవుతారు. నా మాటలు రాసి పెట్టుకో.","They're gonna grow up resenting her. Mark my words."
"182","వాళ్లు పెద్దయ్యాక ఆమెలా కావాలని కోరుకుంటారు.","They're just gonna grow up and wanna be her."
"183","నా ఉద్దేశం, అతను ఇంకా ఘోరమైన మహిళని ఎంచుకుని ఉండచ్చు కదా?","I mean, could he have picked a worse person?"
"184","ఆమె ఆ సంస్థలో భాగస్వామి, తనకి నలుగురు పిల్లలు ఉన్నారు.","She's partner in the firm, she has four kids."
"185","రాగి జుట్టు ఉన్నది, పొడవుగా ఉంటుంది.","She's very blonde, she's very tall."
"186","సరే, ఆగు. మనం మనదైన దారిలో చేద్దాం.","Okay, yeah. Let's do it your way."
"187","వావ్, అంటే, ఆమె అందంగా ఉంది, ఇంకా చాలా విజయాలు సాధించింది. నాకు తెలిసి నీ భర్తని ఆమెకి అప్పగించేయడమే సరైన పని అనుకుంటా.","Wow, I mean, she is beautiful, she's accomplished. I think the-the right thing to do is to give your husband to her."
"188","తను మామూలుగానే చాలా గందరగోళం మనిషి! పైగా ఆమె చాలా బోరింగ్ వ్యక్తి.","She's basic as hell! She's fucking boring."
"189","అవును. ఆమె అంత ముద్దుగా కూడా లేదు.","Yeah. She's not even actually that cute."
"190","పైగా పైపైన ఎవరు శృంగారం చేస్తారు? ప్యాంట్ తీసేసి సరిగ్గా చేయాలి కదా.","And who dry humps? Take your fucking pants off and do it right."
"191","ఆమె మధ్యలోనే వదిలేసే రకం.","She's a quitter. She's a quitter."
"192","నేను చార్లీ విషయంలో ఏం చేయాలి? అతను ఇందుకు మూల్యం చెల్లించుకోవలసిందే. నగలు కొనిపిస్తావా?","What am I gonna do about Charlie? He needs to pay for this. , jewelry?"
"193","అవునా? పైపైన శృంగారానికే నగలు కొనిపించవచ్చా?","Yeah? Is dry humping worth jewelry?"
"194","పర్సుతోనే సరిపెడతావు అనిపిస్తోంది.","Sounds like purse-level."
"195","సిల్, నువ్వు బాగానే ఉన్నావా? నన్ను నీ దగ్గరకి రమ్మంటావా?","Syl, are you okay? Do you want me to come over?"
"196","లేదు. నేను బాగానే ఉన్నాను.","No, no, no. I'm okay. I'm okay."
"198","నేను వెళ్లాలి. ఎవరో తలుపు తడుతున్నారు. థాంక్స్, బేబీ.","I gotta go. Someone's at the door. Thanks, babe."
"200","హేయ్. నువ్వు బాగానే ఉన్నావా?","Hey. You okay?"
"201","బాగానే ఉన్నాను. కేవలం చిన్న గాయం. నువ్వు ఇక్కడ ఏం చేస్తున్నావు?","Yeah. I'm fine. Just paper cut. What are you doing here?"
"202","ఈ రోజు సెలవు తీసుకున్నాను. నిజం చెప్పాలంటే, ఫిర్యాదు చేయడానికి నాకు ఒక మనిషి కావాలి. సరే, నువ్వు సరైన చోటుకే వచ్చావు. అదే అనుకున్నాను.","I took the day off work. Honestly, I just need someone to complain to. , well, you've come to the right place. Thought so."
"203","ముక్కలుగా కోయండి! డా బూచ్ వ్యాపారంలో నీకు వాళ్లు వాటా ఇస్తారని అనుకుంటున్నావా?","So, you think they'll give you a cut-in on the Daa Booch?"
"204","డా బూచ్ లో నాకు వాటా ఇచ్చి, నాకు డబ్బు కూడా ఇస్తారని అనుకుంటున్నాను, అప్పుడు నేను రిటైర్ కావచ్చు.","I do think they'll cut me into da Daa Booch, and they'll give me da money, and I can, , da retire."
"205","నిజంగానా? ఆ ద్వీపాలలో స్థిరపడచ్చు.","Really? To da islands."
"206","అలా ఎందుకు ఆలోచిస్తున్నావు?","Why do you think that?"
"207","నువ్వు ఇక్కడ ఎవరి పక్షం ఉన్నావు?","Whose side are you on here?"
"208","నాకు తెలియదు. నేను కేవలం దీన్ని అర్థం చేసుకోవాలని చూస్తున్నాను.","I don't know. I'm really just trying to slice this meat."
"209","ఆ వ్యాపారం సక్రమంగా నడవాలంటే నా అవసరం ఎంత ఉంటుందో వాళ్లకి తెలుస్తుంది అనుకుంటా ఇంకా వాళ్లు డా బూచ్ లో లెక్కలు వేసుకుంటారు, అప్పుడు వాళ్లు, వాళ్లు ఆ వ్యాపారంలో భాగస్వామిగా ఉండమని ప్రాథేయపడతారు.","I think they will see how much the business needs me to function properly and they will project that onto Daa Booch, and they, you know, they-they'll be begging me to be a part of it."
"210","ఇలా రిలాక్స్ కావచ్చని ఎలా అనుకున్నావో నాకు తెలియడం లేదు.","I honestly don't know why you find this relaxing."
"211","విందుని వండటం అనేది, అంటే, నా రోజులో అతిపెద్ద ఇంటి పని.","Cooking dinner is, like, the biggest chore of my day."
"212","ఇది చాలా రిలాక్సింగ్ గా ఉంది.",", it's so relaxing."
"213","ఒక చిట్టెలుక అపార్ట్మెంట్ ని శుభ్రం చేయడం గురించి కూడా ఒక వీడియోగేమ్ ఉంది. అది కూడా అద్భుతమే.","There's one where you clean up a little mouse's apartment. Also amazing."
"214","హేయ్, విల్.",", hey, Will."
"215","హేయ్! మీరు ఇద్దరూ ఏం చేస్తున్నారు?","Hey! What are you guys up to?"
"216","పెళ్లి కాని ఒక అమ్మాయి సగం చేతులతో వర్చువల్ గా ఒక విందుని మేము తయారు చేయడం నీకు కనిపించడం లేదా?","Can you not see that we are virtually creating a meal with a pair of disembodied Caucasian hands?"
"217","ఓహ్, అలాగే. చూశాను. హేయ్, పిల్లలు ఎక్కడ? పిల్లలు.",", right. I see. Hey, where are the kids? Huh? The kids."
"218","తోటలో ఉన్నారు. అవును. ఒక్కొక్కరూ ఒక ఫ్రెండ్ ని ఇంటికి తెచ్చుకున్నారు, నువ్వు వచ్చి పిజ్జాకి తీసుకువెళతావని నీ కోసం ఎదురుచూస్తున్నారు.","They're in the garden. Yeah. They each brought a friend home, and they're waiting for you to take them out for pizza."
"219","పిజ్జానా? మంచిది. సరే. అలాగే. మీకు ఏమైనా తీసుకురమ్మంటారా?","Pizza? Great. Okay. Good. Um, can I get you guys anything?"
"220","సరే, నాకు పెప్పరోనీ పిజ్జా కావాలి. విల్, నీకు ఏం కావాలి? నువ్వు పిజ్జా కొంటుంటే గనుక నాకు మష్రూమ్ పిజ్జా కావాలి. అవును.","Yeah, I'll take a pepperoni. Will, what do you want? , I'll take some mushroom pizza if you're buying pizza. Yeah."
"221","నాకు ఒక రోజ్ వైన్ సీసా కావాలి, ప్లీజ్. అంటే విష్పరింగ్ ఏంజెల్ లేదా అలాంటిది ఏదైనా సరే.","And I'd love a bottle of rosé, please. Like, a Whispering Angel or whatever."
"222","ఇండియా పేల్ ఆలే ని గనుక మించి వెళ్లగలిగితే, అది లోకల్ బ్రాండ్ కానక్కరలేదు, కానీ అది లోకల్ అయితే గనుక, నేను అది కూడా తీసుకుంటాను.","If you happen to walk past an IPA. It doesn't have to be local, but if it is, I would, , I would take that as well."
"223","సరే, తప్పకుండా. అలాగే.","Okay, sure. Okay. Okay."
"224","థాంక్స్. సరే.","Thanks. All right."
"225","హేయ్, పిల్లలూ! పిజ్జా!","Hey, kids! Pizza!"
"226","తిప్పు! ఆ మీట్ బాల్ ని తిప్పు! తిప్పు! దాన్ని తిప్పు! ఇదిగో చూడు. హేయ్! హేయ్! తిప్పు!","Flip, flip, flip! Flip that meatball! Flip it! Flip it! ! ! Hey! Flip! , there you go. Hey! Hey!"
"227","పిజ్ పిజ్జా! జాక్ రాత్రి ఇక్కడే ఉండిపోవచ్చా?","Piz-Pizza! Can Jack sleep over?"
"228","అలాగే, తప్పకుండా ఉండచ్చు. ఎందుకు ఉండకూడదు? శుక్రవారం రాత్రి, కదా?","Yeah, sure. Why not? Friday night, yeah? !"
"229","జాక్ రాత్రి ఇక్కడ పడుకుంటే, మిగతా పిల్లలు కూడా రాత్రి ఇక్కడే ఉంటాం అంటున్నారు.","If Jack sleeps over, the other kids are gonna wanna sleep over."
"230","గెమ్మా, షెల్బీ, మీరు రాత్రి ఇక్కడే పడుకుంటారా?","Gemma, Shelby, you guys wanna sleep over?"
"232","యాయ్! సరే! వెళదాం పదండి! పిజ్జా టైమ్! సరే. నువ్వు వాళ్ల పేరెంట్స్ కి చెప్పేయ్, సరేనా?","Yay! Okay! Let's go! Pizza time! Okay. You tell their parents, yeah?"
"233","మినీ వ్యాన్ తాళాలు ఆ కొక్కానికి ఉన్నాయి!","Minivan keys are on the hook!"
"234","సరే. అలాగే. సరే.","Yep. Yeah, yeah. Yeah."
"235","సరదా ఇల్లు. ఓహ్, అవును. శుక్రవారం రాత్రి.","Fun house. , yeah. Friday night."
"236","మీ ఇంటి పెరటిలో సెక్యూరిటీ కెమెరా ఉంటే బాగుండేది, నేను ఇప్పుడు ఫేమస్ అయిపోయేవాడిని.","Whoo. I really wish you had a security camera in your backyard, I'd be famous right now."
"237","అవును, ఒక మూర్ఖుడిగా పేరు వచ్చేది.","Yeah, as a stupid person."
"238","ఇంకో రకమైన ప్రముఖుడు ఎవరైనా ఉంటారా? నలుగురు పిల్లలు ఇంక పడుకున్నారు. షెల్బీ ఈ రాత్రి పడుకోదని నా అనుమానం ఎందుకంటే తనకి ఐదేళ్లే, ఇంకా తను ఇదివరకు ఎప్పుడూ ఎవరి ఇంట్లోనూ పడుకోలేదట.","Is there any other kind of famous person? Um, the, , four little ones are in bed. I'm not sure that Shelby's gonna make it through the night because she's five, and she's never slept over at anyone's house before."
"239","అయితే, నేను బహుశా మంచం ఎక్కేయాలి అనుకుంటా. అర్ధరాత్రి రెండు గంటలకు నేను లేవాల్సి రావచ్చు. నేను వెళ్లనా? ఇప్పుడు టైమ్ 9.23 గంటలు అయింది కాబట్టి అప్పుడే పడుకుంటారని అనుకోలేదు, కానీ.","So, , I think I'll probably, hit the hay. Um, in case I get woken up at 2:00 a.m. , should I, , should I get going? I didn't realize it was bedtime 'cause it's 09:23, but, um."
"240","లేదు, నువ్వు కూడా ఈ రాత్రికి ఇక్కడ ఉండిపోవచ్చు.",", no, you should just stay the night."
"241","అవునా? అది బాగానే ఉంటుంది కదా?","Yeah? Is that cool?"
"242","బాగుంటుంది. నాకు బలవంతం చేయడం ఇష్టం లేదు, కానీ.","Cool. I don't wanna impose or anything, but."
"243","లేదు, అంటే, నీ గోళ్లు ఇంకా ఆరాలి కదా.","No, I mean, your nails have to dry anyway."
"244","నా కాలి గోళ్లు ఆరాలి. అవును.","My nails do have to dry. Yeah."
"245","వాటిని పాడు చేయడం నాకు ఇష్టం లేదు. వీటి కోసం చాలా కష్టపడ్డాను.","I would hate to ruin them, I worked pretty hard."
"246","సరే, అయితే. హేయ్, సిల్వియా, నువ్వు వస్తున్నావా?","Sure, okay. Um, hey, Sylvia, are you coming?"
"248","సరే. నేను గాలి పరుపు తీసుకొస్తాలే.","Okay. I'll grab the air mattress then."
"249","నేను అది క్లిక్ చేయడం లేదు, కానీ నేను బ్రాండీ మెల్విల్ భారీ ప్రదర్శన వీడియో చూస్తాను. ఓహ్, దేవుడా. నాకు ఆ అమ్మాయి తెలుసు.","I'm not clicking on that, but I will click on the Brandy Melville mega-haul. ! , my God. I know that girl."
"250","నాకు నిజానికి ఆ షర్ట్ నచ్చింది. నేను అలాంటిది వేసుకుంటాను.","I actually like that shirt. I would wear that."
"251","నేను దాని కోసం చూస్తున్నాను. నిజానికి అది ముచ్చటగా ఉంది.","I've been looking for that. It's actually cute."
"252","అది ఆకుపచ్చ రంగులో కూడా వస్తుంది ఓహ్, దేవుడా. మేము ఈ బ్రాండీ ప్రదర్శన చూసే వరకూ ఆగలేవా?","It comes in green as well , my God. Can you wait until after we've watched this Brandy haul to do that?"
"254","తను తన గురించి గొప్పలు చెప్పుకునేలా ఉంది. అవును. నేను నేను తనని ఇష్టపడను.","She seems pretty self-centered. Yeah. I don't I'm not loving her."
"255","నేను నేను కూడా షాపింగ్ చేస్తాను, కానీ షాపింగ్ చేసిన ప్రతిసారీ అది యూట్యూబ్ లో పెట్టను.","I can I go shopping too, I don't post it on YouTube every fucking time."
"256","అది క్లిక్ చేయి. ""భూమి బల్లపరుపుగా ఉందనే నిజం మీకు తెలియకూడదని నాసా ఎందుకు అనుకుంటోంది.""","Click on that. ""Why NASA doesn't want you to know the earth is flat."""
"257","అవును, మా నాన్న దాని గురించే మాట్లాడతాడు.","Yeah, my dad's all about that."
"258","అవును, ఆయనకి కొన్ని బలమైన అభిప్రాయాలు కూడా ఉన్నాయి.","Yeah, he has some pretty convincing arguments."
"259","ఆయన ఆ వీడియోలని కూడా పోస్ట్ చేస్తారు. అవును.","He posts about it too. Yeah."
"261","ఆ శబ్దం వింటుంటే నీ చేతుల్ని హస్తప్రయోగం చేసుకుంటున్నట్లు ఉంది. ఆడవాళ్లు రాసుకునే క్రీముల గురించి మాట్లాడకు.","Sounds like you're jerking off your arms over there. Ew. Leave a woman to her creams."
"262","ఈ రాత్రి వినోదం పార్టీకి నన్ను ఆహ్వానించినందుకు చాలా ధన్యవాదాలు.","Thank you so much for inviting me to this slumber party."
"263","నేను ఈ రోజు ఒంటరిగా ఉండి ఉంటే, ఆ మానసిక స్థితి కన్నా ఇప్పుడు ఎక్కువ సంతోషంగా ఉన్నాను. అవును, ఎప్పుడూ ఒంటరిగా ఉండకూడదు అనడానికి అదే కారణం.","I'm in such a better mood than I would've been if I was alone all day. Aw. Yeah, that's the thing about never being alone."
"264","మనం దేని గురించి ఆలోచించడానికి టైమ్ ఉండదు.","You just never have time to feel anything."
"265","అది వినడానికి అద్భుతంగా ఉంది. మంచిది.","That sounds amazing. Good."
"266","లక్కీ పెన్నీని విడిచి పెట్టడం గురించి ఎప్పుడయినా ఆలోచించావా, అంటే, నిజంగా?","Do you ever think about leaving Lucky Penny, like, for real?"
"267","నువ్వు ఇంకా ఆ కుర్రాళ్లు ఏ విషయంలోనూ ఏకాభిప్రాయంతో ఉన్నట్లు కనిపించరు.","It just seems like you and those guys, you really do not see eye to eye."
"268","అవును. నాకు ఆ వ్యాపారం చేయడం ఎంత నచ్చదో, బీర్ ని తయారు చేయడం అంత నచ్చుతుంది. నేను అది తప్ప ఇంకేం పని చేస్తానో తెలియదు.","Yeah. You know, as much as I hate the business side of it, I just like making beer too much. I don't know what else I would do."
"269","డొరిటోసారస్. డొరిటోసారస్.","Doritosaurus. Doritosaurus. Doritosaurus."
"270","మీరు ఇల్లు ఎందుకు మారాలి అనుకుంటున్నారో తెలియదు. ఈ ఇల్లు అద్భుతంగా ఉంది. మా ఐదుగురికి ఇది చాలా చిన్నది అయిపోయింది.","I don't know why you wanna move. This house is awesome. It's way too small for the five of us."
"271","మీ ఇంటి వెనుక ఉన్న గారేజ్ ని మీరు కనీసం వాడుకోవడం లేదు.","You've got a garage back there you're not even using."
"272","అది చాలా చెత్తగా ఉంటుంది. ఏదో డ్రగ్స్ ల్యాబ్ మాదిరిగా అనిపిస్తుంది.","It's gross back there. It's like a meth lab."
