"Index","Telugu Text","Mapped English Text"
"403","హాయ్. ఆండీతో మాటలు ఎలా నడిచాయి? హలో.","Hi. How did it go with Andy? Hello."
"404","బాగానే నడిచాయి. అతనితో మాట్లాడటం మంచిది అయింది.","It was good. It was good to talk to him."
"405","బాగుంది, బాగుంది. ఇది వినడం సంతోషంగా ఉంది.","Good, good. Glad to hear."
"406","అవును. నువ్వు ఎలా ఉన్నావు?","Yeah. How you doing?"
"407","బాగున్నాను. నిజంగా? బాగానే ఉన్నావా?","Good. Yeah? You okay?"
"408","ఎందుకు?","Why?"
"409","ఆండీ.","Um, Andy,"
"410","అంటే, చార్లీ ఏం చేశాడో నాకు చెప్పాడు.","I mean, he mentioned to me what happened with Charlie."
"411","అది పెద్ద విషయమే కాదు.","That's nothing."
"412","నిజంగానా? అవును, నేను.","Really? Yeah. I,"
"413","నీకు తెలుసా, అది కేవలం.","You know, it just."
"414","అది ఏదో ఒకసారి జరిగింది. అలా మళ్లీ జరగదు, ఇంకా మేము బాగానే ఉన్నాం.","It happened one time. It's not gonna happen again, and we're fine."
"415","నీకు దాని గురించి మాట్లాడాలని లేదా? లేదు, నాకేమీ ఫర్వాలేదు.","Do you wanna talk about it at all? No, I'm good."
"416","సరే.","All right."
"417","కాబట్టి, నేను ఏం ఆలోచిస్తున్నాను అంటే దీన్ని గనుక ఆఫీస్ గా మార్చేస్తే చాలా బాగుంటుంది అని.","So, I was thinking that this would be great for me if we could turn it into an office space."
"418","అలాగే. నువ్వు ఖచ్చితంగా ఏం కోరుకుంటున్నావు?","All right. What, What exactly are you looking for?"
"419","అంటే, బాగా మెత్తని సోఫాలు, కష్మీరీ దుప్పట్లు, అలాంటివి.","Um, you know, like over-stuffed sofas, cashmere blankets, things like that."
"420","సరే. అయితే, అంటే ఆడవాళ్ల షెడ్డు మాదిరిగానా?","Okay. So, like a she shed?"
"421","లేదు, అంటే ఒక మంచి ఆఫీసు లాగా చేయాలి.","No, like an elevated office space."
"422","నీకు, అంటే, అన్ని చోట్లా చిన్నచిన్న షాండిలైర్స్, బహుశా రోజ్ వైన్ ఉన్న చిన్న ఫ్రిడ్జ్, యుఎస్ వీక్లీ, కాస్మో లాంటి పత్రికల కోసం ర్యాక్ లు ఉండాలా?","You want, like, little chandeliers everywhere, maybe a small fridge with rosé in it, magazine racks with Us Weekly, Cosmo? Ooh."
"423","అది వినడానికి చాలా బాగుంది.","That sounds amazing."
"424","అది మామూలు ఆడవాళ్ల షెడ్డు. అది నీకు తయారు చేసి ఇవ్వడం నాకు ఇష్టం లేదు.","That's a basic-bitch she shed. Hate to break it to you."
"425","వావ్. మంచిది. అవును.","Wow. Nice. Yes."
"426","ఇది అనుకున్న దాని కన్నా పెద్దగా ఉంది.","Bigger than I thought."
"427","సరే. అయితే? అంటే, దీనికి తప్పనిసరిగా కొంత పని ఉంది, కానీ దీన్ని ఆఫీసుగా మార్చే అవకాశం ఉంది, కదా?","Yeah. So? I mean, obviously needs some work, but it's got some potential, right?"
"428","అది ఆడవాళ్లకి సరిపోతుంది.","This will make a great taco trove."
"429","సరే.","Okay."
"430","ఇది విచిత్రంగా ఉంది. ఏంటి?","That's strange. What?"
"431","ఈ స్తంభాలకు పునాదులు లేవు.","These posts aren't fastened to the foundation in any real way."
"432","అది వినడానికి మంచిగా లేదు.","That doesn't sound very good."
"433","ఈ మొత్తం కట్టడం కేవలం ఈ నాలుగు స్తంభాల మీద నిలబెట్టినట్లు ఉంది, ఇంకా అవి నిజానికి వేటికీ జత చేసి లేవు.","This whole thing is actually just being held up by these four things, and they're really not attached to anything."
"434","మరేం ఫర్వాలేదు. వాటిని మళ్లీ ఏర్పాటు చేయచ్చు.","Huh. It's okay. We can We can reinforce them."
"435","అవునా? అవును. మరేం ఫర్వాలేదు.","Yeah? Yeah. It'll be fine."
"436","సరే. అది బాగానే ఉంటుంది. ఆ శబ్దాలు విన్నావా? విన్నాను.","Okay. It'll be fine. Do you hear that? , , yeah."
"437","ఓహ్, దేవుడా! చెత్త! సాయం చేయండి! చెత్త.","! , my God! ! Fuck! Help! Help! Fuck!"
"438","ఓహ్, దేవుడా! చెత్త! ఓహ్, దేవుడా!",", my God! Shit! , my God!"
"439","బయటకి పద! ఇక్కడి నుండి బయటకు పద! అది తలుపు మీదనే ఉంది! నేను రాలేను!","Get out! Get the fuck outta here! He's on the door! I can't!"
"441","ఓహ్, చెత్త. ఓహ్, లేదు.",", shit. , no."
"442","ఓహ్, దేవుడా.",", my God."
"443","అది నిర్మాణపరంగా ఉన్న లోపం. అయ్యో.","That's That's a structural problem. , no."
"444","అది మంచిగా లేదు. బాగానే ఉన్నావా? ఓహ్, దేవుడా.","That's not good. Are you okay? , my God."
"445","నేను బాగానే ఉన్నాను. ఓహ్, చెత్త, నువ్వు బాగానే ఉన్నావా? నాకేం కాలేదు.","I'm okay. , fuck, are you okay? I'm okay."
"446","నా ఇల్లు చూడు! ఏం జరిగింది?","Look at my house! What happened?"
"447","ఏం జరిగిందో చెబితే నువ్వు నమ్మలేవు, బాబు.","You won't fucking believe what happened, man."
"448","ఒక రకూన్ నా పైకి దూకింది ఓహ్, దేవుడా.","A raccoon jumped on me , my God."
"449","నేను ఆ స్తంభాలకి కొట్టుకున్నాను తరువాత ఇలా కూలిపోయింది.","I knocked into the poles Then the thing fell down."
"450","స్తంభాలు పడిపోయాయి. రకూన్ ఏంటి?","and it fell. A racc What?"
"451","దీనికి బిల్డింగ్ పర్మిషన్ ఉందని అనుకోను. నేను ఊహించినది ఇది కాదు.","I don't think this was permitted properly. an earthquake. This is not what I expected."
"452","కానీ నేను ఊహించాను. నేను కూడా.","That makes one of us. Me either."
"453","లేదు, కానీ మనం ఏదైనా మార్గం ఆలోచించవచ్చు. మరేం ఫర్వాలేదు.","No, but we we can figure it out. It'll be okay."
"454","దీన్ని మనం సరిచేయగలమా? నిజంగా?","Can you Can you figure this out? Really?"
"455","అవును! వంద శాతం, బాగుచేయలేను.","Yes! I, 100%, cannot fix this."
"456","నిజంగా? నువ్వు బాగు చేస్తాను అన్నట్లుగా ఇది లేదే.","Really? It doesn't seem like you can figure this out."
"457","నేను చేయలేను. ఫర్వాలేదు. అంతా అదుపులోనే ఉంది.","I can't. It's okay. We have this under control."
"458","నిజంగానా? ఎందుకంటే మన ఇల్లు కూలిపోతే కలత పడకుండా ఉండటం మంచి మార్గం అంటావు.","Honestly? Because destroying our house is not the best way of dealing with being upset."
"459","నా ఫీలింగ్స్ తో నేను ఎలా వ్యవహరించాలో నువ్వు నాకు చెప్పనక్కరలేదు. దీని గురించి మనం ఏకాంతంగా మాట్లాడుకుందామా?","You don't get to tell me how to deal with my feelings. Can we please talk about this alone?"
"460","నేను వెళ్తున్నాను.","I'm gonna go."
"461","ఇలా చూడు. నువ్వు వెళ్లనక్కరలేదు.","Come on. You don't have to go."
"462","అంటే, నీతో ఒంటరిగా మాట్లాడాలని నీ భర్త చెప్పాడు. మరేం ఫర్వాలేదు.","You know, your husband said he wanted to talk to you alone. It's fine."
"463","ఆ ఎ.డి.యు. అనేది నీ ఆలోచన.","The ADU was your idea."
"464","ఇప్పుడు నువ్వు నా గరాజ్ ని కూల్చేశావు కాబట్టి నువ్వే దాన్ని బాగు చేయాలి.","Now that you've destroyed my garage, you gotta help me fix it."
"465","నేను మళ్లీ వస్తాను ఇంకా అప్పుడు మరొకసారి వచ్చి సాయం చేస్తాను.","I'll come back and I'll I'll help another time."
"466","కానీ ఈ మధ్యలో మీరు గొడవలు పరిష్కరించుకోండి.","But in the meantime, , deal with your shit."
"467","ఎక్స్ క్యూజ్ మీ. ఏదో చిన్న వాగ్వాదం జరిగింది మా పెళ్లయి చాలా కాలం అయింది కాబట్టి ఇలాంటిది సహజం. అది ఏమీ ఫర్వాలేదు.","Excuse me. That was a small argument that happens over the course of a long marriage. It's fine."
"468","నేను ఏదో ఊహించాను కానీ అది నీకు అర్థం కాకపోవచ్చు.","But I guess that's something you might not understand."
"469","అది మంచిగా అనిపించడం లేదు.","It does not seem fine."
"471","ఓహ్, దేవుడా. సరే, ఇది చూడటానికి బాగానే ఉంది.",", my God. Well, this looks good."
"472","బేబీ, సారీ.","Babe, I'm sorry."
"473","నాకు తెలుసు.","I know."
"474","వెనెసా ఇంకా నాకు మధ్య జరిగిన దాంట్లో ఏ రకంగాను, నీ పొరపాటు లేదు.","You know what happened between Vanessa and me was in no way, shape or form your fault."
"475","థాంక్యూ.","Thank you."
"476","వెనెసా పొరపాటు కూడా ఇందులో లేదని నీకు తెలుసు.","And you know that this has nothing to do with Vanessa."
"477","ఇలా మాట్లాడడం వల్ల నాకు మంచిగా అనిపించదని నీకు కూడా తెలుసు, కదా?","And you know that that doesn't make me feel any better, right?"
"478","నాకు తెలుసు, నాకు తెలుసు, సారీ.","I do, I do, and I'm sorry."
"479","నేను కేవలం.","I just."
"480","ఏంటి?","What?"
"481","ఏమీ లేదు.","It's nothing."
"482","నాతో చెప్పు, బేబీ, దయచేసి చెప్పు. ఏంటి?","Just tell me, babe, please. What?"
"483","నీ జీవితంలో రెండవ ప్రాధాన్యత ఉన్న మగవాడిగా నేను ఉన్నాను అనే ఆలోచన నాకు నచ్చదు.","I don't like feeling like the second-most important man in your life."
"484","నీ ఉద్దేశం, సైమన్ తరువాత అంటావా? సరే, నీ జీవితంలో హేయ్.","You mean, after Simon? Okay, the third-most important Hey."
"485","మూడో ప్రాధాన్యత ఉన్న మగవాడు.","man in your life."
"486","నేను కేవలం.","I just."
"487","మేవీ స్కూలుకి వెళ్లడం మొదలైనప్పటి నుండి, నేను కొద్దిగా గందరగోళం అయిపోయాను అనిపించింది.","I think since Maeve's gone back to school full-time, I just feel, um, a little bit of a mess."
"488","ఏదో కారణం వల్ల, ఆ విషయం నీతో మాట్లాడటం కన్నా విల్ తో పంచుకోవడం తేలిక అనిపించింది.","And for some reason, it's easier to talk to Will about it than to talk to you."
"489","అది నాకు ఏమీ మంచిగా అనిపించడం లేదు.","That doesn't make me feel great."
"490","నాకు తెలుసు. నీకే మొదటగా ఏదైనా చెప్పాలి అనుకుంటాను. నువ్వు నా భర్తవి, నాకు ఎందుకో తెలియదు.","I know. I wanna tell you everything first. You're my husband, but I don't know."
"491","ఏదో కారణం వల్ల, అది కష్టం అయిపోతుంది.","For some reason, it's just hard."
"492","ఎందుకు? నిన్ను చాలా ప్రేమిస్తాను కదా.","Why? I love you so much."
"493","నువ్వు నాకు ఏమైనా చెప్పచ్చు. నాకు తెలుసు.","You can tell me anything. I know."
"494","ఎందుకంటే నీ ముందు గందరగోళంగా కనిపించడం నాకు ఇబ్బందిగా అనిపిస్తుంది, ఇంకా నా కంటే విల్ పెద్ద గందరగోళం మనిషి, లేదా సమాన స్థాయిలో గందరగోళంగా ఉంటాడు. అదేంటో తెలియదు.","Because it's embarrassing being a mess in front of you, and Will's a much bigger mess than I am, or at least an equal mess. I don't know."
"495","సరే. అలాగే, నేను అందులో ఏమైనా అర్థం ఉందా?","Okay. Yeah, I Yeah, I Does that make any sense?"
"496","నాకు అర్థమైంది. అలాంటిదే ఇది.","I get it. Kind of."
"497","థాంక్యూ.","Thank you."
"499","మళ్లీసారి, అంటే, నువ్వు ఎవరితో అయినా పైపైన శృంగారం చేసినప్పుడు, కాస్త తక్కువ విజయాలు ఉన్న ఆడవాళ్లతో చేయడానికి ఆలోచించగలవా? అంటే జడ్జ్ సోటోమేయర్ మాదిరిగానా?","And next time you, like, dry hump with someone, would you mind doing it with someone just, like, slightly less accomplished? , like Judge Sotomayor?"
"500","లేదు, అది కూడా తప్పుడు ఆలోచనే.","No, that's the wrong direction."
"501","నా ప్రామిస్. కాబట్టి.","I promise. I promise. So."
"502","ఇప్పుడు మనం ఏం చేద్దాం? నాకు తెలియదు.","What are we going to do? I don't know."
"503","కొత్త ఇళ్ల వివరాల సంగతి ఏంటి? మనం ఆ ఇళ్లని ఎప్పుడు చూడచ్చు?","What's the deal with the new listing? When can we see the house?"
"504","""ఈ వారాంతం,"" అని ఆమె చెప్పింది.","""This weekend,"" she said."
"505","సరే, మనం కొనబోయేది అదే కావాలి.","Yeah, I'm sure it'll be the one."
"506","ఓహ్, అవును. అవును.",", yeah. Yeah."
"508","ఓహ్, దేవుడా. వీడు మళ్లీ వచ్చాడు.",", my God. This guy again. Aw."
"509","వీడే, హా? ముద్దుగా లేడు. ఇది ముద్దుగా ఉంది. ఇది ముద్దుగా ఉంది, నిన్ను పట్టుకున్నాను.","This guy, huh? , it's not cute. Aw. , it's cute. It's cute. It's cute, and I got ya."
"510","నువ్వు ముద్దుగా ఉన్నావు. నువ్వు ముద్దుగా ఉన్నావు.","You're cute. Aw. You're cute."
"511","హేయ్? సరే, ఇది ఏంటి?","Hey? Okay, what's this?"
"512","మన గాఢమైన కంబూచా కంపెనీకి నేను ఆమోదించిన పేర్ల జాబితా ఇది.","That is a list of names for our hard kombucha company that I approve of."
"513","కంబూచా చా చా? కంబూ చా చా చా.","Kombucha Cha-Cha? Kombu Cha-Cha Cha."
"514","అంటే సుప్రసిద్ధమైన ఆఫ్రికన్, క్యూబన్ డాన్స్ మాదిరిగా.",", like the legendary Afro-Cuban dance."
"515","ఖచ్చితంగా. మీకు అది నచ్చకపోతే, అలాంటివి ఆ జాబితాలో ఇంకా చాలా ఉన్నాయి. నాకు ఈ బూచీ కాల్ కాస్త నచ్చింది. ఏంటి? వద్దు, బాబు.","Exactly. If you don't like that, there's plenty more on the list. I kinda like Boochy Call. What? No, dude."
"516","డా బూచ్ పేరు చాలా చక్కగా ఉంది. మనం ఏదీ మార్చడం లేదు.","Daa Booch is the perfect fucking name. We're not changing anything."
"517","ఇలా చూడు. మనం వ్యాపారం గురించి మాట్లాడుకుందామని నన్ను ఇక్కడికి రమ్మని చెప్పిన వాడివి నువ్వు.","Come on. You're the one who called me over here and said we were gonna talk things through."
"518","అలాగే, ఈ మనిషి ఎవడు?","Also, who the fuck is this guy?"
"519","ఎవరూ కాదు. అవును, అతను ఎవరో మనిషి.","No one. Yeah, he's just a guy."
"520","అతను ఎవరో మనిషా?","He's just a guy?"
"521","ఇది ఏమైనా మన వ్యాపారంలో జోక్యమా? ఈ వ్యక్తి ""జోక్యం చేసుకునేవాడు"" అంటారా?","Is this an intervention? Is this guy an ""interventionalist""?"
"522","లేదు, అతను అలా కాదు.","No, he's not that."
"523","ఈ వ్యక్తి నాకన్నా ఎక్కువగా తాగుతాడు.","This guy drinks more than I do."
"524","ఈ చెత్తవెధవ ఏం పని చేస్తాడో నువ్వు తెలుసుకునే ప్రయత్నం చేయకు.","You don't wanna know the shit this motherfucker gets up to."
"525","అలాగే, ఆ వ్యసనాల చికిత్స కేంద్రం మలిబులో ఉంటే తప్ప నేను వెళ్లను.","Also, I'm not going to rehab unless it's that place in Malibu."
"526","ఆ ప్రదేశం నిజంగా ఎలా ఉంటుందంటే అది సముద్రం పక్కనే ఉంటుంది, కదా?","That place actually looks really It's right on the water, right?"
"527","అది తాగుడుకి సంబంధించిన సమావేశం కాదు, విల్. ఇది కేవలం వ్యాపారం కోసం.","This isn't about drinking, Will. This is just business."
"528","అయితే ఇది జోక్యం కాదంటావా?","So it's not an intervention?"
"529","కాదు, బాబు. అతని పేరు క్లార్క్. కేవలం వినడం కోసం వచ్చాడు.","Nah, dude. Clark, he's just here to listen."
"530","అతను ఏమైనా ప్రొఫెషనల్ శ్రోతా? ఇప్పుడు ఇక్కడ ఏం జరుగుతోంది?","Is he a fucking professional listener? What is happening right now?"
"531","విల్, లక్కీ పెన్నీని వృద్ధి చేసి బాగా నడపడంలో నువ్వు అద్భుతంగా పని చేశావు.","Will, you have done an incredible job getting Lucky Penny up and running."
"532","కానీ ఇప్పుడు నువ్వు పక్కకు తప్పుకోవలసిన సమయం వచ్చిందని మేము అనుకుంటున్నాము.","We think that maybe it's time you take a step away."
"533","మనం లక్కీ పెన్నీ గురించి ఇప్పుడు ఎందుకు మాట్లాడుకుంటున్నాము?","Why are we talking about Lucky Penny right now?"
"534","బ్రో, మన మధ్య సఖ్యత లేదు, సరేనా? నువ్వు ఇంక తప్పుకోవాలి.","Bro, this shit ain't working, okay? You gotta go."
"535","మీరు నన్ను బలవంతంగా గెంటేస్తున్నారా? అవును.","Are you guys trying to force me out? Yes."
"536","లేదు, అతడిని బలవంతంగా పంపించలేము. అతను స్వచ్ఛందంగా తప్పుకోవాలని నిర్ణయించుకోవాలి.","No, he can't be forced out. He has to voluntarily decide to do this on his own."
"537","అతను నిన్ను ఎందుకు సరి చేస్తున్నాడు? ఈ వ్యక్తి ఎవరైనా లాయరా?","Why is he correcting you? Is this guy a fucking lawyer?"
"538","అవును, నేను లాయర్ నే.","Yes, I am a lawyer."
"539","బ్రో, నువ్వు ఆ వివరాలు చెప్పవలసిన అవసరం లేదు.",", bro, you didn't have to disclose that information."
"540","అవును, నేను చెబుతాను.","Yes, I do."
"541","విల్, చూడు. నువ్వు అంటే నాకు ఇష్టమని నీకు తెలుసు, కదా?","Will, look. You know I love you, all right?"
"542","కానీ మనం ప్రతి విషయంలోనూ గొడవ పడతాం, బ్రో.","But we disagree about everything, bro."
"543","ఎలాంటి బీర్లు తయారు చేయాలన్న దాని గురించి మనకి అభిప్రాయభేదాలు ఉన్నాయి.","We disagree about what fucking beers to make."
"544","మనతో ఎవరు భాగస్వామిగా ఉండాలనే విషయంలో మనం గొడవ పడతాం. ఇది హాస్యాస్పదం.","We disagree about who to partner with. It's ridiculous."
"545","ఒక కామాంధుడిని మన వ్యాపార భాగస్వామిగా పెట్టుకోవడం నాకు ఇష్టం లేదు, సారీ.","I'm sorry I didn't want to partner with a geriatric sexual predator."
"546","లేదు, ఆ జానీ రెవ్ గాడి సంగతి మర్చిపో, సరేనా? ఇది అంతకన్నా ముఖ్యమైనది.","No, fuck Johnny Rev, okay? It's about more than that."
"547","నేను చెప్పినట్లు, ప్రతి విషయంలో మనకి పడదు, బ్రో.","Like I said, it's everything, bro."
"548","మీరు ఈ బార్ ని నా నుండి దూరం చేయలేరు.","You cannot take this bar away from me."
"549","ఈ ప్రదేశం నా జీవితం. ఏమీ లేని స్థితి నుండి ఇంత పెద్దది నిర్మించుకున్నాను.","This place is my life. I built it from nothing."
