"Index","Telugu Text","Mapped English Text"
"2","సూపర్!","Nice!"
"4","మా నాన్న నా జీవితం చక్కగా ఉండాలని తాపత్రయ పడేవాడని నాతో అనేవాడు.","My old man used to say he wanted me to better myself."
"5","ఐ లవ్ యూ.","I love you."
"6","కానీ అతని కనులు అది నిజం కాదని చెప్పేసేవి.","But I could see in his eyes he didn't."
"7","""నా జీవితం చక్కగా ఉండాలి"" అట.","""Better myself."""
"9","లేదు.","No."
"9","దొరికావు.","I got you."
"10","సూపర్, జిమ్మీ.","Nice, Jimmy."
"10","చక్కగా పరుగెత్తి పట్టుకున్నావు.","Way to get off the line."
"11","సూపర్!","Attaboy!"
"13","లంబోర్గిని.","Gremlin."
"14","వాళ్లు నీకు ఎప్పటికీ చెప్పని విషయమేంటో తెలుసా?","You know what they never tell you?"
"15","అదేంటంటే, నువ్వు జీవించేది నీ పిల్లల కోసమే అన్న విషయం.","They don't tell you that the love of your life could be your child."
"16","నా రోగుల్లో ఎవరి మానసిక స్థితికి అయినా నీ వల్ల ప్రమాదం ఉందా?","Are you a threat to the mental health of any of my patients?"
"17","నీ వల్ల ప్రమాదం ఉందా?","Are you a threat? Are you a threat? Are you a threat?"
"18","హాయ్.","Hi."
"18","ఎక్కడికి వెళ్లిపోతున్నావు?","Where are you heading off to?"
"19","ఇంటికి వెళ్లిపోతాను.","Just gonna go home."
"20","నువ్వు వెళ్లలేవు.","You can't."
"20","మాటిచ్చావు.","You promised."
"21","నేను ఏమీ మాటివ్వలేదు.","I never promised anything."
"22","ఇచ్చావు. నువ్వు ఇచ్చావు.","You did."
"23","నువ్వు మాటిచ్చావు.","You promised."
"26","హేయ్, జేమ్స్.","Hey, James."
"27","ఏంటి?","What?"
"29","జేమ్స్.","James."
"32","హేయ్, జేమ్స్.","Hey, James."
"32","జేమ్స్.","James."
"35","ఏదో కల కంటున్నట్టున్నావే.","You were having some dream."
"36","ఏమైనా కలవరించానా?","Did I say anything?"
"37","లేదు.","No."
"37","కానీ నేను నిన్న నీకు చెప్పిన కథల వల్ల నీకు పీడకలలు వచ్చినట్టున్నాయి.","But it did make me think that my stories yesterday may have given you some nightmares."
"38","కథలా?","Stories?"
"39","అవి కథలే.","That's what they are."
"40","ఒక్కోసారి నేను కథలు చెప్తుంటా.","Sometimes I do that."
"41","నీ స్నేహితులకి అబద్ధాలు కూడా చెప్తుంటావా?","Lie to your friends?"
"42","హా?","Huh?"
"43","ఏంటి?","What?"
"43","లేదు.","No. No."
"44","ఇప్పుడే కదా నాకు చెప్పింది అబద్ధమని అన్నావు.","Well, you just said you lied to me."
"45","అయితే, నువ్వు నీ స్నేహితులతో అబద్ధాలు అయినా ఆడుతుండాలి, లేదా నీ స్నేహితులు కానీ వాళ్లతో అయినా అబద్ధాలు చెప్తుండాలి, ఏదేమైనా నా స్థానం మాత్రం నాకు బాగా తెలిసిపోయింది.","So either you lie to your friends, or you lie to people who aren't your friends, which pretty much tells me where I stand either way."
"46","అలా ఏం కాదు.","That's not it."
"47","సరే.","Okay."
"48","అంటే చూడు, అది.","All right, um All right, look, it's."
"49","శాంతించు, లారీ.","Relax, Larry."
"49","నాకేమీ ఆశ్చర్యం కలగలేదులే.","I'm not surprised."
"50","నువ్వు ఏం అంటున్నావు?","What are you What are you saying?"
"51","ఇంకాసేపు ఉండి లోతుగా ఆలోచిస్తే నువ్వు చెప్పేది అబద్ధమని తెలిసిపోయేది.","I guess if I'd given it more thought, I would have realized you were lying."
"52","నేనేమీ అబద్ధాలు ఆడలేదు.","It's not lying."
"52","అది కథ చెప్పడం.","It's storytelling."
"52","నేను అబద్ధాలకోరుని కాదు.","I'm not a liar."
"52","కథలు చెప్పడంలో నేర్పరిని.","I'm a raconteur."
"53","ఏదోకటిలే.","Look, whatever."
"54","నువ్వు చెప్పే కథలో చాలా లోపాలున్నాయి, అది పక్కాగా ఉన్నట్టు అనిపించలేదు.","Your details were off, and God's in the details."
"56","సరే. ఏ ""లోపాలో"" చెప్పు.","Okay. What ""details?"""
"57","నువ్వు గోతులను తవ్వుతూ పెరిగాను అన్నావు కదా.","You said you grew up digging graves."
"57","అది నిజమే.","I did."
"58","అయినా కానీ నువ్వు జెస్సికా రోచ్ శవాన్ని పూడ్చి పెట్టడానికి గొయ్యి తవ్వలేదు.","Yet you didn't dig one for Jessica Roach."
"59","చూశావా?","See?"
"59","నువ్వు చెప్పేది అబద్ధమని నేను అలానే కనిపెట్టేశాను.","That's how I know you're full of shit."
"60","అయితే, ఆ గొయ్యిని అనువైన నేలలోనే తవ్వాలని కూడా నీకు తెలిసి ఉండాలి కదా.","Then you would know that you need to dig a grave in the right kind of soil."
"61","అవునవును.","Yeah, yeah, yeah."
"62","చీకట్లో అది కనిపెట్టడం చాలా కష్టం.","And it's hard to find in the dark."
"63","అవునులే.","Of course."
"64","అదీగాక, ఒకడు వచ్చి నా వ్యానుకు ఎదురుగా రోడ్డు అవతల వాడి కారును ఆపాడు.","And this man, he pulled up on the road across from my van."
"65","అవును, వాడు ఎప్పుడూ వస్తూనే ఉంటాడులే.","Yeah, that guy. He keeps showing up."
"66","నేను మళ్లీ వెనక్కి వెళ్దామనుకున్నా.","I meant to go back."
"67","కానీ నాకు అంత సమయం దొరకలేదు.","I just didn't have the time to do it."
"68","లారీ.","Larry."
"68","మరేం పర్వాలేదు.","It's okay."
"69","పర్వాలేదంటే ఎలా.","It's not."
"69","పర్వాలేదనే చెప్తున్నా కదా.","It's fine."
"70","ఇక్కడ ఉన్నవాళ్ళందరూ కథలు చెప్పేవాళ్లే.","Everybody in here tells stories."
"70","నేను కూడా ఒహాయో యూనివర్సిటీలో క్రీడాకారుడినని చెప్పుకుంటా.","I tell everybody I played for OSU."
"71","పర్వాలేదు అనకు!","It's not!"
"73","నేను.","I."
"75","నేను నిజమే చెప్తున్నాను.","I'm telling the truth."
"76","ఇందాకే కదా కథ అని అన్నావు!","You just said it was a story."
"77","అది అబద్ధం.","That was the lie."
"78","అది అబద్ధమా?",", that was?"
"79","అవును.","Yeah."
"81","నేనేమీ అబద్ధం చెప్పట్లేదు, జిమ్మీ.","I'm not lying, James."
"83","నువ్వు హంతకుడివి కాదు, గురూ.","You're not a killer, man."
"84","నేను హంతకుడినే.","I am."
"85","నేను కొందరు హంతకుల కళ్లలోకి చూశాను.","I've looked into the eyes of a few."
"86","నీ కళ్లు అలా లేవు.","And you don't have those eyes."
"87","మరి నా కళ్లు ఎలా ఉన్నాయి?","What eyes do I have?"
"88","ఏదో కావాలని తపించేవాడి కళ్లలా ఉన్నాయి.","A wannabe's."
"89","తర్వాత కార్పెంటర్ షాప్ కి వచ్చి నన్ను కలువు.","Meet me in the woodshop later."
"89","ఎందుకు?","Why?"
"91","నా కళ్లు ఎలా ఉన్నాయో అప్పుడు చూపిస్తా నీకు.","I wanna show you what kind of eyes I have."
"92","భోజనం వేళయిందిరా, సన్నాసులారా.","Chow, maggots."
"94","నోర్మూసుకోండి!","Shut the fuck up!"
"98","నువ్వు ఎప్పుడైనా రక్షిత కస్టడీని కోరవచ్చు కదా.","You could always request PC."
"100","అలాగే, నీ రహస్యాన్ని పంచుకోవచ్చు, జిమ్.","Might as well open up, Jim."
"101","నేను లోపలికి రావచ్చా?","Mind if I come in?"
"102","నేనే బయటకు వస్తాను.","I'd rather come out."
"103","నీ తోక ఏది?","Where's your girlfriend?"
"104","వాడి బండారం బయటపెట్టడానికేనా నువ్వు ఇన్ఫార్మర్ గా వచ్చింది?","Is he the one you're supposed to rat on?"
"105","ఎందుకంటే, నేను దానికి సాయం చేస్తా కూడా.","Cause I I would support that."
"106","పిల్లల హంతకుడా? అయ్య బాబోయ్, జిమ్! ఆ విషయంలో నేను ఖచ్చితంగా నీకు సాయపడతా.","A kid killer? You kidding me, Jim? I would have your back on that."
"107","అవునా?","Yeah?"
"107","నీకు సంపూర్ణ సాయం అందిస్తాను.","I'd be your true blue, bud."
"108","దానికి నేనేం చేయాలి?","What would it cost me?"
"109","ఏమీ అక్కర్లేదు.","Nothing."
"110","నిజంగానే చెప్తున్నా.","Really."
"111","కొన్ని విషయాలలో మనం మన విభేదాలను పక్కకు పెట్టేయాలి, ఆ దరిద్రుడికి శిక్ష ఖచ్చితంగా పడాలనే విషయంలో నాది కూడా నీ మాటే.","Some things are bigger than us and we can all agree that motherfucker has to get got."
"114","అయితే, మనం ఎవరి తరఫున పని చేయాలి?","So who would we be working for?"
"115","నీ ఉద్దేశం నేనెవరి తరఫున పని చేస్తున్నాననా?","You mean who am I working for?"
"116","అవును, కానీ దీనిలో మనిద్దరం కలిసి పని చేయాలి.","Yes, but we'd be in this together."
"117","ఇంకా, నేను ఇందులో సఫలమైతే, ఇది నాకు ఒక ఇంటర్వ్యూ లాంటిది అవుతుంది.","A-And maybe, if I did good, it would be like an audition for me."
"118","నాకు పోలీసు ఉద్యోగం కూడా రావచ్చు.","And I can get a job with the Marshals."
"119","నేను పని చేసేది పోలీసులతో అయ్యుంటే, నీకు ఆ ఉద్యోగం వస్తుందేమో.","Well, if I was working for the Marshals, maybe."
"120","అయితే నువ్వు ఎవరి తరఫున పని చేస్తున్నావు?","So who you working for?"
"122","ఓ విషయం చెప్పనా, మిస్టర్ కార్టర్.","I tell you what, Mr. Carter."
"123","చెప్పు.","What?"
"124","ఒక వారం పాటు నాపై ఇతర ఖైదీలను ఉసిగొల్పడం ఆపు.","You call off the dogs for a week."
"125","అబ్బా. ఆ పని నేనెందుకు చేస్తాను, జిమ్?","Ooh, Why would I do that, Jim?"
"126","నువ్వు చేయగలవో లేదో నాకు తెలుస్తుంది.","So I know you can."
"126","అప్పుడు నువ్వు ఏం చేస్తావు?","And you'll do what?"
"127","నేను ఎవరి కోసం పని చేస్తున్నానో నీకు చెప్తాను.","Tell you who I'm working for."
"127","మరి చెప్పేయ్.","So, tell me."
"128","ఒక వారం తర్వాత చెప్తాను.","A week from now."
"128","నాకు ఏమీ కాకుండా ఉంటే.","If I'm still walking upright."
"130","మన మన మధ్య డీల్స్ జరిగే విధానం ఇది కాదు, జిమ్.","That's not That's not That's not how our relationship works, Jim."
"131","ఇతరులు నాపై దాడి చేయకుండా ఆపేంత సీన్ నీకు లేదు.","I don't think you can call anyone off."
"132","మరి నువ్వు నన్ను ఎలా వదిలించుకుంటావు?","How you gonna call me off you?"
"133","నాకు ఫోన్ కాల్స్ రాకుండా, నేను చేయలేకుండా చేశావు.","Well, you fucked with my phone calls."
"134","నేను ఇన్ఫార్మర్ అని అందరికీ చెప్పేశావు.","And you already put a snitch jacket on me."
"135","ఇంకేం చేయగలవు?","What else you gonna do?"
"136","అది నీకు తెలీకపోవడమే మంచిది.","You don't wanna find that out."
"136","అవును.","Yeah."
"137","నేను తెలుసుకోవాలనుకుంటున్నా.","I do."
"139","సరే అయితే.","Okay then."
"140","ఈ రోజును కులాసాగా గడుపు.","Enjoy your day."
"141","పండగ చేస్కో.","Savor it."
"142","నేను ఫోన్లో ఉన్నా.","I was on the phone."
"142","హా.","Yep."
"143","మూడు గంటల పాటు హోల్డ్ లో ఉన్నా.","On hold for three fucking hours."
"143","మూడు గంటలు.","Three hour."
"144","అసలు టిఫిన్ సమయమా లేక లంచ్ సమయమా కూడా నాకు తెలియట్లేదు.","I didn't even know that if it's If it's breakfast or-or lunch anymore."
"145","ఇది లంచ్ సమయం.","It's It's lunch. Ooh,"
"146","అంత జరిగాక.","And all-all."
"147","ఇదుగోండి.","Here you go."
"147","అంత జరిగాక, రేపు కాల్ చేయమన్నాడు, అప్పుడు వేరే వ్యక్తితో నేను మాట్లాడవచ్చట, అతను జిమ్మీ డబ్బులు ఎందుకు ఫ్రీజ్ అయిపోయాయో నాకు చెప్పగలడట.","All to tell me to call back tomorrow to talk to talk to the one guy, the one guy who who, , can let me know why Jimmy's funds were frozen."
"148","అయితే, నువ్వు మళ్లీ నన్ను అక్కడికి తీసుకెళ్లు, ఇద్దరం అక్కడ కూర్చొని జైలును చూస్తూ ఉందాం.","Well, you know, maybe you could drive out there again and sit and stare at the prison."
"149","సర్లే.","Come on."
"149","ఆపు ఇక.","Stop."
"151","ఇది చాలా సీరియస్ విషయం.","This is fucking serious."
"152","నాకు తెలుసు.","I know."
"152","తినడానికి ఏం కావాలి?",", what are you having?"
"153","చర్జర్.","Ch A churger."
"154","ఏంటి?","What?"
"154","చీస్ బర్గర్.","The cheeserburger."
"155","కాదు, నువ్వు ""చర్జర్"" అని అన్నావు.","No, you said ""churger."""
"156","అవునా?","I did?"
"156","హా.","Yeah."
"157","హాయ్.","Hi, folks."
"157","మీకేం తీసుకురమ్మంటారు?","Can I get you something to start?"
"158","హాయ్. నాకు ఐస్ టీ తెచ్చివ్వండి.",", hi. , yeah. I'll have ice tea."
"159","బంగారం?","Hon?"
"160","ఒక కఫ్ కాపీ, ఇంకా ఒక చర్జర్.","A A coff of cuppee, and-and-and-and a churger."
"161","ఆ అదే, చీస్ అబ్బా.","The The I don't know, the cheese Ow. Fuck."
"162","911కి కాల్ చేయండి.","Call 911."
"162","ఇతనికి స్ట్రోక్ రాబోతోంది.","He's having a stroke."
"163","ఓరి దేవుడా.",", God."
"163","ఏంటి?","What?"
"164","911కి కాల్ చేయండి.","911."
"164","సరే.","Okay."
"165","సరే.","Okay."
"166","ఏమీ కాలేదు. ఏం పర్వాలేదు.","It's okay. It's okay. Okay. Okay. Okay."
"167","ఓరి దేవుడా.",", God."
"167","911!","911!"
"169","నాకు తెలిసిన ఒక స్నేహితుడికి ప్యాంక్రియాటికి క్యాన్సర్ వచ్చింది.","Good friend of mine got the pancreatic cancer."
"170","నాలుగు నెలల్లో చనిపోతాడని డాక్టర్లు చెప్పారు.","Doctor said he'd be dead in four months."
"171","ఒక వారం తర్వాత, చర్చి మెట్ల మీద తడిగా ఉండే సరికి వాటిపై నడిచేటప్పుడు అతను జారి పడ్డాడు, దానితో అతని తల మెట్లకి బలంగా తగిలింది.","A week later he slipped walking up some icy steps of a church, mind you, and hit his fucking head."
"172","అతని భార్యాపిల్లల కళ్ల ముందే చనిపోయాడు.","Died right there in front of his wife, one of his kids."
"173","సెయిట్ ఆగస్టీన్ చర్చి మెట్ల మీద చనిపోయే ముందు అతను అన్న ఆఖరి మాటలేంటో తెలుసా?","Know what his last words were before he bled out all over the steps of St. Augustine's?"
"175","""ఎప్పుడైనా ఏమైనా జరగవచ్చు.","""You just never fucking know."
"175","""",""""
"179","లోపలికి ఎలా వచ్చావు?",", how'd you get in here?"
"180","తలుపు తెరిచే ఉంది.","Door was open."
"182","ఏం చేస్తున్నావు?","What you working on?"
"184","జేమ్స్.","James."
"186","వీటిని పూర్తి చేసేశాను.","I finished them."
"187","ఇరవై ఒకటా?","Twenty-one?"
"187","ఎందుకు?","Why?"
"188","ఎందుకంటే నాకు చెక్కడమంటే ఇష్టం.","Um, because I like to carve."
"189","అది కాదు, 21 బొమ్మలనే ఎందుకు చెక్కావు?","No. Why 21?"
"190","ఇరవై కానీ, రెండు డజన్లు కానీ చెక్కవచ్చు కదా?","Why not 20 or an even two dozen?"
"192","అంటే, నేను బాగా చెక్కుతాను. చూడు.","Like, I carve well. See?"
"193","కానీ నాకు రంగులు వేయడం రాదు.","It's too bad I don't paint well."
"194","ఆ పని గ్యారీ చేస్తాడు.","I'll leave that to Gary."
"195","గ్యారీ వీటికి నల్ల రంగు వేస్తాడు.","Gary paints them black."
"196","నల్ల రంగు అంటే అట్లాంటి ఇట్లాంటి నల్ల రంగు కాదు.","Blacker than any black you've ever seen."
"197","అయితే వీటికి గ్యారీకి పంపుతున్నావా?","Shipping these to Gary?"
"198","అవును, ఇంటికి పంపిస్తున్నా.","Home, yeah."
"199","ఇవి దేనికో తెలుసా, జేమ్స్?","Do you know what they're for, James?"
"200","తెలీదు.","No."
"201","ఇవి చనిపోయాక దేహాలను గమనిస్తుంటాయి.","They watch over the dead."
"202","అవి ఆ చనిపోయిన వారి ఆత్మలకు కాపలాగా ఉండి వాటికి ఏం కాకుండా చూసుకుంటాయి.","They guard their spirits to make sure they're okay."
"203","ఈ కళ్లనేనా నువ్వు నాకు చూపించాలనుకుంది?","These are the eyes you wanted me to see?"
"204","ఈ కళ్లు చూడు.","Well, there's these too."
"206","సరే.","Right."
"207","విషయమేంటంటే, జేమ్స్, నువ్వు నన్ను అబద్ధాలకోరు అని అనుకోవడం, నాకు చాలా బాధగా అనిపించింది.","You know, James. You thinking that I was a liar, that made me sick to my stomach."
"208","ఎందుకంటే, అప్పుడు నేనేం చేసినా సీరియస్ గా చేయనని నువ్వు అనుకోవచ్చు.","Because then maybe you'd think that I don't take what I do seriously."
"209","నేన చాలా జాగ్రత్తగా చేస్తాను.","There's a a a care that should be taken."
"210","నేను చెప్పేది అదే.","That's what I'm saying."
"210","ఏదో ఆషామాషీగా చేసేయకూడదు.","It shouldn't be casual."
"211","నువ్వు గడిపిన 80 మంది మహిళల్లా కాదు ఇది.","You know, not like your 80 women you've been with."
"212","లేదు, ఇలా చెప్తున్నానని ఏమనుకోకు, వాళ్లలో కొందరి పేర్లు కూడా నీకు గుర్తుండకపోవచ్చు.","No. I'm sorry to say, but you probably don't remember some of their names."
"213","బహుశా వాళ్ల శరీర భాగాలు నీకు సరిగ్గా గుర్తుండకపోవచ్చు.","Maybe their body parts start to blur."
"214","నేనేమైనా తప్పుగా చెప్పానా?","Am I wrong?"
"215","అది కేవలం క్యాజువల్ సెక్స్, లారీ.","It was just sex, Larry."
"216","అది కేవలం సెక్స్ అని తీసిపారేయకూడదు.",", it's never just sex."
"217","ఏ విషయాన్నైనా తీసిపారేయకూడదు.","Never just anything."
"218","నువ్వు ఒక వ్యక్తిని కలిశావంటే ఏదోక కారణం ఉండుంటుంది.","Every interaction you have with a person means something."
"219","మనం ఈ ప్రపంచానికి రుణపడుండేది అదే.","We We That's what we owe to the to the the world."
"220","అలాగే చరిత్రకి కూడా.","To history."
"221","కొన్నిసార్లు అది కేవలం క్యాజువల్ సెక్సే అవుతుంది.","Sometimes it's just sex."
"222","లేదు.","No."
"223","మనం కలిసిన ప్రతీ ఒక్కరికీ సమాన ప్రాధాన్యత ఇస్తే పిచ్చోళ్లం అయిపోతాం, లారీ.","If every interaction with another person had the same weight we'd all go insane, Larry."
"224","లేదు.","No."
"224","నేను చెప్పేది నీకు అర్థం కావట్లేదా?","You fucking hear me?"
"225","లేదు, లేదు, లేదు.","No, no, no, no, no."
"226","నోర్మూసుకొని చెప్పేది విను.","Shut the fuck up and listen to me."
