"Index","Telugu Text","Mapped English Text"
"227","మనందరమూ జగన్నాటకంలో పాత్రధారులమే.","We are part of something."
"228","నేను కూడా అంతే.","I am a part of something."
"229","నేను ఒకరి గుడ్డలను మడతపెట్టినప్పుడు, అది జాలితో అన్నమాట ఆ దేవుని జాలితో.","When I folded those clothes, that was an act of kindness from a a a deity."
"230","ఎవరి గుడ్డలు?","Whose clothes?"
"231","నువ్వు ఎవరి గురించి మాట్లాడుతున్నావు?","Who are we talking about?"
"233","ట్రిషియా రైట్లర్ గురించి.","Tricia Reitler's."
"234","తన కోసం అందరూ వెతికారు.","Everyone was looking for her."
"235","ఇంకా వెతుకుతూనే ఉన్నారు.","They still are."
"236","తను కూడా నీ వ్యాన్ ఎక్కిందా?","She got in your van too?"
"237","తనతో వేగడం కష్టం.","She was a handful."
"238","ఒక మగాడి కన్నా బలంగా గుద్దింది.","She punched like a man."
"239","తనని కత్తితో పొడిచే ఉద్దేశం అస్సలు నాకు లేనే లేదు, జేమ్స్.","And I didn't wanna stab her, James."
"240","నేను తనని పొడవలేదు ఎందుకంటే తనని నేను తర్వాత ఎలాగూ పొడుస్తానుగా.","I didn't stab her because I was going to stab her."
"241","తను నన్ను కొట్టడం ఆపాలని తనని పొడిచాను.","I stabbed her to stop her from hitting me."
"241","అయ్య బాబోయ్.","Man."
"243","కానీ అది పని చేయలేదు.","But that didn't work."
"244","నన్ను ఏదోక విధంగా కొట్టాలని తను ప్రయత్నిస్తూనే ఉండింది.","She just kept on trying to hurt me."
"245","నేను తన గొంతు నులమాల్సి వచ్చింది.","I had to choke her."
"246","తనను పొడిచి, ఆ తర్వాత గొంతు కూడా నులిమావా?","You stabbed her and choked her?"
"247","ఆ దరిద్రపుగొట్టుది.","Such a nasty fucking girl."
"248","నేను స్పృహతప్పిపడిపోయాను.","I must have passed out."
"248","స్పృహ వచ్చేసరికి, తను పక్కన పడి ఉండింది.","When I woke up, there she was lying there."
"249","ఒంటి మీద బట్టల్లేవు.","Naked and all."
"250","ఊపిరి కూడా ఆడట్లేదు.","No pulse."
"251","కానీ నువ్వు ఓ మాట అన్నావు కదా, జేమ్స్.","But to your point, James."
"251","నువ్వు అన్న మాటకి నేను తనకి గొయ్యి తవ్వాను.","To your point I did dig her grave."
"252","ఇందాక నువ్వు నన్ను గేళి చేశావని నాకు తెలుసు.","I know you made fun of me earlier."
"253","కానీ నేను చిన్నప్పటి నుండి కొన్ని వందల గోతులని తవ్వాను.","But I've dug hundreds of graves since I was a child."
"254","నువ్వు పడుకొన్న వాళ్ల కన్నా ఎక్కువే తవ్వి ఉంటాను.","Probably more than you've had women."
"255","నేను నిజమే అంటున్నా.","I-I-I'm serious."
"255","నేను ఎక్కువ గోతులనే తవ్వా, నువ్వు పడుకొన్న.","I-I have I have dug more than you've."
"257","నువ్వు పడుకొంది 80 మందితోనా?","Was that 80?"
"259","నువ్వు అనుభవించినవారి కన్నా నేను తవ్విన గోతులే ఎక్కువ.","I've dug more than you've fucked."
"260","నేను చలిలో తవ్వాను.","I've dug in the cold."
"260","మండే ఎండల్లో తవ్వాను.","I've dug in the boiling heat."
"261","వర్షంలో తవ్వాను.","I've dug in the rainfall."
"262","దాని వల్ల నేల అంతా చిత్తడి చిత్తడిగా అయిపోయింది.","It turned the soil into oatmeal."
"263","ఒక మంచి గొయ్యి ఎక్కడ తవ్వాలో నాకు బాగా తెలుసు.","I know a good grave."
"264","నిజమే, జేమ్స్.","I do, James."
"265","నేను ట్రిషియా కోసం తవ్విన గొయ్యి నేను తవ్విన వాటిలోనే ఒకానొక అత్యుత్తమమైనది.","And Tricia's was one of the best I ever did."
"266","అది ఎక్కడ ఉందో ఎవరూ కనిపెట్టలేరు.","No one will ever find that one."
"267","కానీ అది ఎక్కడుందో నీకు తెలుసు కదా.","But you know where it is."
"268","ఆ గొయ్యిలన్నీ ఎక్కడున్నాయో నాకు తెలుసు.","I know where all of them are."
"269","ఈ జీవితంలో అందరికీ కావలసింది ఒకటే.","Everybody wants the same thing in this life."
"270","అందరూ తమనే చూడాలని ఆరాటం.","To be seen."
"271","వాళ్లని నేను చూస్తున్నాను, జేమ్స్.","Well, I see them, James."
"272","వాళ్లకి ఆ భాగ్యాన్ని కల్పిస్తున్నా.","I give them that."
"273","నేను బతికి ఉన్నంత కాలం, వాళ్ల ఆత్మకి శాంతి లభిస్తుంది.","And so long as my life continues on, theirs has meaning."
"274","అది.","It has."
"275","మీకు ఇంకా అయిదు నిమిషాలే ఉంది.","Five minutes, guys."
"277","నువ్వు ఇంకా ఎక్కువ చేయవచ్చు.","You You could do more."
"278","నాకు అర్థం కాలేదు.","I don't follow."
"279","నువ్వు వాళ్లకి శాంతి ఇవ్వవచ్చు, వాళ్ల కుటుంబాలకు అన్నమాట.","You could give them peace, their families anyway."
"280","వాళ్లకి నువ్వు ఆ మ్యాపును ఇవ్వవచ్చు.","You could give them the map."
"281","మ్యాపునా?","The map?"
"282","అవును.","Yeah."
"283","కానీ ఎందుకు?","But why?"
"284","వాళ్లకి మనశ్శాంతి లభిస్తుంది.","So they could sleep."
"285","వాళ్లు అంత్యక్రియలు నిర్వహించగలరు.","Bury their dead."
"286","నువ్వు వాళ్లకి మనశ్శాంతి ఇస్తే, అలాగే వాళ్ల కూతుళ్లకు నువ్వు నీ.","If If If you've given them their peace, and you've given the daughters your, um Your, your."
"287","నేను వాళ్లకి నా సాక్ష్యాలను ఇస్తే అంటున్నావా?","If I give them my my seeing My witness."
"288","అప్పుడు అంతా బాగుంటుంది.","Then everything will be okay."
"289","అంతా బాగానే ఉంది.","Everything is okay."
"289","చాలా హాయిగా ఉంది.","Everything is bliss."
"290","నువ్వు వాళ్లకి నీ సాక్ష్యం ఇస్తే. అప్పుడు ఆ తల్లిదంద్రులకు ఆ అమ్మాయిల శవాలు ఎక్కడ ఉన్నాయో తెలుస్తుంది.","If you If you've given them your your seeing then the parents would have the, , the the knowing of of where their girls are."
"291","వాళ్లకి కాస్తయినా ప్రశాంతత దక్కవచ్చు.","They could move on."
"292","జేమ్స్, నువ్వు సరిగ్గా ఆలోచించట్లేదు.","James, you're not thinking clearly."
"293","ఆ పనే నేను చేస్తే, జీవితాంతం నేను ఇక్కడే ఉండిపోతాను.","If I did that, then I would never get out of here."
"294","నువ్వు బయటపడవచ్చు.","You cou you could."
"295","ఒకవేళ ఎవరైనా.","Wh What if someone could send the."
"296","ఆ అమ్మాయిల శవాలున్న చోటును పోలీసులకు అజ్ఞాతంగా పంపారు అనుకో?","The locations of the girls to the authorities, like, anonymously?"
"297","ఎందుకు?","Why?"
"298","పంపుతారు అంతే.","They just did."
"299","అప్పుడు ఆ కుటుంబాలకి తెలుస్తుంది.","Then the the families would know."
"299","వాళ్ల దగ్గర అది ఉంటుంది.","They would have that."
"300","కానీ వాళ్ల దగ్గర అది ఉండాల్సిన అవసరమేంటి?","But why should they have that?"
"301","ఎందుకంటే, వాళ్లు చాలా బాధ పడుతూ ఉంటారు, లారీ.","B Because they're probably hurting pretty bad, Larry."
"303","జేమ్స్!","James!"
"304","జేమ్స్.","James, James."
"304","జేమ్స్, జేమ్స్.","James."
"305","నువ్వు నన్ను ఆటపటిస్తున్నావు కదా.","You're fucking with me."
"305","ఎప్పుడూ నన్ను ఆటపట్టిస్తూనే ఉంటావు.","You're always fucking with me."
"306","గ్యారీలాగానే.","Just like Gary."
"307","ఓరి దేవుడా. నువ్వు వాళ్లకి కాస్తంత మనశ్శాంతిని ఇవ్వాలి.",", my God You gotta give these people some release."
"308","ఏమన్నావు? మళ్లీ చెప్పు!","What did you say? Say that again?"
"310","వాళ్లకి కాస్త మనశ్శాంతిని ఇవ్వు.","Give these people some release."
"311","అది జరగని పని.","Never."
"312","ఎందుకు?","Why?"
"313","ఎందుకంటే, జేమ్స్, నేను అప్పీలు గెలవబోతున్నాను.","Because, James, I'm going to win my appeal."
"314","నేను ఈ జైలు నుండి విడుదలయి నా జీవితాన్ని జీవించబోతున్నాను.","And I'm going walk right out those doors and keep on living my life."
"316","నువ్వు అప్పీలు గెలవలేవు.","You're not gonna win your appeal."
"317","నీకు అంత సీన్ లేదు!","No fucking way!"
"318","జేమ్స్, ఎందుకు అదోలా ప్రవర్తిస్తున్నావు.","James, why are you acting."
"319","నువ్వు ఇక్కడి నుండి బయటపడవు.","You'll never get out of here."
"320","నువ్వు అమ్మాయిలను చంపుతావు. అమ్మ కావాలని వాళ్లు ఏడ్చినా లెక్కచేయవు.","You kill children who cry for their mothers."
"321","నువ్వు నరరూప రాక్షసుడివి!","You demented fucking monster!"
"322","నిన్ను బోమోంట్ పంపాడు కదా?","Beau Beaumont sent you, didn't he?"
"323","అవును కదా?","He did, didn't he?"
"324","నిన్ను బోమోంట్ పంపాడు! గార్డ్!","Beaumont, sent you! Guard!"
"325","నిన్ను బోమోంట్ పంపాడు.","Beaumont sent you."
"326","నిన్ను బోమోంట్ పంపాడు కదా?","Beaumont sent you, didn't he?"
"327","హేయ్! దరిద్రుడా!","Hey! You fuck!"
"329","చంపేస్తా! ఇక ఆపండి!","Fuck you! Break it up!"
"330","దరిద్రుడా!","You cunt fucking whore!"
"331","బోమోంట్ పంపాడు నిన్ను! అయిపోయావు నువ్వు!","Beaumont sent you! Fuck you!"
"332","నీది కూడా ఒక బతుకేనా!","Go fuck your mother!"
"333","నీ మనస్సు నిండా కుళ్లే ఉంది కదరా!","I know you've already fucking thought about it!"
"334","ఇక చాలు! ఛ!","Settle down! Fuck!"
"336","నేను డాక్టర్ జికర్మన్ తో మాట్లాడాలి.","I need to talk to Dr. Zicherman."
"337","ఇప్పుడే మాట్లాడాలి.","No, tonight."
"338","అది జరగని పని.","Ain't happening."
"339","ఆయనకి ఫోన్ చేసుకోవచ్చా?","How about a phone call?"
"339","రెండే నిమిషాలు మాట్లాడతానంతే.","Just a quick one."
"340","పోన్ కాల్?","Phone call?"
"340","ఆపరా బాబూ.","Convict, please."
"341","ఫోన్ లేదు గీన్ లేదు.","Ain't no phone call happening either."
"342","దయచేసి వినండి.","Please."
"343","చూడు, రేపు ఫోన్ కలిపిస్తాలే.","Look, I'll hook you up in the morning."
"343","సరేనా?","All right?"
"344","థ్యాంక్యూ.","Thank you."
"349","లేదు.","No."
"349","నాకు డాక్టర్ జికర్మన్ కావాలి.","I need Dr. Zicherman."
"349","శాంతించు.","Calm down."
"350","నాకు డా. జికర్మాన్ వద్దు! ఓయ్.","Get me Dr. Zich No! Come on."
"351","అతని ఫోన్ నంబర్, 6-1-2-5-7-1-1.","His number is 6-1-2-5-7-1-1."
"352","అంతే! నాకింకేమీ వద్దు.","That's it! That's all I need."
"352","ఆ సాయం ఒక్కటి చాలు!","That's it!"
"353","6-1-2-5-7-1-1.","6-1-2-5-7-1-1."
"354","అయ్యో. కనీసం వార్డెన్ తో అయినా మాట్లాడే అవకాశం ఇవ్వండి.","No. Okay. Just let me talk to the warden."
"355","వార్డెన్ తో అయినా మాట్లాడే అవకాశం ఇవ్వండి! నోర్మూయ్!","Let me talk to the fucking warden! Shut the fuck up!"
"356","నోర్మూయ్! వద్దు! వద్దు!","Shut the fuck up! No! No! No!"
"357","లోపలికి వెళ్లు.","Get in."
"357","ఆగండి! ఆగండి!","No! No! No! No!"
"358","హేయ్.","Hey."
"358","హేయ్.","Hey."
"358","నాకు ఒక్క పెన్సిల్ ఇవ్వండి.","I just need a pencil."
"359","నీకు ఇంకో దుప్పటి, ఇంకో దిండు, ఇంకా ఎక్కువ టాయిలెట్ పేపర్ కావాలంటే నువ్వు మాకు కొండంత ఉపకారం చేసి పెట్టాలి, ఇక నోర్మూసుకొని పడుండు.","If you want another blanket, another pillow, more toilet paper, you gotta do us a huge favor and shut the fuck up, Convict."
"360","లేదు.","No."
"360","లేదు, నాకు.","No, I."
"363","నాకు ఒక్క పెన్ కానీ పెన్సిల్ కానీ కావాలి. క్రేయాన్ అయినా పర్లేదు, ఏదోకటి ఇవ్వండి!","I need a pen. A pencil. A fucking crayon, anything!"
"364","దయచేసి వెళ్లిపోకండి!","Come back, please!"
"365","ఇక్కడికి రండి!","Please, come back!"
"368","నాకు ఒకే ఒక్క పెన్సిల్ ఇవ్వండి.","If I could just use a pencil."
"369","నేనేం చేస్తున్నానో మీరు దగ్గర ఉండి చూడవచ్చు కూడా.","You can even stand here with me while I use."
"372","మన లోపలి ద్రవాలు, అవన్నీ.","Bodily fluids, they all."
"373","వాటిలో ఒక్కోటి ఒక్కో పని చేస్తుంటాయి.","They all serve, like, a different function, every one of them."
"374","ఉమ్ము ఒక పని చేస్తుంది, రక్తం ఒక పని చేస్తుంది, అలా అన్నమాట.","Like, saliva has one purpose, and blood another."
"380","రోజంతా ఆయన అదే పని చేస్తాడా?","He do that all day?"
"381","ఆ రోజు ఉండే పనిని బట్టి.","Depends."
"382","తగలబెట్టడానికి అంత ఉంటుందా?","That much to burn, huh?"
"383","ఒక్కోసారి ఉంటుంది.","Sometimes, yeah."
"383","ఎక్కువగా చెత్త, ఇంకా చాలా చాలా వాడిపోయిన పూలు ఉంటాయి.","Just scrub, lots of dead flowers."
"384","నిజం చెప్పాలంటే, అతనికి అది అలవాటైపోయింది.","Mostly, though, he's just in the habit."
"384","తాగుతూ మంటల్లోకి చూడటం అతనికి ఇష్టం.","Likes staring into the fire, drinking."
"385","మనం కొన్నేళ్ల క్రిందట కలిశాం.","We met a few years ago."
"386","నాకు గుర్తుంది.","I remember."
"386","హా.","Yeah."
"387","ఆమె కూడా గుర్తుంది.","Remember her too."
"388","బ్రయన్ మిల్లర్.","Brian Miller."
"389","లారెన్ మెక్ కాలీ, ఎఫ్.బీ.ఐ.","Lauren McCauley, FBI."
"389","నువ్వు ఇంకా ఇక్కడే ఉంటావని అనుకోలేదు.","I didn't think you lived here anymore."
"390","నేను ఉండట్లేదు.","I don't."
"391","అప్పుడప్పుడూ వచ్చి సాయపడుతుంటాను.","Come back to help out now and again."
"392","మీ జుట్టుకు ఏమైనా చేసుకున్నారా?","You do something different with your hair?"
"393","లేదు.","No."
"394","రంగు వేసుకున్నారా?","Color it?"
"394","లేదా?","Nothing?"
"395","లేదు.","Nope."
"396","బాగున్నారు.","You look good."
"397","మంచి మాటే చెప్పావు, గ్యారీ.","That's nice of you to say, Gary."
"397","కాస్త లోపలికి వెళ్లి మాట్లాడుకుందామా?","Maybe we could all talk inside?"
"398","మీ దగ్గర వారెంట్ ఉందా?","You got a warrant?"
"399","అయితే తాజా గాలినే ఆస్వాదించండి.","Then enjoy the fresh air."
"400","నాకు సభ్యత సంస్కారం ఉందిలెండి.","Got manners around here."
"402","థ్యాంక్స్.","Thanks."
"403","పర్వాలేదు.","You're welcome."
"404","అతడిని జీవితాంతం బయటకు రానివ్వకుండా లోపల వేసేశారు కదా.","You already got him locked up the rest of his life."
"405","అప్పీలు గెలిస్తే వస్తాడు కదా.","Not if he makes his appeal."
"406","అవును.","Yeah."
"407","మీ దగ్గర అతినికి వ్యతిరేకంగా సాక్ష్యం లేదు, అంతా మీ ఊహ మాత్రమే.","Well, you ain't never had shit on him but a lot of conjecture."
"408","లేదు, మా దగ్గర రెండు నేరాంగీకారాలు ఉన్నాయి.","No, we got two confessions."
"409","అవును, లాయర్ వాటిని బలవంతంగా పెట్టించుకున్నారు అని అన్నాడు కదా.","Yeah, ""coerced"" was the word his lawyer used."
"410","ఒక కోర్టు ఒప్పుకుంది.","One court's agreed."
"410","రెండవ కోర్టు కూడా ఒప్పుకుంటుందేమో అని మీ బాధ, అందుకే ఇలా దయచేశారు.","You wouldn't be here bothering us if you didn't think his second appeal's gonna go the same way."
"411","ఒప్పుకుంటే, ఇంటికి వచ్చేస్తాడు.","And then he'll be back home."
"412","అవును.","Yeah."
"413","మళ్లీ అవే వేషాలు వేస్తాడు.","Up to his old tricks."
"414","మళ్లీ అతనికి తన ఉద్యోగం వచ్చేస్తుంది, అతనికి ఏమీ కాదు.","He'll get his old job back and be fine."
"415","అవును.","Yeah."
"415","ఒక చక్కటి అమ్మాయిని చూసుకొని పెళ్లి చేసుకొని, పిల్లలని కంటాడేమో.","Maybe meet a nice girl, settle down, raise a family."
"416","హేయ్.","Hey."
"417","ఏంటి?","What?"
"417","అలా మాట్లాడవద్దు.","Just don't."
"418","అలా అంటే ఎలా?","Don't what?"
"418","నా మీద, నా వాళ్ల మీద కామెడీ చేయవద్దు.","Don't make fun of me and mine."
"419","నేనేమీ కామెడీ చేయడం లేదు, గ్యారీ.","No one's making fun of you, Gary."
"419","మీరు కామెడీయే చేస్తున్నారు.","No, sure you are."
"419","ఏదేదో వాగుతున్నారు.","Talking shit."
"420","""లారీ అందరిలా మామూలు జీవితం సాగిస్తాడు.","""Larry's gonna live a normal life."
"420","భార్యాపిల్లలు కూడా ఉంటారు.","Have a wife and kids."
"420","""",""""
"421","అతనికి అలాంటి జీవితం దక్కదని మీకు ఎందుకు అనిపిస్తోంది?","What makes you think he won't?"
"422","అవును.","Yeah."
"422","మీకు ఇప్పుడు నేనేం చెప్పాలంటే, నా సోదరునికి అందరిలా మామూలు జివితం గడపలేడు కనుక, దానర్థం అతను జనాలను చంపుతాడనా?","Yeah, you want me to say because my brother ain't capable of having a normal home life, that means he kills people?"
"423","చంపుతాడని నీకు అనిపిస్తోందా?","Well, does he?"
"424","చూడండి, లారీ కొన్ని దారుణమైన పనులు చేశాడు.","Look, Larry's done some terrible things, sure."
"424","ఎవరు మాత్రం చేసుండరు?","Who hasn't?"
"425","కానీ వాడు ఎవరినీ చంపలేదు.","But he ain't never killed no one."
"426","అతని జీవితంలో ఒక్కరైనా తనని గుర్తించాలని చాలా తపించిపోయేవాడు.","He's just so desperate someone see him once in his life."
"427","గుర్తించడమంటే ఎలా?","See him as a what?"
"428","ఒక వ్యక్తిలా.","A person."
"429","సరదాభరితమైన వ్యక్తిలా, తెలివైన వాడిలా, జనాలకు సాయపడేవాడిలా.","Someone who can be funny, smart, fucking helpful to people."
"430","నీ సోదరుడంటే నీకు చాలా ఇష్టమని నాకు తెలుసు, గ్యారీ, కానీ ఆ అమ్మాయిలందరినీ చంపింది అతనే.","I know you love your brother, Gary, but he killed those girls."
"431","లేదు.","No."
"432","ఆ విషయం నీకు కూడా తెలుసనుకుంటా.","I think you know that."
"435","దీన్ని మీ కోసమే తెచ్చా.","That's for you."
"436","ఇవి నాకోసం.","These, mine."
"437","ఆ ఫోటోలలో ఉన్న వ్యక్తి అతనే, అతనేమీ రాక్షసుడు కాదు.","He's the person in those pictures, not some beast."
