"Index","Start Time","End Time","Telugu Text","Mapped English Text"
"150","00:11:07,960","00:11:13,632","నేను కాగల అత్యుత్తమ థెరపిస్ట్ గా నన్ను నేను అంకితం చేసుకోవాలనుకుంటున్నాను.","I want to dedicate myself to being the very best therapist that I can be."
"151","00:11:14,258","00:11:16,718","కానీ నా గురించి ఇక చాలు. నీ గురించి చెప్పు.","But enough about me. Tell me about you."
"152","00:11:16,802","00:11:17,928","నువ్వు ఎలా ఉన్నావు?","How are you?"
"153","00:11:19,888","00:11:22,850","నేను... నేను బానే ఉన్నాననుకుంటాను.","I'm… I'm fine, I guess."
"154","00:11:22,933","00:11:24,434","మళ్ళీ ఆ పదమే వాడుతున్నావు.","There's that word again."
"155","00:11:24,518","00:11:26,562","హా, మనం చేయాల్సిన పని ఇంకా కొంచెం ఉంది.","I see we have a little more work to do."
"156","00:11:29,022","00:11:33,068","నీకు తెలుసా, మార్టీ, ప్రతి బంధానికి దాని లోటుపాట్లు ఉంటాయి.","You know, Marty, every relationship has its ups and downs."
"157","00:11:33,151","00:11:37,698","కానీ ప్రేమ, గౌరవం అనే పునాదులు ఉంటే నువ్వు ఎలాంటి తుఫానునైనా ఎదుర్కోగలవు.","But if there's a foundation of love and respect, you can weather any storm."
"158","00:11:38,699","00:11:43,328","అలా అన్నా, కొన్నిసార్లు ఆ ప్రేమ మరియు గౌరవాన్ని పునరుద్ఘాటించుకోవడం మంచిది.","That said, sometimes it's good to reaffirm that love and respect."
"159","00:11:44,913","00:11:49,293","అందుకనే నేను, బానీ మా పెళ్లి ప్రమాణాలు మళ్ళీ చేసుకోవాలని అనుకుంటున్నాము.","And that is why Bonnie and I are renewing our vows."
"160","00:11:51,420","00:11:53,088","సరే. అలాగే, అది బాగుంది.","Okay. Yeah, that sounds good."
"161","00:11:53,172","00:12:00,762","మేము దాని గురించి మాట్లాడుకున్నాము, మేమిద్దరమూ మా బెస్ట్ మ్యాన్ అవ్వగల వ్యక్తి ఒక్కరే ఉన్నారని నిర్ణయించుకున్నాము.","We talked about it, and we both decided there could only be one person who could possibly be our best man."
"162","00:12:02,556","00:12:04,308","-నువ్వు. -నేనా?","- You. - Me?"
"163","00:12:05,309","00:12:06,310","ఏమో.","I don't know."
"164","00:12:06,894","00:12:07,936","అది నువ్వే.","You must."
"165","00:12:08,020","00:12:11,857","నువ్వు నాకు చాలా ముఖ్యమైన వాడివి, మా ఇద్దరికీ. చాలా ఆత్మీయుడివి.","You're so important to me, to both of us. So beloved."
"166","00:12:11,940","00:12:14,902","-అలా అనడం మీ మంచితనం, కానీ... -అది నాకు చాలా అమూల్యమైనది.","- That's very nice of you to say, but... - It would mean so much to me."
"167","00:12:16,069","00:12:17,112","ఏమంటావు?","What do you say?"
"168","00:12:19,072","00:12:23,202","నువ్వు నా బెస్ట్ మ్యాన్ అయ్యే గౌరవాన్ని నాకు ఇస్తావా?","Would you do me the honor of being my best man?"
"169","00:12:28,540","00:12:29,958","అలాగే, ఎందుకు కాదంటాను?","Sure, why not?"
"170","00:12:46,934","00:12:48,393","-హే... -హే.","- Hey... - Hey."
"171","00:12:56,944","00:12:57,944","నాన్సీ?","Nancy?"
"172","00:13:04,159","00:13:05,410","కూర్చో.","Have a seat."
"173","00:13:12,835","00:13:15,379","వావ్, నువ్వు చాలా పెద్దయిపోయావు.","Wow, you're like a grown woman."
"174","00:13:15,963","00:13:17,381","అలా అని ఎవరనుకుంటారు?","Who'd have thought?"
"175","00:13:18,257","00:13:21,552","ఫేస్ బుక్ లో నిన్ను వెతకడంలో బ్రూస్ నాకు సహాయం చేశాడు.","Bruce helped me track you down on Facebook."
"176","00:13:21,635","00:13:23,136","నువ్వు ఎలానా అని అనుకుంటే.","If you were wondering."
"177","00:13:23,220","00:13:25,305","-ఆఫీసులో బ్రూస్. -ఆ, మీరు చెప్పారు.","- Bruce at the office. - Yeah, you mentioned."
"178","00:13:28,225","00:13:31,436","అయితే, నన్ను ఎందుకు పిలిచారు? మీరేం చెప్పాలనుకుంటున్నారు?","So, why am I here? What do you want to say?"
"179","00:13:31,520","00:13:33,689","నేను కేవలం మాట్లాడడానికి పిలిచాను. నాకు... అది, నాకు...","Just wanted to talk. I wanna... Well, I..."
"180","00:13:34,439","00:13:40,195","నేను ఏం చెప్పాలనుకున్నానంటే... నేను నిన్ను మిస్ అవుతున్నాను.","What I wanted to say is that… I miss you."
"181","00:13:40,779","00:13:43,198","నేను మీ అమ్మని మిస్ అవుతున్నాను. మీ అందరినీ మిస్ అవుతున్నాను.","I miss your mom. I miss all of you."
"182","00:13:44,074","00:13:46,159","అవును, మీరు మమ్మల్ని మిస్ అవ్వాలి.","Yeah, you should miss us."
"183","00:13:46,243","00:13:49,580","మేము చాలా మంచి వాళ్ళం, మీరు మా జీవితంలో అసలు లేనే లేరు.","We're pretty great, and you've been gone our entire lives."
"184","00:13:51,373","00:13:54,835","అవును. కాదు, అది నిజం. అవును.","Yeah. No, that's true. Yeah."
"185","00:13:57,921","00:14:06,138","నిన్ను చివరి సారి చూసినప్పుడు, నీకు... నీకు అవి చాలా నచ్చేవి... వాటిని ఏమంటారు?","The last time I saw you, you were… You were crazy about those... What were they called?"
"186","00:14:06,221","00:14:07,222","నాకు తెలీదు.","I don't know."
"187","00:14:07,306","00:14:10,976","నువ్వు మెక్ డొనాల్డ్స్ నుంచి ఆ ప్లాస్టిక్ బొమ్మలన్నీ సేకరించేదానివి.","You were collecting all the plastic figures from McDonald's."
"188","00:14:11,685","00:14:14,313","ఆ సెట్ పూర్తి చెయ్యడానికి నీకు ఆ చివరి బొమ్మ దొరికిందా?","Did you ever get the last one to complete the set?"
"189","00:14:14,396","00:14:15,981","-ఒక హ్యాంబర్గ్లర్? -ఆ-హా.","- A Hamburglar? - Uh-huh."
"190","00:14:17,107","00:14:18,692","లేదు, లేదు, నాకు దొరకలేదు.","No. No, I did not."
"191","00:14:20,527","00:14:21,570","అయ్యో.","I'm sorry to hear that."
"192","00:14:21,653","00:14:22,738","నేనది మర్చిపోయాను.","I'm over it."
"193","00:14:24,156","00:14:25,574","-అవును. అవును. -అవును.","- Of course. Yeah. - Yeah."
"194","00:14:26,200","00:14:28,160","నువ్వు అప్పుడు చిన్నపిల్లవి. అవును.","You were just a child. Yeah."
"195","00:14:30,954","00:14:33,707","-నువ్వు లాయర్ అని బ్రూస్ చెప్పాడు, అవునా? -హా, అవును.","- Bruce tells me you're a lawyer? - That's right."
"196","00:14:35,167","00:14:36,168","వావ్.","Wow."
"197","00:14:36,251","00:14:38,795","అద్భుతం. నాకు చాలా గర్వంగా ఉంది.","I'm so impressed. I'm so proud."
"198","00:14:40,130","00:14:41,340","మీరు గర్వపడాల్సిన అవసరం లేదు.","You don't get to be proud."
"199","00:14:44,384","00:14:48,722","-అవును. -ఏదో ఒక పిచ్చి కారణం కోసం, మీరు నన్ను ఇక్కడికి క్షమాపణ చెప్పడానికి పిలిచారనుకున్నాను.","- Right. - For some crazy reason, I thought you had asked me here to apologize."
"200","00:14:49,431","00:14:52,184","-అలా ఎందుకు అనిపించిందో తెలీదు. -ఆగు, నాన్సీ, ప్లీజ్.","- I don't know what I was thinking. - Wait, Nancy, please."
"201","00:14:52,267","00:14:55,521","లేదు, నేను గత ముప్పై ఏళ్లుగా ఎదురు చూస్తున్నాను.","No, I've been waiting for almost 30 years."
"202","00:14:56,855","00:14:58,524","నాకు మిమ్మల్ని మళ్ళీ చూడాలని లేదు, మార్టీ.","I don't want to see you again, Marty."
"203","00:14:59,274","00:15:00,526","మా అమ్మకి కూడా లేదు.","And neither does my mom."
"204","00:15:14,373","00:15:15,499","నీకొక మాట చెప్పనా?","You know what?"
"205","00:15:16,583","00:15:17,751","నేను అనుకుంటున్నాను.","I've been thinking."
"206","00:15:25,175","00:15:26,635","నేనేమనుకుంటున్నానో తెలుసా?","You know what I've been thinking?"
"207","00:15:27,344","00:15:28,345","తెలీదు.","No."
"208","00:15:29,346","00:15:30,931","మనం మళ్ళీ మన పెళ్లి ప్రమాణాలను చేసుకోవాలి.","We should renew our wedding vows."
"209","00:15:31,014","00:15:32,015","ఏంటి?","What?"
"210","00:15:32,766","00:15:35,561","-మనం మళ్ళీ మన పెళ్లి ప్రమాణాలను చేసుకోవాలి. -ఎందుకు?","- I think we should renew our wedding vows. - Why?"
"211","00:15:35,644","00:15:38,105","బహుశా ప్రశ్న ఎందుకు కాదు అన్నది అవ్వాలేమో?","Maybe the question is, why not?"
"212","00:15:38,188","00:15:40,399","అందుకు కొన్ని కారణాలు ఉన్నాయి.","Well, there's a bunch of reasons."
"213","00:15:40,482","00:15:44,236","-ఏంటవి? -అది, ఐసాక్, నిజం చెప్పు.","- Such as? - Such as, Isaac, be honest."
"214","00:15:44,319","00:15:46,488","నిన్ను నేను అసలు చూడనే చూడను. నువ్వు ఇక్కడ ఉండనే ఉండవు.","I barely see you. You're never here."
"215","00:15:46,572","00:15:48,365","మనం ఒకే గదిలో పడుకుని కొన్ని...","We haven't slept in the same room since..."
"216","00:15:48,448","00:15:51,076","సరే, అలాగే, అలాగే. నాకు తెలుసు. నాకు వివరాలు చెప్పనవసరం లేదు.","Okay, all right, all right. I know. Spare me the details."
"217","00:15:51,159","00:15:54,621","మనం మళ్ళీ మన పెళ్లి ప్రమాణాలను చేసుకుని ఏం సాధిస్తామని అనుకుంటున్నావు?","What exactly do you think renewing our vows is going to achieve?"
"218","00:15:55,247","00:15:57,374","నువ్వు ఇంకొక పార్టీ ఇవ్వడం కోసం కారణం వెతుకుతున్నావా?","Are you just looking to have another party?"
"219","00:16:00,836","00:16:03,547","లేదు, మార్టీతో ఏదో అవుతోంది.","No, something is going on with Marty."
"220","00:16:03,630","00:16:06,675","కొన్ని సంబంధాలు కలకాలం నిలిచి ఉండవు.","Well, you know, some relationships run their course."
"221","00:16:06,758","00:16:09,094","-అలా మాట్లాడకు. -కానీ అది నిజం.","- Don't talk like that. - But it's true."
"222","00:16:09,178","00:16:11,471","నువ్వు ఇక దాన్ని వదిలిపెట్టాలి.","Maybe you should just walk away."
"223","00:16:11,555","00:16:13,557","నాకు వదిలి పెట్టాలని లేదు.","I don't want to walk away."
"224","00:16:14,766","00:16:16,977","-నేను తప్పేమీ చెయ్యలేదు. -కానీ ఇది సహజం కాదు.","- I've done nothing wrong. - But it's not normal."
"225","00:16:17,060","00:16:20,063","కాదు... ""సహజం కాదు."" సహజం కా...","No... ""Not normal."" Not norm..."
"226","00:16:20,147","00:16:23,025","నీకు తెలుసా? సహజం అంటూ ఏమీ లేదు.","You know what? There's no such thing as normal."
"227","00:16:23,108","00:16:27,112","నేను గత ముప్పై ఏళ్లుగా ఒక సైకియాట్రిస్ట్ గా ఉన్నాను… …అది నిజం అని నీకు చెప్పగలను.","I've been a psychiatrist for 30 years, and I can tell you that for a fact."
"228","00:16:27,196","00:16:28,989","సహజం అంటూ ఏమీ లేదు.","There is no such thing as normal."
"229","00:16:29,072","00:16:33,911","సరే, కానీ నాకు… దీనిలోని కొన్ని అంశాల గురించి ఆందోళనగా ఉంది.","Okay, but I worry about… certain aspects of this."
"230","00:16:33,994","00:16:35,454","మనం తప్పేమీ చెయ్యలేదు.","We have done nothing wrong."
"231","00:16:36,371","00:16:37,831","అతనే మనల్ని ఆహ్వానించాడు.","He invited us."
"232","00:16:37,915","00:16:40,250","అతనే మనల్ని అతని మాస్టర్ బెడ్ రూమ్ లో పడుకోమని అన్నాడు.","He wanted us to sleep in the master bedroom."
"233","00:16:40,334","00:16:43,462","అతను మనల్ని అక్కడ ఉండమన్నాడు. సరేనా?","He wanted us there. Okay?"
"234","00:16:43,545","00:16:46,089","మనం అతనికి అంతా ఇచ్చాము. అతనికి ఒక కుటుంబాన్ని ఇచ్చాము.","We gave him everything. We gave him a family."
"235","00:16:48,717","00:16:49,718","నాకు ఈ పెళ్లి కావాలి.","I need this wedding."
"236","00:16:53,263","00:16:54,389","మనకు ఈ పెళ్లి కావాలి.","We need this wedding."
"237","00:16:58,185","00:16:59,186","సరే.","Fine."
"238","00:17:01,021","00:17:03,524","సరేనా? లేక ""నేను చేసుకుంటాను"" నా?","Fine? Or ""I do""?"
"239","00:17:10,695","00:17:13,075","నువ్వునా స్తనాలు ముట్టుకుంటున్నావా?","Are you touching my breast?"
"240","00:17:14,826","00:17:16,787","నేను ముట్టుకుంటే నీకేమైనా ఇబ్బందా?","Would it be a problem if I was?"
"241","00:17:16,868","00:17:20,915","ఇప్పుడు... ఇప్పుడు ఇంకా తొమ్మిదే అయింది. నా గదిలో 20/20 రికార్డ్ చేసుకున్నాను.","It's just... It's 9:00 p.m. I have a 20/20 DVR'ed in my room."
"242","00:17:24,711","00:17:25,712","సరే.","Okay."
"243","00:17:27,214","00:17:28,214","సరే.","Sure."
"244","00:17:32,970","00:17:35,264","వన్ అవర్ ఫ్రేమింగ్","**[NO ENGLISH MATCH FOUND]**"
"245","00:17:52,322","00:17:53,323","హలో?","Hello?"
"246","00:17:58,412","00:17:59,830","-హే. -మార్టీ.","- Hey. - Marty."
"247","00:17:59,913","00:18:02,541","-వావ్, నిన్ను కలిసి చాలా కాలమైంది. -హే, జో. ఎలా ఉన్నావు?","- Wow, long time, no see. - Hey, Joe. How you doing?"
"248","00:18:02,624","00:18:05,252","నాకు వృషణాల క్యాన్సర్ ఉందనుకున్నారు.","You know, they thought I had ball cancer."
"249","00:18:05,335","00:18:08,755","కానీ అది నా వృషణంలో ఒక అభివృద్ధి చెందని అండం అని తెలిసింది.","Turned out to be an undeveloped ovary on my testicle."
"250","00:18:08,839","00:18:10,299","అవును, అదంతా పెద్ద వార్త అయింది.","Yeah, it was in all the journals."
"251","00:18:11,133","00:18:12,134","అభినందనలు.","Congratulations."
"252","00:18:12,217","00:18:15,053","సరేలే, ఏంటి సంగతి? ఏం కావాలి?","Anyway, you got something for me? What can I do for ya?"
"253","00:18:16,096","00:18:18,265","నేను హానాతో మాట్లాడదామని అనుకున్నాను.","Actually, I was hoping to speak to Hannah."
"254","00:18:19,183","00:18:21,560","హానా ఇక్కడ పని చేయడం మానేసి చాలా కాలమైంది.","Hannah hasn't worked here in a long time."
"255","00:18:21,643","00:18:25,689","సరే. నేను ఆమెతో ఫోన్ చేసి మాట్లాడడానికి మీ దగ్గర ఆమె నంబర్ ఏమైనా ఉందా?","Right. Would you happen to have a number I could phone her on?"
"256","00:18:25,772","00:18:30,068","ఉందనుకుంటాను. ఆమెకి పెళ్లైంది, ఇద్దరు పిల్లలు కూడా ఉన్నారు.","I guess. You know, she's married with kids now."
"257","00:18:31,445","00:18:32,613","వావ్.","Wow."
"258","00:18:34,072","00:18:37,910","నేను ఊరికే ఆమె గురించి అడుగుదామని అనుకున్నాను.","Yeah, I just wanted to check in."
"259","00:18:38,619","00:18:40,037","ఆమె ఎలా ఉందో చూద్దామనుకున్నాను.","See how she was doing."
"260","00:18:40,120","00:18:45,584","ఇది వింతగా ఉండచ్చని నాకు తెలుసు, కానీ ఆమె మా డేట్ తరువాత నేను ఫోన్ చేస్తే తిరిగి ఎందుకు మాట్లాడలేదా అని అనుకున్నాను.","You know, I know it sounds crazy, but I always wondered why she didn't return my calls after our date."
"261","00:18:46,210","00:18:49,046","మార్టీ, అది జరిగి చాలా కాలమైంది, కానీ జరిగింది అది కాదని నీకు తెలుసు కదా.","Marty, it's been a long time, but you know that isn't what happened."
"262","00:18:49,630","00:18:50,631","ఏమంటున్నావు?","What do you mean?"
"263","00:18:50,714","00:18:53,465","డాక్టర్ హెర్ష్ కాఫ్ ఇక్కడికి వచ్చి ఆమెకి చాలా చెప్పారు.","Well, Dr. Herschkopf came in here, gave her a whole spiel."
"264","00:18:53,550","00:18:54,635","ఆయన ఏం చేశారు?","He did what?"
"265","00:18:54,718","00:18:57,012","నువ్వు ఆమెతో మాట్లాడమని ఆయనకి చెప్పావని అన్నారు.","He said that you asked him to have a word with her."
"266","00:18:57,095","00:18:59,348","లేదు, లేదు, నేనలా అనలేదు.","No, no, I didn't."
"267","00:18:59,431","00:19:01,350","అది, నేను అనలేదు, కానీ నేను...","Well, I did, but I thought..."
"268","00:19:01,433","00:19:03,644","నాకు గుర్తున్నంత వరకు, ఆమె చాలా బాధపడింది.","She was pretty upset, the way I remember."
"269","00:19:08,482","00:19:12,819","సరే, అది... సరే, నిన్ను కలవడం బాగుంది.","All right, well… Yeah, nice seeing you."
"270","00:19:28,168","00:19:30,712","నేను ఇప్పుడు కాల్ తీసుకోలేను. ఏం చేయాలో మీకు తెలుసు కదా.","I can't take the call right now. You know what to do."
"271","00:19:33,757","00:19:43,475","నాకు వేరే పని ఉన్నందువలన... నేను మీ బెస్ట్ మ్యాన్ గా ఉండలేను.","I just called to say… that I can't be your best man due to a prior engagement."
"272","00:19:54,361","00:19:56,363","మరొకసారి ధృవీకరించుకుంటున్నాను, ఇవన్నీ కొత్త తాళాలే కదా?","Just to be clear, all of these are new locks?"
"273","00:19:56,446","00:19:58,574","పాత తాళాలేవీ పని చేయవు కదా?","None of the old keys will work on them, right?"
"274","00:19:58,657","00:19:59,867","అవును.","That's correct."
"275","00:19:59,950","00:20:02,369","మీరు దీనికి... ఇంకో తాళం పెట్టచ్చేమో.","You know, maybe you could add a... another lock."
"276","00:20:02,452","00:20:04,788","ఒక వేళ మాలో ఎవరైనా బండ బలం ఉపయోగిస్తే.","Just in case someone tries to use force."
"277","00:20:04,872","00:20:06,623","-అది... ఆ? -సరే.","- Is that... Yeah? - Sure."
"278","00:20:06,707","00:20:08,333","-అది వీలవుతుందా? -తప్పకుండా.","- Is that possible? - Absolutely."
"279","00:20:08,417","00:20:12,629","కంగారు పడకండి, మిత్రమా. సంబంధాలు పాడయినప్పుడు, నేనిలా చాలా మందికి చేశాను.","Don't worry, buddy, I've done this for many people before when the relationship goes south."
"280","00:20:12,713","00:20:14,047","అవును, ఇది క్లిష్టమైనది.","Yeah, it's complicated."
"281","00:20:15,424","00:20:17,634","అప్పుడే నీ కీర దోసకాయ అంతా తినేసావా?","You ate the whole cucumber already?"
"282","00:20:17,718","00:20:21,597","మీరు, అబ్బా. నేను మీకు అన్ని దోసకాయలు ఇవ్వలేను.","You guys. I can't keep up with your cucumber demands."
"283","00:20:50,083","00:20:51,877","మార్టీ? నువ్వు లోపల ఉన్నావా?","Marty? Are you in there?"
"284","00:20:53,378","00:20:55,631","మార్టీ, నువ్వు వెంటనే తలుపు తెరువు.","Marty, open the door right now."
"285","00:20:55,714","00:20:58,592","నాకు నీ ముఖం కనిపిస్తోంది. దేవుడా.","I can see your face. Jesus."
"286","00:21:01,178","00:21:03,597","మా అమ్మాయి దగ్గరకి వెళ్ళడానికి నీకు ఎంత ధైర్యం?","How dare you go anywhere near my daughter?"
"287","00:21:04,848","00:21:06,767","-నేను ఆమెని చూడాలనుకున్నాను. -ఏంటి?","- I just wanted to see her. - What?"
"288","00:21:07,559","00:21:09,719","-నాకు... -నువ్వు అనేది నాకేమీ వినిపించడం లేదు.","- I wanted to s... - I can't hear a word you're saying."
"289","00:21:10,395","00:21:11,605","తలుపు తెరువు.","Just open the door."
"290","00:21:14,316","00:21:16,902","-ఏంటి? -నేను ఆమెని, నిన్ను చూడాలనుకున్నాను.","- What? - I just wanted to see her, to see you."
"291","00:21:16,985","00:21:21,198","నువ్వు నా జీవితంలోకి మళ్ళీ అలా ఊరికే ప్రవేశించలేవు, ఒక పిచ్చి జాంబీలా.","You don't get to just come back into my life like that, like a fucking zombie."
"292","00:21:21,281","00:21:22,282","నేను నిన్ను చంపేశాను.","I killed you."
"293","00:21:23,033","00:21:24,993","నీకు మా ఎవరి కిడ్నీలు ఇవ్వము.","You're not getting any of our kidneys."
