"Index","Start Time","End Time","Telugu Text","Mapped English Text"
"1","00:00:11,637","00:00:13,180","కంపు కొట్టే చెత్త వెధవ.","Stinking sack of shit."
"2","00:00:13,263","00:00:14,848","దయచేసి అలాంటి భాష మాట్లాడకు.","Please don't use language like that."
"3","00:00:14,932","00:00:16,433","దయచేసి నీ సెక్రెటరీ తో సెక్స్ చెయ్యకు.","Please don't fuck your secretary!"
"4","00:00:16,517","00:00:18,460","సరే, పద. పద, వెళ్దాం.","Okay, come on. Let's go."
"5","00:00:18,852","00:00:21,688","లేదు, ఇంకా నేను అప్పుడే రాలేను. నేను వాడి తల నరికేయాలి!","No, I'm not ready. I still have to rip his head off!"
"6","00:00:21,772","00:00:23,774","కాదు, ఇప్పుడు కాదు. మనం చాలా దూరం వెళ్ళాలి.","No, not now. We have a long way to go."
"7","00:00:23,857","00:00:30,030","డేనియల్, సమయాభావం వలన నీ తలని నువ్వే నరుక్కో. నోరు, మూసుకో, మార్టీ. దయచేసి మర్యాదగా మాట్లాడు.","Daniel, in the interest of time, maybe you could rip your own head off. Fuck you, Marty. Please, watch language."
"8","00:00:30,113","00:00:31,365","ధన్యవాదాలు.","Thank you."
"9","00:00:32,908","00:00:34,159","నన్ను క్షమించు.","I'm sorry."
"10","00:00:35,410","00:00:36,411","నన్ను క్షమించు.","I'm so sorry."
"11","00:00:36,495","00:00:38,372","క్షమాపణ చెప్పాల్సిన అవసరం లేదు.","There's no need to apologize."
"12","00:00:38,914","00:00:40,415","నువ్విది ఎప్పుడో చేసి ఉండాల్సింది.","You should've done this years ago."
"13","00:00:48,048","00:00:49,716","నేను పెద్ద మూర్ఖురాలిని.","I am such an idiot."
"14","00:00:49,800","00:00:51,260","నువ్వు మూర్ఖురాలివి కాదు.","You're not an idiot."
"15","00:00:52,052","00:00:53,929","నువ్వు మా అందరిలానే దద్దమ్మవి.","You're just a schmuck like the rest of us."
"16","00:00:55,305","00:00:56,306","అవునా?","Right?"
"17","00:00:58,725","00:01:01,770","సరే, మీరందరూ ఒక సాహసం కోసం సిద్ధంగా ఉన్నారా?","All right, guys, you ready for an adventure?"
"18","00:01:03,146","00:01:04,147","పదండి వెళ్దాం.","Blast off."
"19","00:01:27,462","00:01:29,882","ఎవరికైనా రేడియో వినాలని ఉందా?","Would anyone like to listen to the radio?"
"20","00:01:33,343","00:01:34,344","నాకు వినాలనుంది.","I think I would."
"21","00:01:37,598","00:01:41,643","అధికారికంగా నాది ఈ ప్రపంచంలోనే అత్యద్భుతమైన పాడే స్వరం అని మీకు తెలుసా?","Did you guys know that I officially have the best singing voice in the world?"
"22","00:01:43,228","00:01:44,229","వినండి.","Listen."
"23","00:01:45,564","00:01:46,773","అబ్బా, అంకుల్ మార్టీ.","Oh, no, Uncle Marty."
"24","00:01:46,857","00:01:49,193","-దయచేసి ఆపండి. -అబ్బా, ఆపండి.","- Please stop. - Come on, stop."
"25","00:01:51,069","00:01:53,113","-వద్దు. -అంకుల్ మార్టీ, ఆపండి.","- No. - Uncle Marty, stop."
"26","00:01:53,197","00:01:54,489","కుక్కలు ఓటు వేసినందుకు.","As voted on by dogs."
"27","00:01:54,573","00:01:55,782","-అబ్బా, మార్టీ. -కుక్కలా?","- No, Marty. - Dogs?"
"28","00:01:56,617","00:01:59,036","కుక్కలు ఓటు వెయ్యలేవు!","Dogs can't even vote!"
"29","00:02:00,662","00:02:02,998","-నా చెవులు! -నన్ను పెద్దగా పాడమంటారా? నేను పెద్దగా పాడగలను.","- My eardrums! - Want me to go higher? I can go higher."
"30","00:02:03,081","00:02:05,751","-ప్లీజ్, పాడద్దు. -వద్దు, వద్దు! మెల్లగా.","- Please, just don't sing. - No, no! Lower."
"31","00:02:07,628","00:02:09,880","సరే, ఎవరైనా నాతో కలిసి పెద్ద రాగాలు తీస్తారా?","Okay, someone join me in the high harmonies here."
"32","00:02:09,963","00:02:11,965","-నాన్సీ, పాడు. నువ్వు పాడు. -వద్దు...","- Nancy, come on. You're up. - Do not..."
"33","00:02:14,676","00:02:15,677","సరే.","Okay."
"34","00:02:15,761","00:02:18,430","నేను లిండా రాన్స్టాడ్ లాంటివాడిని.","You got a regular Linda Ronstadt back there."
"35","00:02:19,890","00:02:22,518","-అది బానే ఉంది. -నా వంతు. నేను ఇంకా పైకి పాడగలను.","- That's not bad. - My turn, my turn. I can sing even higher."
"36","00:02:22,601","00:02:26,104","అది చాలా పెద్ద నింద. సరే, పాడు. పాడు,పెద్ద మనిషి.","That's quite an accusation. Okay, go ahead. Go for it, big shot."
"37","00:02:28,232","00:02:30,400","-స్వరం చాలా పెద్దగా ఉంది. -స్వరం చాలా పెద్దగా ఉంది.","- That's very high. - That's very high."
"38","00:02:30,484","00:02:33,946","వాన్ ట్రాప్ కుటుంబ గాయకుల కొత్త బృందం మన దగ్గర ఉంది.","We got the brand-new version of the von Trapp family singers here."
"39","00:02:34,988","00:02:37,241","మనకి కావలసిందల్లా ఒక సిస్టర్ ఇంకా కొంత మంది నాజీలు.","All we need is a nun and some Nazis."
"40","00:02:37,991","00:02:39,326","మనం ఆల్ప్స్ కేసి వెళ్దాము!","Let's head for the Alps!"
"41","00:02:39,409","00:02:41,620","ఆల్ప్స్ కేసి వెళ్దాము!","To the Alps!"
"42","00:02:41,703","00:02:43,580","-అది బాగుందా? -బాగుంది.","- That sound good? - Yeah."
"43","00:02:43,664","00:02:45,082","-బాగుందా? -బాగుంది.","- Yeah? - Yeah."
"44","00:02:49,753","00:02:52,339","-అద్భుతం. అందరూ అద్భుతంగా పాడుతున్నారు. -అవును.","- Beautiful. Beautiful singing, everyone. - Yes."
"45","00:02:52,422","00:02:55,342","బాగుంది. కానీ నా అంత బాగా కాదు. కానీ నా అంత బాగా కాదు.","Lovely. Not as good as me. Not as good as me."
"46","00:02:56,593","00:02:58,345","ఈ రోడ్డు ఆల్ప్స్ కేసి వెళ్తుందనుకుంటాను.","I think this road goes to the Alps."
"47","00:02:58,428","00:02:59,429","బ్రుక్లిన్","**[NO ENGLISH MATCH FOUND]**"
"48","00:03:04,685","00:03:06,603","వండరీ మరియు బ్లూమ్బర్గ్ పాడ్ కాస్ట్ ఆధారంగా రూపొందించబడింది","**[NO ENGLISH MATCH FOUND]**"
"49","00:03:53,066","00:03:55,777","మీకు ఒక పాత సందేశం ఉంది.","You have one old message."
"50","00:03:55,861","00:03:57,613","హాయ్, మార్టీ. నేను ఐక్.","Hi, Marty. It's Ike."
"51","00:03:57,696","00:03:59,740","ఎ ఎఫ్ సి వద్ద నీ పరిమితులని నేను అర్థం చేసుకోగలను.","I understand your boundary at AFC."
"52","00:04:00,282","00:04:06,663","డాక్టర్ మరియు పేషెంట్ గా మనమిద్దరం కొనసాగబోతున్నాం అని, 11:15 కి నీ అపాయింట్మెంట్ కు వస్తావని నిర్ధారించుకుంటున్నాను.","Just confirming you still want to continue as doctor and patient and that you'll be attending your appointment at 11:15."
"53","00:04:11,960","00:04:14,588","మీకు ఒక పాత సందేశం ఉంది.","You have one old message."
"54","00:04:14,671","00:04:16,423","హాయ్, మార్టీ. నేను ఐక్.","Hi, Marty. It's Ike."
"55","00:04:16,507","00:04:18,716","ఎ ఎఫ్ సి వద్ద నీ పరిమితులని నేను అర్థం చేసుకోగలను.","I understand your boundary at AFC."
"56","00:04:19,218","00:04:25,641","డాక్టర్ మరియు పేషెంట్ గా మనమిద్దరం కొనసాగబోతున్నాం అని, 11:15 కి నీ అపాయింట్మెంట్ కు వస్తావని నిర్ధారించుకుంటున్నాను.","Just confirming you still want to continue as doctor and patient and that you'll be attending your appointment at 11:15."
"57","00:04:33,232","00:04:36,068","డాక్టర్ ఐక్","**[NO ENGLISH MATCH FOUND]**"
"58","00:04:43,492","00:04:45,911","హే, బ్రూస్. నీకు లంచ్ ప్లాన్లు ఉన్నాయా?","Hey, Bruce. You have lunch plans?"
"59","00:04:47,663","00:04:50,207","నువ్వు లంచ్ కి వస్తావా? లంచ్ కి వెళ్లి ఏమైనా తిందామా?","You wanna go eat lunch? You wanna get something to eat?"
"60","00:04:50,290","00:04:53,460","ఇక్కడ దగ్గరలో ఒక మంచి చోటు ఉంది... నాతో వస్తావా?","I found a great place nearby if you... You wanna tag along?"
"61","00:04:56,296","00:04:58,757","-ఇప్పుడా? లేక... -అవును. నువ్వు కావాలనుకుంటే.","- Now? Or... - Yeah. If you want."
"62","00:04:58,841","00:04:59,842","నేను కొంటాను.","My treat."
"63","00:05:01,301","00:05:03,679","సరే, ఇది ప్యూర్టో రికన్ స్ట్రీట్ ఫుడ్, సరేనా?","So, this is Puerto Rican street food, okay?"
"64","00:05:03,762","00:05:05,681","చాలా బాగుంటుంది. ఇక్కడి వాళ్ళు అదే అంటారు.","Pretty authentic. The locals swear by it."
"65","00:05:05,764","00:05:07,766","నీ పొట్ట బాగుంటుందనుకుంటాను, బ్రూస్.","Hope you have a strong constitution, Bruce."
"66","00:05:07,850","00:05:09,601","హలో. హలో. హాన్గ్వయర్ కి స్వాగతం.","Hola, hola. Welcome to Hanguiar."
"67","00:05:09,685","00:05:10,769","ధన్యవాదాలు.","Thank you for having us."
"68","00:05:11,728","00:05:14,147","-నాకు ట్రిప్లేటాస్ ఇవ్వండి. -త్రిప్లేతా అంటారు.","- Give me the tripletas. - Tripletas."
"69","00:05:14,231","00:05:16,441","కానీ, నాకు... నాకు దానికి కొన్ని మార్పులు చేయాలని ఉంది, సరేనా?","But I wanna make some changes on it, all right?"
"70","00:05:16,525","00:05:18,735","బీఫ్ బదులు నాకు మామూలు టర్కీ కావాలి.","Instead of beef, I just want plain turkey."
"71","00:05:18,819","00:05:22,239","మిరియాల్ పొడి వద్దు, టమాటోటా వద్దు, చీజ్ వద్దు, ఉల్లిపాయ వద్దు.","No pepper, no tomato, no cheese, no onion."
"72","00:05:22,322","00:05:28,745","ఒక్క లెట్యూస్ ఆకు, కొంచెం, చాలా కొద్దిగా మెయోనీస్ ఒక ప్లెయిన్ రోల్ మీద.","A single slice of lettuce, and a little dab, just a whisper, of mayonnaise on a plain roll."
"73","00:05:28,829","00:05:30,664","సరే, అయితే మీకు ఒక టర్కీ సాండ్విచ్ కావాలా?","Right, so you just want a turkey sandwich?"
"74","00:05:30,747","00:05:31,748","అవును.","Sí."
"75","00:05:31,959","00:05:33,667","-టర్కీ సాండ్విచ్. -ధన్యవాదాలు. అవును.","- Turkey sandwich. - Thank you. Yeah."
"76","00:05:33,750","00:05:35,169","బ్రూస్, నీకేం కావాలి?","Bruce, what'll you have?"
"77","00:05:35,252","00:05:36,420","నాకు...","I..."
"78","00:05:37,171","00:05:38,172","నేను సూప్ తాగుతాను.","I'll have soup."
"79","00:05:38,714","00:05:41,675","అబ్బా, బ్రూస్. కొంచెం జీవించు. నిర్ణయం తీసుకో.","Come on, Bruce. Live a little. Be decisive."
"80","00:05:41,758","00:05:43,760","నేను జీవిస్తున్నాను. నాకు సూప్ కావాలి.","I am. I decide soup."
"81","00:05:43,844","00:05:46,513","నీ మనసులోకి వచ్చిన మొదటి దాన్ని పైకి అను.","Just shout it out, first thing that comes into your head."
"82","00:05:46,597","00:05:48,056","నీకు... నీకు నిజంగా ఏం కావాలి?","What do you really want?"
"83","00:05:48,140","00:05:49,850","-నాకు సూప్ కావాలి. -నువ్వు మిస్ అవుతున్నావు.","- I want soup. - You're missing out."
"84","00:05:49,933","00:05:52,311","నువ్వు చాలా వాటిని మిస్ అవుతావని అనుకుంటాను, కదా?","I suspect you miss out on a lot, don't you?"
"85","00:05:52,394","00:05:54,354","కాదు. నేను ఇక్కడికి ఒక గంట క్రితమే వచ్చాను.","Not really. I was here like an hour ago."
"86","00:05:54,438","00:06:01,904","నేను ఎంపనాడా డి పోలో, ప్లాటోనో ఫ్రిటోస్, చూరోస్, ఒక కప్పు హోర్చాట తీసుకున్నాను. అందుకని... సరే.","I got the empanada de pollo, plátanos fritos, churros, and a cup of horchata. So… Right."
"87","00:06:03,363","00:06:04,448","ఇది బాగుంది.","This is good."
"88","00:06:05,073","00:06:06,909","ఇది బాగుంది, కేవలం నువ్వు, నేను.","This is nice, just you and me."
"89","00:06:08,452","00:06:10,662","-ఆ-హా. -మాట్లాడుకుంటూ, మాట్లాడుకోకుండా.","- Uh-huh. - Talking, not talking."
"90","00:06:10,746","00:06:14,625","మనకు తెలిసిన వారితో అలా కలిసి ఉండడం.","Just hanging out, you know, with people who know you."
"91","00:06:14,708","00:06:16,793","అందరూ నువ్వు ఏమైనా చెయ్యగలవని అంటారు.","People you can say anything to."
"92","00:06:20,380","00:06:21,632","మనలో... మనలో అది ఉంది. కదా?","We have that. Right?"
"93","00:06:22,799","00:06:24,134","అవును. ఉంది.","Sure. Yeah."
"94","00:06:25,511","00:06:26,512","అది ముఖ్యం.","It's important."
"95","00:06:30,140","00:06:31,808","నేను నిన్నొక ప్రశ్న అడగచ్చా?","Can I ask you a question?"
"96","00:06:31,892","00:06:33,769","తప్పకుండా. అడుగు. అడుగు. ఏమైనా అడుగు.","Yeah. Yeah, sure. Sure. Anything."
"97","00:06:35,395","00:06:43,403","నువ్వు ఫిల్లిస్ ని కలిశావా, ఈ మధ్య లేదా... లేదు. లేదు. కలిసి... కలిసి చాలా కాలమైంది.","You seen Phyllis recently, or… No. No, it's been a while."
"98","00:06:44,696","00:06:45,948","నువ్వు?","You?"
"99","00:06:46,031","00:06:49,535","ఆమె నాకు ప్రతి సంవత్సరం పుట్టిన రోజుకి కార్డ్ పంపుతుంది.","She sends me, you know, birthday cards every year."
"100","00:06:49,618","00:06:51,036","-అలాగా. బాగుంది. -అవును.","- That's nice. Yeah. - Yeah."
"101","00:06:52,037","00:06:53,747","నువ్వు ఆమెతో మాట్లాడి ఎంత కాలమైంది?","How long since you spoke to her?"
"102","00:06:54,498","00:06:58,418","అది... ఇరవై ఏడేళ్ళయింది.","It's been… It's been 27 years."
"103","00:06:59,294","00:07:00,295","అబ్బా.","Jeez."
"104","00:07:02,089","00:07:08,512","అవును, ఒక… కొన్ని సంవత్సరాల క్రితం ఆమె కోసం ఫోన్ డైరెక్టరీ లో చూశాను.","Yeah, one… Few years ago, I looked her up in the phone book."
"105","00:07:10,472","00:07:12,140","ఆమె పేరు చూస్తేనే బాగా అనిపించింది.","It was nice just to see her name."
"106","00:07:15,435","00:07:17,771","హే, నాకో ఐడియా వచ్చింది.","Hey, here's a thought."
"107","00:07:18,939","00:07:21,692","మనం రాత్రికి కలిసి సమయం గడుపుదామా?","You wanna hang out tonight?"
"108","00:07:21,775","00:07:25,863","-మనం సినిమాకి వెళ్ళచ్చు లేదా... -నేను ఇంటికి వెళ్ళాలి.","- We could go see a show or... - I gotta get home."
"109","00:07:25,946","00:07:29,658","మేము... మేము మా మనవరాలిని చూసుకుంటున్నాము.","We're… We're babysitting the granddaughter."
"110","00:07:29,741","00:07:31,743","సరే. సరే, అలాగే.","Right. Right, of course."
"111","00:07:31,827","00:07:35,622","-సరే. అయితే, మరోసారి ఎప్పుడైనా, సరేనా? -సరే.","- Yeah. So, some other time, yeah? - Yeah."
"112","00:07:36,498","00:07:38,584","-హా. ఆ, అలాగే. సరే. -సరే. అలాగే.","- All right. Yeah. - Yeah, no, of course. Yeah."
"113","00:07:38,667","00:07:41,587","-హే, సూప్ కి ధన్యవాదాలు. -ఓహ్, అవును. సరే.","- Hey, thanks for the soup. - Oh, yeah. Yeah."
"114","00:08:22,628","00:08:23,962","హలో?","Hello?"
"115","00:08:25,506","00:08:27,508","హలో? దయచేసి ఏమైనా మాట్లాడతారా?","Hello? Are you gonna start speaking, please?"
"116","00:08:32,846","00:08:33,847","నేను...","This is..."
"117","00:08:34,431","00:08:37,768","-నేను మా... మార్షల్ ఫెల్డ్ హామర్. -మీ గురించి ఎప్పుడూ వినలేదు.","- This is Ma... Marshall Feldhammer. - Never heard of you."
"118","00:08:39,895","00:08:40,895","హలో?","Hello?"
"119","00:08:40,979","00:08:44,358","ఆ, నేను మార్టీ గురించి ఫోన్ చేశాను.","Yes, I'm calling about Marty."
"120","00:08:44,983","00:08:46,443","దేవుడా.","Oh, God."
"121","00:08:46,527","00:08:49,571","దేవుడా, వాడు చచ్చిపోయాడా? వాడు చచ్చిపోయాడు, కదా?","Oh, God, is he dead? He's dead, isn't he?"
"122","00:08:50,447","00:08:53,242","-దేవుడా. -లేదు. లేదు, లేదు, లేదు. లేదు. లేదు.","- Oh, God. - No. No, no, no. No. No."
"123","00:08:53,325","00:08:54,368","లేదు, అతను చచ్చిపోలేదు.","No, he's not dead."
"124","00:08:57,829","00:08:59,831","సరే, అయితే వాడికేం కావాలి? కిడ్నీనా?","Okay, well, what does he want? A kidney?"
"125","00:09:00,666","00:09:01,792","కాదు.","No."
"126","00:09:01,875","00:09:03,293","సరే, అయితే, నేను...","Okay, well, I..."
"127","00:09:03,377","00:09:05,712","వాడికి ఏం కావాలన్నా సరే, వాడికి దొరకదని మీరు వాడికి చెప్పండి.","You tell him, whatever he wants, he's not gonna get it."
"128","00:09:05,796","00:09:08,799","వాడికి కిడ్నీ దొరకదు. వాడికి నా శరీరం నుంచి ఒక్క చుక్క రక్తం కూడా దొరకదు.","He's not getting a kidney. He's not gonna get a drop of my blood."
"129","00:09:22,729","00:09:25,566","మీకు ఒక పాత సందేశం ఉంది.","You have one old message."
"130","00:09:25,649","00:09:27,317","హాయ్, మార్టీ. నేను ఐక్.","Hi, Marty. It's Ike."
"131","00:09:27,401","00:09:29,528","ఎ ఎఫ్ సి వద్ద నీ పరిమితులని నేను అర్థం చేసుకోగలను.","I understand your boundary at AFC."
"132","00:09:30,153","00:09:36,618","డాక్టర్ మరియు పేషెంట్ గా మనమిద్దరం కొనసాగబోతున్నాం అని, 11:15 కి నీ అపాయింట్మెంట్ కు వస్తావని నిర్ధారించుకుంటున్నాను.","Just confirming you still want to continue as doctor and patient and that you'll be attending your appointment at 11:15."
"133","00:09:50,048","00:09:51,133","అతను వచ్చాడు.","There he is."
"134","00:09:52,092","00:09:58,390","నాకు నీ పట్ల చాలా, చాలా, చాలా గర్వంగా ఉంది, మార్టీ.","I am very, very, very proud of you, Marty."
"135","00:09:58,432","00:10:01,310","ఇది ఎంత అద్భుతంగా ఉందో నీకు తెలుసా?","Do you even realize how incredible this is?"
"136","00:10:01,393","00:10:05,063","నువ్వు నీ స్వరాన్ని కనుగొన్నావు. నీ బలాన్ని కనుగొన్నావు.","You found your voice. Your strength."
"137","00:10:05,731","00:10:06,732","రా.","Come on."
"138","00:10:09,484","00:10:15,365","నేను ఒప్పుకోవాలి… …ఇందుకు నేననుకున్న దాని కన్నా ఎక్కువ సమయం పట్టింది, కానీ నువ్వు ఉద్భవించావు.","I must admit, it took longer than I thought, but you have emerged."
"139","00:10:18,577","00:10:19,786","ఆ, కూర్చో.","Yeah, have a seat."
"140","00:10:28,420","00:10:31,715","నువ్వు నన్ను ఎదుర్కొన్నావు, మార్టీ, నన్ను నా స్థానంలో ఉంచావు.","You stood up to me, Marty, put me in my place."
"141","00:10:32,299","00:10:33,800","అది నన్ను ఆలోచించుకునేలా చేసింది.","And it's left me thinking."
"142","00:10:34,384","00:10:40,224","డాక్టర్లు, థెరపిస్టులు, మేము... మేము కూడా పాఠాలు నేర్చుకుంటాము.","Doctors, therapists, we… We learn lessons too."
"143","00:10:40,307","00:10:41,767","నువ్వు నాకొక పాఠం నేర్పించావు.","And you taught me one."
"144","00:10:42,976","00:10:47,231","నేను ప్రేమించేది దీన్నేనని నువ్వు నాకు నేర్పించావు.","You taught me that this is what I love. This."
"145","00:10:47,898","00:10:51,026","ఇక నేను పరిశ్రమ సైకాలజీ చెయ్యను.","I'm through with industrial psychology."
"146","00:10:51,109","00:10:54,071","నేను డబ్బు మనిషిని కాదు. నేను మనుషుల మనిషిని.","I'm not a money guy. I'm a people guy."
"147","00:10:54,154","00:10:57,157","నేను నీకెంత సహాయం చేసానో చూశాను, నాకది కొనసాగించాలని ఉంది.","I see how much I've helped you, and I want to continue that."
"148","00:11:00,077","00:11:02,788","అందుకనే మునుపటి ఏర్పాటుకు నాకు తిరిగి వెళ్ళాలని ఉంది.","That's why I'd like to go back to the way it was before."
"149","00:11:04,081","00:11:06,542","డాక్టర్ మరియు పేషెంట్ గా.","Doctor and patient."
