"Index","Telugu Text","Mapped English Text"
"200","నిజంగానే బిగుసుకుపోయావు. ఇప్పుడు కూడా కంగారుగా ఉన్నావు.","Well, you did. You're tense now."
"201","అవును, ఆ మన్నించాలి, పార్టీల సమయంలో నేను ఇంతే.","Yeah, Sorry, it's just parties."
"202","నువ్వు ఇంతకు ముందు ఒక మాట అన్నావు కదా, అది నిజంగానే చేస్తున్నావా?","Did you mean what you said before?"
"203","అదే నీ ప్లాన్స్ గురించి.","About your plans."
"204","అవును.","Of course."
"205","నాకు కాస్త వివరంగా చెప్పగలవా!","Tell me more."
"206","నన్ను మన్నించాలి. అక్కకు పాపను చూసుకోవడంలో సాయపడాలి.","You know, I I'm so sorry. I-I'm just I'm on uncle duty for my sister."
"207","కాబట్టి నేను కాసేపట్లో వచ్చేస్తాను.","So I-I'll be right back."
"208","సరేనా? సరే.","Okay? Okay."
"209","సరే. థ్యాంక్స్, మిస్ కొబెల్.","Okay. Thanks, Ms. Cobel."
"210","నాకు తెలుసు.","[Eleanor crying] [Devon] I know."
"211","హేయ్, వచ్చావా! హేయ్, నేను నీతో చాలా అర్జంటుగా మాట్లాడాలి.","Hey, there you are. Hey, I really need to talk to you."
"212","నాకు తెలుసు. పాప తిక్కపెడుతోంది. ఏడుపు అస్సలు ఆపడం లేదు.","No, I know. I just have to deal with her. She's having a meltdown."
"213","కానీ నన్ను అక్కడ కలువు, సరేనా?","But j-just meet me in there, okay?"
"214","సరే, నేను వేచి ఉంటాను. ఆ, సరే. నేను వెంటనే వచ్చేస్తాను.","Okay, I'll just Wait. , okay. I promise I'll be back."
"217","ఓహ్, బతికించారు, మిసెస్ సెల్విగ్. హాయ్.",", thank God, Mrs. Selvig. Hi."
"218","ఒక నిమిషం పాప ని చూసుకోగలరా? నేను మార్క్ తో మాట్లాడి వస్తాను.","Can you take her for a sec while I talk to Mark?"
"219","తప్పకుండా, బంగారం. థ్యాంక్యూ.","Of course, love. Thank you."
"220","మార్క్ బాగానే ఉన్నాడా? బాగానే ఉన్నాడు.","Is Mark all right? Yeah, he's fine."
"221","థ్యాంక్యూ, మీరు చాలా మంచివారు.","Thank you, you're an angel."
"224","సరే ఇప్పుడు చెప్పు.","Okay I'm all yours."
"225","నా పేరు హెలెనా, నేను ఈగన్ వంశంలో పుట్టాను.","My name is Helena, and I'm an Eagan. [laughs]"
"226","ఈగన్ కుటుంబంలో పెరిగేటప్పుడు మనకి తెలిసే ఒకానొక విషయం ఏంటంటే, సిబ్బంది కూడా కుటుంబంతో సమానమే అన్న విషయం.","So one of the things you learn growing up as an Eagan is that the workers are our family."
"227","చిన్నప్పుడు, ఆ విషయం నా బుర్రకు అస్సలు అర్థమయ్యేది కాదు, ఎందుకంటే, అదే నిజమైతే నాకు ప్రపంచ నలుమూలలా కలిపి లక్షల మంది అక్కలు, అన్నలు ఉండేవారని అనుకొనేదాన్ని.","And I remember being confused about that as a kid, because I thought that meant I had a few hundred thousand literal brothers and sisters scattered around the world. [chuckles]"
"228","ఓరి దేవుడా.",", my God."
"229","కానీ పెరిగే కొద్దీ, భావాలు కలిశాయి కాబట్టి కుటుంబమని అంటున్నారని అర్థమైంది.","But as I grew older, I learned that it's about shared ideals."
"230","ఆ.","Um [chuckles]"
"231","మా నాన్న ప్రతిరోజూ పడుకొనే ముందు ఆ తొమ్మిది ప్రధాన సూత్రాలను నా చేత చెప్పించేవాడు, అవి చెప్పేటప్పుడు నాకు అప్పుడప్పుడూ కోపం కూడా వచ్చేది. క్షమించు, నాన్నా.","My dad used to make me recite the nine core principles before bed every night, which I can't say I always did happily. Sorry, Dad."
"232","కాబట్టి ఇప్పుడు అవే సూత్రాలను, లూమన్ లో పని చేసే ప్రతీ ఒక్కరితో పాటు నేను కూడా పాటిస్తున్నాను, అందువల్లే మాదంతా ఒకే కుటుంబం అయింది.","But those are now the values that I share with everyone who works at Lumon, and that's what makes them my family."
"233","నాకు ఏవైతే చేయడం ఇష్టముండదో, నచ్చదో అవి చేయమని నేను వాళ్లని ఎన్నటికీ కోరలేను.","[echoing] And I would never ever ask them to do anything that I'm not willing or excited to do myself."
"234","ఓహ్, చూడండి, ఈ ఉద్యోగంలోకి నేను విధేయత కారణంగా చేరుతున్నానని, అలాగే అలా చేరేలా స్వచ్ఛమైన ఈగన్ స్ఫూర్తే నాకు ప్రేరణగా నిలిచిందని నేను చెప్పడం వింటే మా నాన్న చాలా సంబరపడిపోతాడు.","[normal voice] Look, m-my dad would love for me to sit here and say that I'm taking this job out of loyalty and that it was the spirit of pure Eagan calling me to service."
"235","కానీ నాకు ఆ ఉద్యోగం చాలా బాగా నచ్చింది కాబట్టే నేను అందులో చేరాను.","But I took a severed job because it sounds freaking awesome."
"236","కాబట్టి, వేర్పాటు పద్ధతి మనల్ని వేరు చేస్తోందని నేను అనుకోను.","So, no, I don't think severance divides us."
"237","నా దృష్టిలో అది అందరినీ ఏకం చేస్తుంది.","I think it brings us together."
"240","నమస్తే.","[Mr. Milchick] Greetings."
"241","ఇప్పుడు నేను అందుబాటులో లేను. ఒరేయ్, మిల్చెక్!","I'm not here right now. Goddamn it, Milchick!"
"257","హెలెనా.","[assistant] Helena."
"258","తను ఇక్కడ ఉంది, సర్.","She's in here, sir."
"259","హెలెనా.","Helena."
"260","నువ్వు చాలా అందంగా ఉన్నావు.","You look so nice."
"261","ఫిల్మ్ లాగా.","Like a film."
"262","థ్యాంక్యూ.","[Helly] Thank you."
"263","నీకు నీకు ఇంకా నొప్పిగా ఉందా?","Are you Are you still in pain?"
"264","లేదు.","I'm not."
"265","ఇప్పుడు లేదు.","Not anymore."
"266","తను నీకు హాని తలపెట్టాలని ప్రయత్నించిందని వాళ్లు చెప్పాక, నాకు నిద్రే పట్టలేదు, ఏడుస్తూ కూర్చున్నా.","I cried in my bed when they told me what she tried to do to you."
"267","నీ పని అవతారం నీకు తలపెట్టాలనుకున్న హాని. అసలు నాకు.","What that innie tried to do. I."
"268","ఇదంతా అనుభవిస్తున్నందుకు థ్యాంక్యూ.","Thank you for going through with this."
"269","మీ తాతే కనుక ఉంటే, చాలా ఆనందపడేవాడు.","The Grandfather would cherish what you've done."
"270","ఏదోకరోజు, ఈ పగ్గాలు నీకు అప్పగించేస్తాను.","And one day you will sit with me at my revolving."
"271","నువ్వు బాగానే ఉన్నావా?","Are you feeling well?"
"272","బాగానే ఉన్నాను.","Yeah."
"273","డ్రింక్ వల్ల నాకు అదోలా ఉందనుకుంటా.","I think, I think the drink just hit me a little bit."
"274","ప్రసంగం బాగానే ఇవ్వగలవుగా?","You'll be all right for the speech?"
"275","ప్రసంగం. హా, అది బాగానే ఇవ్వగలను.","For my speech. Yeah. Of course."
"276","నేను మొట్టమొదటి చిప్ ని తీసుకువచ్చి నీకు చూపించినప్పటి సంగతి నీకు గుర్తుందా?","Do you remember when I brought home the first chip to show you?"
"277","అదే, శాంపిల్ చిప్.","The prototype."
"278","అప్పట్లో దానికి నీలం, ఇంకా పచ్చ లైట్లు ఉండేవి.","It had the blue and green lights back then."
"279","అవును.","Yeah."
"280","""ఇది చాలా అందంగా ఉంది, నాన్నా. ప్రపంచంలో ఉన్న అందరికీ","I remember you said to me, ""It's so pretty, Daddy."
"281","ఇది దక్కాలి,"" అని నువ్వు అనడం నాకు ఇంకా గుర్తుంది.","Everybody in the whole world should get one."""
"282","నువ్వు అన్నట్టే అందరికీ దక్కేలా చేస్తాను.","They will."
"283","అది నీ కారణంగే సాధ్యమవుతుంది.","Because of you."
"284","అందరూ కియర్ పిల్లలు అయిపోతారు.","They'll all be Kier's children."
"285","మిస్టర్ ఈగన్. హెలెనా. వేదిక ఎక్కాల్సిన సమయం ఆసన్నమైంది.","[footsteps approaching] [door opens] [Natalie] Mr. Eagan. Helena. It's time to head to stage."
"286","ఈ లోకానికి నేను తలపెట్టిన హానికి నన్ను క్షమించండి.","[whispers] Forgive me for the harm I've caused this world."
"287","నా చర్యలకు బాధపడాల్సింది నేనే.","None may atone for my actions but me."
"288","వాటి దుష్పరిణామాన్ని కూడా నేనే భరించాలి.","And only in me shall their stain live on."
"289","అందుకు నేను చాలా తీవ్రంగా చింతిస్తున్నాను.","All I can be is sorry."
"290","చాలా చాలా చింతిస్తున్నాను.","And that is all I am."
"294","నువ్వు నిజంగానే నన్ను ఆటపట్టించడం లేదు కదా?","[Devon] You swear you're not fucking with me?"
"295","నిజంగానే చెప్తున్నాను.","I swear."
"296","ఇది చాలా దారుణం.","This is so insane."
"297","ప్రభుత్వ యంత్రాంగం, ఆ ఆఫీసులోని అణువణువునూ శోధించడానికి ఎవరినైనా పంపించాలి.","They need to send people down to check every inch of that place."
"298","ఇన్స్పెక్టర్లు లాంటి వారినా! ఇన్స్పెక్టర్లు అనే వారు ఉన్నారా?","Like, inspectors or whatever. Is that a thing? Inspectors?"
"299","ఉన్నారు. ఇన్స్పెక్టర్లు ఉన్నారు.","Yeah. There are inspectors."
"300","మార్క్ అంటే, ఇక్కడ ఉన్నప్పుడు, నువ్వు, లూమన్ ఏం చేస్తుంది, నువ్వు ఏం చేస్తావు అనే వాటిని కొనుగొనే ప్రయత్నం చేసేవాడివి.","Mark has b I mean, out here, you have been trying to figure out what Lumon does. What you do."
"301","సరే.","Okay."
"302","నాకు నాకు కారణం తెలుసుకోవాలనుంది.","I just I just want to know why."
"303","ఎందుకు నన్ను అక్కడ చేర్పించాడు అని.","Why he put me in there."
"304","అతని భార్య చనిపోయింది.","[sighs] He lost his wife."
"305","అదే, నీ భార్య చనిపోయింది. నువ్వు లూమన్ లో చేరే కొంత కాలం ముందు అన్నమాట.","You lost your wife. A little before you started at Lumon."
"306","జెమ్మా. ఆ.","Gemma."
"307","కారు ప్రమాదంలో తను చనిపోయింది, మొదట్లో, నువ్వు టీచింగ్ నే కొనసాగించాలనుకున్నావు.","It was a car accident, and, at first, you tried to keep teaching."
"308","నేను టీచర్ నా?","I was a teacher?"
"309","హిస్టరీలో ప్రొఫెసర్ వి.","A professor. Of history."
"310","తను చనిపోయిన మూడు వారాల తర్వాత, నువ్వు టీచింగ్ నే కొనసాగించాలని చూశావు, కానీ దారుణంగా విఫలమయ్యావు.","[inhales sharply] You tried to go back to teaching three weeks after she died, and it was a disaster."
"311","అప్పటికి నువ్వు ఇంకా తనని మర్చిపోలేదు.","She was just still in your veins, you know?"
"312","నువ్వు కుంగిపోయావు.","Making everything hurt."
"313","అందుకే, నువ్వు ఈ ఉద్యోగంలో చేరాలని అనుకున్నావని నాకు అనిపించింది.","Which is why I guess you thought the severed job would."
"314","అలా అయినా ఆ శోకం నుండి బయటపడతాడని ఆశించాడు.","He hoped you'd be spared from the pain."
"315","పేరు బాగుంది. జెమ్మా.","It's a nice name. Gemma."
"317","అవును.","[chuckles] Yeah."
"318","మనమందరం చాలా సన్నిహితంగా ఉండేవాళ్లం. చాలా బాగా ఉండేది.","We were all really close. It was great."
"319","తను చాలా గొప్ప వ్యక్తి.","She was wonderful."
"320","నిన్ను ఒక గొప్ప వ్యక్తిగా తీర్చిదిద్దింది.","She made you wonderful."
"324","నీతో మాట్లాడవద్దని నాకు సూచనలు అందాయి.","They told me not to talk to you."
"325","ఓటీసీని ట్రిగ్గర్ చేస్తున్నారు! మార్క్ ఎస్, ఇప్పుడు పని అవతారంలో ఉన్నాడు!","The goddamn OTC's been triggered! Mark S. is his fucking innie!"
"326","ఏంటి? అది అసాధ్యం.","What? That's not possible."
"328","అది చేస్తున్నది డిలన్. ఇన్నాళ్కూ వాళ్లందరూ ఇది చాలా పకడ్బందీగా ప్లాన్ చేశారు.","It's Dylan. They've been plotting this all along."
"329","హెల్లీ పార్టీలో ఉంది.","Helly's at the gala."
"330","హెల్లీ సంగతి నేను చూసుకుంటాను. ఎప్పటిలాగే దీన్ని కూడా నేనే సరి చేస్తాను.","I'll take care of Helly. I'll fix it like I fix everything."
"331","సెక్యూరిటీ ఆఫీసుకు వెళ్లి, దాన్ని వెంటనే ఆఫ్ చేసేయ్!","Get to the security office, and shut it off now!"
"332","అయ్యయ్యో!","Shit!"
"334","నీ యెంకమ్మ! డిలన్!","Goddamn it! Dylan!"
"335","డిలన్!","Dylan!"
"336","లోపల ఉన్నది నువ్వేనని నాకు తెలుసు, డిలన్. తలుపు తెరువు!","I know you're in there, Dylan. Open the door!"
"337","దొబ్బేయ్, మిస్టర్ మిల్చెక్","Fuck you, Mr. Milchick!"
"338","డిలన్! డిలన్!","Dylan! Dylan!"
"339","రికెన్ కి న్యూ యార్క్ లో చాలా పెద్ద పెద్ద జర్నలిస్టులు తెలుసు.","Ricken knows a lot of high-end journalists in New York."
"340","పోలీసులకు చెప్పడం కన్నా అదే మేలు అంటావా?","And you think that's better than the police?"
"341","లూమన్ వాళ్లు, తమ పలుకుబడిని చాలా చోట్ల ఉపయోగించగలరు.","Well, Lumon has their hands in so many pies."
"342","నీకు నేనేమంటున్నానో అర్థమైందిగా?","Sorry, do you understand metaphor?"
"343","హా, బాగా అర్థమైంది.","Yeah, hands in pies. I get it."
"344","మనం ఎవరితో మాట్లాడుతున్నామనే విషయమై మనం చాలా జాగ్రత్తగా ఉండాలి.","I think we have to be really careful about who we talk to."
"345","సరే. నీకు ఇంకా ఎంత సమయం ఉంది?","Okay. How much time do you have?"
"346","తెలీదు. ఇంకా ఒక గంట ఉండవచ్చేమో.","I don't know. Maybe an hour?"
"347","అవును. మీ బాస్ కి కనుక విషయం తెలిస్తే బాబోయ్, నేను పూర్తిగా మర్చిపోయాను. కొబెల్! ఇక్కడికి కొబెల్ ఎందుకు వచ్చింది?","Right. Because once your bosses find out Jesus, I totally forgot. Cobel! Why is Cobel here?"
"348","ఏంటి?","What?"
"349","లూమన్ లో ఆమె నా బాస్. మిస్ కొబెల్. తను కూడా పార్టీలో ఉంది.","My boss from Lumon. Ms. Cobel. She's at this party."
"350","నువ్వు ఏమంటున్నావు?","What are you talking about?"
"351","అంటే, తను వేరేగా డ్రెస్ అయ్యుంది.","I mean, she's dressed different."
"352","లూజు పర్పుల్ డ్రెస్ వేసుకుంది, తెల్ల జుట్టుతో ఉంది.","Kind of a flowy, purple outfit, silver hair."
"353","మార్క్, నువ్వు మిసెస్ సెల్విగ్ గురించి చెప్తున్నావా?","Mark, are you talking about Mrs. Selvig?"
"354","కావచ్చు, కానీ తన పేరు, హార్మనీ కొబెల్.","Maybe, but her name is Harmony Cobel."
"355","తను లూమన్ లో పని చేస్తుందా?","And she works at Lumon?"
"356","అవును, తనే నా బాస్.","Yeah, she's my boss."
"357","అయ్య బాబోయ్.","Jesus fucking Christ."
"358","డిలన్.","[Mr. Milchick] Dylan."
"359","ఇలా ఎందుకు చేస్తున్నావు?","Why are you doing this, man?"
"360","పిచ్చి పట్టిందా!","Come on."
"361","నువ్వు ఈ త్రైమాసికంలోనే అత్యుత్తమ రిఫైనర్ వి!","You are the refiner of the quarter!"
"362","""అనేక సంస్కృతులు సెక్స్ ని చీదరించుకుంటాయి, పాపంగా చూస్తాయి, కానీ నేను మాత్రం దాన్ని "" మిసెస్ సెల్విగ్?","[Ricken] ""While most cultures view sex as ugly or foul, I've always seen it "" Mrs. Selvig?"
"363","ఏమైంది? మిసెస్ సెల్విగ్ ఇక్కడే ఉందా?","What? Is she there? Is Mrs. Selvig there?"
"364","నువ్వు ఏంటి?","Do you What?"
"365","మిసెస్ సెల్విగ్?","Mrs. Selvig?"
"366","ఏం జరుగుతోంది? తను ఎలెనోర్ ని తీసుకుంది!","What is going on? She has Eleanor!"
"367","ఏంటి? ఆ ఒక్క నిమిషం. ఆ.","What? Um Excuse me a moment, okay. Um."
"368","బంగారం? ఏమన్నావు?","Honey? What did you say?"
"369","మిసెస్ సెల్విగ్ దగ్గర ఎలెనోర్ ఉంది. తనని ఏమైనా చూశావా?","[Devon] Mrs. Selvig has Eleanor. Did you see her?"
"370","ఓరి దేవుడా. ఏం జరుగుతోంది?",", my God. What is going on?"
"371","ఓరి దేవుడా. తన కారు కూడా లేదు.",", my God. Her car's gone."
"372","నేను కాసేపు పట్టుకోమని పాపని ఇచ్చాను, తను వెళ్లిపోయింది!","I gave her the baby, and she left!"
"373","తను ఎలెనోర్ ని తీసుకొని వెళ్లిపోయిందా? నేను తనకి పాపని ఇచ్చాను, తను వెళ్లిపోయింది!","She left? With Eleanor? [Devon] I handed her the baby, and she left!"
"374","అన్నీ చోట్లా వెతికారా? ఇంకా లేదు!","[Ricken] Have we looked everywhere? [Devon] Not yet!"
"375","సరే, ముందు లోపలికి వచ్చి వెతుకుదాం.","[Ricken] Okay, let's Let's go inside and look."
"376","ఓరి దేవుడా!",", my God!"
"377","నువ్వు బాగా నిరాశకు గురి అయినట్టున్నావు.","[panting] I bet the tempers were disappointed."
"378","ఇప్పటికీ నేను నీకు కావలసినవి ఇవ్వగలను.","I can still get you back in there."
"379","నీకు ఏ ప్రోత్సాహకం కావాలంటే, అది ఇవ్వగలను, మార్క్.","I can get you any perk you want, Dylan."
"380","హేయ్, నీకు తెలీని ప్రోత్సాహకాలు చాలా ఉన్నాయి.","Hey, there's stuff you don't even know about."
"381","అంటే పెయింట్ బాల్ ఆట ఉంది, కాఫీ హోల్డర్లు ఉన్నాయి.","There's There's paintball, there's coffee cozies."
"382","డిలన్, నా మాట విను!","Dylan, come on!"
"383","నువ్వు ఊ అను చాలు, ఇప్పటికిప్పుడే నేను నీకు కాఫీ హోల్డర్ ని తెచ్చివ్వగలను, డిలన్.","Just say the word, and I'll get you a coffee cozy literally right now, Dylan."
"384","చెప్పేది విను!","Come on, man!"
"385","నా కొడుకు పుట్టిన క్షణం నాకు గుర్తుండాలి.","I wanna remember my fucking kid being born!"
"386","నీకు ఇంకా ఇద్దరు పిల్లలు ఉన్నారు.","You have two others."
"387","వాళ్ల గురించి నీకు చెప్తాను.","I can tell you about 'em."
"388","తలుపు తెరువు, నీకు వాళ్ల పేర్లు చేప్తాను.","Open the door, and I'll tell you their names."
"389","నా మాట విను, డిలన్.","Come on, Dylan."
"390","డిలన్!","[breathes heavily] [Mr. Milchick] Dylan!"
"393","బాబోయ్. బండి ఇంకా కదులుతోంది.","[valet] Whoa, whoa, whoa. It's rolling."
"394","నా పేరు హెలెనా, నేను ఈగన్ వంశంలో పుట్టాను.","[Helly] My name is Helena, and I'm an Eagan. [chuckles]"
