"Index","Telugu Text","Mapped English Text"
"7","ఏంటి?","What?"
"8","""నువ్వు బాగానే ఉన్నావా?"" అని అడిగా, అవును, నేను బాగానే ఉన్నాను.","[Ms. Cobel] I said, ""Are you all right?"" Yeah, I'm fine."
"9","బహుశా నువ్వు మీ అక్కతో మాట్లాడాలేమో. ఇది చాలా ముఖ్యమైన నిర్ణయం.","Maybe you should talk to your sister. It's an important decision."
"10","నా అక్కనా? అవును.","My sister? Yes."
"11","మార్క్? చెప్పండి.","Mark? Yeah."
"12","నువ్వు బాగానే ఉన్నావా?","Are you sure you're okay?"
"13","బాగానే ఉన్నాను. మన్నించాలి, నాకు నాకు కాస్త తల తిరిగినట్టుగా అనిపించింది, ఆ తర్వాత.","Yes. I'm sorry, I just, I got a little woozy and then, um."
"14","నేను బాత్రూమ్ కి వెళ్లి వస్తాను.","I'm gonna stop by the bathroom."
"15","ఆహా. అది అటు వైపు ఉంది.","I think it's the other way."
"16","అవును.","Right."
"20","నాకు సెనేటర్స్ అంటే ఎక్కువ అసహ్యమో, కాంగ్రెస్ మెన్ అంటే ఎక్కువ అసహ్యమో తెలియట్లేదు.","[Natalie] I don't know if I hate senators or congressmen more."
"21","హా?","[Helly]"
"22","ఎన్ని తాగావేంటి?","How many of those have you had?"
"23","ఇదొక్కటే.","[Helly] Just this one."
"24","మంచిది. నువ్వు చురుకుగా ఉండాల్సిన అవసరం ఉంది. మనం వేదిక ఎక్కాలి. ఇంకా 20 నిమిషాలు మాత్రమే ఉంది.","Good. We need you nimble. We gotta get down there. You're on in 20."
"25","ఇందాక నేను బోర్డుతో మాట్లాడాను. నువ్వు చేస్తున్న దానికి వాళ్లు చాలా ఆనందం వ్యక్తం చేశారు.","I was on with the Board earlier. They're really grateful for this."
"26","గ్యాబీ. నాటలీ, హలో.","Gabby. Natalie, hello."
"27","హాయ్.","Hi."
"28","ఓహ్, గ్యాబీ, తను హెలెనా ఈగన్.",", Gabby, this is Helena Eagan. [chuckles]"
"29","ఓరి దేవుడా. హెలెనా, ఎట్టకేలకు మిమ్మల్ని కలుసుకున్నందుకు నాకు చాలా ఆనందంగా ఉంది.","My gosh. Helena, so good to finally meet you."
"30","నాకు కూడా.","Likewise."
"34","దీన్ని విజయవంతం చేయండ్రా, దరిద్రులారా.","This better be working, assholes."
"37","నేను ఎక్కడ ఉన్నాను?","Where am I?"
"38","మార్క్. నువ్వు బాగానే ఉన్నావా, మహారాజా?","[Devon] Mark. You okay, milady?"
"39","రిబెక్ దగ్గర వింత వాసన వస్తోంది.","So Rebeck smells weird."
"40","అవునా?","Rebeck smells weird?"
"41","అవును, తను ఏదో నములుతున్న శబ్దాలు చేస్తోంది, కానీ తను ఏమీ నమలట్లేదు.","Yeah, she was making chewing noises, but she was not chewing."
"42","మీరిద్దరూ ఒకే పుస్తకం చదవాల్సి రావచ్చు, కాబట్టి సిద్ధంగా ఉండు.","Just be prepared 'cause you might have to share a book with her."
"43","పుస్తకం, అవును. ఆ.","A book, right."
"44","తీసుకురమ్మని నేను నీకు గుర్తు చేసినా నువ్వు తీసుకురాని పుస్తకం.","The one you forgot to bring even though I did remind you."
"45","అవును. నేను ఆ, మన్నించు. ఆ.","Right. Yeah, I'm sure , sorry."
"46","పర్వాలేదులే.","[Eleanor cooing] [Devon] That's okay."
"47","సరే.","Okay."
"48","మన పాప ఎలా ఉంది? ఆ.","How's our baby?"
"49","ఆ, మన.","Um, our [laughs]"
"50","""పిల్లలని పెంచాలంటే అందరూ ఓ చేయి వేయాలి"" అని అలా అన్నావు కదా!","I'm gonna assume you mean that in the ""it takes a village"" sense."
"51","తను బాగానే ఉంది. కాస్త ఆకలిగా ఉన్నట్టుంది.","And she's good. She's hungry."
"52","ఓహ్. ముందు పాపకు పాలు ఇచ్చేసి నీతో నువ్వు అన్న ఆ ముఖ్యమైన విషయం గురించి మాట్లాడతాను.","Um, I wanna have the life change talk. I just need to pump before I die."
"53","చాలా త్వరగా వచ్చేస్తాలే. ఆ అలాగే.","I'll be really fast. Okay. Okay."
"60","హేయ్. హాయ్. హాయ్.","Hey. Hi. Hi."
"61","""రేడార్.""","""Radar."""
"62","ఇంతకీ సిద్ధాంతం ఏంటి?","[chattering] [Patton] What's the thesis?"
"63","అవును. చాలా గందరగోళంగా ఉంది.","[Danise] I agree. It's very confused."
"66","ఓహ, హేయ్, మిత్రులారా. ఎలా ఉన్నారు?",", hey, guys. What's up?"
"67","ప్యాటన్, వద్దు. ఆ, మార్క్. ఇప్పుడు జరిగే కార్యక్రమం తర్వాత పాపని అందరికీ పరిచయం చేస్తే బాగుంటుందేమో అని మేమిద్దరం మాట్లాడుకుంటున్నాం.","Patton, no. Um, Mark, we were just discussing whether it might have been a wiser move for your sister to put off introducing the child until after tonight's event."
"68","మార్క్, దీన్నేమీ నువ్వు పట్టించుకోవలసిన పని లేదు.","Mark, you don't have to weigh in on that."
"69","ఆ పాప చాలా పద్దతి గలది అని తెలిసిపోతుంది కదా. ఒక్క నిమిషం పాపతో ఉన్నది నా అక్కనా?","Obviously the child is an absolute angel. Wait That's my sister? With the baby?"
"70","అవును, ఆమె తన అక్క.","Exactly, it's his sister."
"71","ఒక్క నిమిషం. అలాగే.","Excuse me. Sure."
"72","అది ఎబ్బెట్టుగా అనిపించింది. మ్.","Well, that was awkward."
"73","సరే, నా అక్కకి పాప ఉంది. కొబెల్ ఇక్కడికి వచ్చిందా?","Okay, so my sister has the baby. And Cobel is here?"
"74","చదివేటప్పుడు నా పుస్తకాన్ని నీకు కూడా చూపెట్టమని రికెన్ అన్నాడు.","I've been asked to share my book with you."
"75","నాకు కూడా అదే చెప్పారు. ఆ, రెబెక్కా?","So I've heard. , Rebecca?"
"76","రిబెక్. నా కళ్ళు చిన్నవి, అందుకని దగ్గరగా పెట్టుకొని చదువుతాను.","Rebeck. I have small eyes, so I have to read pretty close."
"77","సరే. నేను.","Okay. Well, I'm."
"78","అదేం పర్వాలేదులే. ఒక్క నిమిషం.","I'm sure that'll be fine. If you'll excuse me?"
"79","నా పక్షి వల్ల నా మెడ వెనుక కొన్ని పుండ్లు ఏర్పడ్డాయి.","And I have some sores on the back of my head from my bird."
"80","నీకు అవి కనిపించవచ్చు. పర్వాలేదు.","You might see them. Okay."
"81","హేయ్.","Hey."
"82","హలో, మార్క్.","Hello, Mark."
"83","పాలు ఇచ్చేశాను, కాబట్టి ఇప్పుడు ఫ్రీగా ఉండవచ్చు.","I pumped, so it's Miller time. Okay, so life change. What's happening?"
"84","మనం, ఆ ఇది కాస్త వింతగా అనిపిస్తుంది.","We're, um This is gonna sound weird."
"86","మనిద్దరి మధ్య మంచి సాన్నిహిత్యం ఉందా?","We're close, you and I?"
"87","నువ్వు ఏం ఏంటి సంగతి?","[chuckles] What do you What's going on?"
"88","ఏదైనా ఏకాంతమైన చోటు మాట్లాడుకుందామా?","Can we talk privately?"
"89","నేను నేను సరే, మిత్రులారా, ఆ, సమయం ఆసన్నమవుతోంది, కాబట్టి మీరందరూ మెల్లగా హాలుకు వచ్చేయండి సరే. మొదటి విరామంలో మాట్లాడుకుందాం.","I I I just have to [Ricken] Okay, my dearest ones, , we are nearing that hour, so if you'd all peacefully waft in the living room Okay. Let's talk at the first reflection break."
"90","సరేనా? సరే.","Okay? Okay."
"91","పిల్లలు మన జీవితాన్ని ఎంతలా మార్చగలరో నీకు ఇంకా తెలీదు.","[Gabby, echoing] You just don't realize how much kids are gonna change your life."
"92","కానీ చాలా మార్చేస్తారు.","[normal voice] But they do."
"93","ఆ, మీకు ఎంత మంది పిల్లలు ఉన్నారు? ఈ మధ్యే మూడవ బిడ్డను కన్నాను.",", how many kids do you have? Just gave birth to my third."
"94","ఇద్దరిని కన్నాక ఆపేసి ఉండాల్సింది.","I should've stopped at two."
"95","హేయ్, ఇక్కడున్నావా! హేయ్.","Hey, there you are. Hey."
"96","ఏంజెలో, నిన్ను కలవడం బాగుంది. నిన్ను కూడా.","Angelo, great to see you. [Angelo] You too."
"97","హెలెనా, ఇతను నా భర్త, ఏంజెలో ఆర్టెటా.","Helena, this is my husband, Angelo Arteta."
"98","హెలెనా, మిమ్మల్ని కలవడం బాగుంది.","Helena, nice to meet you."
"99","నేను బ్యాక్ స్టేజ్ దగ్గరకి వెళ్లాలి.","I've gotta hop backstage."
"100","ఇంకాసేపట్లో వస్తాను. సరే.","I'll see you in a second. Okay."
"101","నిన్ను కలవడం బాగుంది, నాటలీ.","[Angelo] Lovely to see you, Natalie."
"102","నువ్వు బాగానే ఉన్నావా? తనకి సీసా దొరకలేదు.","You okay? [sighs] She couldn't find the bottle."
"104","స్ వావ్. ముగ్గురు పిల్లలా!","S-S Wow. Three kids."
"105","కాస్తంత సాయం దక్కింది అనుకోండి.","Couldn't have done it without a little help."
"106","అంటే, వేర్పాటు పద్ధతికి జనం ఒప్పుకోరు అనే ఆలోచన అన్నమాట.","I mean, the idea that people would want to outlaw severance."
"107","ఆహా. ఆ అదేలే.","I kn I know."
"109","ప్రదర్శనలో పెట్టిన ఫోటోలు చాలా బాగున్నాయి.","[Angelo] The photo display is very moving."
"110","నేను దేనికి ఓటు వేస్తానో నాకు బాగా తెలుసు, కానీ.","I already knew how I'd be voting, but I think."
"111","ఆ ఫోటోలను, ఇంకా మిమ్మల్ని చూడటం, మీరు చెప్పబోయే ప్రసంగం వినడం, ఇవన్నీ కూడా చాలా పెద్ద ప్రభావాన్నే చూపగలవు.","Well, seeing that and seeing you and hearing what you have to say, all of this could really make a difference."
"112","మ్. నేను నేను కూడా అదే ఆశిస్తున్నాను.","I hope I hope so."
"113","జనాల మనస్సులు మారుద్దాం.","Let's change some minds."
"114","నా ప్రయత్నం నేను చేస్తాను మరి.","Well, I'm certainly gonna try."
"116","థ్యాంక్యూ.","Thank you."
"117","ఇంకో విషయం, మీ నాన్నగారు కనిపిస్తే, మా తరఫున కృతజ్ఞతలు చెప్పండి.","And please thank your father if you see him."
"118","తప్పకుండా.","I will."
"120","మార్క్. ఇక్కడికి రా.","[Rebeck] Mark. Come here."
"121","మన కోసం ఒక సీటును అట్టి పెట్టుంచాను.","Saved us a seat."
"122","నా కళ్ళద్దాలు ఎక్కడున్నాయో వెతకాలి.","I just have to find my glasses."
"123","మార్క్, దీన్ని ఒక్క నిమిషం పట్టుకుంటావా? తప్పకుండా.","Mark, can you just hold that for a second? Yeah."
"127","ఓరి దేవుడా.",", my God."
"128","మన్నించాలి, ఈ గంటను మోగించే యాప్ ద్వారా ఆ మోగడాన్ని ఆపడం కుదరడం లేదు. సరే మరి. ఇక్కడికి వచ్చినందుకు అందరికీ థ్యాంక్యూ.","Sorry, you can't unring the bell-ringing app apparently. [crowd laughs] [Ricken] Okay. Thank you all for being here."
"129","ఆ, మనం మొదలుపెట్టే ముందు, మొట్టమొదటిగా నేను ఒక వ్యక్తికి కృతజ్ఞతలు తెలుపుకోవాలి.","Um, before we start, there is one person that I would like to thank first and foremost."
"130","ఆ, నా కుటుంబం ఎల్లప్పుడూ నాకు దన్నుగా నిలిచింది, అదే నాకు స్ఫూర్తి కూడా.",", family is both my bedrock and my inspiration."
"131","కాబట్టి, ఈ పఠనాన్ని ఇక్కడ ఉన్న నా మొదటి బిడ్డకి అంకితం చేస్తున్నాను.","So I dedicate the reading to my firstborn daughter, who is here tonight."
"132","ఎలెనోర్, ఐ లవ్ యూ.","Eleanor, I love you."
"135","నా భావ అన్నమాట.","[whispers] My brother-in-law."
"136","ఇక నేను మొదలుపెడుతున్నాను.","[Ricken] And with that I begin."
"137","""వొల్ఫ్ గ్యాంగ్ మొజార్ట్ చిన్నప్పుడు, తల పియానోకేసి కొట్టడం ద్వారా ఒక పిల్లవాడిని చంపాడని విన్నాం.","""It's said that as a child, Wolfgang Mozart killed another boy by slamming his head in a piano."
"138","కంగారు పడకండి.","Don't worry."
"139","ఈ పుస్తకం కోసం నేను చేసిన పరిశోధనలో అది అవాస్తవమని తేలింది.","My research for this book has proven the claim untrue."
"140","మీ గుండె కొట్టుకొనే వేగం సాధారణ స్థితికి వస్తున్నప్పుడు, ఒక రచయితకి ఎంత శక్తి "" మార్క్.","As your heart rate settles though, consider the power an author "" Mark."
"141","ఆమె పుస్తకాన్ని నేను కూడా చూడవచ్చా? ఆ.","Can I look at her book too?"
"142","నేను ఒంగి చూడగలను.","I can crane."
"143",""" ఆ శక్తి పాఠకులైన మిమ్మల్ని "" తప్పకుండా.","[Ricken] "" can hold over a reader "" Sure."
"144",""" యిట్టె కట్టిపడేయగలదు.""","[Ricken] "" heretofore called 'you.'"
"145","కానీ అసలు ""మీరు"" అంటే అర్థం ఏంటి?","But what, indeed, is 'you'?"""
"146","మీ ప్రసంగానికి గుడ్ లక్.","[Angelo] Good luck tonight."
"147","మిమ్మల్ని కలవడం చాలా బాగుంది, హెలెనా.","It was great to meet you, Helena."
"148","""ఈ సువిశాల భూప్రపంచంలో ఉన్న కోట్లాది పాఠకులలో 'మీరు' అంటే ఎన్ని రకాలుగా అర్థం చేసుకోవచ్చు?","[Ricken] ""How can 'you' mean different things to millions of readers around a vast Earth?"
"149","ఇంకా అంత కన్నా ముఖ్యం, ఎవరవు నువ్వు?""","And perhaps, most importantly, who are you?"""
"157","""ఎగిరే పిల్లి నుండి ముడుచుకుపోయే చుంచెలుక దాకా ప్రాణులన్నీ కూడా 'మీరు' అని అనుకుంటాయి, తామే సర్వసం అని భావిస్తాయి.","[Ricken] ""All creatures, from the leaping cat to the cowering shrew, think of themselves as 'you, ' a logical center for the universe."
"158","కానీ పిల్లులు ఆ ఎలుకలను తినేస్తాయి, ఇక మనం, అపర మేధావుల్లా, అందులో పరమార్థం కోసం జీవితాంతం వెతుకుతూనే ఉంటాం.""","Yet the cat eats the shrew, and we, like Schrödinger, live on to wonder what it means."""
"159","అధ్యాయం ముగిసింది.","End of chapter."
"161","అందరమూ, ఆ, ఏడు నిమిషాలు విరామం తీసుకొని, మళ్లీ ఇక్కడికే వద్దాం.","[Ricken] Let's all take a, , seven-minute reflection break and then come back."
"162","ఆ, బాల్ఫ్. నీళ్ళు బాగా మరిగించి పెట్టు.",", Balf. Prepare the neti pot."
"163","అది చాలా ప్రభావవంతంగా ఉంది.","It was transformative."
"164","నేను నా పేరును మళ్లీ మార్చుకోవాలి.","I'm gonna have to change my name again."
"165","మాటలు భలే మాట్లాడుతున్నాడే. అతని గొంతులో ఏదో ఉన్నట్టుంది.","What a wordsmith. He seemed to have a little something in his throat."
"166","అవును. హేయ్.",", yeah. Hey."
"167","పాప ఇంకాస్త పాలు తాగుతుందేమో చూస్తాను.","I'm gonna see if she'll have more bottle."
"168","రెండు నిమిషాలు ఆగు, ఆ తర్వాత నన్ను పాప గదిలో కలువు, సరేనా?","Give me a couple of minutes, then meet me in the baby room?"
"169","సరే. అలాగే.","Okay. Okay."
"170","ఒక్క నిమిషం.","Excuse me."
"172","ఆ, మిస్టర్ హేల్ రికెన్?","Um, Mr. Hale Ricken?"
"173","నా గొంతు అలా ఎందుకు వణికిందో అర్థం కావట్లేదు.","I don't know why my voice shakes like that."
"174","తారు డబ్బాని రేకు మీద గీకితే వచ్చే శబ్దంలా ఉండింది నా గొంతు.","I sound like a sad old hamburger waiter [inhales shakily] prattling on about sauces."
"175","""రేకు ఏంటి, తారు ఏంటి!"" అసలు నేనేం మాట్లాడుతున్నాను?","""Hamburger waiter."" What the fuck is that?"
"176","బాబోయ్, నా చెత్త నోరును కాసేపు మూసుకుంటే బాగుంటుంది.","Jesus, why do I ever open my buffoon mouth?"
"177","చాలా బాగా చెప్పావు.","It's going great."
"178","నా ఉద్దేశం, పుస్తకం చాలా బాగుంది, ఇంకా సరే, మార్క్.","I mean, the book is brilliant, and Okay, Mark."
"179","థ్యాంక్యూ, కానీ నువ్వు అలా చెప్పాల్సిన పని లేదు.","Thank you, but you don't have to say that."
"180","నీ మనస్సులో నా గురించి ఏమనుకుంటున్నావో నాకు బాగా తెలుసు.","I'm well aware of how I come across to you."
"181","ఏంటి? నేను నిజంగానే అంటున్నా. అంటే నీ పుస్తకం, అది అది నాకు చాలా విషయాలని తెలియజెప్పింది.","What? No, I mean it. [sighs] The Your book, it It opened up the world for me."
"182","మార్క్, నీకు ఏమీ కాలేదు కదా?","Mark, are you okay?"
"183","ఏమీ కాలేదు. ఈ పుస్తకం నా జీవితాన్ని సమూలంగా మార్చేసింది.","Yes. This book changed my whole life."
"184","నువ్వు నిజంగానే చదివావా?","You actually read it?"
"185","రికెన్, మనం మిత్రులమేనా?","Ricken, are we friends?"
"187","చూడు, నువ్వు వేర్పాటు పద్ధతిని జరిపించుకున్నావు కాబట్టి అప్పుడప్పుడూ నిన్ను ""తక్కువగా"" చూశాను.","Look, I know I sometimes make you feel ""less than"" for having had the procedure."
"188","దానికి బాధపడుతున్నాను.","And I regret that."
"189","జెమ్మా మరణించిన తర్వాత ఆ శోకం నుండి నువ్వు నీకు తగిన రీతిలో బయటపడాలని చూశావు.","You had to deal with Gemma's passing in a way that was best for you."
"190","ఇవాళ ఉదయం నేను పాత ఫోటోలను చూస్తూ ఉన్నాను, మన నలుగురం పసిఫిక్ క్రెస్ట్ దారిలో హైక్ చేస్తూ తీసుకొన్న ఫోటో ఒకటి కనిపించింది.","You know, I was scrolling through old pictures this morning, and I found one of the four of us on the crest hike."
"191","నీకు ఆ వింత తుమ్మెదలు గుర్తున్నాయా? నీ దగ్గర ఆ ఫోటో ఉందా?","You remember the funny bees? [laughs] Do you have that on you? The picture?"
"192","ఉంది. ఆ ఆ, రికెన్. నీళ్లు మరిగించాను. ఓహ్, థ్యాంక్యూ, బాల్ఫ్.","Yeah, sure. I should. [inhales sharply] Um , Ricken. The neti pot is warm. , thank you, Balf."
"193","మార్క్, నేను నా గొంతును శుద్ధి చేసుకోవాలి.","Mark, I need to flush my sinuses."
"194","కానీ థ్యాంక్యూ. నువ్వన్న మాటలు నాకు ఎంత జోష్ ని ఇచ్చాయో నువ్వు అస్సలు ఊహించలేవు.","But thank you. You have no idea how much this has meant to me."
"195","మార్క్, నీ గురించి నేను ఆందోళన పడ్డాను.","Mark, I was worried about you."
"196","ఓహ్, నాకేమీ కాలేదు. థ్యాంక్స్, ఆ.",", I'm fine. Thanks,"
"197","అక్కను చూడటానికి వెళ్తున్నాను, అంతే.","I'm just going to check on my sister."
"198","ఓహ్. ఆ, ఇందాక నువ్వు నన్ను హత్తుకున్నప్పుడు, హఠాత్తుగా నువ్వు బిగుసుకుపోయావు. ఏమైంది?","[chuckles] Um, when you hugged me before, you suddenly became tense. What was that?"
"199","ఓహ్, అలా బిగుసుకుపోయానని నాకు తెలీదే.","[stammers] , I didn't know I did."
