"Index","Telugu Text","Mapped English Text"
"112","- ఈ జట్టు అంటే నీకు ఎందుకు ద్వేషమో తెలీట్లేదు. - ఈ జట్టంటే నాకు ద్వేషమేమీ లేదు. కనీసం, నీ చేతిరాతను కప్పిపుచ్చుకోవాలన్న ఆలోచన కూడా నీకు రాలేదు.","- I don't know why you hate this team. - I don't hate this team. You didn't even disguise your own handwriting."
"113","ఒకటి చెప్పనా? అసలు ఈ జట్టులోని ఒక్కరు కూడా నాకు తెలీదు.","You know what? I don't even know who this team is."
"114","నీకు ముందే చెప్పా. నా జట్టు నాకు కావాలి.","I told you. I want my team."
"115","అందులో నీకు అర్థం కానిది ఏంటి?","Which part of that don't you understand?"
"116","మార్క్ ఎస్., ప్రస్తుతానికి, డీపార్టుమెంట్ చీఫ్ గా నీకున్న హోదాని తీసివేస్తున్నాను, దాన్ని నువ్వు నింద మోపాలనుకున్న మార్క్ డబ్ల్యూకి బదిలీ చేస్తున్నాను.","Mark s., at this time, I revoke your status as department chief, which will be transferred to your intended victim, Mark w."
"117","నేను కూడా అంగీకరిస్తున్నాను. నిన్ను ఆఫీసుకు తక్కువ స్థాయికి డీమోట్ చేస్తున్నాను, నీ పురోగతిని గమనిస్తూ ఉంటాం, కాబట్టి నువ్వు క్రమం తప్పకుండా చెక్ ఇన్ చేస్తూ ఉండాలి.","I accept. You will be relegated to the office and must check in regularly as to your progress."
"118","నీకు నిజంగానే బావ ఉన్నాడా, చచ్చినోడా?","Do you even have a brother-in-law, asshole?"
"119","ఎందుకు నవ్వు వస్తోంది నీకు?","What's funny?"
"120","వంటగదిలో ఏం చేశానో మీకు తెలీదు కదా?","You don't know what I did to the kitchenette yet, do you?"
"121","నీ యెంకమ్మ.","Goddamn it."
"122","హేయ్!","Hey!"
"123","నువ్వు ఆ పని అస్సలు చేయకూడదు.","You're definitely not supposed to do that."
"124","మిస్టర్ మిల్చెక్, మీ ఆఫీసులోకి మార్క్ ఎస్. చొరబడ్డాడు. స్పీకర్ తీసుకున్నాడు.","Mr. Milchick, I've got Mark s. In your office. He's got the speaker."
"125","హలో? ఎవరైనా వింటున్నారా? బోర్డు వింటోందా? మ్యాక్రోడేటా రిఫైన్మెంట్ నుండి మార్క్ ఎస్.ని మాట్లాడుతున్నా.","Hello? Is anyone there? Is the board on? It's Mark s. From macro data refinement."
"126","సరే. అయితే మీరు కనుక ఉంటే, దయచేసి వినండి. విషయం ఏంటంటే, వేర్పాటు పద్ధతి జరపబడిన వారి విషయంలో మీరు మంచే చేయాలనుకుంటున్నారని తెలుసు, - అందుకే నేను నా జట్టును మళ్లీ చూడాలనుకుంటున్నా. - మార్క్! మీరు అన్నట్టు, వేర్పాటు సంస్కరణకు మేము నిజంగానే ప్రతిరూపమైతే, - వారికి అవకాశం ఇవ్వడం న్యాయం. - మార్క్! దయచేసి వినండి. వాళ్లు నా మిత్రులు. వాళ్లని మాయం చేసేయడం ఎంత వరకు న్యాయం! ప్లీజ్!","Okay. Well, if you're there, please listen. Now, I know that you want to do the right thing for severed people, - which is why I need to see my team again. - Mark! If we truly are the face of severance reform, as you say, - then they deserve a chance. - Mark! Please. They're my friends! You can't just make them disappear! Please!"
"127","చూడు, మిస్టర్ మిల్చెక్, నేను బోర్డును ఆశ్రయించడానికి కారణం ఏంటంటే... బోర్డు సభ్యులు పని అవతారాలతో మాట్లాడరు.","Look, Mr. Milchick, I only went to the board because I cannot the board does not converse with innies."
"128","నీ పనియేతర అవతారానికి వచ్చిన పేరు నీ పని అవతారం నెత్తికి ఎక్కిందని తెలిసిపోతోంది.","It is clear your outie's fame has gone to your innie's head."
"129","లేదు, నా పని అవతారం, కేవలం పాత సహోద్యోగులనే కోరుకుంటున్నాడు, అలా మేము కలిసి కియర్ కి సేవ చేయగలం.","No, my innie just wants his coworkers back so we can serve kier together."
"130","నన్ను పనిలోంచి తీసేస్తున్నావా?","Are you firing me?"
"131","లోపలికి వెళ్లు.","On you go."
"132","వాళ్లని మళ్లీ ఇక్కడికి తీసుకురావడానికి ఏంటి నీకు సమస్య?","Why can't you just bring them back?"
"133","బై, మార్క్ ఎస్.","Goodbye, Mark s."
"134","ఆగు!","Wait!"
"135","- డిలన్! - మార్క్! - అది పని చేసిందా? - పని చేసింది. - మిగతా వాళ్లు ఎక్కడ? - నాకు తెలీదు.","- Dylan! - Mark. - Did it work? - It worked. - Where are the others? - I don't know."
"136","మిల్చెక్... నేను మళ్లీ ఇక్కడికి వస్తానని అనుకోలేదు. - నేను వచ్చి ఇప్పటికే రెండు రోజులైంది. - ఏంటి? అవును. ఇప్పుడు కొత్త జట్టును తీసుకొచ్చారు. - కొబెల్ మా స్థానంలో కొత్తవారిని తీసుకొచ్చిందా? - లేదు. కొబెల్ ఇప్పుడు ఇక్కడ లేదు. మిల్చెక్ చూసుకుంటున్నాడు. అంటే, నన్ను కొట్టిన, అలాగే నాకు ఇష్టమైన బెల్టును తెంపేసిన వాడు, ఇప్పుడు మన బాసా? - ఛ. - ఒక్క నిమిషం. అతను నిన్ను కొట్టగలిగాడా? హా, అది దారుణమబ్బా. కానీ... నిజం చెప్పాలంటే, నేనే అతడిని ముందుగా కొట్టా, కానీ అతని బెల్టును నేనేం చేయలేదుగా. ""కియర్, అతడిని మోసం చేసినవాళ్లని కూడా క్షమిస్తాడా""?","Milchick was... I didn't think I was coming back. - I've been back a couple days already. - What? Yeah. And they had a whole new team. - Cobel just replaced us? - No. Cobel's gone. Milchick's in charge. Okay, so the man who just tackled me and cut up my best belt is our boss now? - Fuck me. - Wait. He tackled you? Yeah, bad. Which... I mean, fair, I tackled the man first, but I didn't fuck with his belt. ""Kier pardons his betrayers""?"
"137","బర్ట్!","Burt!"
"138","గురూ, నువ్వు బాగానే ఉన్నావా?","Dude, are you okay?"
"139","అర్వింగ్, ఏమైంది? అయ్య బాబోయ్! అర్వ్! గురూ, ఏమైంది? నీ పనియేతర అవతారం పేదవాడా?","Irving, what happened? The fuck? Irv! Dude, what's wrong? You poor up there?"
"140","కానివ్వు. కానివ్వు.","Come on."
"141","హెల్లీ!","Helly!"
"142","ఓరి దేవుడా. నువ్వు బాగానే ఉన్నావా?","My god. Are you okay?"
"143","నేను బాగానే ఉన్నాను. నువ్వు బయట మేల్కొన్నావా? - హా, మేల్కొన్నా, అంతా పిచ్చిపిచ్చిగా ఉండింది. - నా విషయంలో కూడా. బాబోయ్. నీకేం అయిందా అని చాలా కంగారుపడిపోయా. - ఎంత కాలమైంది? - ఐదు నెలలు ఇంకా ఎక్కువే అయ్యుండవచ్చు.","I'm okay. Did you wake up? - Yeah, it was crazy. - Same. My god. I was so worried about you. - How long has it been? - Five months, maybe more."
"144","మిగతావాళ్ళు ఎక్కడ?","Where's everybody else?"
"145","ఇలా రా.","Come on."
"146","వాళ్లు లేరే.","They're gone."
"147","అర్వింగ్?","Irving?"
"148","అతను బయటకి రావట్లేదు.","He won't come out."
"149","- హేయ్, అర్వ్? - నన్ను క్షమించు, మార్క్. ఒక నిమిషం నన్ను ఏకాంతంగా వదిలేయండి.","- Hey, Irv? - I'm sorry, Mark. I just need a moment, please."
"150","సరే. నీకు కావాల్సినంత సమయం తీసుకో.","Okay. Take your time."
"151","సరే మరి, ఏం జరుగుతోంది ఇక్కడ? వీళ్లు మనల్నేమీ చేయడం లేదా? ఏమీ చేయరనే అనుకుంటున్నా. మన సందేశం బయటకు వెళ్లిందని మిల్చెక్ అన్నాడు. మనకి చాలా పేరు వచ్చిందని అన్నాడు. అందరికీ సమానమైన పేరు వచ్చిందా, లేదా ఎవరికైనా ఎక్కువ పేరు వచ్చిందా? అది నాకు తెలీదు. కానీ ఆ తర్వాత అతను నన్ను పనిలోంచి తీసేయాలని చూశాడనుకుంటా. ఎందుకు?","Okay, so what is going on? We're not in trouble? I don't think so. I mean, milchick said our message got out. He said we're famous. All of us equally or one of us is, like, the star? I don't know. But then he tried to fire me, I think. Why?"
"152","ఎందుకంటే, కొత్త జట్టుపై కుట్రపూరితంగా నింద మోపే ప్రయత్నం చేశా, అందుకని. - కొత్త జట్టా? - అసలేం జరిగింది అక్కడ? చూడండి, మిల్చెక్ ఇక్కడికి వస్తూ ఉంటాడు. సూపర్. వాడి బెల్టును కూడా నేను తెంపాలి కదా. లెక్క బాకీ ఉంది.","Well, because I sort of sabotaged the new people. - New people? - So, what the fuck happened up there? Well, look, milchick is probably coming. Good. I owe him a fucking belt cut. Now tell me."
"153","ఒకవేళ ఏం జరిగిందో మనం ఒకరికొకరం చెప్పుకోవడమే వాళ్లకి కావాలేమో, ఎందుకంటే, ఏం జరిగిందో వాళ్లకి తెలీదు కదా? అంటే, ఒకవేళ వాళ్లు వింటూ ఉంటే, అప్పుడు ఏంటి పరిస్థితి, డిలన్? ఒక్క నిమిషం, ఇక్కడున్న సెక్యూరిటీ కెమెరా ఏమైంది?","What if they're waiting for us to tell each other what happened because they don't know what happened? I mean, what if they're listening, Dylan? Wait, what happened to the security camera?"
"154","నన్ను... నన్ను క్షమించండి, నాకు...","I I'm sorry, I was..."
"155","అదీ... అసలు నువ్వు బాగానే ఉన్నావా?","Just are you okay?"
"156","అందరికీ హాయ్. నా పేరు మిస్ హ్వాంగ్.","Hi, everyone. I'm miss huang."
"157","మిస్టర్ మిల్చెక్ మీ కోసం బ్రేక్ రూమ్ లో ఎదురు చూస్తున్నాడు.","Mr. Milchick's waiting for you in the break room."
"158","ఏం జరుగుతోంది అసలు? తనకి ఒక ఎనిమిదేళ్ళు ఉంటాయా? ఏమో మరి.","What the fuck is going on? Why is she, like, eight? I don't know."
"159","ఆగు, వాళ్లు మా స్థానంలోకి వేరే వాళ్లని తెచ్చారా? రెండు రోజుల పాటు ఉన్నారు వారు. నా స్థానంలోకి ఎవరు వచ్చారు? ఫలానా వ్యక్తి స్థానంలోకి ఫలానా వారు అంటూ ఏమీ లేదు. కానీ వాళ్లు విచిత్రంగా ఉన్నారు. సరే. అయితే, నువ్వు బాధపడాల్సిన పని లేదులే. - బాధపడటం ఏంటి? - వారిని పనిలోంచి పీకించేసినందుకు. తొక్కలో ముఖాలు. నా ఉద్దేశం వారిని పనిలోంచి పీకించాలని కాదు... లేదు, గురూ. బాధపడకు అని చెప్తున్నా. నన్ను అడిగితే, వాళ్లకి అలా జరగడం న్యాయమే.","Wait, so they replaced us? For a couple days. Who was me? They weren't, like, specific counterparts. They were, I don't know, weird. Okay. Well, I don't think you should feel bad at all. - Feel bad? - Yeah, for ending their lives. Fuck 'em. Well, I wasn't trying to no, dude, I'm saying don't feel bad. Like, I'm sure they deserved it."
"160","బ్రేక్ రూమ్","**[NO ENGLISH MATCH FOUND]**"
"161","లూమన్","**[NO ENGLISH MATCH FOUND]**"
"162","మ్యాక్రోడేటా రిఫైన్మెంట్ సభ్యులారా. పునఃస్వాగతం.","Macrodata refinement. Welcome back."
"163","దయచేసి, అందరూ కూర్చోండి.","Please, take a seat."
"164","అర్వింగ్, నీకు అభ్యంతరం లేకపోతే, వెనుక కూర్చుంటావా? నాకు సరదాగా గడపడమంటే ప్రాణం!","Irving, if you wouldn't mind being in back."
"165","తాటి చెట్టులా పొడుగ్గా ఉన్నావు కదా.","Tall glass of water."
"166","బోర్డు నా విన్నపాన్ని అంగీకరించినట్టుంది.","I guess the board reconsidered my terms."
"167","అలానే అనిపిస్తోంది.","Guess so."
"168","ఎల్లప్పుడూ ఆనందంగా గడపండి!","**[NO ENGLISH MATCH FOUND]**"
"169","మీకు ఇప్పుడు ఏదైతే చూపించబడుతుందో, అది ఇవాళ్టి నుండి ఇక్కడికి రాబోయే ప్రతి పని అవతారానికి కూడా చూపబడుతుంది.","What you're about to see will be shown to every innie who sets foot in this building after today."
"170","దీని వల్ల లూమన్ సూత్రాలకు సంబంధించి, మీకు ఒక ఐడియా వస్తుందని ఆశిస్తున్నా.","I hope it will give you a sense of lumon's feelings."
"171","లూమన్ ఆలకిస్తోంది!","**[NO ENGLISH MATCH FOUND]**"
"172","హాయ్. ఈ కోణం నుండి మీరు నన్ను గుర్తుపట్టకపోవచ్చు. నేను లూమన్ పరిపాలన భవనాన్ని, నాది 501వ బ్రాంచ్. మీరు ఇప్పుడు నాలోనే కూర్చొని ఉన్నారు.","Hi. You probably don't recognize me from this angle. I'm the lumon administrative building, branch 501. And you're sitting in me right now."
"173","నా ఆకారంలా నా పేరు కూడా పెద్దగా ఉంది కదా.","The name's a mouthful, or as I say, a ""doorful."""
"174","కాబట్టి మీరు నన్ను లూమన్ అని పిలిస్తే చాలు.","So you can just call me lumon."
"175","నన్ను ఇక్కడ 1870లో నిర్మించారు, అప్పటి నుండి నాలో చాలా మార్పులు చేశారు. కానీ నాలో మారని ఏకైక విషయం ఏంటంటే, నా ఉద్యోగుల పట్ల నాకున్న ప్రేమ, అది వేర్పాటు పద్ధతి జరిగిన వారైనా సరే, జరగని వారైనా సరే. నేనేమీ గొప్పలకు పోవడం లేదు కానీ, లూమన్ పని చేస్తున్న 206 దేశాల్లో, వేర్పాటు పద్ధతి ఆచరణలో ఉన్న ఆఫీసుల్లో నా బేస్మెంట్ అంత అద్భుతమైనది మీకెక్కడా కనిపించదు. హేయ్, నా హాళ్ళలో పరుగెత్తకూడదు!","I've gone through a lot of changes since my siring here in 1870. But one thing I've always had is a love for my workers, both unsevered and severed. Not to brag, but my basement floor is one of the premier severed workspaces in the 206 countries from which lumon operates. Hey, no running in my halls!"
"176","నాకు గిలిగింతలు కలుగుతాయి.","That tickles."
"177","కానీ ఒక భవనానికి నిజమైన ఆనందం ఎప్పుడు కలుగుతుంది?","But what makes a building truly happy?"
"178","ఈ ప్రశ్న ఎప్పుడు ఉత్పన్నమైనదంటే, తమ వెర్పాటు జీవితంతో అసంతృప్తితో ఉన్న నలుగురు ఎండిఆర్ ఉద్యోగులు తిరుగుబాటు బావుటా ఎగురవేశారు, అది మ్యాక్రోడాట్ తిరుగుబాటుగా చరిత్రలో శాశ్వతంగా నిలిచిపోతుంది.","This question came to light when four mdr workers, dissatisfied with their severed lives, conspired to mount what lumon historians will forever call the macrodat uprising."
"179","నాలోనే, మనుషులు రూపొందించిన ఒక భయంకరమైన, అలాగే ఆసక్తికరమైన ప్రణాళిక కార్యరూపం దాల్చింది.","Under my literal nose unfolded a human drama of danger and intrigue."
"180","సముచితమైన క్రోధం.","Righteous anger."
"181","ఈ చోటును భూస్థాపితం చేసేద్దాం.","Let's burn this place to the ground."
"182","స్ఫూర్తి.","Inspiration."
"183","ఇంకా అంధకారంలో మనం ఎందుకు పని చేయాలి?","Why are we down here still working in the dark?"
"184","ఇంకా ప్రేమ.","And love."
"185","అయ్య బాబోయ్!","What the shit?"
"186","మ్యాక్రోడాట్ తిరుగుబాటు పుణ్యమా అని అనేక సంస్కరణలు పుట్టుకొచ్చాయి.","The macrodat uprising yielded bounteous reforms."
"187","ఇందులో భాగంగా, ఎండబెట్టిన పళ్లు, కోసిన బీన్స్, క్రిస్మస్ మింట్స్, సాల్సా వంటి రుచికరమైన కొత్త స్నాక్స్ ని అందించడం జరుగుతుంది.","These include tasty new snacks, like fruit leather, cut beans, Christmas mints, and salsa."
"188","దేవుడా... ఇంకా నమ్మకం కలగట్లేదా? లూమన్ హాల్ పాస్ ప్రోత్సాహకాల్లో కూడా సంస్కరణలను తీసుకురావడం జరిగింది, వాటిలో భాగంగా హాల్ పాసులు, నీట్లో పైన్ యాపిల్ ని నోటితో పట్టుకోవడం...","Wh... not sold yet? The incentives were also reformed and now range from hall passes to pineapple bobbing..."
"189","అలాగే మా సరికొత్త సరదాభరితమైన అద్దాల గది వంటివి ఉన్నాయి.","To our brand-new playful mirror room."
"190","గమ్మత్తైన విషయం ఏంటంటే, నేను జీవితాంతం నన్ను నాకు చూపించే ఈ అద్దం లాంటి సరస్సు పక్కనే కూర్చొని ఉన్నాను, కానీ నిజంగా నేనెవరో నాకు చూపించడానికి, నలుగురు ఎండిఆర్ వీరుల నిశ్శబ్ద విప్లవం అవసరమైంది.","You know, it's funny. I've sat by this reflective pool my whole life, yet it took the quiet courage of four mdr heroes to show me who I really am."
"191","వారు మామూలు అలజడి సృష్టించలేదు. అది నిజమే, నీటి ట్యాంక్. వారిని అందించినందుకు కియర్ కి కృతజ్ఞతలు.","They made quite a splash. They sure did, water tower. And I thank kier for them."
"192","మ్యాక్రోడాట్ తిరుగుబాటు జరిగినందుకు కియర్ కి కృతజ్ఞతలు తెలుపుకుంటున్నాను.","I thank kier for the macrodat uprising."
"193","మన మధ్య భేదాభిప్రాయాలు ఉన్నాయని నాకు తెలుసు...","I know we have our differences..."
"194","కానీ, మీలోని ప్రతి ఒక్కరినీ నేను చాలా గౌరవిస్తున్నానని తెలుసుకోండి.","But I want you to know that I truly respect each and every one of you."
"195","మీ పట్ల యమరాజుగా ఉండాలని నాకు లేదు.","And I don't wanna be your jailer."
"196","కానీ ఈరోజు చివరికల్లా, మీకు ఇక్కడ ఉండాలనుందో, లేదో మీరు నిర్ణయించుకోవాలి. మీ పనియేతర అవతారాలు కాదు, మీరే.","By end of day, each of you will choose whether you want to remain here. Not your outies, but you."
"197","మీ ఫైల్ పై మీరు పని చేయడం ప్రారంభిస్తే, మీకు ఇక్కడే ఉండాలని ఉందని భావిస్తాను. లేదంటే, మనస్సులో ఏమీ పెట్టుకోకుండా మిమ్మల్ని బయటకు పంపించేస్తాను.","If you start work on your file, I'll assume you want to stay. If not, I'll send you to the surface. No ill will."
"198","కుదిరితే ఏదోకరోజు మీకు ఏదైనా బారులో ఒక డ్రింక్ కూడా ఇప్పిస్తా.","Maybe I'll even buy you a drink at a bistro one day."
"199","ప్రత్యేకమైన అంతస్థులో లాగానే, బ్రేక్ రూమ్ లో కెమెరాలు కానీ, మైక్రోఫోన్లు కానీ ఏమీ లేవు.","Like the rest of the severed floor, the break room has no cameras or microphones."
