Index,Details,Telugu,English,Status
71,t(2)-e(3) | .. vs ...,"మిమ్మల్ని కలవడం కూడా బాగుంది, డెవన్. అవును, మిమ్మల్ని కూడా.","Nice to meet you too, Devon. [laughs] Yeah. You too.",MISMATCH
128,t(4)-e(3) | .... vs ...,మిస్ కేసీ. మిస్ కేసీ. మిస్ కేసీ. అవును.,"Ms. Casey. Ms. Casey. Ms. Casey. Yeah,",MISMATCH
299,t(2)-e(3) | .. vs ...,జాగ్రత్తగా చూసుకుంటూ రండి. ఇటు వైపు రండి.,[Ricken] Careful. Watch your step. Right this way. [sighs],MISMATCH
300,t(3)-e(4) | ... vs ....,"చాలా బాగుంది. రా, బంగారం. నా బంగారు కొండ.",[Mrs. Selvig chuckles] Love it. Okay. My girl. There's my girl. [shushes],MISMATCH
305,t(2)-e(3) | .. vs ...,"హాయ్, అవును, మీరు మార్క్ పక్కింటావిడ కదా. మమ్మల్ని కలవడానికి వచ్చినందుకు థ్యాంక్యూ.","Hi. Yeah, and you're Mark's neighbor. Thanks so much for meeting with us.",MISMATCH
