"Index","Start Time","End Time","Telugu Text","Mapped English Text"
"118","00:06:40,193","00:06:42,820","నేను అన్ని ఏర్పాట్లు చేసుకోవాలి ఎందుకంటే సోమవారం నుండి నేను ఉద్యోగానికి వెళ్లాలి.","I'm trying to get organized because I start work on Monday."
"119","00:06:42,862","00:06:44,239","ఎందుకంటే నాకు ఉద్యోగం వచ్చింది!","Because I got the job!"
"120","00:06:44,322","00:06:49,035","ఇది ఇంత ముఖ్యం కాకపోతే నేను అడిగేవాడినే కాదు. ""కంగ్రాట్యులేషన్స్, సిల్వియా. నీకు ఉద్యోగం వచ్చింది!""","I wouldn't ask if it wasn't very important. ""Oh! Congratulations, Sylvia. You got the job!"""
"121","00:06:49,119","00:06:50,919","థాంక్యూ, విల్. నువ్వు చాలా చక్కని మిత్రుడివి.","Thank you, Will. You're such a good buddy."
"122","00:06:50,996","00:06:53,248","పేటన్ తో తెగతెంపులు అయి నేను చాలా సమస్యల్లో ఉన్నాను.","I am in deep fucking shit with Peyton."
"123","00:06:53,331","00:06:56,084","తను నాకు ఏమీ కాదు అని, తనతో నాకు ఎలాంటి సంబంధం లేదని నేను అన్న విషయం తనకి తెలిసిపోయింది.","She found out that I said she was nothing and the relationship was nothing."
"124","00:06:56,126","00:06:59,546","అది ఘోరంగా ఉంది. ఈ అమ్మాయితో నువ్వు ఎన్నిసార్లు డేటింగ్ కి వెళ్లావు?","- I-I-It's bad. - [stammers] How many dates have you gone on with this girl?"
"125","00:06:59,629","00:07:01,381","కొన్నిసార్లు. కానీ మా మధ్య బలమైన అనుబంధం ఉంది.","A few. Uh, we have a very strong connection."
"126","00:07:01,423","00:07:02,924","- అంటే, మీ మధ్య ఏదో ఉంది. - ఖచ్చితంగా ఉంది.","- Well, that's something. - It is something."
"127","00:07:02,966","00:07:05,552","లేదు! ఏమీ లేదు! ఏడాది తరువాత కూడా మీరిద్దరూ కలిసి ఉంటే గనుక నాకు ఫోన్ చేయి.","No! It's nothing! Call me in a year if you're still together."
"128","00:07:05,594","00:07:07,220","నేను నా అసలైన జీవితానికి వెంటనే తిరిగి వెళ్లిపోవాలి.","I-I have to get back to my real life right now."
"129","00:07:07,262","00:07:09,806","తను అలాంటిది కాదు! తను పెద్దమనిషిలా ఆలోచిస్తుంది. నువ్వు చూస్తావు.","She's not like that! She's an old soul. You'll see."
"130","00:07:09,848","00:07:14,060","నువ్వు వెంటనే ఇక్కడికి రావాలి. మన ఇద్దరం కలిసి అంత సమయం గడుపుతాం కానీ తన గురించి నీకు చెప్పకపోవడం తనకి విచిత్రంగా అనిపిస్తోంది.","I need you right now. She thinks it's weird that we spend so much time together and that I didn't tell you about her."
"131","00:07:14,102","00:07:17,689","తను నిజమే చెప్పింది. అది విచిత్రం అనిపిస్తుంది, అందుకే పరిస్థితిని ""మామూలు"" గా చేయాలని నా ప్రయత్నం.","And she is right. It is weird, and I'm trying to ""unweird"" the situation."
"132","00:07:17,731","00:07:21,067","కాబట్టి, దయచేసి నన్ను క్షమించి, ఇక్కడికి వచ్చి నాకు సాయం చేస్తావా?","So, will you please just forgive me, and just come here and help me out?"
"133","00:07:21,151","00:07:23,194","వచ్చే సోమవారం నేను ఉద్యోగంలో చేరుతున్నానని చెప్పాను గుర్తుందా?","Do you remember how I said I had a job starting on Monday?"
"134","00:07:23,236","00:07:24,779","అవును, సోమవారం నుంచి నేను ఉద్యోగం చేయాలి!","Well, I have a job starting on Monday!"
"135","00:07:24,821","00:07:28,783","చూడు, నేను చెబుతున్నాను. నువ్వు తనని కలవాలి, ఎందుకంటే నీ అభిప్రాయాన్ని నేను గౌరవిస్తాను.","Look, I'll say it. I want you to meet her, because I care about your opinion."
"136","00:07:28,867","00:07:32,954","మిగతా అన్నింటికన్నా నేను నీ అభిప్రాయానికి ఎక్కువ విలువ ఇస్తాను, కాబట్టి నువ్వు అలా వచ్చి తనని కలుస్తావా?","It's actually the opinion I care about more than anything, so will you just come meet her?"
"137","00:07:33,038","00:07:36,124","మేవీ, ఇతను నాయనమ్మ ఫ్రెండ్, మార్జొరీ కొడుకు, పీటర్.","[gasps] Maeve, this is Nana's friend, Marjorie's son, Peter."
"138","00:07:36,207","00:07:39,487","అతను చాలా సంపాదించి ఇప్పుడు తన సొంత చర్మవ్యాధి వైద్యుడిగా ప్రాక్టీసు మొదలుపెట్టాడు.","He's very successful and owns his own dermatology practice."
"139","00:07:39,544","00:07:42,305","సరే, మంచిది. కానీ ఇది పనికిమాలిన పని, ఇంకా నువ్వు నాకు ఒక సాయం చేయాలి.","Okay, fine. But this is dumb, and you owe me one."
"140","00:07:45,926","00:07:48,386","- హేయ్, అదిగో తను వచ్చింది. - హాయ్.","- Hey. There she is. - [Sylvia] Hi."
"141","00:07:47,844","00:07:49,221","**[NO TELUGU MATCH FOUND]**","[exclaims]"
"142","00:07:49,304","00:07:50,639","హాయ్!","Hi!"
"143","00:07:50,722","00:07:56,603","హాయ్! - హాయ్. - మీరు ఇప్పటికే బాగా కలిసిపోయారు.","- [chuckles] Oh, hi! - [chuckling] - Hi. - You guys are hitting it off already."
"144","00:07:57,312","00:07:58,396","నీకు తాగడానికి ఏం ఇవ్వను?","What can I get you to drink?"
"145","00:07:58,438","00:08:00,857","కేవలం తేలికపాటి బీర్ చాలు.","Uh, just, um, your least gross beer."
"146","00:08:00,941","00:08:02,776","- మంచిది. నీకు? - యమ్.","- Cool. You? - Yum."
"147","00:08:02,859","00:08:04,652","- నాకు ఏది నచ్చుతుందని నీకు అనిపిస్తే అది. - అద్భుతం.","- Whatever you think I'll like. - Awesome."
"148","00:08:04,694","00:08:07,280","అక్కడ విఐపి సీటులో కూర్చోండి.","- Have a seat in the VIP table right there. - Ooh. [chuckles]"
"149","00:08:07,364","00:08:08,865","నేను చాలా… ఇప్పుడే వస్తాను.","Um, I'm very... Uh, I'll be back."
"150","00:08:08,949","00:08:11,785","- సరే. - ""రిజర్వ్ అయింది.""","- Okay. [chuckles] - ""Reserved."" [chuckles]"
"151","00:08:11,868","00:08:12,994","కొత్తగా ఉంది.","Fancy."
"152","00:08:15,247","00:08:18,583","హేయ్.","- [chuckles] - Hey. [chuckles, sighs]"
"153","00:08:19,584","00:08:22,254","అయితే, నువ్వు ఎక్కడి నుంచి మీ స్వస్థలం ఏది, పేటన్?","So, where are you... Where are you from, Peyton?"
"154","00:08:22,337","00:08:26,174","నేను డెన్వర్ శివార్లలో ఉండే కొలంబైన్ పట్టణం నుండి వచ్చాను. మీరు ఎప్పుడైనా విన్నారా?","I'm from this town outside Denver called Columbine. Have you heard of it?"
"155","00:08:27,259","00:08:28,635","- విన్నాను. - నిజంగానా?","- I have. - Really?"
"156","00:08:28,718","00:08:29,844","**[NO TELUGU MATCH FOUND]**","Mm-hmm."
"157","00:08:31,179","00:08:32,722","**[NO TELUGU MATCH FOUND]**","[both chuckle]"
"158","00:08:33,640","00:08:35,058","విల్ గారి ఆడవాళ్లు, హా?","Will's ladies, huh?"
"159","00:08:35,140","00:08:38,602","మీ చెత్త వాగుడు వినేంత టైమ్ ఇప్పుడు నాకు లేదు.","Ugh, I really don't have time for your weird bullshit right now."
"160","00:08:38,687","00:08:40,246","మంచిది. బహుశా తరువాత ఎప్పుడైనా విందువు.","Fair enough. Maybe another time."
"161","00:08:40,313","00:08:41,356","అలాగే.","Yeah."
"162","00:08:41,438","00:08:43,817","ఇంకా విల్ ని ఎలా కలుసుకున్నావు?","And, um, how did you meet Will?"
"163","00:08:43,900","00:08:46,903","ఓహ్, దేవుడా. అది నిజంగా ఒక విచిత్రమైన కథ.","Oh, my God. It's a really funny story."
"164","00:08:46,987","00:08:50,365","- ఓహ్, అవునా? - అంటే, నా మిత్రుడు ఒమర్ ఇక్కడ పని చేస్తాడు.","- Oh, yeah? - So, my friend Omar works here."
"165","00:08:50,448","00:08:51,348","**[NO TELUGU MATCH FOUND]**","Mm-hmm."
"166","00:08:52,325","00:08:58,748","ఇంకా నువ్వు ఏం పని చేస్తుంటావు?","- [chuckles] - [chuckles] Aw. And what, uh... What do you do for a living?"
"167","00:08:58,832","00:09:03,378","నేను నిజానికి కోలరాడోలో ఇద్దరు చిన్నారి ఆడపిల్లలు, కెంజీ ఇంకా కేడెన్, కుటుంబానికి ఆయాగా పని చేసేదాన్ని.","I actually used to nanny for this family back in Colorado with two little girls, Kenzie and Kayden."
"168","00:09:03,461","00:09:06,840","వాళ్లు ఇప్పుడు మిడిల్ స్కూల్ లో ఉన్నారు. మేము ఎప్పుడూ సందేశాలు పంపుకుంటూ ఉంటాం.","They're in middle school now. [sighs] We text all the time."
"169","00:09:06,923","00:09:08,258","ఆవ్. అది చాలా ముచ్చటగా ఉంది.","Aw. That's so cute."
"170","00:09:08,341","00:09:09,676","అవును.","Yeah. [chuckles]"
"171","00:09:11,219","00:09:13,597","ఇంకా ఏంటి ఇప్పుడు ఏం చేస్తున్నావు? నీ పని ఏంటి…","And what... what do you do now? What's your..."
"172","00:09:13,680","00:09:17,642","అక్కడా ఇక్కడా పిల్లల్ని చూసుకుంటూ ఉంటాను. అవును, పిల్లలు అంటే ఇష్టం. నాది పిల్లల మనస్తత్వం.","I babysit here and there. Yeah, kids are my passion. I'm a kid at heart. [chuckles]"
"173","00:09:17,726","00:09:20,395","- అవును, సరే… - నాకు టీచర్ కావాలని ఉంది.","- Yes. Well... - [chuckles] I wanna be a teacher."
"174","00:09:20,478","00:09:23,565","వచ్చే శరత్కాలంలో ఎడ్యుకేషన్ లో నేను మాస్టర్స్ డిగ్రీ చేయడానికి తిరిగి వెళ్తున్నాను.","I'm actually going back to get my Master's in Education in the fall."
"175","00:09:23,607","00:09:28,611","అది గొప్ప విషయం. నిజానికి నేను మళ్లీ ఉద్యోగంలో చేరుతున్నాను, మా అత్తమ్మ కాకుండా ఒక ఆయా కోసం చూస్తున్నాను.","Oh, that's great. I'm actually going back to work, and I'm looking for a babysitter other than my mother-in-law."
"176","00:09:28,653","00:09:30,446","- ఓహ్, దేవుడా. - మీ దగ్గర ఏమైనా అవకాశాలు ఉంటే…","- [Peyton] Oh, my God. - If you have any openings..."
"177","00:09:30,488","00:09:33,742","- తప్పకుండా చేస్తాను. అవును, ఓహ్, దేవుడా… - సరే. నాకు ముగ్గురు పిల్లలు, కాబట్టి…","- Love to. Yes. Oh, my... - Okay. Oh, I have three little ones, so..."
"178","00:09:33,825","00:09:35,705","ఉద్వేగంగా ఉన్నారు! మీరు ఏం మాట్లాడుకుంటున్నారు?","Oh, exciting! What are you guys talking about?"
"179","00:09:35,785","00:09:37,704","తన పిల్లల్ని చూసుకోమని సిల్వియా అడుగుతోంది.","Sylvia asked me to babysit her kids."
"180","00:09:40,540","00:09:43,418","ఊరికే ప్రస్తావన వచ్చింది. నేను ఇంకా కనీసం…","It just... [stammers] It just came up. I-I wasn't even..."
"181","00:09:43,501","00:09:44,544","నేను చాలా ఉద్వేగంగా ఉన్నాను.","I'm so excited."
"182","00:09:44,586","00:09:47,005","మంచిది. అవును. అది…","Good. Yeah. That'll... That'll... Hmm."
"183","00:09:47,589","00:09:52,469","టాయిలెట్ ఎక్కడ ఉందని ఇందాక అడిగావు. నీకు చూపిస్తాను పద.","- Um... - [chuckles] You were asking where the restroom was. Uh, let me just walk you back there."
"184","00:09:52,552","00:09:55,096","ఇక్కడ అంతా గందరగోళంగా ఉంటుంది. నేను ఇప్పుడే వచ్చేస్తాను. సరేనా? అలాగే.","It's a maze here. I'll be right back. Okay? Yeah."
"185","00:09:55,138","00:09:57,682","- రెండు సెకన్లు. నేను ఇప్పుడే వస్తాను. - సరే.","- Two seconds. Um, I'll be back. - Okay."
"186","00:09:57,766","00:10:04,731","తను కూడా కాసేపట్లో వస్తుంది. నువ్వు ఇలాంటిది ఏదో పాడు పని చేస్తావని నాకు తెలుసు.","- She might be a while. - [chuckles] I knew you were going to do something fucked up like this."
"187","00:10:04,814","00:10:06,566","- నువ్వు ఏం మాట్లాడుతున్నావు? - ఏం మాట్లాడుతున్నానా?","- What are you talking about? - What am I talking about?"
"188","00:10:06,608","00:10:09,235","మనం ఇక్కడికి వచ్చి ఐదు నిమిషాలు అయింది, అప్పుడే పేటన్ నీ ఉద్యోగి అయిపోయింది.","We've been here for five minutes, and Peyton is now your employee."
"189","00:10:09,277","00:10:10,278","ఇది చాలా విచిత్రంగా ఉంది.","That is very weird."
"190","00:10:10,362","00:10:14,282","ఇది నాకు విచిత్రం అనిపించడం లేదు, అలాగే పేటన్ కూడా అలాగ అనుకోవడం లేదు, కాబట్టి ఆడవాళ్లని నమ్మడం నేర్చుకో.","I don't think it's weird, and Peyton doesn't think it's weird, so maybe believe women."
"191","00:10:14,366","00:10:18,203","నువ్వు ఇంత తేలికగా మాట్లాడద్దు, నీకు చెబుతున్నాను. ఆ పదాన్ని ఊరికే అలా వాడేయకు.","Not the right use of that expression, FYI. Don't toss that around like that!"
"192","00:10:18,286","00:10:20,455","- ఎందుకు అరుస్తున్నావు? - తను నాకంటే చిన్నది అని నీ ఉద్దేశం.","- Why are you freaking out? - You think she's too young for me."
"193","00:10:20,497","00:10:22,290","ఆ ఆలోచన నాకు కనీసం తట్టనే లేదు.","That thought never even crossed my mind."
"194","00:10:22,374","00:10:24,254","తను ఈ శతాబ్దపు అమ్మాయి. నేను ఈ శతాబ్దపు వాడిని.","She's a millennial. I'm a millennial."
"195","00:10:24,334","00:10:27,879","మేము ఈ శతాబ్దపు రెండు అంచుల్లో ఉన్నాం, కానీ మేము ఇద్దరం ఈ కాలానికి చెందిన వాళ్లమే.","We are on different ends of the millennial spectrum, but we are both millennials."
"196","00:10:27,963","00:10:31,299","మేము రెండు అంచులలో ఉండే శతాబ్దపు మనుషులం, అది చాలా రొమాంటిక్ గా ఉంటుంది, అనుకుంటా.","We are bookend millennials, and that is very romantic, I think."
"197","00:10:31,383","00:10:32,884","జో బైడెన్ కూడా ఈ శతాబ్దపు మనిషే అని విన్నాను.","I hear Joe Biden's a millennial."
"198","00:10:32,926","00:10:37,138","మా వయసుల్లో తేడా అనేది పెద్ద విషయమే కాదు, సరేనా? మా మధ్య చాలా గాఢమైన అనుబంధం ఉంది.","Our age difference is not that big a deal, all right? We have a very deep connection."
"199","00:10:37,222","00:10:40,183","ఇంకా తను… నువ్వు గమనించావో లేదో కానీ, తను చాలా పాతకాలపు మనిషి.","And she... I don't know if you've noticed, but she's a very old soul."
"200","00:10:40,267","00:10:41,643","తను చాలా ముచ్చటగా ఉంది అనిపించింది.","I think she's adorable."
"201","00:10:41,685","00:10:45,063","తను బేబీసిట్టర్ అని చాలా స్పష్టంగా చెప్పింది. నాకు ఒక ఆయా కావాలి. అంతే!","She literally said she was a babysitter. I needed a babysitter. That was it!"
"202","00:10:45,146","00:10:47,732","నిజాయితీగా చెప్పాలంటే నేను అయోమయంలో ఉన్నాను. నువ్వు మంచిగా ఉండటానికే తనకి ఉద్యోగం ఇచ్చావా?","Now I'm honestly just very confused. Did you just hire her to be nice?"
"203","00:10:47,774","00:10:52,570","అవును! నాకు తను ముచ్చటగా, మంచిగా కనిపించింది, - ఇంకా సరదాగా కూడా ఉంది… - తను ముద్దుగా, మంచిగా ఉందని అనకు, సరేనా?","Yes! I-I think she's so cute and sweet, - and funny and... - Stop saying she's cute and sweet, okay?"
"204","00:10:52,612","00:10:53,821","- ఎందుకు? - తను ఆటపట్టించే బొమ్మ కాదు.","- Why? - She's not a troll doll."
"205","00:10:53,863","00:10:56,074","తను నా గర్ల్ ఫ్రెండ్, సరేనా? అది కాస్త ఇబ్బందిగా ఉంటుంది.","She's my girlfriend, all right? It's a little condescending."
"206","00:10:56,116","00:10:58,368","తను బాగుందని నాకు అనిపించింది. ఆమెకి ఉద్యోగం ""ఇవ్వద్దు"" అని నువ్వు అంటే…","I think she's great. But if you want me to ""unhire"" her..."
"207","00:10:58,410","00:11:01,121","వద్దు, ఎందుకంటే అది మరింత పిచ్చితనంగా ఉంటుంది, సరేనా?","No, 'cause now that would be even weirder, all right?"
"208","00:11:01,204","00:11:02,247","నీకు కొత్త ఆయా దొరికింది.","You have a new babysitter."
"209","00:11:02,330","00:11:03,748","- అభినందనలు. - సరే.","- Congratulations. - Okay."
"210","00:11:04,749","00:11:07,043","విందు కోసం బయటకు రావడం చాలా బాగుంది.","Oh, it's so nice to be out for dinner."
"211","00:11:07,544","00:11:13,008","చార్లీ వెళ్లి యాభై రెండు గంటలే అయింది, కానీ డైనో నగ్గెట్స్ ఇంకా ఫిష్ స్టిక్స్ ని తిని నాకు రోత పుట్టింది.","Charlie's only been gone for 52 hours, and I'm just so sick of eating dino nuggets and fish sticks."
"212","00:11:13,091","00:11:14,968","- లేదు. - లేదు.","- Mmm. No. - No."
"213","00:11:14,467","00:11:15,468","**[NO TELUGU MATCH FOUND]**","[phone buzzes]"
"214","00:11:16,428","00:11:20,098","పేటన్ నాకు చక్కని ఫోటోలు మెసేజ్ చేస్తునే ఉంటుంది. అది చాలా చిరాకు కలిగిస్తుంది.","Peyton keeps texting me the cutest photos. It's so annoying."
"215","00:11:20,181","00:11:23,351","- సైమన్ కి కొత్త గర్ల్ ఫ్రెండ్ దొరికింది. - నిజమా?","- Aw, Simon's got a girlfriend. Aw. - Right?"
"216","00:11:23,435","00:11:26,104","ఎనిమిదేళ్ల బాబుతోనూ, అలాగే నలభై ఏళ్ల వ్యక్తితోనూ తను ఒకేలా మాట్లాడగలుగుతుంది.","She really speaks to eight-year-old boys and 40-year-old men."
"217","00:11:26,146","00:11:27,346","మామూలుగా అయితే రెండూ ఒకటే కదా.","Basically the same thing."
"218","00:11:27,397","00:11:29,732","నాకు ఇంటికి వెళ్లాలి అనిపించడం లేదు. మనం ఇంకాస్త ఐస్ క్రీమ్ ఆర్డరు చేద్దామా?","I don't wanna go home. Should we order some more dessert?"
"219","00:11:29,774","00:11:31,985","మెన్యూలో ఉన్నవన్నీ మనం దాదాపు ఆర్డరు చేసేశాం.","We have had everything on the menu."
"220","00:11:32,068","00:11:34,905","సరే, కాస్త వైన్ లేదా, అంటే, చీజ్ ప్లేట్ గానీ తెప్పించుకుందాం.","Well, let's get some more wine or, like, a cheese plate."
"221","00:11:35,530","00:11:39,784","ప్లీజ్. నాకు ఇంటికి వెళ్లి, ఈ అమ్మాయితో మాట్లాడాలని లేదు.","Please, please. I don't want to have to go home and make conversation with this girl."
"222","00:11:39,868","00:11:40,702","అది ఒక శిక్ష.","It's a punish."
"223","00:11:40,785","00:11:43,538","నువ్వు ఒక పిచ్చి పరిస్థితిని సృష్టించుకున్నావు, ఇప్పుడు దాన్ని అనుభవించడం నీకు తప్పదు.","You made your weird bed, and now you have to lie in it."
"224","00:11:43,580","00:11:45,540","- నీకు జాలి లేదా? - లేనే లేదు.","- No sympathy? - None."
"225","00:11:49,002","00:11:50,462","- హేయ్. - హేయ్.","- Hey. - [Peyton] Hey."
"226","00:11:50,545","00:11:51,838","విందు ఎలా జరిగింది?","How was dinner?"
"227","00:11:51,922","00:11:55,258","చాలా బాగా జరిగింది. థాంక్యూ. అలా అడిగినందుకు ధన్యవాదాలు. పిల్లలు ఎలా ఉన్నారు?","Oh, it was really nice. Thank you. Thanks for asking. How were the kids?"
"228","00:11:55,342","00:11:59,971","చాలా ముద్దుగా ఉన్నారు. నిజంగా చాలా మంచి పిల్లలు. వాళ్లని నిద్రపుచ్చడం చాలా తేలిక.","- Ugh, so adorable. Seriously the sweetest. - Aw. So easy to put to sleep."
"229","00:12:00,055","00:12:03,099","సరే. చాలా థాంక్స్.","Aw, well… [sucks teeth] …thank you so much."
"230","00:12:03,183","00:12:05,393","- థాంక్యూ. - అవును.","- Thank you. [chuckles] - Yeah."
