"Index","Start Time","End Time","Telugu Text","Mapped English Text"
"231","00:12:05,477","00:12:11,691","ఓహ్, దేవుడా. ఈ వారం హడావుడి నా మీద ప్రభావం చూపిస్తున్నట్లుంది.","[yawns] Oh, my goodness. Think this week has just caught up with me. [sighs]"
"232","00:12:11,775","00:12:13,415","మనం మాట్లాడుకోవడానికి ఒక క్షణం టైమ్ ఉందా?","Do you have a second to talk?"
"233","00:12:14,319","00:12:16,239","అలాగే. ఓహ్, దేవుడా. నాకు అది అన్నింటికంటే ఇష్టం.","Yeah. Oh, God. I'd love nothing more."
"234","00:12:16,321","00:12:23,787","అయితే, నువ్వు ఇంకా విల్ చాలాకాలంగా స్నేహితులు, కదా?","- [chuckles, clears throat] - [chuckles] So, you and Will go way back, right?"
"235","00:12:23,870","00:12:27,499","మేము స్నేహితులం, అవును. మాకు పరిచయమై ఇరవై ఏళ్లు అయింది.","We do, yeah. Known each other for over 20 years."
"236","00:12:27,582","00:12:30,782","అతడిని అర్థం చేసుకోవడం కష్టం. అంటే, కొన్నిసార్లు ఏం జరుగుతుందో నాకు తెలియడం లేదు.","He's tough to read. Like, I don't know what's going on sometimes."
"237","00:12:30,835","00:12:32,045","**[NO TELUGU MATCH FOUND]**","Mmm."
"238","00:12:32,128","00:12:36,550","ఏది ఏమైనా, నా పుట్టినరోజు రాబోతోంది, ఇంకా అది కొద్దిగా పెద్ద వేడుక కాబోతోంది.","Anyways, I've got a birthday coming up, and it's kind of a big one."
"239","00:12:37,133","00:12:38,385","పెద్ద ఇరవై ఆరవ పుట్టినరోజు.","The big two-six."
"240","00:12:38,468","00:12:40,220","అభినందనలు.","Oh! Congratulations."
"241","00:12:40,303","00:12:42,138","నా స్నేహితులు నా కోసం పుట్టినరోజు పార్టీ ఇస్తున్నారు.","My friends are throwing me a birthday party."
"242","00:12:42,180","00:12:49,312","కానీ నేను ఆలోచిస్తున్నాను, నాకు తెలియదు, నేను ఒక రకంగా… - ఏంటి? నీకు ఏం కావాలి… - …విల్ ఆ పార్టీకి రావాలి.","And I was thinking, I don't know, I kinda… - What? You want... - …want Will to be there."
"243","00:12:50,146","00:12:52,524","- తను నా స్నేహితుల్ని కలుసుకోవాలి. - అలాగే.","- I want him to meet my friends. - Hmm. 'Course."
"244","00:12:52,607","00:12:55,402","ఏది ఏమైనా, ఆ పార్టీ థీమ్ వచ్చేసి యోలో. దాని అర్థం నీకు తెలుసా?","Anyways, the theme is YOLO. Do you know what that means?"
"245","00:12:55,485","00:13:00,031","- నాకు తెలుసు. - దాని అర్థం ""యూ ఓన్లీ లివ్ వన్స్"" అని. అది ఆసక్తికరంగా ఉంది. మంచి ఐడియా.","- I do. - It means ""you only live once."" Mmm. It's interesting. It's a good idea."
"246","00:13:00,115","00:13:02,284","- అందులో మొదటి అక్షరాలు కలిపితే యోలో. - అవును.","- It's the first letter of all those words. - I see."
"247","00:13:02,367","00:13:06,287","దాని అర్థం కేవలం అనుకున్నది చేసేయడమే, - ఎందుకంటే మనకి ఉండేది కేవలం ఒక్క జీవితమే. - అవును, నాకు అర్థం అయింది.","It means just going for it, - because you've only got this one life. - Yeah, I get it."
"248","00:13:06,329","00:13:08,999","అయితే, విల్ ఇందుకు ఇష్టపడతాడని అనుకుంటున్నావా?","So, do you think Will would be okay with that?"
"249","00:13:09,082","00:13:11,668","అంటే, నా పుట్టినరోజు పార్టీలో మా ప్రపంచాలు కలవాలి.","Like, merging our worlds at my birthday party."
"250","00:13:12,627","00:13:14,713","నేను… నువ్వు తననే అడగచ్చు కదా.","I... You could just ask him."
"251","00:13:16,047","00:13:17,424","అతను ఏం అంటాడు అనుకుంటున్నావు?","What do you think he's gonna say?"
"252","00:13:19,175","00:13:22,804","నాకు తెలియదు. నా ఉద్దేశం, తన విడాకుల గొడవ నుండి తను ఇప్పుడిప్పుడే ఇంకా కోలుకుంటున్నాడు అనుకుంటా.","I don't know. I mean, I think he's still getting himself together from the divorce."
"253","00:13:22,846","00:13:26,526","అతను కోలుకున్నట్లు పైకి కనిపిస్తున్నాడు కానీ, తన విడాకుల సమస్య అతడిని ఇంకా వెన్నాడుతునే ఉంది.","I know he seems like he's together, but he's still dealing with the fallout."
"254","00:13:26,808","00:13:30,395","ఆడ్రే పూర్తిగా మర్చిపోయింది. నా ఉద్దేశం, ఆమె ఇంకా స్కాగన్ నార్వే వెళ్లిపోయారు.","Audrey's totally moved on. I mean, her and Skaagn just went to Norway."
"255","00:13:31,187","00:13:33,690","ఏంటి? ఏంటి? వాళ్లు నీకు ఎలా తెలుసు?","What? What? How do you know them?"
"256","00:13:33,773","00:13:35,609","ఇన్ స్టాగ్రామ్. వాళ్లని ఫాలో అవుతాను.","- Instagram. I follow them. - Oh."
"257","00:13:39,946","00:13:42,115","ఆ అల్లికలు. నిజం.","Ugh, braids. Of course."
"258","00:13:42,198","00:13:44,367","నిజం కదా? చాలా స్పష్టంగా.","Right? So obvi."
"259","00:13:48,663","00:13:51,958","విల్ ఇప్పటికీ, అంటే, ఆమెని ప్రేమిస్తున్నాడు అంటావా?","Do you think Will's still, like, in love with her?"
"260","00:13:53,043","00:13:56,129","నేను… ఖచ్చితంగా ప్రేమించడు. కానీ తను ఇంకా కోలుకుంటున్నాడు అనుకుంటాను.","I... Absolutely not. But I do think he's still getting himself together."
"261","00:13:56,213","00:14:01,885","కాబట్టి, నీ పుట్టినరోజు పార్టీలో మీ ప్రపంచాలు కలుసుకోవడానికి అతను ఇష్టపడకపోతే, అది నీ మీద ఇష్టం లేక కాదు.","So, if he ends up not wanting to merge worlds at your party, it's got nothing to do with you."
"262","00:14:01,927","00:14:03,407","""ప్రపంచాలు కలుసుకోవడం"" అనేది బాగుంది.","""Merge worlds"" sounds cool."
"263","00:14:04,137","00:14:05,555","అవును.","[chuckles] Yeah."
"264","00:14:06,473","00:14:07,913","నేను ""యోలో"" తోనే పార్టీ చేసుకుంటాను.","I'm gonna stick with ""YOLO."""
"265","00:14:08,642","00:14:10,644","అది గొప్ప పార్టీ థీమ్.","It's a great... It's a great theme."
"266","00:14:11,686","00:14:14,356","సరే. అయితే, మళ్లీ థాంక్యూ.","Okay. Well, thank you again."
"267","00:14:14,439","00:14:16,149","- సరే. - థాంక్యూ.","- Sure. - Thank you."
"268","00:14:16,233","00:14:18,318","**[NO TELUGU MATCH FOUND]**","[slurping]"
"269","00:14:19,778","00:14:21,905","నీకు ఇందాక ఇక్కడ… ఇంటి ముందు కారు పార్క్ చేశావా?","And did you just... Did you get a spot at the front?"
"270","00:14:25,200","00:14:26,201","**[NO TELUGU MATCH FOUND]**","[buzzes]"
"271","00:14:29,371","00:14:31,248","**[NO TELUGU MATCH FOUND]**","[buzzing]"
"272","00:14:31,331","00:14:34,417","**[NO TELUGU MATCH FOUND]**","[sighing]"
"273","00:14:37,212","00:14:40,090","**[NO TELUGU MATCH FOUND]**","[knocking]"
"274","00:14:43,260","00:14:46,260","- మా పిల్లలు నిద్రపోతున్నారు. - సరే, చూడు, మనం వెంటనే మాట్లాడుకోవాలి…","- My children are sleeping. [shushes] - Okay, look, we need to talk right..."
"275","00:14:46,304","00:14:47,722","- మనం మాట్లాడాలి. - పెరటిలోకి పద.","- [whispering] We need to talk. - Backyard."
"276","00:14:47,764","00:14:48,932","సరే, మంచిది.","Okay, fine."
"277","00:14:51,351","00:14:52,435","సరే.","Okay."
"278","00:14:56,982","00:14:58,024","**[NO TELUGU MATCH FOUND]**","[sighs]"
"279","00:15:00,819","00:15:02,195","నాకు క్షమాపణలు చెప్పు.","I demand an apology."
"280","00:15:02,279","00:15:03,822","ఏంటి? నువ్వు ఏం మాట్లాడుతున్నావు?","What? What are you talking about?"
"281","00:15:03,905","00:15:09,869","ఎందుకంటే నేను ఇప్పటికీ ఆడ్రేతో ప్రేమలో ఉన్నానని నువ్వు పేటన్ కి చెప్పినందుకు. - సరే. నేను అలా చెప్పలేదు. - నువ్వు అలా చెప్పలేదా?","'Cause you told Peyton that I am still in love with Audrey. - [scoffs] Okay. Uh, I-I didn't. - You did not say that?"
"282","00:15:09,953","00:15:16,584","తను ఇందాకే మా ఇంటికి వచ్చి గొడవ చేసింది ఎందుకంటే నేను ఇప్పటికీ ఆడ్రేతో ప్రేమలో ఉన్నానని, ఇంకా నేను ""నిజమైన అనుబంధానికి"" సిద్ధంగా లేనని, నువ్వు చెప్పావని తను గొడవ పెడుతోంది.","- Mm-mmm. - She was just at my house freaking out 'cause she said that you said that I was still in love with Audrey, and I was not ready for a ""real relationship."""
"283","00:15:16,626","00:15:18,253","- నేను ఆ మాట అనలేదు. - నువ్వు అనలేదా?","- I didn't say that. - You didn't?"
"284","00:15:18,336","00:15:19,296","లేదు, నేను అనలేదు.","No, I didn't."
"285","00:15:19,379","00:15:27,304","నువ్వు తనని నీ జీవితంలోకి రానివ్వడానికి కాస్త సమయం తీసుకోవచ్చని చెప్పాను, ఎందుకంటే నువ్వు ఆ డైవోర్స్ నుండి ఇంకా కోలుకుంటున్నావు కాబట్టి, తనని ప్రేమించే విషయంలో దాని ప్రభావం ఏమీ ఉండదని చెప్పాను.","I said to her that you might need to take it slow, because you're still recovering from the divorce, but that's no reflection on how much you care for her."
"286","00:15:27,387","00:15:30,765","- నువ్వు అసలు ఇవన్నీ తనతో ఎందుకు చెబుతున్నావు? - ఎందుకంటే తను నేరుగా నన్ను అడిగింది.","- Why are you saying anything to her? - Because she asked me directly."
"287","00:15:30,849","00:15:32,893","నువ్వు మా అనుబంధాన్ని తక్కువ చేయాలని చూస్తున్నావు.","You are trying to undermine my relationship."
"288","00:15:32,976","00:15:34,895","నేను చేయడం లేదు.","I'm not. I'm not. [stammers]"
"289","00:15:34,978","00:15:38,481","- నాకు పేటన్ అంటే ఇష్టం. తను ముచ్చటగా ఉంది. తను… - మళ్లీ ఈ ""ముచ్చటగా ఉంది"" అనే చెత్త మొదలుపెట్టావు.","- I like Peyton. She's adorable. She's... - This ""adorable"" shit again."
"290","00:15:38,523","00:15:39,566","ఆ మాట అనడం ఆపు!","Stop saying that!"
"291","00:15:39,649","00:15:45,280","తను వయసులో నాకంటే చాలా చిన్నది అని నీ అభిప్రాయం, ఆ మాటని నా మొహం మీద చెప్పడానికి బదులు, తనని నీ ఇంట్లో ఆయాగా మార్చుకున్నావు.","You think that she's too young for me, and instead of just saying that to my face, you made her your babysitter."
"292","00:15:45,363","00:15:46,406","సరే, నువ్వు సరిగ్గానే చెప్పావు.","Okay, you're right."
"293","00:15:46,448","00:15:49,033","తను నీకంటే చాలా చిన్నది అనుకుంటాను, ఎందుకంటే తను నిజంగానే నీకంటే చాలా చిన్నది.","I do think she's too young for you, because she is too young for you."
"294","00:15:49,075","00:15:55,081","చాలామంది ఆడవాళ్లకి కోపం వస్తుంది ఎందుకంటే నీ వయస్సు మగవాడు అంత చిన్న ఆడపిల్లతో డేటింగ్ చేస్తున్నాడు కాబట్టి.","And a lot of women would get a little bit offended seeing this guy your age dating someone so much younger."
"295","00:15:55,165","00:15:58,960","సరే, అలాంటి ఆడవాళ్లకి నేను చెప్పేది ఏమిటంటే, నేను ఎవర్ని కలుసుకుంటానో అది నేను ఎంచుకోలేేను.","Well, what I would say to those women is that I don't have a choice who I meet."
"296","00:15:59,044","00:16:02,964","- నేను ఒక బార్టెండర్ ని. కుర్రాళ్లని కలుస్తాను. - ఏంటి? యువతని ఇంకెవరు కలుసుకుంటారో తెలుసా? కాలేజ్ ప్రొఫెసర్లు.","- I'm a bartender. I meet young people. - What? Oh, you know who else meets young people? College professors."
"297","00:16:03,006","00:16:04,883","బాయ్ స్కౌట్ ట్రూప్ లీడర్లు. మతాధికారులు.","Boy Scout troop leaders. Priests."
"298","00:16:04,966","00:16:08,720","- ఆ వ్యాఖ్యకి నేను తీవ్రంగా మనస్తాపం చెందుతున్నాను. - అది గొప్ప గ్రూప్.","- I take extreme umbrage at that comment. - It's a great group."
"299","00:16:08,803","00:16:11,473","నేను అత్యంత తీవ్రంగా మనస్తాపం చెందుతున్నాను.","- I take the most umbrage one can take. - Oh."
"300","00:16:11,556","00:16:13,099","నువ్వు నా విషయంలో చాలా ఏకపక్షంగా ఆలోచిస్తున్నావు.","You are being so judgmental of me."
"301","00:16:13,141","00:16:15,518","నిజంగానే ఏకపక్షంగా ఆలోచిస్తున్నాను, ఎందుకంటే ఇది ఘోరంగా ఉంది.","Of course I'm judgmental, because it's pathetic."
"302","00:16:15,560","00:16:19,773","మన మధ్య చాలా అందమైన, గాఢమైన, అర్థవంతమైన అనుబంధం ఉంది.","We have a very beautiful, deep, meaningful connection."
"303","00:16:19,856","00:16:20,940","సరే, అది… నీకు ఒక విషయం తెలుసా?","Okay, that... You know what?"
"304","00:16:20,982","00:16:23,818","నువ్వు ఎలా చెప్పినా సరే, విల్, నువ్వు ఆమెకన్నా చాలా పెద్దవాడివి. సరేనా?","No matter what you say, Will, you're too old for her. Okay?"
"305","00:16:23,902","00:16:33,078","సగటు అమెరికన్లకు 2.3 పిల్లలు ఉంటారన్న వాదనతో ఏకీభవించని ఏ విషయమైనా, తెల్ల కంచెతో ఇల్లు కలిగి ఉండే లైఫ్ స్టయిల్ లేకపోయినా… అది నీకు చిరాకు కలిగిస్తుంది, కాదంటావా?","You know, anything that doesn't conform to your 2.3 kids, white picket fence lifestyle really... R-really gets under your skin, doesn't it?"
"306","00:16:33,161","00:16:36,122","నాకు కొత్త ఉద్యోగం వచ్చినందుకు కనీసం అభినందించలేదు కానీ నాకు లెక్చర్ ఇవ్వడానికి నీకు ఎంత ధైర్యం.","How dare you lecture me when you haven't even said congratulations on my new job."
"307","00:16:36,164","00:16:37,874","ఒక్కటి కూడా వద్దు. ఒక్క ప్రశ్న కూడా అడగద్దు.","Not one. Not one single question."
"308","00:16:37,916","00:16:39,876","మళ్లీ ఉద్యోగానికి వెళ్లడం అనేది నాకు ఎంత పెద్ద విషయమో నీకు తెలుసు.","You know what a big deal it is for me to go back to work."
"309","00:16:39,918","00:16:42,170","నా సమస్యలలో నేను ఉన్నాను. కానీ ఇప్పుడు దాని గురించి కూడా ఆలోచించడం లేదు.","I'm dealing with my own shit. I don't give a fuck about that right now."
"310","00:16:42,212","00:16:44,088","అవును, నాకు నిజంగా చాలా స్పష్టత ఇచ్చావు, విల్. నాకు అర్థమైంది.","Yeah, you've made it really clear, Will. I get it."
"311","00:16:44,130","00:16:45,381","ఈ విషయంలో నా బుర్రని పాడు చేశావు.","You really got in my head about this."
"312","00:16:45,423","00:16:47,050","ఇప్పుడు నేను తనలో లోపం గురించే ఆలోచిస్తున్నా.","Now all I can think of is what's wrong with her."
"313","00:16:47,092","00:16:49,511","నువ్వు సంతోషంగా ఉండాలని మాత్రమే నేను కోరుకుంటాను, మూర్ఖపు వెధవా!","All I want is for you to end up happy, you fucking idiot!"
"314","00:16:49,553","00:16:51,679","సరే, నేను చాలా సంతోషంగా ఉన్నాను. కాబట్టి, కంగ్రాట్యులేషన్స్.","Well, I am fucking happy. So, congratulations."
"315","00:16:51,721","00:16:53,515","నేను నా జీవితంలో ఇంత సంతోషంగా ఎప్పుడూ లేను!","I've never been fucking happier in my life!"
"316","00:16:56,768","00:16:57,686","**[NO TELUGU MATCH FOUND]**","[groans]"
"317","00:16:58,186","00:16:59,586","ఓహ్, దేవుడా. నువ్వు బాగానే ఉన్నావా?","Oh, my God. Are you okay?"
"318","00:16:59,354","00:17:02,232","**[NO TELUGU MATCH FOUND]**","[groaning]"
"319","00:17:02,315","00:17:06,361","ఓహ్, లేదు.","- [Sylvia] Whoa. - [breathing heavily] [Sylvia] Oh, no. Oh."
"320","00:17:08,029","00:17:09,469","దీనికి ఎంత ఖర్చవుతుందో నాకు పంపించు.","Send me the invoice."
"321","00:17:11,491","00:17:13,367","నాన్నకి చాలా కోపం వస్తుంది.","Dad's gonna be pissed."
"322","00:17:14,243","00:17:15,684","నువ్వు ఎంతసేపటి నుండి ఇక్కడ ఉన్నావు?","How long have you been there?"
"323","00:17:34,973","00:17:36,224","**[NO TELUGU MATCH FOUND]**","[buzzes]"
"324","00:17:36,308","00:17:37,434","**[NO TELUGU MATCH FOUND]**","[door buzzes]"
"325","00:17:44,399","00:17:46,568","- నీకు ఏమైనా సాయం కావాలా? - పేటన్ ఇక్కడ ఉందా?","- Can I help you? - Is Peyton here?"
"326","00:17:46,651","00:17:49,404","హేయ్, పేటన్. నీ కోసం ఎవరో ఒకాయన వచ్చాడు.","Hey, Peyton. There's some guy here to see you."
"327","00:17:49,487","00:17:51,364","హేయ్. ఓహ్, దేవుడా. నీ ముఖానికి ఏం అయింది?","Hey. Oh, my God. What happened to your face?"
"328","00:17:51,448","00:17:53,867","నేను గాజు తలుపుకి గుద్దుకున్నాను.","I, uh, walked into a glass door."
"329","00:17:53,950","00:17:57,787","నేను బాగానే ఉన్నాను. చూడు, నీ పుట్టినరోజున అద్భుతమైన పార్టీని నీ కోసం ఇవ్వబోతున్నాను.","I'm fine. Look, I'm going to throw you the most epic birthday party ever."
"330","00:17:57,871","00:18:00,415","నేను లక్కీ పెన్నీని మూసేస్తాను. ఓపెన్ బార్ పెడతాను.","I'm gonna shut down Lucky Penny. Open bar."
"331","00:18:00,498","00:18:02,584","నీ స్నేహితులు అందరినీ ఆహ్వానించు. దుమ్ము రేపుదాం, సరేనా?","Invite all your friends. [stammers] We'll blow it out, okay?"
"332","00:18:02,626","00:18:05,211","నిజంగా అంటున్నావా? నువ్వు రెడీగా లేవని నిన్ను బలవంతం చేయాలి అనుకోలేదు.","Are you sure? I don't wanna force you to do something you're not ready to do."
"333","00:18:05,253","00:18:10,926","నేను రెడీగా ఉన్నాను. ఇది చేయడానికి సిద్ధంగా ఉన్నాను, సరేనా? ఐ లవ్ యూ. నా ఉద్దేశం అది కాదు.","I'm ready. I'm ready to do this, okay? I love you. [inhales sharply] I didn't mean to say that."
"334","00:18:11,009","00:18:13,762","- మరేం ఫర్వాలేదు. - అది పొరపాటు.","- It's fine. - That was a mistake."
"335","00:18:13,845","00:18:18,141","నా ఉద్దేశం అది కాదు. అది… అది నోరు జారింది. నేను… నేను…","Mmm, I didn't mean to say that. That w... That slipped out. I'm, uh... I..."
"336","00:18:18,225","00:18:20,894","- నేను నీ గురించి బాగా ఆలోచిస్తాను, కానీ నేను… - ఫర్వాలేదు.","- I... I care about you deeply, but I-I... - It's fine."
"337","00:18:20,977","00:18:22,437","నాకు పెళ్లయింది. మేము ""ఐ లవ్ యూ"" అంటుంటాం.","I was married. We say ""I love you"" a lot."
"338","00:18:22,479","00:18:24,397","- నేను దాన్ని అలా అనడం అలవాటు. - అవును. నాకు అర్థమైంది.","- I'm used to tossing it around. - Yeah. I get it."
"339","00:18:24,439","00:18:27,776","- ఆ మాట అనలేదని మనం నటించుదాం. - అద్భుతం! బహుశా ఏదో ఒక రోజు, చెప్పుకుందాం. మంచిది.","- We can just pretend that didn't happen. - Fantastic! Maybe one day, yeah. Great."
"340","00:18:27,859","00:18:32,656","సరే, థాంక్యూ. - అత్యుత్తమ పుట్టినరోజు పార్టీ. - అది చాలా సరదాగా ఉండబోతోంది. నిజం.","- Okay, thank you. [chuckles] - [chuckles] - Best birthday present ever. - It's gonna be so fun. [chuckles] Yeah."
"341","00:18:32,739","00:18:34,640","ఏంటి?","- Uh… - Yeah?"
"342","00:18:34,699","00:18:36,576","- ఒక ప్రశ్న. - అడుగు.","- [whispering] Question. - Yeah."
"343","00:18:37,661","00:18:40,330","నీ సోఫా మీద ఆ మనిషి, అతను ఎవరు?","This man on your couch, who is he?"
"344","00:18:40,413","00:18:42,999","అతను ఆలెన్. మా కొత్త రూమ్ మేట్.","That's Alan. He's our new roommate."
