"Index","Start Time","End Time","Telugu Text","Mapped English Text"
"1","00:00:11,972","00:00:15,267","నాకు తెలియడం లేదు. ఇది, అంటే… ఇది మరీ 2010 నాటిదిలా ఉందా?","I don't know. Is this, like... Is it too 2010?"
"2","00:00:15,350","00:00:16,893","నిజంగా, బేబీ, ఇది దుస్తులకు సంబంధించి కాదు.","Oh, seriously, babe, it is not the clothes."
"3","00:00:16,935","00:00:19,812","ఒక ఉద్యోగం ఇంటర్వ్యూలో అభ్యర్థి ఎలా డ్రెస్ చేసుకున్నారో ఎవ్వరూ పట్టించుకోరు.","Nobody cares how a person is dressed in a job interview."
"4","00:00:19,854","00:00:22,357","కర్క్ ఫ్రీడ్కిన్ కేవలం, నిన్ను కలవడానికే ఎక్కువ ఉత్సాహం చూపిస్తున్నాడు.","Kirk Friedkin is just, you know, excited to meet you."
"5","00:00:22,399","00:00:24,067","ఒక మగవాడు అది తేలికగానే చెప్పేయగలడు.","That's so easy for a man to say."
"6","00:00:24,150","00:00:26,694","- ఓహ్, బాబు. ఇప్పుడు ఆడజాతి గురించి పాఠాలు వినాలి. - అవును, నువ్వు వినాలి.","- Oh, boy. I'm about to get womansplained. - Yeah, you are."
"7","00:00:26,736","00:00:31,324","మా వస్త్రధారణ ఎంపికలో ప్రతీదీ క్షణ్ణంగా పరిశీలిస్తారు. మా షూస్ నుంచి లిప్ స్టిక్ వరకూ.","We get dissected for every wardrobe choice. From our shoes to our lipstick."
"8","00:00:31,408","00:00:34,202","ఇది ఎలా చెప్పాలంటే, ""స్థిరంగా ఉండాలి, కానీ మరీ స్థిరంగా కాదు.","This has to say ""assertive, but not too assertive."
"9","00:00:34,286","00:00:37,372","స్ట్రాంగ్ గా ఉండాలి, కాని మరీ స్ట్రాంగ్ గా కాదు. ఆత్మవిశ్వాసంతో ఉండాలి కానీ మరీ ఆత్మవిశ్వాసంతో కాదు.""","Strong but, not too strong. Confident, but not too confident."""
"10","00:00:37,414","00:00:38,248","ఈ డ్రెస్ అది చెబుతోందా?","Does this say that?"
"11","00:00:38,331","00:00:41,710","అవును. అది ఏం చెబుతోంది అంటే, ""యువ ఏంగెలా మెర్కెల్"" అంటోంది.","Yes. It says, ""young Angela Merkel."""
"12","00:00:41,793","00:00:42,877","- మరెప్పుడూ అలా అనకు. - ఇలా చూడు!","- Don't say that again. - Come on!"
"13","00:00:42,919","00:00:44,587","ఈ ప్రపంచంలోనే ఆమె అతి శక్తిమంతమైన మహిళ.","She is the most powerful woman in the world."
"14","00:00:44,629","00:00:46,464","నేను షాపింగ్ కి వెళ్తున్నా. నా దుస్తులన్నీ పాతవి అయిపోయాయి.","I'm going shopping. All my clothes are old."
"15","00:00:46,506","00:00:48,226","నువ్వు బెల్లా హదీద్ అని చెప్పి ఉండాల్సింది.","You should've said Bella Hadid."
"16","00:00:48,466","00:00:50,260","దేవుడా. ఇక్కడ ఎంత సేపటి నుండి నిలబడ్డావు?","Jesus. How long have you been standing there?"
"17","00:00:50,343","00:00:52,137","నాకు తెలియదు. కొద్ది సేపటి నుండి.","I don't know. A while."
"18","00:00:57,142","00:00:58,143","తను మరీ మౌనంగా ఉంటోంది.","She's too quiet."
"19","00:00:58,226","00:01:02,186","- ఏదో రోజు మనం శృంగారం చేస్తుండగా కూడా వచ్చేసేలా ఉంది. - నాకు తెలుసు. తనకి అలా చూడాలని ఉండచ్చు కూడా.","- She's gonna walk in on us one day. - I know. It's almost like she wants to."
"20","00:01:06,818","00:01:10,488","ఇది ఒక సూట్.","Hmm. It's a suit."
"21","00:01:11,072","00:01:12,115","నేను…","I..."
"22","00:01:12,198","00:01:13,283","అది మంచి విషయం.","That's a good thing."
"23","00:01:14,034","00:01:15,243","కాదా?","No?"
"24","00:01:16,745","00:01:18,622","సరే. ఇది కూడా ఒక సూట్.","Okay. That is also a suit."
"25","00:01:18,705","00:01:20,749","ఇది మరీ ఏంగెలా మెర్కెల్ లా ఉందా?","Is it too Angela Merkel?"
"26","00:01:20,832","00:01:21,833","పూర్తిగా.","Totally."
"27","00:01:22,959","00:01:23,960","ఆమె ఎవరు?","Who is that?"
"28","00:01:25,670","00:01:27,255","అది ఇబ్బందికరమైన ప్రశ్న, కదా? అదే సూట్ కదా?","This is a trick question, right? Same suit?"
"29","00:01:27,297","00:01:29,883","మిగతా వాటికన్నా దీని ధర నాలుగు రెట్లు ఎక్కువ.","This costs four times as much as the other ones."
"30","00:01:29,966","00:01:32,302","- అయితే, నువ్వు అదే కొనాలి. - కదా?","- Well, then you have to buy that one. - Right?"
"31","00:01:32,385","00:01:33,803","దీనితో పాటు షర్ట్ కూడా ఇస్తారా?","Does it come with the shirt?"
"32","00:01:38,516","00:01:40,185","ఇది అద్భుతంగా ఉంది, కదా?","It's amazing, right?"
"33","00:01:40,268","00:01:41,228","ఇది ఒక సూట్.","It's a suit."
"34","00:01:42,354","00:01:43,514","నేను అలా అనిపించుకోవాల్సిందే.","I deserve that."
"35","00:01:45,106","00:01:46,107","సారీ.","I'm sorry."
"36","00:01:49,736","00:01:51,696","టోబీ, ఫ్రీడ్కిన్, క్వాంగ్ అండ్ జెల్మన్ న్యాయవాదులు","**[NO ENGLISH MATCH FOUND]**"
"37","00:01:55,951","00:01:56,952","**[NO TELUGU MATCH FOUND]**","[sighs]"
"38","00:01:57,035","00:01:58,870","మెర్కెల్ ఏకాభిప్రాయం ఎప్పటికీ కొనసాగుతుంది","**[NO ENGLISH MATCH FOUND]**"
"39","00:02:05,544","00:02:07,003","సిల్వియా గ్రీవ్స్?","Sylvia Greeves?"
"40","00:02:07,087","00:02:08,086","అవును.","Yes."
"41","00:02:10,549","00:02:12,092","- ఈ వైపు రండి. - హాయ్.","- [receptionist] Right this way. - Hi."
"42","00:02:12,175","00:02:13,718","- మిమ్మల్ని కలవడం సంతోషంగా ఉంది. - మిమ్మల్ని కూడా.","- Nice to meet you. - You too."
"43","00:02:13,760","00:02:15,929","మీరు ఇక్కడ ఎంతకాలం నుండి పని చేస్తున్నారు?","And how long have you been working here?"
"44","00:02:16,012","00:02:17,847","**[NO TELUGU MATCH FOUND]**","[""Work Bitch"" playing]"
"45","00:02:28,900","00:02:30,944","యోలో","**[NO ENGLISH MATCH FOUND]**"
"46","00:02:31,027","00:02:32,654","**[NO TELUGU MATCH FOUND]**","[phone ringing]"
"47","00:02:33,154","00:02:34,989","ఓహ్, దేవుడా. కర్క్ ఫ్రీడ్కిన్ ఫోన్ చేస్తున్నాడు.","Oh, my God. It's Kirk Friedkin."
"48","00:02:35,031","00:02:36,658","- మాట్లాడు. - నాకు చాలా భయంగా ఉంది.","- Answer it. - I'm too scared."
"49","00:02:36,741","00:02:38,118","ఫోన్ మాట్లాడు.","Pick it up."
"50","00:02:38,201","00:02:41,321","హలో, సిల్వియా గ్రీవ్స్ మాట్లాడుతున్నాను. మీరు ఎవరితో మాట్లాడాలి అనుకుంటున్నారు?","Hello, Sylvia Greeves speaking. How may I direct your call?"
"51","00:02:43,123","00:02:47,627","ఓహ్, అవును. హలో, కర్క్. మిమ్మల్ని కలవడం… మీ మాట వినడం సంతోషంగా ఉంది. మీ మాట వినడం గొప్పగా ఉంది.","Oh, yes. Hello, Kirk. Nice to see... hear from you. Um, great to hear your voice."
"52","00:02:50,338","00:02:54,801","వావ్! ఇది చాలా థ్రిల్లింగ్ గా ఉంది. నేను పూర్తిగా…","Oh, wow! That's so thrilling. I'm absolutely..."
"53","00:02:54,885","00:02:57,428","చాలా ధన్యవాదాలు. వచ్చే వారం నుంచి మీతో కలిసి పని చేయడానికి నేను సిద్ధంగా ఉన్నాను.","Thank you so much. I can't wait to work with you next week."
"54","00:02:57,470","00:02:59,180","సరే. ఆల్ ద బెస్ట్.","[chuckling] Okay. All the best."
"55","00:03:01,141","00:03:05,103","- నాకు ఉద్యోగం వచ్చింది! - కంగ్రాట్యులేషన్స్!","- I got the job! I got the job! - [screams] Oh! Congratulations!"
"56","00:03:05,186","00:03:07,439","- నిన్ను చూసి చాలా గర్వపడుతున్నాను. - థాంక్యూ!","- I'm so proud of you! - [chuckles] Thank you!"
"57","00:03:07,522","00:03:11,776","నాకు చాలా అసూయగా ఉంది. నువ్వు ప్రయత్నించే ముందే ఉద్యోగం రావడం అనేది గొప్ప విషయం.","I'm so jealous. The best part of getting a job is the time right before you start."
"58","00:03:11,860","00:03:15,113","ఉద్యోగం కోసం నువ్వు ఆందోళన చెందాల్సిన అవసరం లేదు, కానీ నిజానికి నీకు ఉద్యోగం కూడా అవసరం లేదు.","You don't have the stress of getting it, but you don't have to actually do the job."
"59","00:03:15,155","00:03:18,491","కానీ, నేను ఇంకా అందులో చేరలేదు. నేను చేరడానికి ముందు చాలా పనులు పూర్తి చేయాలి.","Well, I'm not there yet. I have so much to organize before I even start work."
"60","00:03:18,575","00:03:23,329","పిల్లల్ని చూసుకోవడానికి, వాళ్లని స్కూళ్లలో దింపడానికి నేను ఎవర్నయినా వెతకాలి, స్కూలులో జరిగే ఇతరత్రా శిక్షణల్లో పిల్లల్ని చేర్చించాలి, తెలుసా?","I have to find someone to look after the kids, drive them around and sign them up for every after school thing, you know?"
"61","00:03:23,371","00:03:24,456","ఇదంతా పెద్ద మార్పు.","It's a big transition."
"62","00:03:24,539","00:03:25,957","ఏంటి?","- [gasps] - What?"
"63","00:03:26,041","00:03:30,503","ఆఫీస్ అమ్మల కోసం నువ్వు నన్ను వదిలేస్తున్నావు, - ఎందుకంటే నువ్వు కూడా వాళ్లల్లో ఒకర్తివి. - అలా మాట్లాడకు. నేను ఎప్పటికీ నిన్ను వదలను.","You're gonna leave me for the office moms, - 'cause you'll be one of them. - Oh! How dare you. I would never."
"64","00:03:30,545","00:03:32,797","- నా స్నేహాన్ని వదిలేశావంటే… - ఇది తీసుకో.","- If you break up with me… - Here we go."
"65","00:03:32,881","00:03:41,640","…నేను హెరాయిన్ కి బానిసగా మారిపోతాను. ఒక పాడుబడిన ఇంటిలో చల్లని, మురికి నేల మీద పడి ఉన్న నన్ను చూస్తావు, - అదంతా టాకో బెల్ కాగితాలు చెల్లాచెదురై ఉంటాయి. - టాకో బెల్.","- …I will end up on heroin. - [gasps] You will find me lying in a shelled-out building… - Mm-hmm. - …on a cold, dirty floor, - covered in Taco Bell wrappers. - Ooh, Taco Bell."
"66","00:03:41,723","00:03:44,017","- ఈ కథ సుఖాంతం అయింది. - అది అలాగే అవుతుంది.","This story has a happy ending. - Oh, I guess it does. - Mmm."
"67","00:03:48,188","00:03:55,487","- హలో? - హలో. నేను డ్రాక్యులాని. నీతో శృంగారం కోసం వచ్చాను.","- [intercom buzzes] - Hello? [imitates Dracula] Hello. This is Dracula. I'm here for a booty call."
"68","00:03:55,570","00:03:56,863","అవసరం లేదు, థాంక్స్.","Um, no, thanks."
"69","00:03:56,947","00:04:00,533","నిజంగా డ్రాక్యులాని కాను. నేను విల్. జీవితం ఎలా నడుస్తోంది? నన్ను లోపలికి రానిస్తావా?","[normal voice] Not actually Dracula. It's Will. How's it going? Wanna, uh, buzz me in?"
"70","00:04:00,617","00:04:02,493","నిన్ను కలవడానికి ప్రస్తుతం నేను అంత ఉత్సాహంగా ఏమీ లేను.","I'm not super psyched to see you right now."
"71","00:04:02,535","00:04:09,042","- ఎందుకని? - బహుశా ఇది ప్రమాద సంకేతం కావచ్చు: మన మధ్య సంబంధం ""ఏమీ లేదు"", ""కనీసం పేరు చెప్పడానికి కూడా పనికి రాను"" అన్నావట.","- Why not? - Maybe this rings a bell: Our relationship is ""nothing,"" and I'm ""not even worth mentioning."""
"72","00:04:09,125","00:04:10,251","అలా అన్నానని నీకు ఎవరు చెప్పారు?","Who told you I said that?"
"73","00:04:10,293","00:04:13,129","నాకు ఒమర్ స్నేహితుడు. అతని కోసమే నేను నీ బార్ కి మొదట్లో వచ్చాను.","I'm friends with Omar. That's why I was at your bar in the first place."
"74","00:04:13,213","00:04:15,215","మీ స్నేహితులు అందరి ముందు నువ్వు నా గురించి అలాగేనా మాట్లాడేది?","Is that how you talk about me with all your friends?"
"75","00:04:15,257","00:04:18,257","లేదు, నేను నిన్ను ఎంత ఇష్టపడతానో, నీ గురించి ఎంత ఆలోచిస్తానో నా మిత్రులకి తెలుసు.","No, my friends know how much I like you and how much I care about you."
"76","00:04:18,300","00:04:20,720","- అది కేవలం ఒక విచిత్రమైన రాత్రి. - ఎలాంటి విచిత్రం?","- It was just a weird night. - Weird how?"
"77","00:04:20,803","00:04:26,309","విచిత్రం ఎందుకంటే నా ఫ్రెండ్ అక్కడికి వచ్చింది, ఇంకా ఆమె నిజంగా చాలా హింస పెడుతుంది, అందుకే నేను తనకి మన విషయం చెప్పలేదు.","Weird in that my f-friend was there, and she's a pain in the ass, and I... I hadn't told her about you yet."
"78","00:04:26,393","00:04:27,310","ఆమెనా?","Her?"
"79","00:04:27,394","00:04:30,981","అవును, నా స్నేహితురాలు సిల్వియా. తను నా పాత మిత్రురాలు.","Yeah, my friend Sylvia. [stammers] She's an old friend."
"80","00:04:31,064","00:04:33,608","తనకి పెళ్లయి సంతోషంగా ఉంది. ముగ్గురు పిల్లలు కూడా ఉన్నారు. సరేనా?","She's happily married. She has three children. Okay?"
"81","00:04:33,650","00:04:35,527","వావ్, తను నిజంగా చాలా అందంగా ఉంది.","Wow, she's really pretty."
"82","00:04:35,610","00:04:37,320","- ఆ విషయం నీకు ఎలా తెలుసు? - నేను ఆమె ఇన్ స్టాలో ఉన్నాను.","- How do you know that? - I'm on her Insta."
"83","00:04:37,362","00:04:38,947","ఇప్పటికేనా? అలా ఎలా చేశావు?","Already? How did you do that?"
"84","00:04:39,030","00:04:40,031","తను ఒక మోడల్ లా ఉంటుంది.","She looks like a model."
"85","00:04:40,115","00:04:43,395","చూడు, నేను లోపలికి రావచ్చా, అప్పుడు మనం ఈ విషయం గురించి కలిసి మాట్లాడుకుందామా? హలో?","Look, can I come in and we can just talk about this in person? Hello?"
"86","00:04:43,827","00:04:44,828","హలో?","Hello?"
"87","00:04:44,911","00:04:47,163","**[NO TELUGU MATCH FOUND]**","[intercom buzzing]"
"88","00:04:56,756","00:04:58,717","బై. బై.","Bye. Oh, bye."
"89","00:04:58,800","00:05:00,176","- ఉంటాను. ప్రయాణం బాగా జరగాలి, బేబీ. - అలాగే.","- Bye. Have a great trip, babe. - I will."
"90","00:05:00,218","00:05:01,636","- ఐ లవ్ యూ. - ఉంటాను.","- I love you. - Bye."
"91","00:05:01,720","00:05:02,762","ఉంటాను, డాడీ.","Bye, Daddy."
"92","00:05:02,762","00:05:06,600","జెసిపాకి మరీ ఎక్కువ ఆలుగడ్డలు పెట్టకు, దానికి మలబద్ధకం పెరగచ్చు.","Oh, don't give Jessipa too much sweet potato. It tends to back her up."
"93","00:05:06,683","00:05:07,642","సరదాగా గడుపు!","Have fun!"
"94","00:05:07,726","00:05:09,519","మారియట్ హోటల్ గదుల్లో ఎవరు రచ్చ చేయబోతున్నారు?","Who's ready to rock the Marriott Suites?"
"95","00:05:09,561","00:05:13,940","సరే. కంగారు పడద్దు. వీళ్లని చూసుకోవడానికి నేను ఉన్నాను. ఈ ట్రిప్పులో ఒక పెద్దమనిషిని నేను ఉన్నాను.","All right. Don't worry. I'm here to chaperone. There's one adult on the trip."
"96","00:05:14,524","00:05:18,236","ఇది వినడానికి ఆనందంగా ఉంది. నువ్వు భలే నవ్విస్తావు!","Glad to hear it. [laughs] You're hilarious!"
"97","00:05:18,320","00:05:20,030","అది జోక్ కాదు.","[chuckles] That was not a joke."
"98","00:05:21,740","00:05:28,486","నేను మళ్లీ పనిలో పడుతున్న సందర్భంలో పిల్లల్ని తీసుకురావడం, మధ్యాహ్నాలు వాళ్లని చూసుకోవడం కోసం నువ్వు సాయం చేస్తాను అనడం ద్వారా నాకు ఎంత మేలు చేస్తున్నావో నీకు చెప్పలేను.","I can't tell you how much it means that you're gonna help out with pick-ups and afternoons, just while I get back into the work swing of the things."
"99","00:05:28,538","00:05:30,582","నాయనమ్మలు ఉండేది అందుకే కదా. అవునా, మేవీ?","Oh, that's what Nana's here for. Right, Maevy?"
"100","00:05:30,665","00:05:32,083","ఇంకా మనం ఎంతో మంచిగా గడుపుదాం.","And we're gonna have such a good time."
"101","00:05:32,125","00:05:36,254","రాత్రి భోజనాలకి ముందు సాధారణంగా మేము ఇంత చక్కెర పదార్థం తినము.","We actually don't usually have this much sugar before dinner. [chuckles]"
"102","00:05:36,338","00:05:39,799","ఇది తనకి మూడో లాలిపాప్. కానీ, ప్రత్యేక సందర్భాలలో మాత్రమే ఇస్తాం.","That's her third lollipop. But, uh, you know, just on special occasions."
"103","00:05:39,883","00:05:43,595","సరే, ప్రతి రోజు ఒక ప్రత్యేక సందర్భమే. అవును కదా?","Well, every day's about to be a special occasion. Isn't it? [chuckles]"
"104","00:05:43,678","00:05:45,263","అవును, కానీ తన పళ్లు పాడవుతాయనే మా ఆందోళన.","Yeah, we're just worried about her teeth."
"105","00:05:45,305","00:05:51,061","కానీ వాళ్లని మధ్యాహ్నం మూడు గంటలకి తీసుకురావాలి, కానీ కార్ పూల్ లైను 2:55 వరకూ మొదలు కాదు.","But, um, pick-up is 3:00 p.m., but the carpool line doesn't start until 2:55."
"106","00:05:51,144","00:05:58,568","ఇది నేను అసలైన రొయ్యలతో చేసిన పయెల్లా వంటకం. ఒక కిరాణా దుకాణంలో ఇతను నటుడు, సినీ దర్శకుడు లిన్-మాన్యుయెల్ మిరండా.అతను చాలా మర్యాదగా ఉంటాడు.","[gasps] This is a paella I made with real shrimp. Oh, and this is Lin-Manuel Miranda in the grocery store. He-He's very polite."
"107","00:05:58,652","00:06:05,825","ఇంకా కిండర్ లైమ్ అనే యాప్ లో నేను పొందుపర్చిన సైన్ అవుట్ కోడ్ ఏమిటంటే, అది 6235-గ్రీవ్స్ అండ్.","And the sign-out code I mentioned on the app, Kinderlime, is 6235-Greeves&."
"108","00:06:05,909","00:06:11,248","ఇంకా ఫ్రాన్సిస్ కి విడిగా సైన్ అవుట్ కోడ్ ఉంది, అది అకెపెల్లా బృందగానం రిహార్సల్ కోసం.","And there's a separate sign-out code for, um, Frances, for the a cappella choir rehearsal."
"109","00:06:11,331","00:06:16,753","ఇది ఒక చూడచక్కని స్ట్రా టోపీ, దీన్ని మనం సూట్ కేస్ లో పెట్టేయచ్చు, అది తెరవగానే ఈ టోపీ మళ్లీ తిరిగి చక్కగా పైకి వచ్చేస్తుంది.","And this is a fabulous straw hat you can pack in a suitcase, and it just pops right back."
"110","00:06:16,795","00:06:18,547","నువ్వు ఇవన్నీ రాసుకుంటావా, మార్లా?","Are you gonna write this down, Marla?"
"111","00:06:18,630","00:06:20,340","లేదా ఇవన్నీ నీకు ఈమెయిల్ ద్వారా పంపించమంటావా?","Or do you want me to send it to you in an e-mail?"
"112","00:06:20,382","00:06:30,183","అమ్మ భలే కంగారు మనిషి! విల్ జిస్మన్ దయచేసి జవాబు ఇవ్వు సరే. నేను ఒక క్షణంలో తిరిగి వస్తాను. - ఓహ్, దేవుడా. - సరే. ఏంటి సంగతి? నువ్వు చనిపోయావా?","- Mommy is such a worrier! - [phone buzzes] - Okay. Um, I'll be... I'll be one second. - [phone buzzes] - Oh, my God. - Yeah. What is it? Are you dead?"
"113","00:06:30,267","00:06:32,769","హేయ్! లేదు, నా గర్ల్ ఫ్రెండ్ ని కలుసుకోవాలని అనుకున్నావు కదా?","Hey! No, you know how you wanted, uh, to meet my girlfriend?"
"114","00:06:32,852","00:06:34,187","- నువ్వు వచ్చి తనని కలుస్తావా? - ఇప్పుడా?","- Can you come meet her now? - Now?"
"115","00:06:34,229","00:06:35,855","అవును. నువ్వు ఎంత వేగంగా బార్ దగ్గరకి రాగలవు?","Yeah. How fast can you get to the bar?"
"116","00:06:35,897","00:06:37,398","నేను చాలా బిజీగా ఉన్నాను. నిజంగా సారీ.","I'm really busy. I'm really sorry."
"117","00:06:37,440","00:06:40,110","చార్లీ ఇందాకే టూర్ కి వెళ్లాడు. మా అత్తమ్మ ఇక్కడికి వచ్చింది.","Charlie just left on a trip. My mother-in-law is here."
