"Index","Telugu Text","Mapped English Text"
"1","బేబీ, నువ్వు వ్యాపార భాగస్వామివి అయ్యావు.","Baby, you made partner."
"2","మనం రిట్రీట్ వేడుకలో పాల్గొంటే తప్ప భాగస్వామి అయ్యామన్న ఫీలింగ్ ఉండదని కొందరు అంటారు. ఇంతకుముందు అది వినలేదు.","They say you don't feel like a partner until you've been to the retreat. I've never heard that before."
"3","అయితే, అది నేనే కల్పించా, ఇప్పుడు వ్యాపార భాగస్వామిని కాబట్టి ఆ పని చేయగలను.","Well, I just made it up, but I can do that now because I'm a partner."
"4","నీ నుంచి వెలువడుతున్న పవర్ చూస్తుంటే నాలో శృంగారభావన కలుగుతోంది.","[sighs] The power emanating from you is really turning me on."
"5","అవును, నాలో కూడా ఆ భావన కలుగుతోంది. అవును.","Yeah, it's turning me on too. Yeah."
"6","హేయ్, నా ఐడి కార్డు పట్టీ ఇస్తావా? నీ పట్టీ.","Hey, , why don't you get my lanyard? Ooh, your lanyard."
"7","థాంక్యూ.","Thank you."
"8","ఇదిగో వేసుకో. వావ్.","[clicks tongue] Ooh, there it is. Wow."
"9","ఇది చూడు. నీకు క్యూ.ఆర్. కోడ్ ఉంది.","[sighs] Look at that. You got a QR code."
"10","పూర్తి షెడ్యూల్ కోసం నేను ఆ క్యూ.ఆర్. కోడ్ ని స్కాన్ చేయాలి. నేను నిన్ను ప్రేమగా స్కాన్ చేస్తాను. వావ్.","I gotta scan that QR code for the full schedule. , yeah. I'm gonna scan your ass. [chuckles] , wow. [sighs]"
"12","నువ్వు ఎప్పుడూ కలగన్నది ఇదేనా?","Is this everything you ever dreamed of?"
"13","అవును, ఇంత కన్నా తక్కువే, అది నిజం కావాలని ఊహించుకున్నాను.","Yes, but even blander, if that's possible."
"14","సిల్వియా. ఓహ్, దేవుడా. హాయ్. హేయ్, స్టివర్ట్, నిన్ను కలవడం సంతోషంగా ఉంది.","Sylvia. , my God. , hi. Hey, Stewart, nice to see you."
"15","నువ్వు రావడం సంతోషం. ఇప్పుడు ఈ వేడుక అంత బోర్ కొట్టదు. అది నీ అభిమానం.","[chuckles] I'm so glad you're here. It's gonna be so much less boring. Aw, you're so sweet."
"16","కానీ, వసతితో పాటు సెలవుని ఇచ్చినందుకు, ఈ భాగస్వాముల వేడుకలో మొదటి వరుస సీటు ఇచ్చినందుకు మాకు చాలా ఆనందంగా ఉంది.","Well, we're very excited for our staycation, and me for my front-row seat of the partners' orgy."
"17","ఈ వేడుక ఒక రహస్యంగా ఉండాలి. అది నా పొరపాటే. చీజ్ వంటకాలు, హలో.","The orgy is supposed to be a secret. My bad. Cheese platter, hello."
"18","ఆ ఫ్లోరెసెంట్ ఆకుపచ్చ క్యూబ్స్ ని సిఫార్సు చేయవచ్చా?","May I recommend the florescent green cubes?"
"19","వాటి రుచి అమోఘంగా ఉంటుంది.","They taste like nothing."
"20","ఫ్రాంక్ షేఫర్, అతని ఉపన్యాసాలు అనంతం. ప్రధాన వక్త ఫ్రాంక్ షేఫర్","[sighs] Frank Schaeffer, his speeches are endless."
"21","మనల్ని బందీలుగా చేసి తన గోల్ఫ్ విజయగాథల్ని వినిపించడం కోసమో అతను ఈ సంస్థని స్థాపించాడని నాకు అనిపిస్తుంది.","I think he founded the firm so he can hold us all hostage with his golf stories."
"22","దేవుడా. ఈ మనిషి. ఇతనిని ఓ డజను సార్లు కలిశాను.",", my God. That guy. I've met him a dozen times."
"23","అతను నా పేరుని గుర్తుంచుకోడు. ఒక్కసారి కూడా.","He never remembers my name. Not once."
"24","ఎవరి పేరునీ అతను గుర్తుంచుకోడు.","Never remembers anybody's name."
"25","సక్సెస్ అయిన వాళ్లకి అదొక వరం.","It's one of the perks of being successful."
"26","నేను ఎవరి పేర్లనీ గుర్తుంచుకోలేనంత సక్సెస్ సాధించాలని తహతహలాడుతున్నాను.","I cannot wait to be successful enough that I don't have to remember the names."
"27","హేయ్, హేయ్, హేయ్. ఈ షోకి స్వాగతం, కొత్త భాగస్వామి.","Hey, hey, hey. Welcome to the show, newbie. [laughs]"
"28","హేయ్. అవును. హేయ్, కొత్త భాగస్వామి.","Hey. [laughs] Yeah. Hey, newbie. [laughing]"
"29","అభినందనలు, భాగస్వామి. అది కౌబాయ్ యాస. ఆ యాసని చాలా బాగా అన్నారు. సిల్వియా, మీది ఆస్ట్రేలియా కదా.","[laughing] Congratulations, partner. That was a cowboy accent. , and a fine one at that. [chuckles] Sylvia, you're from Australia."
"30","కౌబాయ్ ల గురించి నీకు ఏం తెలుసు?","What do you know about cowboys?"
"31","హేయ్, డ్యూపాంట్ నుండి మిల్టన్ ని తప్పించడం గురించి మీరు విన్నారా?",", hey, did you guys hear that Milton got taken off Dupont?"
"32","ఏంటి?","What?"
"33","ఆగండి, స్వారెజ్ తో చేసే లావాదేవీలన్నీ మిల్టన్ చూసేవాడు కదా. ఒకప్పుడు చూసేవాడు. ఇంక చూడటం లేదు.","Wait, Milton was running point on everything to do with Suarez. , he was. Not anymore. [chuckles]"
"34","సారీ, మనం ఈ విషయాన్ని మొదట నుంచి మాట్లాడుకోవాలి.","Sorry, we're gonna have to take this from the top."
"35","ఇంఛార్జ్ ఎవరు? డ్యూపాంట్ లో నేను చాలా కాలం పని చేశాను.","Who's in charge? I've done wh A ton of work on Dupont."
"36","సరే, మొదటగా, అతను స్వచ్ఛందంగా తప్పుకున్నాడు.","Okay, it was a mandatory withdrawal, first of all."
"37","ఆ తరువాత విచారణ మొదలైంది అవును. స్వచ్ఛందంగా తప్పుకున్నాడా?","But then trail Yes. Mandatory withdrawal?"
"38","హాయ్, నా పేరు మార్జొరీ, ఆల్బర్ట్ భార్యని. హాయ్.","Hi, I'm Marjorie, Albert's wife. , hi."
"39","నా పేరు గ్రెగ్, డాన్ భర్తని. మిమ్మల్ని కలవడం సంతోషం. సంతోషం.","Greg, Dan's husband. , nice to meet you. [chuckles] Nice to meet you."
"40","నేను సిల్వియా. చార్లీ భార్యని.","Sylvia. I'm Charlie's wife."
"44","అది ఒక ఘోరమైన ఘటన.","[Albert] It's a disaster."
"45","ఆ సంఘటన విచారణలో ఉంది. రిలాక్స్.","[Albert] It's the event trial right now. [Rachel] Relax."
"46","జెంటిల్మెన్, సరదాగా గడుపుతున్నారు. హేయ్, ఫ్రాంక్. నీ స్పీచ్ ఎలా వచ్చింది?","Gentlemen, playing through. [laughing] , hey, Frank. How's the speech coming?"
"47","అది ఎలా వచ్చింది? నిదానంగా ఉంది.","[Tasmin] how's it coming? , slow."
"48","అది ముగించడం కోసం మనం ఈ మధ్యాహ్నం కార్యక్రమాలన్నీ ఎగగొట్టాలి అనుకుంటా. ఎవరు పట్టించుకుంటారు?","We're gonna have to skip all the afternoon sessions to finish the damn thing. But who cares?"
"49","కొంతమంది లాయర్లు బార్ లోకి వెళ్లడానికి ఎదురు చూస్తుంటారు. నేను చెప్పింది నిజమే కదా? సారీ. మరేం ఫర్వాలేదు. ఏదో మంచికే అయింది.","It's a bunch of lawyers just waiting to get to the bar. Am I right? , I'm sorry. [chuckles] , it's okay. It's probably for the best. [stammers]"
"50","ఫ్రాంక్ షేఫర్.","Frank Schaeffer."
"51","సిల్వియా గ్రీవ్స్. అవును. మనం గతంలో కొన్నిసార్లు కలిశాం.","Sylvia Grieves. Yeah. We've actually met before a few times."
"52","మన్నించాలి. నేను పేర్లని గుర్తుంచుకోవడంలో ఘోరంగా ఉంటాను.",", forgive me. I'm terrible with names. [laughs]"
"53","లేదు, నేను మీకు అనవసరంగా ఇబ్బంది కలిగిస్తున్నాను. ఊరికే అంటున్నాను. మిమ్మల్ని కలవడం సంతోషం.","No, I'm just giving you a hard time. Just kidding. [laughs] Nice to see you."
"54","ప్రొసెకో? అవును.","Prosecco? Yes."
"55","ఒక నిమిషం ఆగు. నువ్వు మెజ్జలూనాలో పని చేసేవాడివా?","Wait a minute. Did you use to work at Mezzaluna?"
"56","మూడు సంవత్సరాల కిందట.","Three years ago."
"57","ఆగు. ఒహాయో నుంచి వచ్చిన కెనెత్ కదా.","Wait. Kenneth from Ohio."
"58","అవును. ఓహ్, దేవుడా. నేను సరిగ్గా చెప్పానా? సరిగ్గా చెప్పానా?","Yes. , my God. [chuckles] Am I right? Am I right?"
"59","ఇది ఒక వరం. సరే, ఇంక తాగుదాం.","It's a gift. All right, let's drink."
"64","అప్పుడు నేను మా ఆంటీ వాళ్ల అపార్టుమెంట్ లో నా కజిన్స్ తో పాటు ఉన్నాను, ఇంకా మా ఆంటీ ఒక పక్క వంట చేస్తోంది.","So I'm at my aunt's apartment with my cousins, and my aunt's cooking dinner."
"65","నాకు ఇష్టమైన వంటకాలు. ఏడు పొరల డిప్ వంటకం.","My favorite kind of dinner. Seven-layer dip."
"66","అప్పుడు ఎవరు వచ్చారో తెలుసా?","And guess who walks in?"
"67","నువ్వు ఎప్పటికీ ఊహించలేవు, ఎందుకంటే అతను ఎవరో నీకు తెలియదు.","I don't think you're ever gonna guess, 'cause you don't know him."
"68","అప్పుడు అతను ఏం అన్నాడంటే, ""మనం హై స్కూల్ తరువాత ఒకరినొకరం కలుసుకోలేదు కాబట్టి, దాని అర్థం మనం ఇంక ఫ్రెండ్స్ కాదని కాదు.""","Then he's like, ""Just because we haven't seen each other since high school, doesn't mean we're not friends anymore."""
"69","""మనం హై స్కూలులో స్నేహితులమా?"" అని నేను అన్నాను.","I'm like, ""Were we friends in high school?"""
"70","ఎందుకంటే అతను నా నెత్తి మీదకి చికెన్ శాండ్విచ్ లు విసిరేవాడు.","Because he used to throw chicken sandwiches at my head."
"71","పైగా అది పబ్లిక్ స్కూలు, అందులో చికెన్ చాలా గట్టిగా ఉండేది.","And it was public school, so the chicken was hard as fuck."
"73","అప్పుడు, మేము అతని ఇంటికి వెళ్లాం, అతని చిన్న తమ్ముడు అరుస్తున్నాడు, ""నా ఎక్స్ బాక్స్ ని ముట్టుకోవద్దు.""","So, we're at his place, and his little brother is all like, ""Don't touch my Xbox."""
"74","అప్పుడు నేను, ""నేను ఇప్పుడు ఎక్స్ బాక్స్ అసలు ఆడటమే లేదు, చిన్న బాబు"" అన్నాను.","And I'm like, ""I don't even play Xbox anymore, little man."""
"75","నేను చెప్పింది అర్థమైందా? అంటే, నేను నేను పిల్లల వస్తువులు పక్కన పెట్టేశాను.","You feel me? Like, I-I put aside childish things."
"76","సెట్లర్స్ ఆఫ్ కెటాన్ లాంటి పెద్దవాళ్ల ఆటలు ఆడతాను.","I play I play adult games like Settlers of Catan."
"77","నువ్వు ఎప్పుడైనా ఆ ఆట ఆడావా? లేదు.","You ever played that? No."
"78","దాన్ని ఇప్పుడు కేవలం ""కెటాన్"" అంటున్నారు, ""సెట్లర్స్ ఆఫ్ కెటాన్"" కాదు, ఎందుకంటే సెట్లర్ల వలసవాదం తాలూకు ప్రభావం ఉంటుంది. పెన్నీ బ్రూయింగ్","It's actually just called ""Catan"" now, not ""Settlers of Catan,"" because of the implications of settler colonialism."
"79","ఇంకా 7 ఎలెవెన్ స్టోర్స్ ని నిజంగా మూసివేశారు. దాన్ని మూసివేస్తారని నాకు కనీసం తెలియదు.","And the 7-Eleven was literally closed. I didn't even know it could close."
"80","అది ఇరవై నాలుగు గంటలు తెరిచి ఉంచే స్టోర్ కదా?","Isn't that supposed to be a 24-hour place?"
"81","అంటే వారంలో ఏడు రోజులు. రాత్రి పదకొండు గంటల వరకు? చెత్త డబ్బా! అయ్యో, పాపం. నీకు దెబ్బ తగిలినట్లు ఉంది.","You know, like seven days a week. Seven till 11? Ow! Fucking shit! , shit, man. That looked like it hurt."
"82","బాగా తగిలింది. ఏది ఏమైనా, నేను ఏం చెబుతున్నాను?","It did. [grunting] Anyway, where was I?"
"83","అవును, ఏడు అంటే వారంలో ఏడు రోజులు, కానీ పదకొండు అంటే.","Yeah, the seven is for seven days a week, but the 11 is."
"84","అది పదకొండు, హమ్.","It's 11 Ugh. Eleven, um."
"85","అది అప్పుడు మూతపడుతుంది, బాబు. రాత్రి పదకొండు గంటలు.","When it closes, man. , 11:00 p.m."
"86","అవును. ఓహో.","Yes. Damn."
"87","సెవెన్ ఎలెవన్ నుంచి ఎప్పుడూ ఏదో ఒకటి దొంగిలించేవాడిని, తెలుసా, కానీ నాకు ఆ అవసరం ఉండేది కాదు, నా దగ్గర డబ్బు ఉండేది.","You know, I used to steal from 7-Eleven all the time, but I didn't have to, I had the money."
"88","నేను అందరిలాగే బ్లూ కాలర్ ఉద్యోగి లాంటి వాడినే.","You know, I'm like a normal blue-collar guy."
"89","అందరి కుర్రాళ్ల లాగే నాకు కూడా మసాలా వంటకాలు అంటే ఇష్టం.","You know, I like spicy stuff as much as the next guy."
"90","కానీ ఎప్పుడయినా నువ్వు బాగా కారంగా ఉండే డోరిటోస్ తిన్నావా?","But, But have you ever had Doritos for the damned?"
"91","చెత్త.","Fuck."
"92","దాన్ని ఇప్పుడు నువ్వు క్రిమిరహితంగా శుభ్రం చేయాలి, కదా?",", you know you have to sterilize that now, right?"
"93","నాకు తెలుసు.","I know."
"94","బాబు, మనం బార్ లో పని చేస్తున్నాం. అది ఎంత అద్భుతమైన విషయమో కదా.","[sighs] Man, we work in a bar. How dope is that?"
"95","అది చాలా అద్భుతమైన విషయం, ఒమర్.","It's pretty dope, Omar."
"96","ఓయ్, ఆ డబ్ల్యు-4 ప్రింట్ అవుట్ తీసుకున్నావా?","Yo, did you, , print out that W-4?"
"97","లేదు, నిజానికి ఇక్కడ ప్రింటర్ పాడైపోయింది.","Um, no, actually the printer here is broken."
"98","సరే. మీ ఇంట్లో ప్రింటర్ లేదా?","Okay. You ain't got a printer at your house?"
"99","నా దగ్గర ప్రింటర్ లేదు. విడాకుల తరువాత ప్రింటర్ ని నా భార్య తీసుకుంది, కాబట్టి ఆ చాలా, చాలా బాధాకరమైన జ్ఞాపకాలని మళ్లీ గుర్తు చేసినందుకు థాంక్స్.","I don't. My wife got the printer in the divorce, so thanks for bringing up that very, very, very painful memory."
"100","నిజంగా మెచ్చుకుంటాను. ఏంటి సంగతులు, కుర్రాళ్లూ?","I really appreciate that. What up, boys?"
"101","హేయ్, ఓయ్, మీతో నేను ఒక విషయం మాట్లాడాలి.","Hey, yo, I got something to float by you guys."
"102","మనతో ఒకరు కలిసే అవకాశం గురించి. కలుస్తున్నారా?",", a possible collab for us. A collab?"
"103","జానీ 66 గురించి ఏం అనుకుంటున్నారు?","What do you think of Johnny 66?"
"104","జానీ 66 అది రెస్టారెంట్ చైన్, కదా?","Johnny 66 , that's the restaurant chain, right?"
"105","అవును, అది బాగా వ్యాపారం జరిగే హోటల్. అవును, చాలా చెత్తగా, ఘోరంగా ఉంటుంది.","Yeah, it's like a fast-casual place. Yeah, it's super cheesy, terrible."
"106","తెలియదు, కానీ అవి చాలా ఎక్కువ ఉన్నాయి.","[singsongy] I don't know, but there's a lot of them."
"107","సరే, అవి చాలా ఎక్కువ బ్రాంచీలు ఉన్నాయి కాబట్టి, అది మంచి రెస్టారెంట్ అనుకోలేము.","Ooh, well, just 'cause there's a lot of something, it does not mean it's good."
"108","అది మనకి మంచి పాఠం.","That's a good lesson for you."
"109","చాలామంది సీరియల్ కిల్లర్స్ ఉన్నంతమాత్రాన సీరియల్ కిల్లర్స్ మంచి వాళ్లు కారు.","There's a lot of serial killers. Serial killers are not good."
"110","అంతమంది సీరియల్ కిల్లర్స్ ఉంటారా? చాలామంది సీరియల్ కిల్లర్స్ ఉంటారు అనుకుంటా.","Are there that many serial killers? I think there is a lot of serial killers."
"111","అప్పట్లో గోల్డెన్ స్టేట్ సీరియల్ కిల్లర్ పక్క ఇంట్లోనే మా నాయనమ్మ ఉండేది.","My grandma used to live next to the Golden State killer."
"112","అదీ విషయం. అది క్రేజీగా ఉంది.","There you go. [Andy] That's crazy."
"113","వాళ్లు పరస్పరం బనానా బ్రెడ్లు లాంటివి ఇచ్చి పుచ్చుకునే వారు.","They used to bring each other banana bread and shit."
"114","నిజానికి సీరియల్ కిల్లర్స్ కంటే ఎక్కువగా వాళ్ల గురించి చాలా టెలివిజన్ షోస్ ఉన్నాయి.","There's more television shows about serial killers than there's actually serial killers."
"115","అది నిజం కావాలని కోరుకుంటున్నాను, ఎందుకంటే అలా కాకపోతే, ఐస్-టి ఒక్కడే న్యూ యార్క్ లో పాతిక వేలమంది సీరియల్ కిల్లర్లని పట్టుకుంటాడు.","I really hope that's true, 'cause if it's not, Ice-T alone has conservatively caught 25,000 serial killers just in New York."
"116","అది చాలా పెద్ద సంఖ్య. కుర్రాళ్లూ, మనం మాట్లాడుకుందాం, కుర్రాళ్లూ.","[Andy] That's a lot of serial killers. Guys, let me talk, guys."
"117","దయచేసి మాట్లాడు.","Please talk."
"118","నేను జానీ 66 సిఇఓని కలిశాను, ఎందుకో తెలుసా?","I fucking met the CEO of Johnny 66, and guess what?"
"119","అతను మన బీర్ కి లైసెన్స్ ఇవ్వడానికి ఆసక్తిగా ఉన్నాడు.","He's interested in licensing our beer."
"120","అది సంతోషం.","You're welcome."
"121","ఇంకా మన బీర్ ని రుచి చూడటానికి అతను ఈ రాత్రి ఇక్కడికి వస్తున్నాడు. మనం ఈ ఒప్పందం చేసుకోవాలి.","And he's coming in tonight to try it. Let's fucking close this shit."
"122","అది, అంటే, నిజంగా మనం ఎవరనే దానిని అది సరిగ్గా సూచిస్తుందని నేను అనుకోవడం లేదు.","[clicks tongue] I don't think that is, like, really what is representative of who we are necessarily."
"123","అదేంటి మళ్లీ చెప్పు?","Which is what again?"
"124","మనం ఎంతో నిజాయితీతో అత్యంత నాణ్యమైన బీర్ ని తయారు చేస్తున్నాం, కానీ మన నాణ్యమైన ఉత్పత్తిని చౌకబారు డేట్స్ కి వచ్చే మనుషులకీ, లేదా, అంటే, మామూలుగా మందుకొట్టే తాగుబోతులకి అందించాల్సి వస్తుంది.","Which is creating an incredibly high-quality product using integrity, and then selling that product to people on Hinge dates and, like, pretty well-to-do alcoholics."
"125","కానీ, జానీ 66 అనేది చాలా గొప్ప ఆలోచన అని నా అభిప్రాయం.","Well, I think Johnny 66 is a dope-ass idea."
"126","అతనికి గనుక మన బీర్ నచ్చితే, మనం చాలా డబ్బు గడిస్తాం, బ్రదర్.","And if he likes our beer, we make freaking bank, bro."
"127","మనం ఈ ఒప్పందం కుదుర్చుకోవాలి.","We should do it."
"128","సారీ, నాకు ఆసక్తి లేదు.","I'm sorry, I'm not interested."
"129","కానీ, తోసిపుచ్చుతున్నాను. నీ నిర్ణయంతో నాకు పని లేదు, బాబు.","Well, overruled. It's not really up to you, man."
