"Index","Telugu Text","Mapped English Text"
"130","కానీ, అది నా నిర్ణయమే కావాలి, ఎందుకంటే నేనే బ్రూమాస్టర్ ని.",", well, it is up to me, 'cause I'm the brewmaster."
"131","సరే, నేను డబ్బు ఇచ్చే మాస్టర్ ని ఇంకా ఇది నా బార్. కాబట్టి.","Well, I'm the money master and this is my bar. So [laughs]"
"132","డబ్బు అనేది, ఇక్కడ ముఖ్యం కాదు.","Money master, , is not a thing."
"133","నాకు, ఆండీకి ఈ వ్యాపారంలో పావలా వాటా ఉంది.","And me and Andy each own a quarter of this place."
"134","అది కాదు. సరే, నువ్వు చెప్పింది నిజమే.","Yeah, no. Yeah, you're right."
"135","మీ ఇద్దరికీ 24.5 శాతం వాటా ఉంది, ఆ రెండు కలిపితే నలభై.","You each own 24.5% which together equals f."
"136","నలభై తొమ్మిది శాతం వాటా అవుతుంది.","Forty-nine."
"137","థాంక్యూ. నలభై తొమ్మిది శాతం. అది మైనారిటీ వాటా, చెత్తవెధవ.","Thank you. Forty-nine percent. A minority stake, you fucking idiot."
"138","ఈ రెస్టారెంట్ కి ఇంత ప్రాముఖ్యత వచ్చిందంటే అందుకు కారణం నేను కష్టపడి పని చేయడమే.","I'm the one who works their fucking ass off to make this place what it is."
"139","అవును, నువ్వు ఆ పనిని నా డబ్బుతో చేశావు, బ్రదర్.","Yeah, you did that with my money, bro."
"140","అయితే నువ్వు చాలా గొప్పగా పని చేశావు, విలియమ్. అభినందనలు.","And you did a great job, William. Congratulations."
"141","మనం అందరి దృష్టిని ఎలా ఆకర్షిస్తున్నామో చూడు. ఇప్పుడు మనం ఇంకా ఎక్కువ సంపాదించాలి.","Look at all the attention we're getting. And now we can make even more money."
"142","నా ఉద్దేశం, జీవితం ఉన్నది దేని గురించి, కుర్రాళ్లూ?","I mean, that's what life's about, right, boys?"
"143","అంటే, ఒకసారి ఆలోచించు, ఇది అభివృద్ధి గురించి, పైకి ఎదగడం గురించి. ఇది ఎప్పటికీ పెరిగే ఆదాయం గురించి.","I mean, think about it, it's about progression, it's about moving up. It's about generational wealth."
"144","నువ్వు కాల్ ఆఫ్ డ్యూటీ ఆట ఆడుతుంటే, నువ్వు ఆడుతున్నంత సేపూ రూకీ లెవెల్ లోనే ఉండిపోతావా?","When you're playing Call of Duty, do you sit on rookie level the entire time?"
"145","ఖచ్చితంగా ఉండవు. నువ్వు పైకి వెళతావు, ప్రముఖుల సరసకు వెళ్లాలని చూస్తావు.","Absolutely fucking not. You move up, you go to elite."
"146","ఆ ప్రముఖులని కూడా దాటిపోయిన స్థాయిలో, జానీ 66తో మన లక్కీ పెన్నీ బ్రూయింగ్ సంస్థ చేతులు కలుపుతుంది.","And then after elite, you go where Johnny 66 with an association of Lucky Penny Brewing is gonna go."
"147","నువ్వు గొప్పవాడివి అయిపోతావు.","You go to legendary."
"148","నువ్వు ఏం మాట్లాడుతున్నావో నాకు ఒక్క ముక్క కూడా అర్థం కాలేదు ఎందుకంటే నేను ఆ ఆట ఆడి పన్నెండేళ్లు దాటింది.","I don't know what the fuck any of that means because I'm over 12 years old."
"149","ఆ నియంతృత్వ పోకడలు ఉన్న బర్గర్ సంస్థతో నేను చేతులు కలపను అని ఈ మీసాలు మొలిచిన పొట్టి మనిషికి నువ్వు చెబుతావా?","Will you tell this mustachioed little fucking twerp that I'm not collabing with a fascist burger chain?"
"150","నీకు ఒక విషయం చెప్పనా? నేను వెనుక వైపు వెళ్లి శుభ్రం చేసుకోవాలి మీరు ఇక్కడ సూట్లు తొడుక్కుని దర్జాగా నిలబడి డబ్బు సంపాదించాలంటే నేను వెనుక ఆ చెత్తలో కష్టపడి పని చేయాలి.","You know what? I gotta go to the back and clean up because it's a little messy making you guys money while you stand here in your fucking vest."
"151","నీ పేరు తెలుసుకోలేదు, నా పేరు విల్.","I didn't get your name. I'm Will."
"152","నీ బూట్లు చాలా బాగున్నాయి. అవి బాల్మాన్ లో కొన్నావా?","Those are fucking cool. Are those Balmain?"
"153","బాబు, తను నాతో కలిసి ఉంటోంది. సరే, అది నిజం కావచ్చు.","Yo, she's with me. Yeah, no fucking kidding."
"154","నీ గురించి నాకు ఏమీ తెలియదు. కానీ నువ్వు ఇంతకన్నా మంచి మనిషిని పొందగలవని నీకు నేను గ్యారంటీ ఇస్తున్నాను.","I don't know anything about you at all. I guarantee you can do better."
"155","విల్, ఆగు.","Will, wait."
"156","నేను గత నాలుగు నెలలుగా డెస్ మొయిన్స్ కేసు మీద పని చేస్తూ గడిపాను.","I spent the last four months in Des Moines working on a case."
"157","కానీ నీకు చెప్పాలి, ఆ డెస్ మెయిన్స్ అనేది ఆశ్చర్యకరంగా ఒక బలమైన స్వలింగ సంపర్కుల ప్రపంచం. చాలామంది ఆపిల్బీ సంస్థలో పని చేస్తారు.","I gotta say, Des Moines, surprisingly robust gay scene. Most of them work at Applebee's."
"158","నాకు ఆపిల్బీలు అంటే ఇష్టం.","I love Applebee's."
"159","ఈమెకి ఆపిల్బీలు ఇష్టం.","She loves Applebee's."
"160","ఆపిల్బీలు ఇష్టపడని వాళ్లెవరు? నేను ఇంకా డువాన్ ని కలుస్తున్నా.","Who doesn't love Applebee's? I'm still in touch with Duane."
"161","హేయ్, మీరు ఇక్కడ ఏం చేస్తున్నారు?","Hey, what are you doing here?"
"162","ఈ వేడుక వ్యాపార భాగస్వాముల కోసం.","This retreat's for partners. [cheers, laughs]"
"163","వెనెసా, హేయ్.",", Vanessa, hey."
"164","నాతో పాటు, సిల్వియాని తీసుకొచ్చాను.","Plus, I get Sylvia. [Sylvia]"
"165","హాయ్, వెనెసా. ఎంత బాగుంది.",", hi, Vanessa. , my goodness."
"166","మన నలుగురినీ చూడండి.","Look at the four of us."
"167","ఇది ఇరవై ఏళ్ల కిందట కాప్లాన్ మేయర్ సమ్మర్ అసోసియేట్స్ సంస్థ ఉద్యోగుల కలయికలా ఉంది కదా.","It's like a 20-year reunion at Kaplan-Meyer summer associates."
"168","అయితే, నువ్వు కూడా భాగస్వామి అయ్యావు.","So, you made partner too."
"169","అది గొప్ప విషయం, అభినందనలు.","That's amazing. Congratulations."
"170","థాంక్స్. కానీ ఇప్పటికీ నాకు దక్కాల్సిన వాటాకి దగ్గరలో ఎవరూ లేరు, కానీ అది మరెప్పుడైనా దాఖలు చేయాల్సిన కేసు. వావ్, కానీ చార్లీతో కలిసి నువ్వు ఇక్కడికి రావడం గొప్ప విషయం.","Thanks. Still not anywhere close to the equity I deserve, but that is a lawsuit for another day. [chuckles] Wow, you are a trooper for coming to this with Charlie."
"171","లేదు, నేను చార్లీతో కలిసి గడపడానికి ఇక్కడికి రాలేదు.",", no, I'm not here to hang out with Charlie."
"172","ఇక్కడ ఉచితంగా హోటల్ రూమ్ ఇచ్చారు ఇంకా ఒక రాత్రయినా పిల్లలకి దూరంగా ఉండచ్చని వచ్చాను.","I'm just here for the free hotel room and a night away from the kids."
"175","ప్రస్తావన వచ్చింది కాబట్టి, ఫ్రాన్సిస్, సైమన్, మేవీ ఎలా ఉన్నారు?","Speaking of which, how are Frances, Simon, and Maeve?"
"176","సరిగ్గా చెప్పావు. అమ్మలు ఎప్పుడూ అంతే.","Nailed it. Mommies always do."
"177","నాకు తెలుసు, అమ్మల సామర్థ్యం.","I know, Mommy power."
"178","అంతే. అమ్మ సమర్థత. నువ్వు ఇంత సరదాగా ఉంటావని మర్చిపోయాను.","That's it. Mommy power. I forgot how funny you are."
"179","అమ్మ సమర్థత.","[chuckles] , Mommy power."
"180","కానీ పిల్లలు బాగానే ఉన్నారు. అడిగినందుకు ధన్యవాదాలు. అవును. అవును, ముగ్గురు అంటే పెద్ద సంతానమే.","But they're good. Thank you for asking. Yeah. Yeah, three's a lot."
"181","అవును, కానీ, నన్ను భయపెట్టకు, ఎందుకంటే ఈ మధ్యనే నాకు నాలుగో సంతానం పుట్టింది.","Yeah, well, color me terrified then, 'cause I just had my fourth. [chuckles]"
"182","ఏంటి? అవును.","What? Yep."
"183","కానీ, నువ్వు.","[stammers] But, did you."
"184","అది సరే, నేను ఇంక వెళ్లాలి. మిమ్మల్ని తరువాత కలుస్తాను, భాగస్వాములు.","Anyway, I'm gonna go. I will see you and you later, partners."
"185","ఇంకా అమ్మా, నువ్వు ఈ రోజుని సంతోషంగా ఆస్వాదించు ఇంకా జాగ్రత్తగా చూసుకో, సరేనా?","And Mama, I want you to have a wonderful day and take care of yourself, okay?"
"186","నువ్వు గొప్పదానివి.","You're the best."
"187","వెనెసా, ఒక్క క్షణం మనం మాట్లాడుకుందామా?","Vanessa, can we put our heads together for a sec?"
"188","నాకు ఒక సెకను టైమ్ ఇవ్వు. అమ్మ శక్తి. నేను వెళ్లాలి.","[Vanessa] Give me a second. Mommy power. I've gotta [laughing]"
"190","అయితే, వెనెసా ఒక భాగస్వామి అయ్యింది.","So, Vanessa made partner."
"191","అవును. ఆ విషయం నాకు చెప్పావా?",", yeah. Did I know that?"
"192","నాకు తెలియదు. నీకు తెలియదా?","Um, I don't know. Did you?"
"193","నాకు చెప్పలేదు అనుకుంటా. లేదు, ఖచ్చితంగా నాకు తెలియదు.","I don't think I did. No, I definitely didn't."
"194","నువ్వు నాకు ఎందుకు చెప్పలేదు? నాకు తెలియదు, అదంత ముఖ్యం అనుకోలేదు. చాలామంది భాగస్వాములు అవుతుంటారు.","Why didn't you tell me? , I don't know, it didn't seem that important. Lots of people make partner."
"195","నేను అది మర్చిపోయి ఉండచ్చు.","I guess it just slipped my mind."
"196","అది నువ్వు మర్చిపోయావా?","[scoffs] It slipped your mind?"
"197","నేను ఏం చెప్పాలి అనుకుంటున్నావు?","What do you want me to say?"
"198","తను కష్టపడి పని చేస్తుంది, ఈ సంస్థలో చాలాకాలంగా పని చేస్తోంది.","She works hard, she's been at the firm for a long time."
"199","అలాగ పని చేస్తుంటే, ఏదో దశలో, వాళ్లు భాగస్వాములుగా ఎదుగుతారు.","When you do those things, at a certain point you make partner."
"200","అవును, కానీ వెనెసా చాలా భిన్నమైన మనిషి.","Yeah, but Vanessa is different."
"201","మేము కలిసి లా స్కూల్ కి వెళ్లాం, కలిసి క్లర్కులుగా పని చేశాం.","We went to law school together, we clerked together."
"202","ఆమె గురించి నేను ఏం అనుకుంటానో నీకు తెలుసు.","And you know how I feel about her."
"203","నేను సాధించాల్సిన ప్రతి దానికి ఆమె ప్రతిరూపం అనిపిస్తుంది.","It's like she represents everything that I could have been."
"204","బేబీ, నీ మాటని ఒప్పుకుంటాను. నేను నిజంగా అంగీకరిస్తాను.","Babe, I I hear you. I-I really do."
"205","కానీ ఆమె ఏదో అద్భుతమైన జీవితాన్ని జీవించడం లేదు.","But she's not living some magical life."
"206","బహుశా ఆమె నిన్ను చూసి అసూయపడుతూ ఉంటుంది.","You know, she probably envies you."
"207","బహుశా ఆమె నీ గురించి తన భర్తతో మాట్లాడుతుండచ్చు.","She's probably saying things to her husband about you."
"208","అంటే ఎలాగ?","Like what?"
"209","నాకు తెలియదు. వాళ్ల సంభాషణల్ని నేను వినలేదు కదా.","I I d I don't know. I'm not in their conversations."
"210","బహుశా నువ్వు ఇల్లు కొనడం గురించి, దానికి మరమ్మతులు చేయించడం గురించి, ఇంకా క్రియేటివ్ గా ఉండటం గురించి కావచ్చు.","Maybe about you buying the house, fixing it up, and being, you know, like, creative."
"211","నువ్వు ఆ విషయాన్ని నమ్మవు కదా.","You don't believe that."
"212","ఒక కాన్ఫరెన్స్ టేబుల్ చుట్టూ ఐదు గంటల పాటు ఒక లీగల్ కాంట్రాక్టు గురించి వాదులాడుకోవడం, కనీసం కాళ్లు చాచడానికి వీలు లేకుండా కేబుల్ వైర్లు అడ్డంగా ఉండటం వాటి కన్నా నీలా బతకడం సరదాగా ఉండచ్చు.","It sounds like a lot more fun than arguing about a legal contract for five hours around a conference table where you can't cross your legs because there are so many AV wires."
"213","నీకు ఒక విషయం తెలుసా? సారీ, బేబీ. అది పెద్ద విషయం కాదు, కదా.",", you know what? I'm sorry, babe. I It's not a big deal, right."
"214","ఈ వారం అంతా నీ గురించి, నిన్ను చూసి గర్వపడుతున్నాను.","This weekend is about you, and I'm I'm so proud of you."
"215","నువ్వు ఈ సందర్భాన్ని ఆస్వాదించాలి ఇంకా ఆ కేబుల్ వైర్లని ఆస్వాదించాలి.","I just want you to enjoy yourself and en-enjoy the AV wires."
"216","థాంక్యూ.","[chuckles] Thank you."
"217","ఇంకా ఈ మధ్యాహ్నాన్ని ఆస్వాదించు. రాత్రికి రెసెప్షన్ లో నిన్ను కలుస్తాను.","And you enjoy your afternoon. And I'll see you at the reception tonight."
"218","సరే. లవ్ యూ. లవ్ యూ.","Okay. Love you. Love you."
"219","డ్యూపాంట్ నుండి మిల్టన్ ని తప్పించారని నువ్వు విన్నావా?","[Tasmin] Did you hear Milton got taken off of Dupont?"
"220","ఆగు, ఏంటి?","[lawyer] Wait, what?"
"221","సోరేజ్ కేసు ఇదే అనుకుంటా. ఇదివరకు ఉండేది.","I thought the Suarez case was his thing. Used to be."
"222","వావ్. పాల్ ఆ ప్రింటర్ ని తెచ్చాడు.","Wow. , Paul with the printer."
"223","హేయ్, హేయ్. అవును!","[Paul] Hey, hey. Yes! [laughs]"
"224","ఇక్కడ ప్లగ్గులు ఉన్నాయని చెప్పారు అందుకే నేను ఆలోచించి దీన్ని ఇక్కడికే తెచ్చేశాను.","They told me there were plugs up here so I figured I'd I'd bring it up."
"225","అవును, ఇది చేయడమే మేలు.","Yeah, might as well."
"226","సమస్య పరిష్కారం అయింది!","Whoo-hoo! Problem solved!"
"227","ల్యాప్ టాప్ వైరు తెచ్చావా? లేదు. నా నాచోస్ ఎక్కడ? నేను నాచోస్ ఆర్డరు ఇచ్చాను.","[Tasmin] Did you bring a laptop cord? [Paul] , no. Where are my nachos? I ordered nachos."
"228","నువ్వు ఎలా ఆర్డరు చేశావు? మొత్తం టాపింగ్స్ తో.","[Tasmin] How'd you order 'em? [Paul] Fully loaded."
"229","నేను అదే అనుకున్నాను.","[Tasmin] That's what I thought."
"230","సారీ.",", sorry."
"231","సారీ.",", sorry. [sighs]"
"232","అందరూ నిలబడండి.","All rise."
"233","గుడ్ ఆఫ్టర్నూన్, లేడీస్ ఇంకా జెంటిల్మన్.","[Judge] Good afternoon, ladies and gentlemen."
"234","క్లార్క్ కేసులో ఈ న్యాయస్థానం నీకు రెండున్నర సంవత్సరాల శిక్ష విధిస్తోంది.","[announcer 1] This court now sentences you to two and a half years in the Clark."
"235","న్యాయస్థానం ప్రత్యక్ష ప్రసారంలో తరువాత, ముగ్గురు పిల్లలు ఉన్న తల్లి తను చదివిన విద్యాసంస్థ మీద కేసు దాఖలు చేసింది ఎందుకంటే తను ఆశించిన కెరీర్ అవకాశాలు.","[announcer 2] Next on Courtroom Live, a mother of three sues her alma mater when career opportunities th."
"237","డ్యూపాంట్ నుండి మీరు నన్ను తొలగించలేరు, ఆ కేసుని నేనే తెచ్చాను.","[Milton, muffled] You can't just take me off Dupont, I brought that case in."
"238","నేను కేవలం ఒక అసోసియేట్ ని కాను. నేను భాగస్వామిని. నేను ఒక భాగస్వామిని!","I'm not just some associate, I'm a partner. I'm a partner!"
"241","అందులో సమస్య ఏమిటో నాకు తెలియడం లేదు. నేను, నా పిల్లలు జానీ 66 ని ఇష్టపడతాం.","I don't see what the problem is. My kids and I love Johnny 66."
"242","అది నాకు ఎందుకో మంచిగా అనిపించడం లేదు.","That does not make me feel better at all."
"243","కానీ, అది నీకు మంచిగా అనిపించడం గురించి కాదు.","Well, it's not meant to make you feel better."
"244","అది పిల్లలకు మంచిగా అనిపిస్తుంది. మనం ఇక్కడ ఎందుకు కలిశాం?","It's meant to make our kids feel better. Why did we meet here?"
"245","డౌన్ టౌన్ లో ఇదే రద్దీలేని ప్రదేశం.","This is the lamest part of downtown."
"246","నీకు తెలుసా, నాకు నిజంగా బాగా ఆకలిగా ఉంది. ఇంకా గొప్ప గొప్ప కార్ల మధ్య పాత అమెరికా జ్ఞాపకాల మధ్య ఉండాలని నాకు కోరికగా ఉంది అప్పట్లో ఈ దేశం చాలా అందమైన ప్రదేశంగా ఉండేది.","You know, I was just really hungry. And I also have this desire to be surrounded by classic cars and old American nostalgia from when this country was a better place."
"247","ఆ రెండు కోరికల్ని కలిపి సాధించడానికి నాకు ఒక మార్గం తోచింది. చూడు.","I found a way to reconcile those two desires. Look."
"248","జానీ 66 బార్ అండ్ గ్రిల్ అయ్యో, ఇక్కడ కాదు. వద్దు, వద్దు, వద్దు, వద్దు, నేను రాను.","no, not here. No, no, no, no, I'm not going."
"249","లేదు, ఇక్కడ తినడానికి ఇంకా చాలా మంచి హోటళ్లు ఉన్నాయి.","No, there's so many better places to eat around here."
"250","మరీ అంత విసిగించకు. పద. పద. ఇలా చూడు, నన్ను బలవంత పెట్టకు.","Don't be a square. Come on. Come on. , come on, don't do that."
"251","ఇలాంటి చోటుకి రావడం నాకు ఇష్టం ఉండదు.","I can't be seen going into a place like this."
"253","హలో. హాయ్.","Hello. Hi."
"254","ఇద్దరికి టేబుల్ కావాలి, ప్లీజ్. సరే, మీ సర్వర్లు మీ కోసం ఒక్క నిమిషంలో టేబుల్ రెడీ చేస్తారు.","[chuckles] , table for two, please. , well, your pit crew will have your table ready in one minute and counting."
"255","సరే, థాంక్యూ.","[chuckles] Huh? [laughing] All right, thank you."
"256","నీ గురించి నాకు తెలియని విషయం ఏదైనా ఉందంటే అది ఈ హోటల్ నీకు నచ్చిందనే నిజం మాత్రమే.","The fact that you like this place is the most unknowable thing about you."
"257","నాకు ఈ రెస్టారెంట్ అంటే ఇష్టం.",", I love this place."
"258","ఇది చూడు, ఇక్కడ గోడల మీద రోసా పార్క్స్ ఎందుకు ఉంది పక్కన అడాల్ఫ్ హిట్లర్ డిజైన్ చేసిన కారు పైన ముగ్గురు అమ్మాయిలు మిల్క్ షేక్స్ ఎందుకు తాగుతున్నారు?","Now, why do we have Rosa Parks on the wall next to three girls drinking milkshakes, above a car Adolf Hitler designed?"
"259","ఇది నీ దేశం. నువ్వు వివరించు.","It's your country. You explain it."
"260","తను రెస్టారెంట్ మొదట్లోనే ఉండటం ఇంకా దారుణం.","Least she's at the front of the restaurant."
