"Index","Telugu Text","Mapped English Text"
"261","ఈ చెత్తవెధవ ఎవడు? అది ఎవరో నీకు తెలుసు కదా?","[chuckles] Who's this fucking guy? , you know who that is?"
"262","అతను జానీ 66 సంస్థ వ్యవస్థాపకుడు ఇంకా దార్శనికుడు.","That's the founder and visionary of Johnny 66."
"263","అతను జానీ రెవ్. అది అతని అసలు పేరు కాదు.","It's Johnny Rev. That's not a real name."
"264","అదే నిజమైతే, అది నిజంగానే ఒక అద్భుతం అవుతుంది.","If it was, that would be truly miraculous."
"265","అతను నిజానికి చాలా ఆసక్తికరమైన మనిషి.","He is actually a very interesting guy."
"266","చాలా తెలివైన వాడు. ఎన్.పి.ఆర్. లో నేను అతని ఇంటర్వ్యూ చూశాను.","He's very smart. I heard him interviewed on NPR."
"267","అతడిని ఒక విధ్వంసకారుడిగా వాళ్లు పరిగణిస్తారు.","They consider him a disrupter."
"268","చూడు, జనం అతని ఆనియన్ రింగ్స్ తిన్నాక వాళ్ల పిరుదలని అతను ఇబ్బంది పెడుతున్నాడు.","Look he's, , disrupting people's buttholes after they eat his onion rings."
"269","విను, నువ్వు అతడి నుంచి చాలా నేర్చుకోవచ్చు.","[Sylvia] Listen, you could learn from him."
"270","ఏంటి? టానింగ్ మంచానికి ఇంకా మనిషికీ హైబ్రీడ్ లా ఎలా మారాలి అనా?","[Will] What? How to become a hybrid of a human and a tanning bed?"
"271","అందరికీ ఇష్టమైన విజయవంతమైన వ్యాపారాన్ని ఎలా నడపాలి.","How to run a beloved and successful business."
"272","నిజం చెప్పాలంటే, ఈ ప్రదేశం నాకు విసుగు పుట్టిస్తోంది, ఇంకా నాకు దీనిని అనుసరించాలనే కోరికే లేదు.","Honestly, this place fucking sucks, and I want nothing to do with it. [gasps]"
"273","ఇది చాలా బాగుంది.","That was cool."
"274","నన్ను అనుసరించండి. థాంక్యూ, మీ జుట్టు నాకు నచ్చింది. వాళ్లు ఇలా ఉండాలని చెబుతారు. అది చాలా బాగుంది.","Follow me. Thank you, I love your hair. [chuckles] , they make me do this. That's great."
"275","వ్యాపారం.","[gasps] Merch."
"276","జనం ఈ చెత్త అంతా కొంటున్నారా?","[Will] Do people actually buy this shit?"
"277","ఊరికే ఒకసారి చూడు.",", just have a little look."
"278","డూ-వాప్ పాటలు ఎన్ని ఉన్నాయి?","[sighs] How many doo-wop songs are there?"
"279","నీకు తెలుసా, ఆ పదాలని జాగ్రత్తగా వింటే, ప్రతి పదమూ ఒక చిన్నవయస్సు అమ్మాయితో సెక్స్ చేయడం గురించే ఉంటుంది.","You know, if you listen to the words carefully, every single one of them is about having sex with an underage girl."
"280","అది చాలా అసహ్యకరమైన సాహిత్యశైలి.","It's a disgusting genre."
"281","వీళ్ల దగ్గర మొజరెల్లా స్టిక్ షిఫ్ట్స్ లేకపోవడం నాకు చాలా నిరాశ కలిగిస్తోంది.","I'm so bummed they didn't have the mozzarella stick shifts."
"282","అవి చాలా బాగుంటాయి. నీకు బాగా నచ్చుతాయి.","They're so good. You would've loved them."
"283","ఈ బీర్ చెత్తలా ఉంది.","The beer The beer is garbage."
"284","నువ్వు ఫెండర్ బ్లెండర్ ని రుచి చూడాలి. ఇది చాలా స్ట్రాంగ్ గా ఉంది.","You should try a fender blender. They're very strong."
"285","అందులో ఏం ఉంటుంది?","What's in there?"
"286","పీన కోలడలో ఉండేవన్నీ ఇందులో ఉంటాయి.","Everything that's in a piña colada."
"287","అయితే ఇది పీన కోలడ అన్నమాట? కాదు, ఇది ఫెండర్ బ్లెండర్.","So it's a piña colada? No, it's a fender blender."
"288","అది మంచి బ్రాండింగ్. నువ్వు కూడా ఒకటి తాగుతావా?","That's good branding. You want to get one?"
"289","నాకు చాలు, నాకు థాంక్యూ. ఇలా చూడు.","I'm okay, I'm Thank you. Come on."
"291","హ్యాపీ బర్త్ డే హ్యాపీ, హ్యాపీ బర్త్ డే టూ యూ వ్రూమ్, వ్రూమ్. హ్యాపీ బర్త్ డే, డాడీ. థాంక్యూ. లవ్ యూ, బొమ్మ బేబీ! నా పుట్టినరోజు కాదు. థాంక్స్, మిత్రులారా. తను అబద్ధం చెబుతున్నాడు.","♪ Happy birthday Happy, happy, birthday ♪ ♪ Happy birthday Happy, happy birthday ♪ ♪ Happy birthday Happy, happy, birthday ♪ ♪ Happy birthday Happy, happy, birthday to you ♪ Vroom, vroom. Happy birthday, Daddy-o. Thank you. Love you, baby doll! Not my birthday. Thanks, guys. He's lying."
"292","నీకు ఇదంతా గర్వంగా ఉందా? హ్యాపీ బర్త్ డే.","You proud of yourself? Happy birthday."
"293","నా కోరిక ఏంటో చెప్పనా? ఒక ఉల్క మీదపడి ఈ క్షణమే మనందరినీ చంపేయాలి.","You know my wish? That a meteorite kills us all, right now."
"295","ఈ పుట్టినరోజుని జానీ రెవ్ కి అంకితం ఇస్తున్నాను, ""జోనథన్ రెవల్యూషన్"" కి అది పొట్టి పేరు అనుకుంటా.","I'll give it to Johnny Rev, which I assume is short for ""Johnathan Revolution."""
"296","ఇవి చాలా రుచిగా ఉన్నాయి, ఇంకా ఈ బూత్ లు కూర్చోవడానికి సరదాగా ఉన్నాయి.","These are delicious, and these booths are very fun to sit in."
"297","చూశావా? ఈ వంటకాలు కూడా చాలా రుచిగా ఉన్నాయి. ఎవరో వాళ్ల మనసు మార్చుకున్నారా? లేదు, అస్సలు లేదు.","See? And the food is pretty fucking good. , somebody changing their mind? No, not at all."
"298","నాకు అయోమయంగా ఉంది.","I-I'm confused."
"299","నువ్వు బ్రూవరీని ప్రారంభించింది కేవలం చాలా బీర్ ని అమ్మడం కోసమేనా?","Isn't the point of starting a brewery just to sell a lot of beer?"
"300","నా ఉద్దేశం మంచి బీర్ ని అమ్మడమే, ఇప్పుడు మేం చేస్తున్నది కూడా అదే.","The point is to sell good beer, which we are doing."
"301","మా స్థాయి విజయంతో నేను చాలా సంతోషంగా ఉన్నాను, అలాంటి దాన్ని ఒక పెద్ద కార్పొరేట్ సంస్థకి, అంటే, ఊరికే అమ్మేయడం మీద నాకు ఆసక్తి లేదు.","And I'm very happy with our level of success, and I have no interest in selling out to, like, a giant corporate conglomerate."
"302","ఇది కాస్త అసంబద్ధంగా ఉంది. ఇలా చూడు.","That's a little bit illogical. Come on."
"303","అంటే, నువ్వు బీర్ తయారు చేస్తావు ఇంకా అమ్ముతావు ఇంకా బహుశా ఎక్కువ డబ్బు సంపాదిస్తావు.","Like, you're just gonna be making beer and selling beer and probably make a lot of money."
"304","ఇంకా అందరికీ డబ్బు అంటే ఎందుకు అంత పిచ్చి? తేలికగా తీసుకో. వెనక్కి తగ్గు, అలెగ్జాండ్రియా కోర్టాజియో-కోర్టెజ్.","And Why is everyone so obsessed with money? Whoa. Take it easy. Back up, Alexandria Cortazio-Cortez."
"305","అది ఆమె పేరుకి కనీసం దగ్గరగా కూడా లేదు.","Not even almost her name."
"306","మూడు పదాల్లో ఒక్కటి కూడా నువ్వు సరిగ్గా పలకలేదు అనుకుంటా.","I don't think you got I think you got one out of three right."
"307","సరే. నిజంగా ఏం జరుగుతోంది?","Okay. Wha What's really going on?"
"308","నేను నీతో నిజాయితీగా మాట్లాడతాను.","I'm gonna be honest with you."
"309","నేను ఇప్పుడు బాగానే ఉన్నాను.","I am cool."
"310","నేను బాగానే ఉన్నాను. సంతోషపడే వారి జాబితాలో ఉన్నాను. ""చాలా సంతోషంగా""?","I'm I'm a cool. I'm in the cool category. ""A cool""?"
"311","నేను మంచిగా ఉన్నవాడిని. ఒంటరిగానా?","I'm a cool guy. Singular?"
"312","ఈ ప్రదేశం? ఇది అంత బాగాలేదు. ఇది బాగాలేదు.","This place? Not fucking cool. It's uncool."
"313","నువ్వు కూడా నాలాగ ఆలోచించగలిగితే, ఇది భయంకరంగా ఉంటుంది. సరేనా?","And if you're like me, that is terrifying. Okay?"
"314","నేను మంచిగా ఉండాలి. మంచిగా ఉండాలి. నేను మంచిగా ఉండాలి.","You gotta stay cool. Gotta stay cool. I gotta stay cool."
"315","నేను అంతగా మంచిగా ఉండలేను.","I can't not be cool."
"316","నువ్వు మంచిగా లేవని ఎవరూ అనడం లేదు.","Nobody is saying that you're not cool."
"317","నేను మంచిగా లేనని ఈ హోటల్ చెబుతోంది.","This place would be saying I'm not cool."
"318","నువ్వు మంచిగా లేవని ఎవరూ అనడం లేదు.","Nobody's saying you're not cool."
"319","నా సలహా ఏమిటంటే మనం ఉన్న ఈ దశలో మన ఈ వయస్సులో, మనం మంచిగా ఉండటం గురించి దృష్టి పెట్టకుండా మన వయస్సుకు తగ్గట్లుగా ప్రవర్తించడం మంచిది అనుకుంటా.","I'm just suggesting that maybe at this point in our lives when we're at this age, that maybe we should focus less on being cool and more on acting our age."
"320","కానీ, ఒక నిజమైన బలహీనురాలి మాదిరిగా మాట్లాడావు.","Well, that was spoken like a true lamazoid."
"321","నేను ఊరికే ఒక కార్పొరేట్ సంస్థకి అమ్ముడుపోలేను.","I just can't be a corporate sellout."
"322","సరే, నువ్వు వెళ్లి ఈ విషయం ఆండీకి చెప్పు.","Well, you gotta go tell Andy."
"323","అతను బిజినెస్ స్కూల్ కి వెళ్లాడు. ఏం చెప్పాలో నాకు తెలియడం లేదు.","He went to business school. I don't know what to say."
"324","నేను లాయర్ ని. నీతో పాటు నేను కూడా వస్తాను. మనం ఈ సమస్యని పరిష్కరిద్దాం.","I'm a lawyer. I'll come with you. We'll sort it out."
"325","నేను నీతో పాటు వస్తాను. థాంక్యూ.","I'll come with you. , thank you."
"326","మీరిద్దరూ చాలా హాస్యాస్పదంగా ఉన్నారు.","[snickers] You guys look fucking insane."
"327","అవును, అది ఎందుకో కూడా నీకు చెబుతాను. మేము జానీ 66 కి వెళ్లాం.","Yeah, and I'll tell you why. We were at Johnny 66."
"328","మేము చాలా బాగా ఆస్వాదించాం.","We had a great time."
"329","అక్కడ కేక్ చాలా బాగుంది, అది ఒక చిన్న కారులో వచ్చింది, ఇవి మినహా ఆ హోటల్ చాలా చిరాకు తెప్పించింది, మనం ఆ జానీ గాడిని ఈ రాత్రికి ఇక్కడికి రానివ్వకూడదు, వాడు మన రుచికరమైన బీర్లన్నీ రుచి చూసి మనం కాదని చెప్పలేనంత ఆఫర్ చేయనివ్వకూడదు.","The cake was good, and it came in a little car, but other than that it fucking sucks there, and we cannot have this guy coming here tonight, trying all of our delicious beers and making us an offer we can't refuse."
"330","మన బీర్లని జానీ 66లో అందించాలని నా ఉద్దేశం.","I think we should serve our beers at Johnny 66."
"331","అవును, దీన్ని పూర్తిగా అమ్మేసి డబ్బు చేసుకోవాలని అనుకుంటున్నాను.","Yeah, I want to completely sell out and make money."
"332","నువ్వు పరాచికాలు ఆడుతున్నావా, బాబు? నువ్వు ఎప్పుడైనా జానీ 66 లోపలికి వెళ్లావా?","Are you kidding me, man? Have you been inside of a Johnny 66?"
"333","నేను వెళ్లాను. అది బాగుండదు.","I have. It's not good."
"334","అందులో గోడ మీద మార్టిన్ లూథర్ కింగ్ చిత్రం ఉంది ఆయన ఫ్రెడ్ ఫ్లింస్టోన్ తో కలిసి సర్ఫ్ బోర్డు మీద ఉంటాడు, ఇంకా ఆ చిత్రంలో మార్టిన్ లూథర్ కింగ్ ""నిజమా?"" అన్నట్లు ఉంటాడు.","There was a painting on the wall of Martin Luther King on a surfboard with Fred Flintstone, and even in the painting Martin Luther King was like, ""Really?"""
"335","ఏమైనా కానీ. ఏదైనా కానీ. నేను వాటిని గూగుల్ లో వెతికాను, అలాంటివి కొన్ని లక్షల చిత్రాలు ఉన్నాయి.","Whatever. Whatever. I googled them, and there's a fuck ton of them."
"336","దాని అర్థం మనం చాలా డబ్బు సంపాదించవచ్చు.","Meaning we can make a lot of money."
"337","నీకు తెలుసా, రాత్రి వేళల్లో నాకు బాధపడే విషయం ఏమిటంటే ప్రతి ఒక్కరూ ""డబ్బు"" గురించి పిచ్చిగా ఆలోచించడమే.","You know, what makes me sad at night is how obsessed with ""money"" everyone is."
"338","కానీ, మనం అమెరికాలో బతుకుతున్నాం.","Well, we live in America."
"339","అవును. ఇది పెట్టుబడిదారీ సమాజం. డబ్బు ఉంటే, నువ్వు కారు కొనచ్చు.","Right. It's a capitalist society. With money, you can buy a car."
"340","లేదా నీ ఇంట్లో ఒక ప్రింటర్ ఉంటుంది, అప్పుడు నేను అడుగుతున్న ఆ డబ్ల్యు-4ని నువ్వు నాకు ఇవ్వగలవు.","Or it gets you a printer for your house, so you can get me that fucking W-4 I've been asking for."
"341","డబ్బు ఏవేం చేస్తుందో నాకు తెలుసు. నేను ఏం ఆలోచిస్తున్నానో తెలుసా?","I know the things money does. You know what I think?"
"342","నీకు ఈ ఒప్పందం ఇష్టం లేదు ఎందుకంటే దీన్ని రెజీ తీసుకువచ్చాడు, ఇంకా నువ్వు రెజీని ద్వేషిస్తావు ఎందుకంటే వాడు ఆడ్రే తమ్ముడు కాబట్టి.","You don't want this deal to work out because it came from Reggie, and you fucking hate Reggie because he's Audrey's brother."
"343","నువ్వు నీ చెత్త డైవోర్స్ నుండి ఇంకా బయటపడలేదు కాబట్టి రెజీ తెచ్చే ప్రతి ఐడియాని, అది ఎంత మంచి ఐడియా అయినా సరే, నువ్వు ఒప్పుకోవు, ఇది నిజానికి చాలా లోతయిన విశ్లేషణ.","And you're clearly not over your goddamn divorce so you're gonna tank every idea he has, even if it's a fucking good one. That's actually very insightful."
"344","ఇది అంతా విడాకుల వ్యవహారం, ఇంకా నాకు బోధనలు చేయడం మొదలుపెట్టకండి.","This is about the divorce, and Don't start fucking therapizing me."
"345","వెళ్లి మీరు ఇద్దరూ కలిసి వేరే ప్రాక్టీసు తెరవండి. ఆపు, మేము చేయచ్చు. మేము చేయచ్చు.","Go Go open a practice together. Fuck, maybe we should. Maybe we should."
"346","నేను ఇక్కడ సంపాదించే దానికన్నా ఆ పని చేస్తే ఇంకా ఎక్కువ డబ్బు గడిస్తానేమో.","I bet you I'd make more money there than I do in this fucking place."
"347","చూడు, కాస్త ఎక్కువ డబ్బు చేసుకుంటే మనం ఏమీ చచ్చిపోము అంటున్నాను. అంతే.","Look, I'm just saying it wouldn't kill us to get a little more liquid. That's all."
"348","నాకు తెలిసిందల్లా ఈ హోటల్ ఎప్పుడూ నిండుగా ఉంటుంది, ఇంకా మన ఇద్దరం బాగానే సంపాదిస్తున్నాం.","All I know is that this place is always full, and we're both doing fine."
"349","బాగానే అనేది చెత్త. నేను ఇంకా బాగా ఉండాలి. ఆ విషయం నీకు కూడా తెలుసు.","[sighs] Fuck fine. I want more than fine. Goddamn it. You know this."
"350","నాకు పెళ్లి చేసుకోవాలని ఉంది, బ్రదర్. ఒక కుటుంబాన్ని ఏర్పాటు చేసుకోవాలి, ఆ పనులు చేయాలి.","I wanna be married, bro. I wanna start a family, do family shit."
"351","నీకు కావాలని అనుకుంటున్నావు అంతే. నిజానికి నీకు కుటుంబంతో పని లేదు. నువ్వు బాగానే ఉన్నావు.","You just think you want that. You don't actually fucking want that. You're fine."
"352","ఎక్కడికి వెళ్తున్నావు? ఎక్కడికీ లేదు.","Where are you going? Nowhere."
"353","విల్? చెప్పు.","[Sylvia] Will? Yeah."
"354","నువ్వు బీర్ అంతా ఒలకబోస్తున్నావు.","You're spilling the beer."
"355","నేను ఒలకబోస్తున్నానని తెలుసు. బీర్ లేకపోతే దాన్ని సర్వ్ చేయలేరు కదా.","I know I am. Can't serve beer if there is no beer."
"356","హేయ్, నువ్వు ఏం చేస్తున్నావు?","Hey, what are you doing?"
"357","హేయ్, ఒమర్, ఇక్కడ ఈ ట్యాంకుని ఖాళీ చేయడంలో నాకు సాయం చేస్తావా? అలాగే. థాంక్యూ.","Hey, Omar. Will you help me, , empty this tank over here? , yeah. Thank you."
"358","ఈ ఈ ట్యాంకుల్లో చూడబోతే చాలా చాలా బీర్ ఉన్నట్లుంది.","The-These tanks look like they hold a-a lot of beer."
"359","వీటిల్లో చాలా ఉంటుంది.","They do."
"360","ఇదేమో చిన్న వైపు, కానీ ఇక్కడ చాలా పెద్ద ట్యాంకులు ఉన్నాయి.","And that's a very small hose, and there's a lot of tanks in here."
"361","కానీ ఇది ప్రధానంగా ఒక నిరసన ప్రదర్శన.","But it is a largely symbolic gesture."
"362","కానీ, నీ వెనుక కొన్ని బీర్ క్యాన్లు ఉన్నాయి.","Well, and there's also some cans of beer behind you."
"363","అది సైడర్, బీర్ కాదు. కానీ నేను వాటిని కూడా ఖాళీ చేస్తాను.","Those are cider, not beer. But I can empty those too."
"364","అవును. నీకు సైడర్ నచ్చుతుంది. ఆడవాళ్లు సైడర్ ని ఇష్టపడతారు.","Yeah. You'd like the cider. Ladies love cider."
"365","బాబూ, విల్. నాకు సైడర్ అంటే ఇష్టం.","[Andy] Dude, Will. I do like cider."
"366","నా పేరు సిల్వియా. విల్, ఇక్కడ ఏం చేస్తున్నావు, బ్రదర్?","I'm Sylvia. Will, what the fuck are you doing, bro?"
"367","హేయ్. చెత్త పని! ఏంటి ఇది ఇంక ఆపు.","[Will] Hey. Goddamn it! What the Stop it."
"368","ఇది ఇలా ఇవ్వు వద్దు.","Gimme the fucking Don't."
"369","ఆపు! లేదు! నేను ఆపను. లేదు! హేయ్. ఆ పైపు ఇలా ఇవ్వు.","! Stop it! [Sylvia screams] [Will] No! I won't stop. No! [Andy] Hey. Gimme the hose."
"370","ఇక్కడి నుండి బయటకు వెళ్లు. లేదు! అడ్డు రాకు.","Get outta here. [Will] No! Fuck you."
"371","నా కళ్లలో పడింది, చెత్తవెధవ! నువ్వు ఏం చేస్తున్నావు?","[grunts] It's in my eyes, you dick! What are you doing?"
"372","నేను పోరాడకుండా వదిలిపెట్టను!","I will not go down without a fight!"
"373","ఆడ్రే గురించి నువ్వు చెప్పినదంతా నిజం కాదు, సరేనా?","[pants] What you said about Audrey is not true, okay?"
"374","అవును, నేను ఆ విషయం ఎప్పుడో వదిలేశాను. ఆ సమస్యని మానసికంగా పరిష్కరించుకున్నాను.","Yeah, I've moved on from that. I've resolved that situation emotionally."
"375","నా సామాన్లు కూడా ఆమె ఇంటి నుంచి తెచ్చుకున్నాను, సరేనా?","I even got my stuff out of her place, okay?"
