"Index","Telugu Text","Mapped English Text"
"226","కానీ నువ్వు ఒకటి మర్చిపోయావు.","But you forgot something."
"227","జీవితం ఎప్పటికీ జీవితమే.","Life is still just life."
"228","ఇది నువ్వు ఊహించనిది అని అన్నావు.","You said it's not what you expected."
"229","నువ్వు ఏం ఊహించావు?","What did you expect?"
"230","నేను పరిపూర్ణత అని అంటే నేను మూర్ఖుడిని అనుకుంటావేమో.","You're gonna think I'm a dick if I say perfection."
"231","ఇప్పుడు తను నన్ను గ్యాలరీలో ఉద్యోగం మానేయమంటున్నాడు.","Now he wants me to quit my job at the gallery."
"232","నువ్వు మానేస్తావా?","Are you going to?"
"234","నిజం చెప్పాలంటే, దాని గురించి నేను ఇంకా అంతగా ఆలోచించలేదు.","Honestly, I can't really wrap my head around it all yet."
"235","కానీ అది చాలా ఎక్కువ డబ్బు కదా.","But it's a lot of money."
"236","దారుణం. సరే.","Insane. Okay."
"237","అవును, కానీ చాలా చిన్న విషయాలు ఆందోళన కలిగిస్తున్నాయి, అంటే హఠాత్తుగా తను ప్రతి రోజూ పళ్ల మధ్య శుభ్రం చేసుకుంటున్నాడు, మంచిగా డ్రెస్ చేసుకుంటున్నాడు.","Yeah, but there's all this small stuff too, like suddenly he flosses every day, and he dresses better."
"238","వెళ్లి ఒక డైవోర్స్ లాయర్ ని సంప్రదించు.","Go hire a divorce lawyer."
"239","అవి చిన్న విషయాలని నాకూ తెలుసు.","I know they're tiny things."
"240","కానీ అలాంటివి చాలా ఉన్నాయి. వివరంగా చెప్పు.","There are just so many of them. Keep going."
"241","ఎలా అంటే, తన తాళాల్ని ఇంటి ముందు తలుపు వెనుక హుక్ కి వెళ్లాడదీసే బదులు కిచెన్ బల్ల మీద వదిలేస్తాడు.","Like, he leaves his keys on the kitchen counter instead of hanging them on the hook by the front door."
"242","తను తలుపు తీసి లోపలికి రాగానే షూస్ విప్పేస్తాడు.","He takes his shoes off as soon as he walks in the door."
"243","డిష్ వాషర్ ఆఫ్ కాగానే అతను దాని లోపల వంటపాత్రల్ని బయటికి తీసేస్తాడు.","He unloads the dishwasher as soon as it's done."
"244","ఎప్పుడూ సెక్స్ కావాలని అంటాడు.","He wants to have sex all the time."
"245","దయచేసి ఇంక ఆపు. అతను ఆకర్షణీయంగా ఉన్నాడని, పరిశుభ్రంగా ఉంటున్నాడని, బాగా సంపాదించాడని అంటున్నావు.","Please stop. I'm hearing he's hotter, cleaner and richer."
"246","కానీ చార్లీ విషయంలో అతని ప్రవర్తన, అది చిన్న విషయం కాదు.","That thing with Charlie though, that's not small."
"247","కానీ, కొన్ని రోజుల కిందట నేను పెద్ద తప్పు చేశాను.","So, I messed up pretty bad a few days ago."
"248","నా కొడుకు చార్లీకి నేను ఐస్ క్రీమ్ ఇచ్చాను.","I gave my son, Charlie, ice cream."
"249","అందులో పప్పు పలుకులు ఉండటంతో అవి వొంటికి సరిపడక తను ఎమర్జెన్సీ రూమ్ లో చేరాల్సి వచ్చింది.","It had nuts in it and he had to go to the emergency room."
"250","ఇప్పుడు బాగానే ఉన్నాడా?","Is he okay?"
"251","ఉన్నాడు. అవును.","Yeah."
"252","కానీ నేను వాడిని ఎలాగోలా మెప్పిస్తాను.","And I'll make it up to him."
"253","కానీ డానియేలా, అంటే, తను ఇప్పటికీ చాలా ఆందోళన పడుతోంది.","But Daniela, you know, she's still very upset."
"254","నువ్వు క్షమించమని అడిగావా? అడిగాను.","You apologized? Yeah."
"255","అవును, కానీ నేను ఆ విషయంలో శ్రద్ధగా ఉన్నానని, అంటే, తనకి అది ప్రత్యక్షంగా చూపించాలి అనుకున్నాను.","Yeah, but I feel like I need to show her that, you know, I'm paying attention somehow."
"256","నువ్వు ఏం ఆలోచిస్తున్నావు?","What are you thinking?"
"257","నేను ఒక పెద్ద రొమాంటిక్ పని చేయాలి అనుకుంటున్నా.","I like the big romantic gesture."
"258","ఆమె అలా అనుకుంటోందా?","Does she?"
"259","నీకు అలా అనిపించదా?","Don't you?"
"260","అందరూ అలాగే అనుకుంటారు కదా?","Doesn't everyone?"
"261","ఏది బాగా రొమాంటిక్ అనే విషయంలో నా జీవితభాగస్వామికీ, నాకూ భిన్నాభిప్రాయాలు ఉన్నాయి.","My partner and I can have sometimes different ideas of what's romantic."
"262","నీకు పెళ్లయింది అయితే.",", you're married."
"263","ఒక రోజు రాత్రి, ఎమర్జెన్సీ గదిలో చార్లీ కోసం మేము వేచి ఉన్నప్పుడు, అతని చేతి మీద కొన్ని గుర్తులు చూశాను.","The other night, when we were waiting for Charlie in the emergency room, I saw these marks on his arm."
"264","అంటే గాయపడినట్లుగానా?","Like an injury?"
"265","అంటే సూది గుచ్చినట్లు మచ్చలు.","Like needle marks."
"266","అంటే తరచూ సూదులు గుచ్చుకున్నట్లుగానా?","Like track marks?"
"267","నువ్వు ఇంతసేపూ ఈ అసలు విషయం దాచావు.","You really buried the lede."
"268","అతడిని అడిగావా? లేదు.","Did you ask him? No."
"269","అతను ఈ మధ్యన రాత్రుళ్లు ఎప్పుడూ బయటే ఉంటున్నాడు.","And he's been out all the time at night recently."
"270","ఏవో సేల్స్ మీటింగ్స్ ఉన్నాయి అంటుంటాడు, కానీ నాకు అనుమానమే.","He says that it's for these sales meetings, but I don't know."
"271","నేను తనతో మాట్లాడాలి.","I should talk to him."
"272","లేదు, వద్దు.","No, don't."
"273","లేదు, అతను అబద్ధాలు చెబుతాడు ఇంకా అప్రమత్తం అయిపోతాడు.","No, he'll lie and you'll tip him off."
"274","నువ్వు అతడిని ఫాలో కావాలి.","You need to follow him."
"275","నిజంగానా? అవును.","Really? Yes."
"276","ఏం జరుగుతోందో తెలుసుకో.","Find out what's really going on."
"278","లేదు.","No."
"279","నేను తనతో మాట్లాడతాను.","I'll talk to him."
"280","అన్నట్లు, నా గురించి నీకు ఎలా తెలిసింది?","By the way, how did you hear about me?"
"281","మాజీ ప్రియురాలు చెప్పింది.","An ex-girlfriend."
"282","అది చాలా పెద్ద కథ.","It's a long story."
"283","హేయ్.","Hey."
"284","మనం మాట్లాడుకోవాలి అనుకుంటున్నాను.","I was hoping we could talk."
"285","నాకు కూడా అది ఇష్టమే, కానీ నేను బయటకి వెళ్తున్నాను.","I would love that, but I'm headed out."
"286","ఎక్కడికి వెళ్తున్నావు?","Where you going?"
"287","మనం ఎక్కడికి వెళ్తున్నాము?","Where are we going?"
"288","అది నాకు తెలియాలి ఇంకా నువ్వు తెలుసుకోవాలి.","That's for me to know, and you to find out."
"289","ఇందులో విందు కార్యక్రమం కూడా ఉందా?","Is there dinner involved in this?"
"290","ఉంది, ఉంది. సరే.","Yes, yes. Okay."
"291","కానీ ముందుగా, మనం ఇంకొక ప్రదేశానికి కాసేపు వెళ్లి రావాలి.","But first, we just need to pop in somewhere."
"292","మొదటగా ఒక చోట కాసేపు ఆగుతాము.","There's just one quick stop first."
"293","ఇదిగో వచ్చేశాము.","We are here."
"295","ఈ చారిటీ కళాఖండాల వేలంపాటకి నన్ను తీసుకువచ్చావా?","You brought me to the charity auction?"
"296","అవును. లేదు.","Yes. No."
"297","లేదు, నీకు ఊరికే చూపించాలని ఒక విషయం. నువ్వు ఒకటి మాత్రం త్వరగా చూడాలి.","No, I just want to sh One thing. I want you to see one thing really quick."
"298","నాకు అర్థం కాలేదు. ఇలా రా.","I don't understand. Come on."
"300","మనం ఇక్కడికి ఎందుకు వచ్చాం?","Why are we here?"
"301","నన్ను నమ్ము. నన్ను నమ్ము చాలు.","Trust me. Just trust me."
"302","హాయ్. ఎలా ఉన్నారు? మిమ్మల్ని కలవడం సంతోషంగా ఉంది. హాయ్.","Hi. How are you? Nice to see you. Hi."
"303","మీరు కలవడం సంతోషం.","Good to see you."
"304","సరే. సరిగ్గా నీ వెనుకే ఉంది. ఏంటి అది?","Okay. Right behind you. What is?"
"305","నన్ను ఇంటికి తీసుకువెళ్లు. ఏం అయింది?","Take me home. What's the matter?"
"306","నాకు ఇంటికి వెళ్లిపోవాలని ఉంది.","I wanna go home."
"307","సరే, విను, నేను తప్పు చేశానని తెలుసు.","Okay, listen, I know I know that I messed up."
"308","కానీ ఎలా చేశానో నాకు తెలియదు.","I I seriously don't know how."
"309","ఎలా చేశావో నీకు అర్థం కాలేదా?","You don't get how?"
"310","లేదు. నువ్వు సంతోషపడతావు అనుకున్నాను.","No. I thought you would be happy."
"312","అవును. లేదు.","Yeah. No."
"313","లేదు, నేను సంతోషంగా లేను.","No, I'm not happy."
"314","నాకు చాలా, చాలా అవమానంగా అనిపించింది.","I'm really, really fucking humiliated."
"315","అవమానమా ఆ పెయింటింగ్ చాలా గొప్పగా ఉంది.","Humiliat The painting is great."
"316","కానీ నువ్వు నా అనుమతి లేకుండా దాన్ని తీసుకువెళ్లావు, దాన్ని వేలానికి పెట్టమని నా తోటి ఉద్యోగుల్ని అడిగావు.","And you took it without my permission, and you asked my colleagues to hang it."
"317","సంతోషంగా దాన్ని వేలానికి పెట్టారు. వాళ్లు.","They were happy to hang it. They."
"318","దాన్ని వేలానికి పెట్టడం తప్ప వాళ్లకి మరో మార్గం లేకపోయింది.","They had no choice but to hang it."
"319","ఆ తరువాత నాకు ఇష్టంలేని ఈ డ్రెస్ ని నాతో వేయించావు, ఇంకా నాకు తెలిసిన వాళ్లందరి మధ్యకి నన్ను తీసుకువెళ్లావు.","And then you put me in this dress that I hate, and you took me there where everyone knows me."
"320","ఆ పెయింటింగ్ చెత్తగా ఉండటమే కాదు, అది ఇంకా పూర్తి కూడా కాలేదు.","And not only was that painting bad, it wasn't even finished."
"321","ఆ పెయింటింగ్ బాగుంది.","That painting is good."
"322","అది గొప్పగా ఉంది. గొప్పగా ఉంది! అది నిర్ణయించాల్సింది నువ్వు కాదు, జేసన్.","It's great. It's great! That is not your decision, Jason."
"323","అది నా పని.","It is my work."
"324","అది నా వ్యక్తిగత విషయం.","And it's private."
"325","నేను దానిని అమ్మాలని అనుకోవడం లేదని నీకు చెప్పాను కూడా.","And I told you that I didn't want to sell it."
"326","సరే, అయితే దాన్ని అమ్మకు! దాన్ని అసలు అమ్మకు!","All right, so don't sell it! Don't fucking sell it."
"327","కేవలం మీకు ఎందుకు అర్థం కావడం లేదో నాకు తెలియడం లేదు.","Just I don't see why people can't see it."
"328","ఎందుకంటే నేను కొన్ని సంవత్సరాల తరువాత మళ్లీ పెయింటింగ్ మొదలుపెట్టాను.","Because I haven't painted in years!"
"329","ఎందుకంటే నాకు అసలు అది అవసరమో కాదో అని కూడా నేను ఆలోచించుకుంటున్నాను!","Because I'm still trying to figure out if I even want to anymore!"
"330","అది బాగానే ఉందని నువ్వు ఎలా అనుకున్నావు?","How could you even think it would be okay?"
"331","బహుశా నువ్వు నేను ఊహించుకున్న మనిషివి కావేమో.","Maybe, , you're just not the person I thought you were."
"333","నేను వేరే ఉద్దేశంతో అనడం లేదు.","I didn't mean that like that."
"334","నా ఉద్దేశం అది కాదు.","I didn't."
"335","నేను నువ్వు ఊహించుకున్నట్లు లేనేమో.","Maybe I'm not."
"336","నువ్వు సంతోషంగా ఉండటమే నాకు కావాలి.","I just want you to be happy."
"337","ప్లీజ్. నీ సంతోషమే నువ్వు కోరుకుంటున్నావు.","Please. You want you to be happy."
"342","ఇది ఏంటి?","What is this?"
"343","తను దీన్ని ఇంజెక్ట్ చేసుకుంటున్నాడు అనుకుంటా.","I think he's been injecting it."
"344","ఏంటి? నీ ఉద్దేశం, డ్రగ్స్ మాదిరిగానా? లేదు.","What? You mean, like, drugs? No."
"345","అతని చేతి మీద మచ్చలు ఉన్నాయి.","He has marks."
"346","చెత్త.","Shit."
"347","సరే. ఉండు. బహుశా అతను అనారోగ్యంతో ఉన్నాడేమో ఇంకా నువ్వు ఆందోళనపడకూడదు అనుకున్నాడేమో.","Um, okay, wait. Maybe he's sick and doesn't want to worry you."
"348","అతను ఏదో మందు కనిపెట్టాలని ప్రయోగం చేస్తున్నాడు.","He's trying out some experimental drug."
"349","రహస్య అనారోగ్యం అనేది అబద్ధం.","I think secret illness is a reach."
"350","అలాగే తనకి ఈ గిడ్డంగి ఉందని నాకు చెప్పలేదు కూడా.","Although he has a storage unit that he didn't tell me about."
"351","నిజంగానా? అందులో ఏం ఉంది? అదే.","Really? What's in that? That."
"352","ఇంకా ఏం ఉన్నాయో తెలియదు. నేను లోపలికి వెళ్లలేకపోయాను.","I don't know what else. I couldn't get in."
"354","దాన్ని సీక్వెన్స్ చేయగలవా?","Can you sequence it?"
"355","ఇందులో పెద్దగా ఏమీ మిగలలేదు, కానీ, చేస్తాను.","It's not much of a sample, but, yeah."
"356","బహుశా అది ఏంటో తెలుసుకో, ఆ తరువాత మనం ఏం చేయాలో ఆలోచిద్దాం.","Maybe just find out what it is, and then we figure out what to do."
"358","నువ్వు బాగానే ఉన్నావా?","Are you okay?"
"359","బాగున్నా.","Yeah."
"360","నాకు ఈ రోజంతా ఒంటరిగా గడపాలని ఉంది.","Just think I need a day for myself."
"361","మనం ఈ రాత్రి తిరిగి ఇక్కడే కలుసుకుందామా?","Can we meet back here tonight?"
"362","ఇదే నా ప్రపంచం అయితే ఏంటి?","And what if this is my world?"
"363","ఏది ఏమైనా, ఈ రాత్రి నన్ను ఇక్కడ కలుస్తావా?","Either way, meet me here tonight?"
"365","మీకు ఏమైనా సాయం కావాలా?","Can I help you?"
"366","మీరు ఆర్టిస్టా?","Are you the artist?"
"367","ఇది అద్భుతంగా ఉంది.","It's, , amazing."
"368","థాంక్స్.","Thanks."
"369","ఇదీ.","This."
"370","ఎందుకో కానీ, ఇది నాకు జూన్వే బీచ్ ని గుర్తు చేస్తోంది.","It reminds me of Juneway Beach, for some reason."
"371","ఇది అదే.","It is."
"373","అవును, ఇది ఎలా ఉందంటే ఏదో ఆకురాలు కాలాన్ని గుర్తు చేస్తోంది.","Yeah, it's like it's like the fall or something."
"374","నిజానికి, నవంబర్ మాసం.","November, actually."
"375","నాకు సూర్యోదయాలు అంటే ఇష్టం.","I like the sunrises."
"376","అవును.","Yeah."
"377","సరే, మీరు అలా చుట్టూ చూసి రండి. నేను కాసేపట్లో వస్తాను.","Well, I'll let you just, um, walk around. I'll be over here."
"378","మీకు ఇంకేమయినా సందేహాలు ఉంటే నన్ను అడగండి.","If you have any more questions just let me know."
"379","నా భార్య కూడా ఆర్టిస్టు.","Um, my my wife is, is an artist."
"381","ఆమె స్థానికంగానే ఉంటారా? అవును. అవును. కానీ.","Is she local? Yeah. Yeah. Well."
"382","వాస్తవంగా, లేదు.","Actually, no."
"383","టెక్నికల్ గా చెప్పాలంటే.","technically."
"384","అంటే, మేము కలిసి ఉండటం లేదు.","So, we're not together."
"385","అందుకే అంటే లేదు, మేము కలిసి ఉండటం లేదని కాదు.","So Well, no, it's not that we're not together."
"386","అదీ.","It's."
"387","సంక్లిష్ట పరిస్థితి.","Complicated."
"388","అవును.","Yeah."
"390","హేయ్, నాతో కలిసి కాఫీకి ఏమైనా రాగలరా?","Hey, would you grab a coffee with me or something?"
"391","అంటే, నేను రోజంతా ఇక్కడే ఉండాల్సి వస్తుంది.",", well, I'm kind of stuck here all day."
"392","సరే. లేదా, చూడండి, అంటే, మీరు డ్యూటీ అయిపోయాక, లేదా.","Okay. Or, you know, like, after y-you get off, or."
"393","లేదా ఇది మీరు నన్ను నిరుత్సాహానికి గురి చేస్తున్నారు.","Or This is That's you letting me down easy."
"395","సారీ. సారీ.","I'm sorry. Sorry."
"396","అవును. ఛ. ఛ, సారీ.","Yeah. Fuck. Fuck, sorry."
"397","మరేం ఫర్వాలేదు. మీరు వచ్చినందుకు థాంక్స్.","All good. Thanks for coming in."
"398","థాంక్యూ. థాంక్యూ.","Thank you. Thank you."
"399","హాయ్. మీకు ఏమైనా సాయం చేయగలనా?","Hi. Can I help you?"
"400","నువ్వు డ్రెస్ చేసుకున్నావు.","You're dressed."
"402","బాగుంది.","Great."
"403","కితకితలు పెట్టాలి. కితకితలు పెట్టాలి.","Tickle time, tickle time."
"404","ఇది నీ ప్రపంచం కాదా?","Not your world?"
"405","త్వరలో మనకి ఆంప్యూల్స్ అయిపోతాయి ఇంకా అవకాశాలు కూడా అయిపోతాయి.","Soon we'll be out of ampoules and options."
"406","అవును.","Yeah."
"407","నేను చూడచ్చా?","May I?"
"408","థాంక్యూ.","Thank you."
"410","నువ్వు ఆమె జుట్టు పొడవు, రంగు, ఆమె ఉద్యోగం వివరాలు రాస్తున్నావు.","You're writing about her hair length, color, job description."
"411","అది సరిపోతుందని అనుకోను.","I don't think it's enough."
"412","నేను చేయగలిగింది చేస్తున్నాను. నువ్వు ప్రయత్నిస్తున్నావని నాకు తెలుసు, కానీ నువ్వు మరింత లోతుగా అధ్యయనం చేయాలి.","I'm doing the best that I can. I know you are, but I think you need to go deeper."
"413","సరే.","Yeah."
"415","నేను కాస్త గాలి పీల్చుకు రావాలి అనుకుంటా.","I think I need to get some air."
"416","మనం తినడానికి ఏదైనా ఏర్పాటు చేయి. నేను కాసేపట్లో వస్తాను.","Bring us some food or something. I'll be I'll be back."
"420","అవును, చివరి పేరు డెస్సన్. డి ఇ ఎస్ ఎస్ ఇ ఎన్.","Yeah, last name Dessen. D-E-S-S-E-N."
"421","సరే. థాంక్యూ. హేయ్.","Okay. Thank you. Hey."
"422","నువ్వు నన్ను వదిలి వెళ్లిపోయావు అనుకున్నా.","Thought you'd left me."
"423","సారీ. నేను నిన్ను ఎప్పటికీ వదిలి వెళ్లనని ప్రామిస్ చేస్తున్నాను.","Sorry. I I promise I would never leave you."
"424","నువ్వు అసలు ఎక్కడికి వెళ్లావు?","Where have you been?"
"425","నన్ను నేను గమనిస్తున్నాను, నన్ను నేనే అనుసరిస్తున్నాను.","I've been watching myself, following myself."
"426","డానియేలానీ ఇంకా నన్ను రెస్టారెంట్ వరకూ అనుసరించాను, వాళ్లని చూస్తూ కిటికీ బయట గడిపాను.","Followed Daniela and I to a restaurant, sat outside the window just watching."
"427","తరువాత వాళ్లు సినిమాకి వెళ్లారు.","Then they went to a movie."
