"Index","Telugu Text","Mapped English Text"
"108","సరే. అంటే, నేను అక్కడ ఆటోపైలెట్ బటన్ ఆన్ చేస్తే, నా ఫ్లయిట్ స్క్రీన్ మీద మనం ఇక్కడ ఉన్నామని చూపిస్తూ ఒక మెసేజ్ వస్తుంది. మీరు చూస్తే గనుక, ఆ ఆటోపైలెట్, ఎపి1 అమలులో ఉంటుంది. ఇంకా ప్రోగ్రామ్ గమ్యాలు ఇక్కడ ఉన్నాయి.","Okay. Well, if I press autopilot there, I get a message on my flight screen here that shows you there, if you look, the autopilot AP1 is engaged. And the program destinations are here."
"109","అది హీత్రో, ఇజిఎల్ఎల్, 320 డిగ్రీల బేరింగ్ లో ఉంది.","That's Heathrow, EGLL, at a bearing of 320 degrees."
"110","ఆ విషయం నాకు ఎలా తెలుస్తుంది?","How do I know that?"
"111","ఆ డిగ్రీల గురించా? అది లండన్ అని. అంటే, అది ఇక్కడ ఉంటుంది. ఇజిఎల్ఎల్, అది కోడ్. యూరోప్, గ్రేట్ బ్రిటన్, లండన్.","About the degrees? That it's London. Well, it's there. EGLL, that's the code. Europe, Great Britain, London."
"112","అయితే నువ్వు ఇప్పుడు ఏమీ ముట్టుకోనక్కరలేదా?","So you don't have to touch anything now?"
"113","లేదు. హీత్రో చేరుకోవడానికి ఒక గంట ముందు వరకూ.","No. Not until an hour before Heathrow."
"114","సలామ్ ఆలేకుమ్. ఆలేకుమ్ సలామ్.","Peace be upon you. And also upon you."
"115","- ఇక్కడ ఇన్ఛార్జ్ నువ్వేనా? - అవును. నేను ఎటిసిలో పని చేస్తాను. ఈ ఉదయం టేకాఫ్ అయిన విమానంలో ఏదో సమస్య ఉండవచ్చని అనుకుంటున్నాం. విమానాలు నా డిపార్టుమెంట్ కాదు. నాకు అది తెలుసు. అది అర్థమైంది. కెమెరాలు.","- You're in charge here, yes? - Yes. I work in ATC. We think there might be a problem with one of the aircraft that took off this morning. Planes are not my department. I get that. I realize that. The cameras."
"116","నేను ఫుటేజ్ చూడచ్చా?","Can I see the footage?"
"117","ఆ ఫుటేజ్ చూడటానికి నిన్ను అడగచ్చా?","Can I ask to see the footage?"
"118","మీరు అడగవచ్చు. ఎప్పుడైనా అడగచ్చు.","You can ask. You can always ask."
"119","సరే. థాంక్యూ.","Okay. Thank you."
"120","నీ సీట్ బెల్ట్ తీసేయ్. బెల్టు తీసేయ్.","Take your seat belt off. Belt off."
"121","కదులు.","Move."
"122","నా చేయి వదులు. ఆపు.","Let go of my arm. Stop it."
"123","నా చేయి నొప్పి పెడుతోంది.","You're hurting my arm."
"124","నా చేయి! హేయ్! ఆమె నువ్వు అడిగింది చేస్తోంది కదా.","My arm! Hey! She's doing what you want."
"125","ముందుకు కదులు.","Go on."
"126","అది గన్ ఏమో ఆమెని అడుగు.","Ask her if it was a gun."
"127","అది గన్ ఏమో అడుగు.","Ask if it was a gun."
"128","అక్కడ కూర్చో. ఆమె ఏం చేసింది?","Sit there. What's she done?"
"129","ఈమె ఇక్కడ ఉంటుంది.","She stays here."
"130","నువ్వు బాగానే ఉన్నావా, అమ్మాయి? ఏం జరుగుతోంది? ఏం జరుగుతోందా? అక్కడ ఒక మనిషి ఉన్నాడు, అతను వాళ్ల పక్షం వెళ్లిపోయాడు.","You all right, pet? What's happening? What's happening? There's a man up there who's gone over to their side."
"131","తనని తాను కాపాడుకోవడం కోసం మనందరికీ ద్రోహం చేశాడు. అదే జరుగుతోంది అక్కడ.","He's just betrayed us all to help himself. That's what's happening."
"132","నాకు అర్థం కాలేదు.","I don't understand."
"133","మొదటగా, అక్కడ కూర్చో. సరిగ్గా అక్కడ.","First one, sit there. Just here."
"134","చిన్నగా మాట్లాడు.","Keep your voice down."
"135","ఈమె పరిస్థితి మరీ ఘోరంగా ఉంది. నేను... నేను తనకి కొన్ని మందులు తెచ్చి ఇస్తాను. - ఆమె బాగానే ఉంది. - తను బాగాలేదు. ఆమెకు పాపం చాలా రక్తం కారుతోంది. నేను విమానం వెనుక భాగానికి ఒకసారి వెళ్లి వస్తాను. లేదు, అది జరగని పని.","She's in a really bad way. I need to get some more supplies to her. - She's fine. - She's not. She's... She's bleeding really badly. If I could just get to the back of the plane. No, it's not happening."
"136","కూర్చో.","Sit."
"137","హలో? కింద కూర్చో.","Hello? Sit down."
"138","కూర్చో.","Sit."
"139","గేమ్ సెంటర్ ఇప్పుడు ఆడండి","**[NO ENGLISH MATCH FOUND]**"
"140","నన్ను పట్టుకో చూద్దాం.","Shiver me timbers."
"141","మీ ప్రత్యర్థితో చాట్ చేయండి నిజంగానా? ఏమీ జరగనట్లే నువ్వు బయటకి వెళ్తున్నావా? అయితే, తను మనం ఏం చేయాలని ఆశిస్తున్నాడు?","Seriously? You're just going out like nothing's happened? Well, what would he want us to do?"
"142","- మనల్ని ఆందోళన పడవద్దని చెప్పాడు. - ఆ విషయం నీకు తెలియదు. - కానీ నువ్వు నీ పని మీద నువ్వు వెళ్లిపోతున్నావు. - నీకు కూడా ఏం జరిగిందో తెలియదు, కదా. ఈ రోజు నాకు చాలా ముఖ్యమైన రోజు, ఖాయ్.","- He'd tell us not to worry. - You don't know that. - And to get on with our day. - You don't know that though. This is an important day for me, Kai."
"143","పరిస్థితి ఏమైనా మారితే, మనం ఫోనులో మాట్లాడుకుందాం.","If anything changes, we'll call."
"144","లేదా మెసేజులు పంపుకుందాం.","Or text."
"145","నేను ఉన్నాను. సరేనా?","I'm here. Okay?"
"146","నా ఫోను ఆన్ లోనే ఉంచుతాను.","I'll leave my phone on."
"147","నీ ఫోన్ ఎప్పుడు ఆఫ్ అయింది గనుక?","When has your phone ever been off?"
"148","ఇంకా? వాళ్లు దుబాయ్ లో, ఎయిర్ పోర్ట్ సిబ్బందితో మాట్లాడారు. అది తప్పుడు హెచ్చరిక. అది నిజమేనా? ఏదో పొరపాటుగా అనుకున్నారు.","And? They spoke to the airport, to Dubai. It's a false alarm. Are you sure? All a misunderstanding."
"149","మార్షా.","Marsha."
"150","చూశావా?","See?"
"151","ఇదే అసలు సమస్య. అలాంటి మనిషిని నేను భరిస్తున్నాను. - మార్షా... - లేదు, సామ్ ఇలాగే ఉంటాడు. అతను ఎప్పుడూ ఇలాగే చేస్తుంటాడు. ముఖ్యమైన విషయం ఏమిటంటే, విమానంలో ఏం జరుగుతున్నా సరే, అతను బాగానే ఉన్నాడు.","This is the problem. This is the man I'm dealing with. - Marsha... - No, this is what Sam's like. This is what he will always be like. The main thing is, whatever we thought was happening on that plane, he's okay."
"152","సామ్ క్షేమంగా ఉన్నాడు.","Sam is okay."
"153","థాంక్యూ.","Thank you."
"154","అయితే, నాన్న క్షేమంగా ఉన్నాడా?","So, Dad's okay?"
"155","తుపాకి పేలింది, నాకు అదే వినిపించింది. - గన్ పేలడం విన్నావా? - లేదు, అది జరిగిందని విన్నాను. బిజినెస్ క్లాసులో ఒక గన్ పేలింది, అక్కడ గొడవ జరిగింది, ఇద్దరు వ్యక్తులు వాళ్ల మీద దాడికి ప్రయత్నించారు. జనం అదే అనుకుంటున్నారు. వాళ్లని నువ్వు చూశావా? ఆ మగాళ్లని?","A gun went off, that's all I heard. - You heard the gun? - No, I heard that's what happened. A gun went off in business, there was a fight, two guys tried to take them on. That's what people were saying. You saw 'em then? These blokes?"
"156","వాళ్లు నన్ను ఇక్కడికి పంపించినప్పుడు చూశాను. వాళ్లని కట్టేసి ఉంచారు. ""ఇకపై సహించము"" అని వాళ్లు ఎందుకు అన్నారో ఇప్పుడు అర్థం అవుతోంది. అసలు వాళ్లు ఇలా ఎందుకు చేస్తున్నారనేది కావాలి. నేను అదే తెలుసుకోవాలి అనుకుంటున్నాను. అయితే, మరి నువ్వు ఏం చేశావు? ఇలా చూడు, నువ్వు ఏదో చేసి ఉంటావు. ఆమెతో అలా మాట్లాడకండి. కానీ, దాని గురించి ఆలోచించు. ఏ కారణం లేకుండా ఆమెని వాళ్లు ఇక్కడకి పంపించరు.","Only when they brought me back here. They were tied up. That's what they must have meant by will not be tolerated. It's why they're doing this in the first place. That's what I wanna know. So, what did you do then? Come on, you must have done something. Don't talk to her like that. Well, think about it. They've not put her here for no reason."
"157","వెనక్కి తిరగండి.","Turn round."
"158","నువ్వు. ఎదురుగా చూస్తూ కూర్చో.","You. Face forward."
"159","నువ్వు. నోరు మూయి.","You. Shut up."
"160","హేయ్, అంతా బాగానే ఉంటుంది, సరేనా? నేను ఇప్పుడే ఏం చెప్పాను?","Hey, it's gonna be all right, okay? What the fuck did I just say?"
"161","ప్యాసింజర్ 1కెకి అభ్యర్థన పంపబడింది...","**[NO ENGLISH MATCH FOUND]**"
"162","ప్యాసింజర్ 2డి మిమ్మల్ని సవాలు చేస్తున్నారు ఆమోదించండి తిరస్కరించండి","**[NO ENGLISH MATCH FOUND]**"
"163","2డి","**[NO ENGLISH MATCH FOUND]**"
"164","సవాలు ఆమోదం","**[NO ENGLISH MATCH FOUND]**"
"165","కెఎ29 ప్రయాణికులు ఈ ప్రాంతంలో ఉన్నారు. మిగతా విమానాల ప్రయాణికులతో కలిసి.","Passengers of KA29 will be in this area. Mixed in with other flights."
"166","ఇదంతా చాలా మామూలు వ్యవహారం.","It's all pretty normal."
"167","అయితే ఏదైనా అనుమానాస్పదంగా ఉండటం చూశారా? ఈ రోజా? లేదు.","So you saw nothing suspicious? Today? No."
"168","ఇక్కడ సెక్యూరిటీ చాలా గట్టిగా ఉంటుంది. ఎలాంటి పొరపాట్లు జరగవు.","Security's tight here. We're good."
"169","చూశారా?","See?"
"170","ఆమెని నేను గుర్తించాను.","I recognize her."
"171","నీలా. అది ఆమె పేరు.","Neela. That's her name."
"172","మా అమ్మాయిని తన బిడ్డ పార్టీకి తీసుకువెళ్లింది. నీలా, అవును.","Took my daughter to her kid's party. Neela, yeah."
"173","కిందటి వారం, ఒక వ్యక్తి స్టార్టర్ పిస్టల్ తీసుకువస్తుంటే ఆమె ఆపింది.","Last week, she stopped a man from bringing on a starter pistol."
"174","అంటే అది, నీకు తెలుసా, ఏదైనా పోటీని ప్రారంభించే గన్.","As in, you know... a gun to start a race."
"175","నీలా సమర్థురాలు. ఏదైనా సమస్య ఉంటే, ఆమె వెంటనే గుర్తిస్తుంది.","Neela's the best. If there's any kind of problem, she'll spot it."
"176","మళ్లీ ఫాస్ట్ ఫార్వార్డ్ చేయి.","Fast-forward again."
"177","అంతేనా? తను ఇంటికి వెళ్లిపోయిందా?","That's it? She went home?"
"178","బహుశా ఆమె షిఫ్టు అయిపోయి ఉండచ్చు.","Maybe it was the end of her shift."
"179","అయి ఉండచ్చు. ఎవరైనా చెక్ చేశారా?","Maybe. Did anyone check?"
"180","2డి: ఇక్కడ చాట్ చేయండి.","**[NO ENGLISH MATCH FOUND]**"
"181","మీ సందేశం టైప్ చేయండి","**[NO ENGLISH MATCH FOUND]**"
"182","2డి: గ్రౌండ్ కి ఎంత సమాచారం ఉంది?","**[NO ENGLISH MATCH FOUND]**"
"183","1కె: ఇంకా ఏం తెలియదు.","**[NO ENGLISH MATCH FOUND]**"
"184","బాగానే ఉన్నావా?","You all right?"
"185","సీట్ బెల్ట్.","Seat belt."
"186","అన్నీ తీసుకున్నావా?","Got everything?"
"187","మంచి నీళ్లు ఉన్నాయా? స్నాక్స్ ఉన్నాయా? నీ రీడింగ్ డైరీ తీసుకున్నావా?","Got your water? Got your snack? Got your reading diary?"
"188","సరేనా? సరే, లోపలికి వెళ్లు. లోపలికి వెళ్లు.","Yeah? Right, go on in. In you go. In, in, in, in."
"189","ఇంతకుముందు చెప్పావు.","You said it before."
"190","- ఇంతకుముందు ఏం చెప్పాను? - నాకు అపెండిక్స్ ఆపరేషన్ అయిందని.","- Said what before? - That I had my appendix out."
"191","నేను చెప్పానా?","Did I?"
"192","కిందటి టెర్మ్ లో కూడా అదే చెప్పావు. అపెండిక్స్ ఆపరేషన్ కేవలం ఒక్కసారి మాత్రమే జరుగుతుంది, కాబట్టి దాన్ని ఎదుర్కొందాం. మరి ఇదే మాటని ఎవరైనా రెండుసార్లు చెబితే... ఏదో తేడాగా ఉందని అర్థం. నిజం. మరి నువ్వు ఏం చేస్తావు? మా బాస్ నీ అంత తెలివైన వాడు కాకూడదని ఆశిస్తాను. ఇంక నువ్వు లోపలికి వెళ్లు, ప్లీజ్. నువ్వు ఆలస్యం అయ్యావు. లోపలికి, వెళ్లు.","You said that last term. And you can only have your appendix out once, let's face it. So if somebody says that twice... Something smells dodgy. Something smells dodgy. Yes. What are you gonna do? I'm gonna hope that my boss isn't as clever as you. Now go in, please. You're late. In, in, in."
"193","- లవ్ యూ. బై బై. - గుడ్ బై. లవ్ యూ!","- Love you. Bye-bye. - Goodbye, love you!"
"194","ప్లాజాలో ఇద్దరి కోసం టేబుల్ కావాలి.","A table for two at the Plaza."
"195","నా పుట్టినరోజున నేను కోరుకునేది అదే.","That is what I want for my birthday."
"196","నీకు ఎండ్రకాయల వంటకాన్ని విందుగా ఇస్తాను. సరేనా?","I want to buy you lobster. Okay?"
"197","సరే. అయితే, ఆ విందు సవ్యంగా చేద్దాం. స్టార్టర్లు... అన్ని రకాల సీఫుడ్... బిడ్డని చూసుకునే మంచి ఆయా... ఫాతిమా. నేను మళ్లీ ఫోన్ చేస్తాను.","Okay. So, let's do it properly. Starters... All the seafood... A proper babysitter... Fatima. I'll call you back."
"198","అబ్దుల్లా. నా పేరు నటాలియా. ఎయిర్ పోర్ట్ సెక్యూరిటీ.","Abdullah. It's Natalia. Airport security."
"199","మీ ఫ్రెండ్ నీలా విషయంలో, మీరు చెప్పినట్లే జరిగింది, ఆమె త్వరగా వెళ్లిపోయింది. ఒంట్లో బాగాలేదని చెప్పింది.","Your friend Neela, you were right, she left early. She said she was sick."
"200","ఆమె అంత అనారోగ్యంగా ఏమీ కనిపించలేదు. అవును, ఆమె అదే చెప్పింది, మరి.","She didn't seem very sick. Well, that's what she said, apparently."
"201","సరే. థాంక్యూ.","Okay. Thank you."
"202","1కె: ఇరాకీ ఎటిసి మన విమానాన్ని కాంటాక్ట్ చేస్తారు. కానీ ఎలాంటి సమాధానం ఉండదు.","**[NO ENGLISH MATCH FOUND]**"
"203","ఎందుకంటే కాక్ పిట్ లో ఎవ్వరూ లేరు.","**[NO ENGLISH MATCH FOUND]**"
"204","2డి: మరి అప్పుడు ఏం జరుగుతుంది?","**[NO ENGLISH MATCH FOUND]**"
"205","1కె: వాళ్లు ఇరాకీ సైన్యాన్ని సంప్రదిస్తారు.","**[NO ENGLISH MATCH FOUND]**"
"206","టర్కీ - సిరియా - ఇరాక్","**[NO ENGLISH MATCH FOUND]**"
"207","ఇరాక్","**[NO ENGLISH MATCH FOUND]**"
"208","నా గర్ల్ ఫ్రెండ్ చాలా కృతజ్ఞతలు చెప్పింది.","My girlfriend's very grateful."
"209","సరే, మరేం ఫర్వాలేదు. ఆమె కోపంగా కూడా ఉంది. తెలుసా? తన మాజీ భర్త... ప్రమాదంలో లేకపోయినా అనవసరంగా తనని ఆందోళన పడేలా చేసినందుకు కోపంగా ఉంది. సరే. మళ్లీ, అవును, కౌంటర్ టెర్రరిజమ్ కేసులు వచ్చినప్పుడు నాకు ఎందుకు ఫోన్ చేస్తావో తెలుసు కానీ... లేదు, ఇది పని గురించి చేసిన ఫోన్ కాదు. అవును, ఇది ఇప్పుడు కాస్త విచిత్రంగా అనిపిస్తోంది.","Yeah, no problem. She's also angry. You know? Angry that her ex... her ex made her think that he was in danger when he obviously wasn't. Okay. Again, yeah, I get why you might call me about all the counterterrorism stuff, but... No, this isn't a work call. Yeah, this is getting a bit strange now."
"210","సరే, నువ్వు ఏం అనుకుంటున్నావో తెలుసుకోవాలి అనిపించింది.","Well, I just... I just wanna know what you think."
"211","నువ్వు ఏం అనుకుంటావంటే... నాకు తెలుసు, ఇది ఒక విచిత్రమైన ఫోన్ కాల్, నాకు తెలుసు. ఎవరైనా ఆ ప్రేమని వదిలి వెళ్లిపోయిన వాళ్ల గురించి ఆలోచిస్తున్నావా... ప్రేమ బంధం వదిలి వెళ్లిపోయిన మనిషి గురించి, అతను ఏం చెప్పినా, ఏం చేసినా ఆమె అంతగా పట్టించుకుంటోంది అంటే నువ్వు ఏం అనుకుంటున్నావు?","You think that... I know it's a... a weird call to make, I do. You think that for someone who's meant to... You think that for someone who's meant to have moved on, she cares too much about what this guy says and does?"
"212","అవును, అందుకే...","Yeah, so..."
"213","అందుకే, ఈ మాజీ భర్త నిజంగానే మాజీనా అని నిన్ను నేను అడిగినప్పుడు...","So, when I asked you if this ex really is an ex..."
"214","హేయ్, నువ్వు అలా అన్నప్పుడు, తెలుసా... లేదా మన మధ్య బంధం ముగిసింది అని నువ్వు ఒప్పుకున్నప్పుడు, అది ముగిసిపోయింది.","Hey, when you said, you know... Or when we agreed that it was... it was over between us, it was over."
"215","మనం ఎప్పుడూ మాట్లాడుకోలేదు, నువ్వు ఎప్పుడూ ఫోన్ చేయలేదు. అది అంతే.","We never spoke about it, you never called me... You know. That was it."
"216","- నువ్వు ఇంకా లైన్ లోనే ఉన్నావా? - ఉన్నాను. చూడు... చూడు, డానియెల్. నాదే పొరపాటు అంటే, సరే, - ఆమె కోసం పోరాడవచ్చంటే... - అందుకు ఆమె అర్హురాలు. ...అప్పుడు ఆమె ఆ వ్యక్తి కోసం తనకి కావలసినంతగా పట్టించుకోవచ్చు, ఎందుకంటే ఆమె నన్ను ఎక్కువ గౌరవించాలని కోరుకుంటున్నాను. ఆమె విషయంలో స్పష్టంగా ఉండు, డాన్, లేదా పరిస్థితులు మారిపోవచ్చు.","- Are you still there? - Yes. Look... Look, Daniel, if it was me, okay, - and she's worth fighting for... - She is. Then she can care about this guy all she wants, 'cause I'm just gonna make sure that she cares about me more. Commit, Dan, or things move on."
"217","సరే, ఆమెని వెళ్లనివ్వండి.","All right, let 'em through."
"218","అవును, ఇంకా బహుశా మళ్లీ ఇలాంటి విషయాల గురించి నాకు ఇంకెప్పుడూ ఫోన్ చేయకు, సరేనా?","Yeah, and maybe... maybe don't call me about this kinda thing again, yeah?"
"219","సారీ.","Sorry."
"220","మరేం ఫర్వాలేదు.","It's all right."
"221","కింగ్డమ్ 2-9, ఇది బాగ్దాద్ కంట్రోల్, వింటున్నారా?","Kingdom 2-9, this is Baghdad control, how do you read?"
"222","కింగ్డమ్ 2-9, మేము కంట్రోల్, మీరు వింటున్నారా?","Kingdom 2-9, control, how do you read?"
"223","అందులో నుంచి ఏదో మెసేజ్ వస్తోంది. నువ్వు ఒకసారి వినాలి.","Got a message coming through in there. Have a listen."
