"Index","Telugu Text","Mapped English Text"
"1","ఎవరు నువ్వు?","Who are you?"
"2","చూడు, ఈ జనం...","Look, these people..."
"3","ఈ జనం ఎవ్వరూ నాకు ఏ మాత్రం ముఖ్యం కాదు. నాకు వీళ్లలో ఒక్కరు కూడా తెలియదు, కానీ వాళ్లు మిమ్మల్ని ఏదైనా చేయాలని ప్రయత్నిస్తే, మీలో ఎవరైనా వాళ్లలో ఒక్కరిని ఎదుర్కోలేకపోయినా, అప్పుడు ఈ మొత్తం విమానం నేల కూలిపోతుంది. - విమానం భద్రంగా ఉంది. - సరే. ప్రస్తుతానికి, భద్రంగా ఉంది, సరే.","these people don't mean anything to me. I don't know any of these people, but if they try something and one of you lot let off one of those, and then this plane goes down. The plane's secure. Yeah. Right now, it is, yeah."
"4","మాకు ఏ సాయం అవసరం లేదు. సరే, ఇప్పటికి మీకు అవసరం లేదు, కానీ మళ్లీ అంతా గందరగోళం అయితే ఏం చేస్తారు?","We don't need any help. Well, right now you don't, but what if it all goes wrong again?"
"5","- నువ్వు అసలు ఎవరు? - మీరు చాలా త్వరగా పని మొదలుపెట్టారు, కదా?","- Who the fuck are you? - You went too early, didn't you?"
"6","మరికొద్ది ప్రయాణం తరువాత మీరు ఈ పనిని చేయాలి అనుకున్నారు, కానీ ఆ పెద్దమనిషి హడావుడిగా ఫస్ట్ క్లాస్ లోకి పరిగెత్తుకొచ్చాడు ఆయన ఆందోళనగా కంగారుగా కనిపించాడు ఆ తరువాత నువ్వు అతనికి ఆకుపచ్చ టోపీ ఇచ్చావు. ఆ తరువాత మీకు తెలుసు, అంతా జరిగిపోయింది.","You was gonna do this later on in the flight, then that man came rushing into first class and he was worried and panicking and then you gave him a green hat. The next thing you know, it was all going off."
"7","అది మీ ప్లాన్ లో భాగం కాదు, కదా? వెళ్లి అతని పాస్ పోర్ట్ తీసుకో. అది మీ ప్లాన్ లో భాగం కాకపోవచ్చు.","That wasn't part of the plan, right? Go and get his passport. That can't have been... That can't have been part of the plan."
"8","చూడు, మొదటి గంటలోనే ఇంత గందరగోళం జరిగితే, తరువాత ఆరు గంటల్లో ఇంకెంత జరగచ్చో ఊహించండి.","Look, if it's all going wrong in the first hour, imagine what could happen in the next six."
"9","సరే.","Okay."
"10","అతను నీ వైపే వస్తున్నాడు, ఎడీ. హేయ్, ఓయ్. మీరు ఏం చేస్తున్నారు? నోరు మూయి.","He's coming down your side, Eddie. Hey, oi. What you doing? Shut up."
"11","నెల్సన్ - సామ్ బ్రిటీష్ పౌరుడు","**[NO ENGLISH MATCH FOUND]**"
"12","- ""సామ్ నెల్సన్."" - అవును.","- Sam Nelson. - Yeah."
"13","మేము మూర్ఖులం అనుకుంటున్నావా...","You think we're stupid..."
"14","సామ్ నెల్సన్? లేదు, నేను అనుకోను. నువ్వు మూర్ఖుడివి కాదనుకుంటా. చాలా తెలివైనవాడివి. కానీ...","Sam Nelson? No, I don't. I don't think you're stupid. I think you're very smart. But..."
"15","చూడు, నేనేం చెబుతున్నానో నీకు అర్థమవుతోంది అనుకుంటా.","Look, I think you get what I'm saying."
"16","ఇతనిని తన సీటు దగ్గరకి తీసుకువెళ్లు.","Take him back to his seat."
"17","దీన్ని ఓపెన్ చేయి.","Open it."
"18","వీళ్లని నువ్వు మళ్లీ చూడాలి అనుకుంటే, దీన్ని ఓపెన్ చేయి.","You wanna see them again, open it."
"19","మెసేజ్ లు మార్షా","**[NO ENGLISH MATCH FOUND]**"
"20","నేను విమానంలో తిరిగి వస్తున్నా. ఆటల ఆడకు.","**[NO ENGLISH MATCH FOUND]**"
"21","నా టేకాఫ్ 9.12 గంటలకి","**[NO ENGLISH MATCH FOUND]**"
"22","ఆ విమానం ఎక్కకు. చాలా ఆలస్యం అయింది ఇది అంతేనా?","Is that it?"
"23","ఇదే సమయం. నేను వెళ్తాను, నువ్వు అనుసరించు. సరేనా?","This is it. I go, and you follow. Yeah?"
"24","వద్దు!","No!"
"25","అతడిని పట్టుకో, ఎడీ! ఊపిరి ఆడనివ్వకు!","Grab him, Eddie! Strangle him!"
"26","కిందికి!","Down!"
"27","ఆ తుపాకి! తుపాకిని తన్ను!","The gun! Kick the gun!"
"28","కూర్చోండి. వెంటనే కూర్చోండి. ముందుకు కూర్చో! కదలద్దు!","Sit down. Sit the fuck down. Face forward! Don't fucking move!"
"29","గన్! గన్ ఎక్కడ ఉంది?","The gun! Where's the gun?"
"30","నేను ముందే చెప్పినట్లు, నాకు ఇంటికి వెళ్లాలని ఉంది.","Like I said, I just wanna get home."
"31","నేను చెప్పబోతున్నాను, సరేనా? దాదాపు ఐదు యేళ్లుగా అసలు కలవని వ్యక్తి ఉదయం ఏడు గంటలకు ఫోన్ చేయడం అంటే, చాలా త్వరగా చేసినట్లు కదా? నాకు తెలుసు. సారీ. నాకు ఒక సాయం చేయాలి. మరో ముప్పై సెకన్లలో నేను నా కారులో ఉంటాను... ఇంకా విను, ఇందులో విషయం ఉండకపోవచ్చు, కానీ... ...అది నా తరహాలో ""త్వరగా పూర్తి చేయి"" అని చెప్పడం. థాంక్స్. నా గర్ల్ ఫ్రెండ్ మాజీ భర్త దుబాయ్ నుండి లండన్ కి విమానంలో బయలుదేరాడు. ఆ విమానం టేకాఫ్ అయిన వెంటనే అతను ఒక మెసేజ్ చేస్తూ విమానంలో ఏదో పరిస్థితి తలెత్తిందని చెప్పాడు.","I'm gonna say it, yeah? 7 a.m. is way too early to call someone you haven't seen in about, what, five years? I know, I know. I'm sorry. I need one favor. I'm heading into my car in about 30 seconds... And listen, there might not be anything in this, but... Which is my way of saying, make it quick. Thanks. My girlfriend's ex is on a plane to London from Dubai. He messaged her straight after takeoff saying there was an incident on board."
"32","ఆమె వెంటనే సమాధానంగా మెసేజ్ చేసింది కానీ, అది ఆ ఫోన్ కి అందలేదు. నన్ను నువ్వు ఏం అడుగుతున్నావు? సరే, అది అంతా సవ్యంగా ఉందో లేదో చూడాలి.","She messaged him back straightaway, can't get through. What are you asking me? Well, to check if it's okay."
"33","చూడు, నీకు తెలిసిన వాళ్లు ఎవరైనా ఉండచ్చు... అవును. కానీ ఇది కౌంటర్ టెర్రరిజమ్ ఘటన కాదు, డానియెల్. కానీ, బహుశా ఇది అదే కావచ్చు.","Look, there must be someone you work with who can... Yeah. It's not a counterterrorism issue, Daniel. Well, it might be."
"34","అది తీవ్రవాద చర్య కాకపోతే, నేను... చూడు, బహుశా ఎవరైనా అయి ఉండచ్చు... చూడు, అది ఎవరో ఎలా తెలుస్తుంది...","And if it's not, I... You know, maybe there's someone who... You know, who knows someone who..."
"35","ప్లీజ్, జాహ్రా. నేను చూసుకుంటానని తనకి హామీ ఇచ్చాను.","Please, Zahra. I told her I'd try."
"36","సరే. విమానంలో ఒక సమస్య ఏర్పడిందా? ఒక పరిస్థితి.","All right. An issue on board? An incident."
"37","తరువాత అతను ఆమెని ఎంతగా ప్రేమిస్తున్నాడో చెప్పాడు. అతను ఎలా ఎప్పటికీ ఆమెని ప్రేమిస్తాడో చెప్పాడు. సరే. అయితే మనం ఖచ్చితంగా ఆమె మాజీ భర్త గురించే మాట్లాడుతున్నామా?","Then he told her how much he loves her. How he'll... he'll always love her. Right. And this is definitely her ex we're talking about?"
"38","అతను అలా చెప్పాడు. అతను అలా చెప్పాడు అంటే...","It's the way he said it. He wouldn't have said it unless it..."
"39","పరిస్థితి చాలా తీవ్రమైనది కాబట్టే అతను అలా చెప్పి ఉంటాడు.","He'd never have said it like that unless it was serious."
"40","సరే, ఆ విమానం నెంబరు ఎంత?","Okay, what's the flight number?"
"41","థాంక్స్. మనస్ఫూర్తిగా చెప్తున్నాను. నీకు, నాకు మధ్య ఇంత జరిగాక కూడా... చూడు. సరే, విమానం నెంబరు చెప్పు, డానియెల్.","Thanks. Genuinely. Especially after everything you and I... You know. Yeah, yeah, the flight number, Daniel."
"42","కెఎ29. కిలో ఆల్ఫా రెండు తొమ్మిది. ఒక గంట కిందట టేకాఫ్ అయింది.","KA29. Kilo Alpha Two Nine. Took off about an hour ago."
"43","అలాగే, అర్థమైంది.","All right, got it."
"44","కెఎ29","**[NO ENGLISH MATCH FOUND]**"
"45","ఎందుకు ఇదంతా చేస్తున్నావు? మీకు ఏం కావాలి? నోరు మూయి.","Why... Why are you doing this? What do you guys want? Shut up."
"46","టై తీసి ఇవ్వు.","Ties."
"47","ఐస్ కావాలి.","Ice."
"48","సారీ? విమానంలో ఐస్ ఉందా?","Sorry? You got any ice on the plane?"
"49","ఉంది.","Yeah."
"50","మా మీద దాడి చేయాలన్న ఆలోచన ఎవరిది?","Whose idea was it to start all that shit?"
"51","నాది. అది నా ఆలోచన.","Mine. Mine. It was mine."
"52","అది మంచి ఆలోచన కాదు, మిత్రమా.","Not a good one, mate."
"53","అది నా కోసం కాదు.","It's not for me."
"54","ఆ మనిషి, ఆ ఇన్ఛార్జ్, అతని పేరు ఏంటి? మాటలు ఆపు, మిత్రమా.","The guy that's in charge, what's his name? Stop chatting, mate."
"55","కూర్చో.","Sit down."
"56","నీ చెత్త వాగుడు వినే ఆసక్తి ఎవరికీ లేదు.","No one's interested in your bullshit."
"57","నేను అక్కడికి వచ్చేలా చేయకు, మిస్టర్.","Don't make me come up there, mister."
"58","చూడు, నాకు ఇంక ఇప్పుడు కోపం వస్తోంది. ఇంక రా. నేను వస్తున్నాను.","All right, I'm starting to get angry now. Come on. I'm coming."
"59","మనం నిన్నటి కన్నా ఈ రోజు ఇంకా ఆలస్యం అయ్యాం. ఇదే ఒక రికార్డు అయిపోయింది.","We're even later than yesterday. And that was a record in itself."
"60","ఆగు. వెల్క్రో. - ఇవి ఫిజికల్ ఎడ్యుకేషన్ కోసం. - వెల్క్రో.","Wait. Velcro. - They're for P.E. - Velcro."
"61","- బాబ్స్. - ఆలిస్? హాయ్. అంటే, నేను ఐదు నిమిషాలు ఆలస్యంగా వస్తాను. - అయితే నిన్నటి మాదిరిగా పది నిమిషాలు కాదా? - లేదు, ఐదు నిమిషాలు. సరే, ఈ రోజుల్లో ఐదు నిమిషాలు అంటే ఎంత సమయం? సైమన్, నేను ""ఐదు"" అంటే, నా ఉద్దేశం ఐదు అనే. నేను నీకు అబద్ధం చెప్పను.","- Bobs. - Alice? Yeah, hi. Yeah, I'm... I'm five minutes late. - Oh, so not ten like yesterday? - No, five. Okay, and how long is five minutes these days? Simon, if I say five, I mean five. I'm not gonna lie to you."
"62","సరే, అయితే, నువ్వు పనిలోకి వచ్చేవరకూ విమానాన్ని గాలిలో చక్కర్లు కొట్టమని చెబుతాను, చెప్పనా? చూడు, బాబీకి నిన్న అపెండిక్స్ సమస్య వచ్చింది, అందువల్ల ఈ రోజు స్కూలుకు వెళ్లడంలేదు, ఆ కారణంగా నేను వేరే చైల్డ్ కేర్ సెంటర్ చూసుకోవలసి వచ్చింది. అది వాడి స్కూలు కన్నా చాలా దూరంగా ఉంది. ఈ అన్ని కారణాల వల్ల, సైమన్, నేను పది నిమిషాలు ఆలస్యంగా వస్తాను. - అవునా? - మరీ ఆలస్యం అంటే పదిహేను నిమిషాలు.","Okay, well, I'll just tell the plane to keep circling till you're ready to come to work, shall I? Look, Bobby had his appendix out yesterday, which means he's off school today, which means I need to find alternative childcare. And that's further away than his school. All of which means, Simon, I'm going to be ten minutes late. - Yeah? - Fifteen minutes tops."
"63","సరే, ఇప్పుడు ఇది విందాం. మంచి పాట.","All right, now. Tune."
"64","""మీ క్యాబిన్ సిబ్బందిని మాట్లాడుతున్నాను.","This is your cabin crew speaking."
"65","మీ సీట్లలో మీరు కూర్చుని సీటు బెల్టులు పెట్టుకుని ఉండాల్సిందిగా మిమ్మల్ని కోరుతున్నాను.","We ask that you remain in your seats with your seat belts fastened."
"66","ఈ విమానం ప్రస్తుతం స్వాధీనం చేసుకున్న వారి ఆదేశాలను మాత్రమే అనుసరించండి.","Do only as instructed by those now in charge of this aircraft."
"67","కొద్ది నిమిషాల కిందట జరిగిన సంఘటనలు లాంటివి ఇకపై సహించము.","The events of the past few minutes will not be tolerated."
"68","ఇక ముందు ఎవరైనా ప్రతిఘటిస్తే ఫలితం ప్రాణాంతకంగా ఉంటుంది.","Any further resistance will result in a fatality."
"69","ఇది తుది హెచ్చరికగా భావించగలరు."" సరే, అది నాకు ఇవ్వు.","Take this as your final warning. Right, give me that."
"70","ఇప్పుడు ముందు భాగానికి వెళ్లు.","Now fuck off down the front."
"71","హేయ్. ఈ దెబ్బకి ఏదైనా కట్టడానికి తీసుకురా.","Hey. Get something for this."
"72","పైలెట్ ఒక సమస్య","**[NO ENGLISH MATCH FOUND]**"
"73","నీ గురించి కనుక్కుందామని చేశాను.","Checking for you now."
"74","సరే. ఒక్క సెకను.","Yeah. One second."
"75","కింగ్డమ్ 2-9, దాని వేళలు ఏంటి? 13:06 గంటలకు అది చేరాలి.","Kingdom 2-9, what are the timings on that? Not due till 13:06."
"76","అందుకు ఇంకా చాలా సమయం ఉంది అనుకుంటా. మన గగనతలంలోకి రావడానికి ఐదు గంటలు పడుతుంది. నేరుగా ఆ విమానాన్ని సంప్రదించగలవా? అంటే, మాట్లాడగలను, కానీ వై-ఫై ఆన్ లో ఉంటే ఎవరైనా సంప్రదించచ్చు. ఏదో కారణం వల్ల, వై-ఫై పని చేయడం లేదు. లేదంటే మనం ఎటిసి ద్వారా ప్రయత్నించచ్చు... - ఎక్కడ అంటావు? దుబాయ్? - అవును.","It's still a way out I'm afraid. Five hours till it hits our airspace. Can you contact the plane direct? Well, I can, but anyone can if the Wi-Fi's on. For some reason, the Wi-Fi's down. Or we could try ATC at... - Where did you say? Dubai? - Yeah."
"77","వాస్తవంగా అది మన పరిధిలోకి రాదు, కానీ మనం ప్రయత్నించి చూద్దాం.","Doesn't really fall under our remit, but there you go."
"78","కాస్త ఓపికతో ఉండు.","Bear with me."
"79","షియోబన్, దుబాయ్ ఎటిసి ఫోన్ నెంబరు ఇస్తావా?","Siobhan, can you get me a number for Dubai ATC?"
"80","కంట్రోల్, ఇది బిఎ9850, టేకాఫ్ కోసం అనుమతి కోరుతున్నాం.","Control, this is BA9850 requesting clearance for take off."
"81","ఎనిమిది. తొమ్మిది మీద వేయడానికి నీకు ఎనిమిది ఉంది.","Eight. You've got an eight to go on a nine."
"82","ఇంకొకసారి చూడు.","Take a second look."
"83","నేను ఇంటికి వెళ్తున్నాను. పుట్టినరోజు శుభాకాంక్షలు! బిఎ9850, మీ టేకాఫ్ కి అనుమతి ఉంది. నిజం. విమానం వారితో మాట్లాడాను. ఇప్పుడు అంతా సద్దుమణిగింది. తప్పుడు హెచ్చరిక.","I'm going home. Happy birthday! BA9850, you're clear to take off. Correct. Talked to the aircraft. Now everything is fine. False alarm."
"84","ఆ ఫోన్ కింగ్డమ్ విమానం గురించేనా?","Was that about the Kingdom flight?"
"85","అవును. బ్రిటీష్ వాళ్లు ఫోన్ చేస్తున్నారు. నువ్వు ఏం చెప్పావు?","Yes. British calling. What'd you say?"
"86","అంతా బాగానే ఉంది అని చెప్పాను. కేవలం తప్పుడు హెచ్చరిక.","I say everything is okay. Just false alarm."
"87","లేదు. ఇక్కడ ఆడకూడదు, మిత్రమా.","No. Not here, my friend."
"88","దొంగ కేకలు పెట్టిన కుర్రాడి గురించా?","The boy who cried wolf?"
"89","హేయ్, నువ్వు పైలెట్ తో మాట్లాడావు. ఏమీ జరగలేదని అతను చెప్పాడు. అతను చెప్పింది తప్పు కావచ్చు కదా? అతను తప్పుగా ఎందుకు చెబుతాడు? అతను అబద్ధం ఆడి ఉండచ్చు కదా? ఎందుకు అబద్ధం చెబుతాడు?","Hey. You spoke to the pilot. He said it was nothing. What if he's wrong? How could he be wrong? What if he's lying? Why would he lie?"
"90","బహుశా ఎవరైనా అతనితో అబద్ధం చెప్పించి ఉండచ్చు.","Maybe someone was making him lie."
"91","అతడిని బెదిరించి ఉండచ్చు.","Maybe he was threatened."
"92","కానీ అతని గొంతు. అతను భయపడినట్లు అనిపించలేదు. చాలా ప్రశాంతంగా, నిదానంగా మాట్లాడినట్లు అనిపించింది. వాళ్లు అలాగే మాట్లాడతారు. - పైలెట్లా? - బ్రిటీష్ ప్రజలు. వాళ్లకి భావోద్వేగాలు శూన్యం. ఏమీ తెలుసుకోలేం.","But his voice. He was not frightened. He sounded very calm and relaxed. That's how they sound. - Pilots? - British people. Zero emotion. Tells us nothing."
"93","అతడిని అక్కడి నుండి తప్పించాలి.","You need to get him out of there."
"94","చూడు, అందరూ ఎవరు ఎక్కడ ఉండాలో అక్కడ ఉన్నారు, అతను తప్ప.","Look, you've got everyone where you want them except for him."
"95","అతను అక్కడ ఉండనవసరం లేదు.","He doesn't have to be in there anyway."
"96","పైలెట్లు కేవలం టేకాఫ్ ఇంకా ల్యాండింగ్ మాత్రమే చేస్తారని అందరికీ తెలిసిందే.","Everyone knows that pilots just do the takeoffs and the landings."
"97","మిగతాదంతా ఆటో పైలెట్.","The rest is on autopilot."
"98","అయితే?","So?"
"99","కాబట్టి అతను మనల్ని ఎక్కడికైనా తీసుకువెళ్లచ్చు.","So he could be taking us anywhere."
"100","నాకు ఏం సమాచారం చెబుతావు, హయిదీ?","What have you got for me, Heidi?"
"101","విమాన మార్గం కంట్రోల్ అధికారి దుబాయ్ తో మాట్లాడాడు. వాళ్లు ఇప్పటికే పైలెట్ తో మాట్లాడారట. అది తప్పుడు హెచ్చరిక అని ఖరారు చేశారు. ఛ.","Flight Path Control spoke with Dubai. They'd already contacted the pilot. It's confirmed as a false alarm. Shit."
"102","అది మంచి విషయం కాదా?","Isn't that good?"
"103","సారీ, నా ఉద్దేశం అది కాదు.","Sorry, sorry, I didn't mean that."
"104","కేవలం నీ ఉదయం సరిగ్గా లేదంతే. ఈ ప్రపంచంలోనే అతి చెత్త ప్రయాణం చేస్తున్నాను, అదే నేను చేస్తున్నది.","You're just having a bad morning. I'm having the world's worst journey, that's what I'm having."
"105","అవును. ఆటోపైలెట్ లో ఉంచు. ఆటోపైలెట్ లోనే ఉంది.","Right. I want it on autopilot. It is."
"106","నాకు చూపించు.","Show me."
"107","సరే, చూపించు. దాని గురించి వివరించు.","Yeah, show me though. Explain it."
