"Index","Telugu Text","Mapped English Text"
"311","వాళ్లు వచ్చేవారం ఇల్లు మారిపోతున్నారు. నువ్వు వచ్చావని పైకి వెళ్లి చెప్పి రమ్మంటావా? వద్దు, థాంక్యూ. నేనే వెళ్తాను.","They're moving out next week. You want me to go up and tell them you're here? No. Thank you. I will go."
"312","నీలా!","Neela!"
"313","ఇంక చాలు, మిత్రమా.","That's it, pal."
"314","అందరూ వెనుక వైపుకి వెళ్లండి.","All the way in the back there."
"315","నీలా?","Neela?"
"316","సెక్యూరిటీ లైసెన్స్ నీలా కుమార్","**[NO ENGLISH MATCH FOUND]**"
"317","నాకు ఒక సాయం చేయి. వెనుకకి బాత్ రూమ్ లోకి వెళ్లు.","Do me a favor. Step back into the bathroom for me."
"318","బాత్ రూములు శుభ్రం చేయడం తేలిక.","The bathroom's easier to clean."
"319","తెలుగు అనువాదం: సతీశ్ కుమార్","**[NO ENGLISH MATCH FOUND]**"
