Index,Details,Telugu,English,Status
55,t(3)-e(4) | ?.. vs ??..,నీకు తెలుసా? నిజానికి నువ్వు నాకు థాంక్స్ చెప్పాలి. నీకు నేను సాయం చేశాను.,[gasps] [Bucky] You know what? You You know what? You should actually be thanking me. I did you a favor.,MISMATCH
79,t(2)-e(3) | .. vs ...,"నువ్వు దొంగవెధవవి. కానీ, ఎవరో ఒకరు యుద్ధవాతావరణాన్ని ప్రత్యక్షంగా చూడాలి, అక్కడ పరిస్థితి ఎలా ఉంది నీకు చెప్పాలి కదా.","You son of a bitch. , yeah. Well, someone's gotta taste a little combat, tell you what it's really like up there.",MISMATCH
148,t(3)-e(2) | ... vs ..,ఆకాశం క్లియర్ గా ఉంది. గాలుల వేగం 330 వద్ద గంటకి 64 కిమీ. ఉధృతి గంటకి 80 కిలోమీటర్లు వరకూ.,"Sky CAVU. Winds 330 at 40, gusting to 50.",MISMATCH
400,t(2)-e(3) | .. vs ...,కనీసం ఒక్కటి. హేయ్.,[Bucky] Whoa. Hey. [Bubbles] At least one.,MISMATCH
445,t(4)-e(3) | ...? vs ..?,"ఆహ్ ఓహ్. ఓహ్, ఛ. అతను ఉప్పు ఒలకబోసేశాడు. మేమంతా మా బ్రేక్ ఫాస్ట్ ని సజావుగా తినగలిగేలా ఆ కిందపడిన ఉప్పు తీసుకుని నీ ఎడమ భుజం పైనుండి విసురుతావా?","[soldier] , shit. He spilled the salt. [chuckles] Would you please toss the salt over your shoulder, so we can all get on with our breakfast?",MISMATCH
462,t(2)-e(3) | .. vs ...,"గుడ్ మార్నింగ్, బాయ్స్. మేజర్ వీల్! గుడ్ మార్నింగ్, సర్.","Morning, boys. [soldiers] Major Veal. Morning, sir.",MISMATCH
