"Index","Telugu Text","Mapped English Text"
"14","మా కస్టమర్లకు గమనిక: మేనేజ్మెంట్ మీ యూనిట్లను తెరవాల్సి వచ్చింది.","To all of our customers: Management was obligated to open your units."
"15","నష్టపరిహారం ఇవ్వబడుతుంది.","Restitution will be made."
"15","క్షమించండి.","Apologies."
"23","హలో, సర్.","Hola, señor."
"24","మే యామో.","Me llamo"
"26","ఓలా, యో సోయ్ కారోల్ స్టుర్క.","Hola, yo soy Carol Sturka."
"27","ఎస్టోయ్ దే లోస్ యునైటెడ్ స్టేట్స్ నన్ను వదిలేయండి, వెధవల్లారా!",", estoy de los United States Leave me alone, you sons of bitches!"
"29","పోయి చావరా, పోరంబోకు!","Fuck your mother, asshole!"
"38","హాయ్, కారోల్.","Hi, Carol."
"39","మా మాట వినిపిస్తుందా?","Can you hear us?"
"40","నీకు స్పందించాలి అనిపిస్తే, నువ్వు నీ హ్యాండ్ సెట్ తీసి మాట్లాడితే సరిపోతుంది.","If you feel like responding, all you have to do is pick up the handset and speak into it."
"41","దానికి పక్కన మాట్లాడటానికి నొక్కే బటన్ ఒకటి ఉంటుంది.","It's got a push-to-talk button on the side."
"42","హేయ్, కారోల్!","Hey, Carol!"
"43","అచ్చం ఆడమ్-12 లో చూసినట్టే పని చేస్తుంది.","Works just like on Adam-12."
"43","నీకు ఆ షో చాలా ఇష్టం ఉండేది గుర్తుందా?","Remember how you used to love that show?"
"44","ఏంటి?","What?"
"45","ఓహ్, హాయ్, కారోల్.",", hi, Carol."
"46","నువ్వు హాస్పిటల్ నుండి కొంచెం ముందే వెళ్ళిపోయావు.","You left the hospital kind of quickly."
"46","అంతా బానే ఉందా?","Is, , everything okay?"
"47","అవును.","Yep."
"47","ఉంది.","Yes."
"47","హేయ్, కారోల్!","Hey, Carol!"
"48","నేను నేను ఇంటికి వెళ్తున్నాను.","Just Just headed home."
"49","నువ్వు రేంజ్ రోవర్ లో ప్రయాణిస్తే ఇంకొంచెం సౌకర్యంగా ఉంటుందేమో?","Would you be more comfortable in your Range Rover?"
"50","దాన్ని మేము నీకు డెలివర్ చేయగలం.","We can deliver it to you."
"51","అంతేకాక, నీ వాహనంలో మద్యం ఇంటర్లాక్ పరికరాన్ని సంతోషంగా తీసేయగలం.","Also, we're happy to remove the alcohol interlock device."
"52","వద్దు.","No."
"53","హేయ్, కారోల్.","Hey, Carol."
"54","మీరు ఇక్కడేం చేస్తున్నారు?","What are you doing here?"
"55","మీరు నా ఇంట్లో ఉన్నారే?","You're in my house?"
"55","నా ఇంట్లో మీ అందరికీ ఏం పని?","What the hell are you doing inside my house?"
"56","బాంబు ధాటికి పడిన రంధ్రాల్ని పూడుస్తున్నాం.","Patching shrapnel holes."
"57","అంతేకాక ఇక్కడ శుభ్రం చేయాల్సిన గాజు ముక్కలు చాలా ఉన్నాయి.","Plus, there was a lot of broken glass to clean up."
"58","సరే, కానీ నా ఇంట్లోకి రావడానికి మీకు అనుమతి ఎవరు ఇచ్చారు?","Well, who gave you permission to be in my house?"
"59","నువ్వే.","You did."
"60","గుర్తుందా?","Remember?"
"60","నువ్వు మాతో కలిసి అంబులెన్స్ లో వెళ్తున్నప్పుడు మేము జోసియ వీపు మీద బ్యాండేజ్ తో ఒత్తిడి పెట్టాం కదా.","When you were riding with us in the ambulance and we were applying a pressure bandage to Zosia's back."
"61","అప్పుడు నీ ఇంటిని కొంచెం శుభ్రం చేయొచ్చా అని అడిగితే నువ్వు మెల్లిగా తల ఊపావు.","And we asked you if you'd like us to tidy up your house a little bit and you sort of nodded absently."
"62","సరే.","Okay."
"62","దేవుడా, పోనిలే.","Jesus, fine."
"62","ఏదోకటి.","Whatever."
"62","అందరూ బయటకు వచ్చారా?","Is everyone out now?"
"63","అవును.","Yes."
"63","మా పని దాదాపుగా అయిపోయింది, కారోల్.","And we're almost done here, Carol."
"64","కానీ మేము నీకు కావాలంటే శుభ్రం చేసే పని తర్వాత పెట్టుకుంటాం.","But we could leave the finishing touches for later and clear out now if you'd like."
"65","నువ్వు కాసేపు ఒంటరిగా ఉండొచ్చు.","Give you some space."
"66","నువ్వు నాకు తెలుసా?","Do I know you?"
"67","హాయ్.","Hi."
"68","నువ్వు మేయర్ వి.","You're the fucking mayor."
"69","నీ ఓటుకు థాంక్స్.","Thank you for your vote."
"76","నాకు ఒక వాలంటీర్ కావాలి.","I need a volunteer."
"77","రాజకీయ నాయకుడు కాదు.","Not a politician."
"78","నువ్వు.","You."
"78","పొట్టోడా.","Shorty."
"79","మిగిలిన వాళ్ళు కావాలంటే కాఫీ బ్రేక్ తీసుకోండి, లేదా ఏది చేయాలనుకుంటే అది చేయండి.","Rest of you just take a coffee break, or whatever floats your boat."
"80","నాతో రా.","Come with me."
"81","సంతోషంగా.","Happy to."
"82","కూర్చో నీ పేరు ఏంటి?","Have a seat, What's your name?"
"83","నీ పేరు?","Your name?"
"84","అంటే ఈ వ్యక్తి ఒకప్పుడు లారెన్స్ జే.",", well This individual went by Lawrence J."
"84","క్లెస్ అని పిలవబడేవాడు.","Kless."
"85","ఇతని ఫ్రెండ్స్ ల్యారీ అని పిలిచేవారు, ఇతనికి చాలా మంది ఫ్రెండ్స్ ఉండేవారు.","Or Larry to his friends, of which he had many."
"86","ఏదొకటి.","Whatever."
"86","వచ్చి కూర్చో.","Just have a seat."
"88","మీకు నా పుస్తకాలు నచ్చుతాయా?","Do you like my books?"
"89","మాకు మీ పుస్తకాలు చాలా ఇష్టం.",", we love your books."
"90","వాటిలో మీకు నచ్చే విషయం ఏంటి?","What do you love about them?"
"91","ప్రతీది.","Everything."
"91","నీ పుస్తకాలు నీ వ్యక్తిత్వాన్ని వ్యక్తపరుస్తాయి.","Your books are an expression of you."
"91","కాబట్టి మాకు నువ్వంటే చాలా ఇష్టం.","And we love you."
"92","నువ్వు ఇంకొంచెం వివరంగా చెప్పాలి.","Need you to be more specific."
"92","క్యారెక్టర్ లోని మార్పులు.","Character arcs."
"92","ప్లాట్ ట్విస్టులు.","Plot turns."
"93","ఓహ్, అవును.",", yes."
"93","అవును.","Yes."
"93","మాకు క్యారక్టర్ మార్పులు ఇంకా ప్లాట్ ట్విస్టులు అన్నీ నచ్చుతాయి.","We love the character arcs and the plot turns."
"94","ఏవేవి?","Which ones?"
"95","అన్నీ.","All of them."
"96","ఏమీ అనుకోకు, ల్యారీ, కానీ నువ్వు నాకు అబద్ధం చెప్తున్నావు అనిపిస్తోంది.","No offense, Larry, but, , I think you're bullshitting me."
"97","వినడానికి మీరు నా రచనలు అసలు చదివినట్టే లేదు.","Sounds to me like you haven't even actually read my work."
"98","కానీ చదివాము.","But we have."
"99","దేవుడా, ఎక్కడి నుండి మొదలెట్టము?","Gosh, where do we even begin?"
"100","నీ మొదటి నవలలో, రెండవ పేజీలో లూకేసియా వేసుకున్న గౌన్ ను నువ్వు వివరించిన విధానం మాకు చాలా ఇష్టం.","In your first novel, , we greatly admire the description of Lucasia's gown on page two."
"101","""అత్యుత్తమ శ్రేణి షాంగ్ పట్టుతో నేసిన సన్నని దారాలు కరిగించిన బంగారంలా మెరిసిపోయాయి, సూర్యుడే స్వయంగా ప్రకాశవంతమైన ముద్దులతో లూకేసియా భుజాలపై జల్లు కురిపిస్తున్నట్లుగా ఉంది.","""Gossamer threads of the finest shang silk shimmered like spun gold, as if the sun itself were showering Lucasia's shoulders with resplendent kisses."
"101","""",""""
"102","అది చదివి మాలో చాలా మంది ఒళ్ళు జలదరించింది.","That made quite a few of us tingle."
"103","సరే.","Okay."
"104","హ.","Ha."
"105","షేక్ స్పియర్ రచనలతో పోల్చితే నా రచనలు ఎలా ఉన్నాయి అంటారు?","How would you say my work compares to Shakespeare?"
"106","సమానం.","Equally."
"106","రెండూ ఒకే స్థాయిలో అద్భుతంగా ఉంటాయి.","Equally wonderful."
"107","అంటే మీరు నా పుస్తకాల స్థాయి మెక్బెత్ తో సమానం అంటారా?","You love my books as much as Macbeth?"
"108","లేక మచ్ ఆడూ?","Or Much Ado?"
"109","అవును.","Yes."
"109","అలాగే హేన్రీ 6, మొదటి, రెండవ అలాగే మూడవ భాగాలు కూడా.","And Henry VI, parts one, two and three."
"110","అంటే, నా ఉద్దేశం, జనానికి చాలా ఇష్టమైన కథలతో పోల్చితే?","Well, I mean, what about a crowd-pleaser?"
"110","రోమియో అండ్ జూలియట్?","Romeo and Juliet?"
"111","అద్భుతం.","Wonderful."
"111","నువ్వు 1597లో రాసిన మొదటి క్వార్టో చదివావా?","Have you read the first quarto of 1597?"
"112","లేదు, నువ్వు చదవలేదు, కానీ చదివితే మంచిది.","No, you haven't, but you must."
"112","మేము నీకు ఒరిజినల్ పుస్తకం తెచ్చి ఇస్తాము.","We'll bring you the original."
"113","సరే, ల్యారీ, అంటే మీకు నేను రాసిన వైకారో కథలు ఇంగ్లీష్ భాషలోనే అత్యంత ఫేమస్ నాటకమంత ఇష్టం అంటున్నారా?","So, Larry, you are telling me that you love the Wycaro series as much as the most famous English language play of all time?"
"114","కారోల్.","Carol."
"115","మేము నువ్వు రాసిన అద్భుతమైన కథలోని ఒక అంశాన్ని తలచుకుంటే ఆ పదం వాడటం ఆపు.","When we think about a passage from one of your wonderful Stop using that word."
"116","నీ పుస్తకాలలో ఒకదాన్ని తీసుకుందాం.","From one of your books."
"117","మేము అనేక దృక్కోణాలలో దాన్ని అర్థం చేసుకుంటాం.","We experience it through many eyes."
"117","ఎన్నో మనసుల నుండి.","Many hearts."
"118","నీకు మొయిరా మెక్ఆలిస్టర్ అనే మహిళ గుర్తుందా?","Do you remember a woman named Moira McAllister?"
"119","నాకు చేతితో చేసిన పిచ్చి టోపీలు పంపించే కాన్సాస్ సిటీలో ఉండే మొయిరానా?",", crazy Moira from Kansas City that sends me these dumb crocheted hats?"
"120","అవును, అర్థమైంది.","Right, of course."
"120","ఇప్పుడు ఆమె కూడా మీలో ఒకరు.","She's one of you now."
"121","అవును.","Yes."
"122","ఆమె నీ పుస్తకాలను కనుగొనడానికి ముందు, మొయిరా చాలా డిప్రెషన్ లో ఉండేది.","Before she found your books, Moira was deeply depressed."
"123","చెప్పాలంటే, ఆమె అసలు చని నువ్వు ఆమెకు బ్రతకడానికి ఒక ఆశను ఇచ్చావు.","In fact, she was going to You gave her something to live for."
"124","నీ వల్ల ఆమె జీవితం మెరుగైంది.","You made her life better."
"125","మేము నిన్ను, నీ రచనలను చూసే విధానం అది.","That's how we see your work, and you."
"125","మొయిరా కళ్ళ నుండి.","Through Moira's eyes."
"126","నా పుస్తకాల గురించి హెలెన్ ఏమనుకుంది?","What did Helen think of my books?"
"127","చెప్పు.","Tell me."
"128","హెలెన్ నిన్ను చాలా ప్రేమించింది.","Helen loved you very much."
"129","నేను అడిగింది అది కాదు, ల్యారీ.","Not what I asked, Larry."
"130","చెప్పు.","Spit it out."
"130","హెలెన్ నా వైకారో పుస్తకాల గురించి ఏమనుకుంది?","What did Helen think of the Wycaro books?"
"131","కారోల్, హెలెన్ గురించి మాట్లాడొద్దు అని నువ్వు మాకు స్పష్టంగా చెప్పావు.","Carol, you expressly told us that Helen is off-limits."
"132","సరే, కానీ ఒకటి చెప్పనా?","Yeah, but you know what?"
"132","ఈ ఒక్కసారికి స్పెషల్ అనుమతి ఇస్తున్నా.","Special dispensation this one time."
"133","హెలెన్ నా వైకారో పుస్తకాల గురించి ఏమనుకుంది?","What did Helen think of my Wycaro books?"
"134","ల్యారీ?","Larry?"
"135","ఆమె వాటిని హానికరం కానివి అనుకుంది.","She thought they were harmless."
"136","హానికరం కానివా?","Harmless?"
"137","ఆమె తన మనసులో ""పీచుమిఠాయి"" అనుకునేది.","""Cotton candy"" was the phrase she used in her mind."
"137","ఎక్కువగా.","Mostly."
"138","పీచుమిఠాయి.","Cotton candy."
"139","అవును.","Yes."
"140","అంటే నీకు తెలుసు కదా, హెలెన్ కి పీచుమిఠాయి అంటే ఇష్టం.","And as you know, Helen loved cotton candy."
"141","హెలెన్ పీచుమిఠాయి తినడం నేను ఎప్పుడూ చూసిందే లేదు.","I don't actually recall Helen ever eating cotton candy."
"142","ఓహ్, లేదు.",", no."
"142","ఆమె జీవితంలో అది నాలుగుసార్లు తిన్నది, ప్రతీసారి అవును.","She consumed it four times in her life, and each ti Yeah."
"142","అప్పుడు నువ్వు లేవు.","You weren't there."
"142","కానీ నిజంగా హెలెన్ నీకు ఆడియన్స్ ని మెప్పించడం బాగా వచ్చు అనుకుంది.","But really Helen thought you knew how to please your audience."
"143","అలాగే మీరిద్దరూ పంచుకున్న అందమైన జీవితానికి ఆమె ఎంతో సంతోషపడింది, వైకారో కారణంగా సాధ్యమైన జీవితానికి.","And she was so grateful for the beautiful life the two of you shared, that Wycaro provided."
"144","ఆమె నిన్ను చూసి చాలా గర్వపడింది.","She was so proud of you."
"145","నేను పబ్లిష్ చేయని నవల గురించి హెలెన్ ఏమనుకుంది?","What did Helen think of my unpublished novel?"
"146","బిట్టర్ క్రిసలిస్?","Bitter Chrysalis."
"147","ఆమె ఏమనుకుంది?","What did she think?"
"148","కారోల్.","Carol."
"148","నువ్వు అలా అడగడం మనం ఇంకేమైనా మాట్లాడుకుందామా?","This line of inquiry isn't Can we talk about something else?"
"148","నాకు తెలుసుకోవాలని ఉంది.","I wanna know."
"149","నువ్వు నాకు చెబితే నేను సంతోషపడతాను.","If you tell me, it'll make me happy."
"150","హెలెన్ అది బానే ఉంది అనుకుంది.","Helen thought it was fine."
"151","బానే అంటే బాగుంది అనుకుందా?","Fine as in good?"
"152","లేక బానే అంటే ""పర్లేదు"" అనా?","Or fine as in ""meh""?"
"153","అవును, ""పర్లేదు.","Yeah, ""meh."
"153","""",""""
"154","మరి ఆఖరి 200 పేజీల సంగతి ఏంటి?","What about the last 200 pages?"
"155","హెలెన్ 137వ పేజీలో మూడవ పారాగ్రాఫ్ తర్వాత చదవడం ఆపేసింది.","Helen stopped on page 137, paragraph three."
"156","అది 489 పేజీల పుస్తకం.","It's 489 pages long."
"157","ఆమె ఆఖరి రెండు పేజీలు చదివింది.","She read the last two pages."
"157","కథ బాగానే ముగిసింది అనుకుంది.","Thought it wrapped up nice."
"158","ఆమెకు అది నచ్చకపోతే ఆమెకు అది నచ్చకుండా లేదు.","If she hated it so much She didn't hate it."
"159","ఆమెకు అది నచ్చకపోతే, నాతో ఎందుకు పబ్లిష్ చేయమని చెప్పింది?","If she hated it so much, why did she tell me to publish it?"
"160","ఎందుకంటే ఆమె వాల్ తో మాట్లాడింది, వాళ్ళు అది రిలీజ్ చేయడం వల్ల నీకు నష్టం ఉండదు అనుకున్నారు.","Because she talked to Val, and they agreed that it wouldn't hurt your career."
"161","అలాగే నువ్వు సంతోషపడతావు అనుకున్నారు.","And it would make you happy."
"162","వెళ్ళు.","Out."
"164","హాయ్, కారోల్.","Hi, Carol."
"166","నాకు ఇవ్వు.","Here."
"167","థాంక్స్.","Thank you."
"168","నీకు ఇది కావాలా?","You want this?"
"168","నీకు నీ పోలీస్ కార్ నచ్చిందా?","Do you like your police car?"
"169","అవును.","Sure."
"170","ఒక సరదా విషయం చెప్తా, ఆ వాహనాన్ని నడిపిన పోలీస్ ఆఫీసర్ కొడుకు చదివే మూడవ గ్రేడ్ టీచర్ గారి భర్త చెల్లి వైకారో ఫ్యాన్ క్లబ్ లో ఒక చార్టర్డ్ సభ్యురాలు.","Fun fact, the police officer who drove that vehicle, his son's third-grade teacher's husband's sister was a chartered member of the Wycaro fan club."
"171","వావ్.","Wow."
"171","అమ్మో.","Chills."
"172","ఒక మాట చెప్పాలి.",", listen, about the, um."
"174","మీ మనసులు నాకు నిజంగా బాంబులు ఇచ్చేటంత పెద్దవి అని నాకు నాకు తెలిసి ఉంటే ఇలా జరిగేది కాదు, కాబట్టి నాకు బాధగా ఉంది.","It wouldn't have happened if I had had the foresight to understand that you people are generous enough to give me actual explosives, and I regret it."
"175","దయచేసి అలా అనుకోకు.","Please don't."
"176","అంటే, నీకు గాయాలైనందుకు నాకు బాధగా ఉంది.","Well, I'm s-sorry you got hurt."
"177","నిన్ను కొన్ని ప్రశ్నలు అడిగితే నాకు సమాధానం చెప్తావా?","Are you up for answering some questions?"
"178","తప్పకుండా.","Certainly."
"179","ఒక వారం క్రితం, అండర్ సెక్రటరీ ఒకరి అంటే, మీరు.",", about a week ago, the Undersecretary of Ag Well, I mean you."
"179","మీరంతా ఒక్కటే అని నాకు తెలుసు.","I know you're all one."
"179","నేను అర్థం చేసుకోగలను.","I get the basics."
"180","ఏదైతేనేం, మీరు అండర్ సెక్రటరీ రూపంలో నాతో.","Anyway, all of you, in the form of the Undersecretary of."
"182","ఇదంతా ఎలా పని చేస్తుందో మీకు కూడా తెలీదు అన్నారు.","You told me that you don't really understand how all this works."
"183","ఇలా కలవడం.","This joining."
"183","మరి నా ప్రశ్న ఏంటంటే, మీకు ఇప్పుడు తెలిసిందా?","So my question is, do you understand it now?"
"184","మాకు ఇప్పుడు అవగాహన బాగా పెరిగింది, అవును.","We have quite a bit more insight into it now, yes."
"185","అయితే దీన్ని రివర్స్ చేయడం అవుతుందా?","So Is there a way to reverse it?"
"186","ఇలా కలవడమా?","The joining?"
"187","దీన్ని రివర్స్ చేయడానికి దారి లేదా?","Is there not a way to reverse it?"
"188","జోసియ?","Zosia?"
"189","మేము నిన్ను ఎలాగైనా మెప్పించాలని అనుకుంటున్నాం, కారోల్, కానీ కానీ అలాంటి ప్రశ్నలకు మేము సమాధానం చెప్పలేం.","We want so much to please you, Carol, but we we can't answer questions like that."
"190","సరే.","Right."
"190","కాకపోతే నువ్వు సమాధానం చెప్పలేకపోవడమే నా ప్రశ్నకు సమాధానం.","Except your nonanswer is my answer."
"191","ఎందుకంటే మీరు నాకు అబద్ధం చెప్పలేరు.","'Cause I don't think you can lie to me."
"191","అది మీకు సాధ్యం అవుతుందని నేను అనుకోను.","I don't think it's something you can do."
"192","కానీ కుదిరే అవకాశం లేకపోతే మీరు ఖచ్చితంగా లేదు అని చెప్పేవాళ్ళు.","But you would definitely tell me if the answer was no."
"193","నీకు బాధ కలుగుతున్నందుకు మమ్మల్ని క్షమించు.","We're sorry you're so troubled by this."
"193","నాకు బాధగా ఉందా?","Do I seem troubled?"
"194","నేను సంతోషపడుతున్నాను.","This is me happy."
