"Index","Telugu Text","Mapped English Text"
"167","మన్నించు, జెడ్. ఇదంతా ల్యాంబ్ ఐడియా.","Sorry, Jed. Lamb's idea."
"168","ల్యాంబ్, ఇంకా స్టాండిష్ వాళ్లని తీసుకురాలేకపోయాం.","Lamb and Standish Have not been apprehended."
"169","అది నాకు తెలుస్తూనే ఉంది. ల్యాంబ్ తుపాకీ బయటకు తీశాడు.","Yes, I can see that. Lamb pulled a gun."
"170","అతడిని మీరు చెక్ చేయలేదా?","You didn't frisk him?"
"171","అది స్టాండిష్ బ్యాగులో ఉండింది.","It was in Standish's bag."
"172","వీళ్లేనా కీడ్నాపర్స్?","This is them?"
"173","రౌపెల్ స్ట్రీట్ ఇంట్లో లభించిన వేలి ముద్రలు వీళ్లవే.","Fingerprints match those at the Roupell Street house."
"174","వీళ్లందరూ ఇంతకు ముందు అరెస్ట్ అయినవాళ్లే. దాడులు, తీవ్రమైన దాడులు, దొంగతనం.","They all have priors. ABH, GBH, burglary."
"175","వాహనాల తనిఖీ విషయం ఎంత దాకా వచ్చింది? ఇంకా ఎనిమిది వాహనాల ఆచూకీ తెలియాల్సి ఉంది, కానీ వాళ్లు సీసీటీవీలు ఉన్న రోడ్లలో ప్రయాణిస్తూ ఉండకపోవచ్చు.","How we doing on the vehicles? Still have eight to locate, but they might be avoiding roads with CCTV."
"176","వాహనాలను మారుస్తూ వెళ్తున్నారేమో.","They may have swapped vehicles."
"177","అన్ని వాహన చోరీల కేసులనూ చెక్ చేస్తున్నాం.","We're following up on all reported vehicle thefts."
"178","మేడమ్. ఇప్పుడు కాదు.","Ma'am. Not now."
"180","భలే భలే.","Showtime."
"181","పెట్రోల్ అయిపోవస్తోంది.","We're running out of petrol."
"182","అబ్బా.","No."
"183","దుంప దెగ!",", fuck off!"
"184","అయితే ఏమైంది? పెట్రోల్ బంక దగ్గర ఆగుదాం.","So what? Stop at the garage."
"185","మన మీద రక్తపు మరకలు ఉన్నాయి. ఏదో నేరం చేశామని అనుకుంటారు.","We're covered in fucking blood. Bit of a giveaway."
"186","అక్కడి సీసీటీవీలో పడతాం.","We'll end up on the CCTV."
"187","మనం మాస్కులని తెచ్చుకొని ఉండాల్సింది.","Shouldn't have left the balaclavas behind."
"188","పెట్రోల్ లేకపోతే పడవ దాకా వెళ్లలేం కదా? శాంతించండి. నా దగ్గర ఒక ప్లాన్ ఉంది.","F Well, we can't make the boat without petrol, can we? Just calm down. I've got a plan."
"189","ఏంటది? పెట్రోల్ అయ్యేదాకా నడుపుదాం, ఆ తర్వాత వాడి తలని నరికేద్దాం.","Yeah? We drive until we run out, and then we're gonna chop his head off. , f."
"190","నీకేమైనా తిక్కా?","What the fuck is wrong with you?"
"191","ఒకసారి ఆలోచిద్దాం. మనకి ఇంకో దారి లేదు.","Yeah, let's just think about this. We don't have options."
"192","ఉంది. నరకకుండా ఉండవచ్చు.","Yeah, we do. We have the option not to fucking do that."
"193","ఇంత చేసీ వృథా అయిపోవలసిందేనా?","And have all this for nothing?"
"194","వాళ్లు మనల్ని ఇరికించే పని చేశారు, ఇప్పుడు మనం చేస్తామన్న పని చేయకపోతే వెధవలం అయిపోతాం.","While they set us up and make us look like twats and we don't even do the thing that we said we were gonna do."
"195","నేను అలా అస్సలు జరగనివ్వను.","No, I can't have that."
"196","మనం జోకర్లు అయిపోతాం.","We'll be a fucking joke."
"197","జనానికి మనమంటే భయం, గౌరవం ఉండాలి.","People need to fear and respect us."
"198","మనం ఒకటి చెప్పామంటే, అది చేసి తీరతామని వాళ్లకి తెలియాలి.","They need to know that we mean what we say when we say it."
"200","ఇప్పటిదాకా జరిగిన ఘోరాలు చాలు. ఇది మన దేశం, దీన్ని మనం.","Enough is enough, man. This is our country, and we want it."
"201","కాస్త నోర్నూసుకో!","Fucking shut up!"
"203","ఇక నేను భరించలేను. సరేనా? అది నీకు ఎక్కడిది? వీడు తల నరికేశాడే, అతనిది.","I've had enough. Okay? Where'd you get that? On the guy whose head he cut off, eh?"
"204","వాడు ఏజెంట్ అన్నావు కదా, మరి వాడి జేబుల్లో ఏముందో చూడవా?","He said he was a spy, but you didn't check his pockets, did ya?"
"205","మళ్లీ నేను పిచ్చోడిని అంటుంటావు.","And I'm the dumb one, aren't I?"
"206","వాడిని చంపడం కన్నా, నువ్వు సాటి బ్రిటీషోడిని చంపాలనుకుంటున్నావు, నువ్వు ఒక దేశద్రోహివి.","You'd rather spill my British blood than his, then you're a traitor."
"207","సరే. వెనక్కి వెళ్లి, వాడు బాగానే ఉన్నాడో లేదో చూడు.","Yeah. Get in the back. Check he's okay."
"208","నువ్వు సిగ్గుచేటు పనులన్నీ చేస్తున్నావు.","F You're a fucking embarrassment, man."
"209","వాడికి వాంతి వస్తోంది అనుకుంటా.","I think he's being sick."
"210","అవును. బాగా వస్తున్నట్టుంది.","Yep. He's choking on his sick."
"211","అదీలెక్క. హేయ్.","Result. Hey."
"212","బండిని ఆపు. ఆపెహే.","Pull over. Chop-chop."
"213","దిగు.","Get out."
"214","దిగు.","Go on."
"215","దిగరా, చచ్చినోడా.","I said get out, now."
"216","రా. దిగు.","Come on. Move it."
"217","పద. తలుపు తెరువు.","Just move it. Open the door."
"218","సరే. వాడిని బయటకు తీసుకురా.","Right. Lift him up."
"219","వాడి మొహం నుండి ఆ టేపును తీసేయండి.","And get that fucking tape off his face."
"220","బాబోయ్.",", fuck."
"221","వామ్మోయ్. సరే మరి.","Whoa. Okay."
"222","వాడి నోట్లో ఏదైనా పెట్టండి.","Put something in his mouth."
"223","లేకపోతే అరుస్తాడేమో.","In case he screams."
"224","వాడిని బెదిరించకుండా నన్ను బెదిరిస్తావే, చెత్త వెధవా?","Why aren't you threatening him, you fucking pussy?"
"225","నువ్వు వాడిని చంపను అని చెప్పావు కదా, అందుకా?",", you told him you're not gonna kill him, didn't ya?"
"226","నన్ను రెచ్చగొట్టకు, సరేనా?","Don't fucking push me. Okay?"
"227","రెచ్చగొట్టకు!","Don't!"
"228","పెట్రోల్ లేదు. ఎక్కడికీ వెళ్లలేని పరిస్థితి.","No fuel. Nowhere to go."
"229","నీ ప్లాన్ ఏంటో చెప్పు, కెప్టెన్?","What's the plan now, eh, Captain?"
"230","పెట్రోల్ పట్టించుకుందాం.","Eh? We get some petrol, right?"
"231","పడవ దగ్గరికి వెళ్దాం అక్కడికి వెళ్లాక ఈ కుర్రాడిని వదిలేద్దాం. మరి పెట్రోల్ ఎవరు పడతారు?","We get to the boat and we let the kid go. Who's gonna get the petrol?"
"233","ఏంటి?","What?"
"234","ఒకసారి అద్దంలో చూసుకున్నావా?","Have you looked in the mirror?"
"235","బండి నుండి ఎవరు దిగి పెట్రోల్ పడతారు?","Who's gonna get out of the van?"
"237","ఏదైతే అది అయింది!",", fuck it. Fuck it."
"239","వీడు పెట్రోల్ పడతాడు.","He is."
"241","ట్రిపుల్-డీ కార్ మరియు వ్యాన్ అద్దె సర్వీస్ దొరికాడు. ఈ హో ఉచ్చు నుండి ఎవరూ ప్రాణాలతో తప్పించుకోలేరు.","Got him. Like a rat in a trap that I will kill with a hammer."
"242","""ట్రిపుల్-డీ కార్ అద్దె సర్వీస్."" లీడ్ లో ఉంది ఇది.","""Triple-D Car Hire."" Leeds address."
"243","రిజిస్ట్రేషన్ నంబర్?","Registration number?"
"245","దానికి కొంత సమయం పడుతుంది.","That will take a while."
"247","నాకు ఒక కాఫీ తీసుకురండి.","Get me a coffee."
"248","ఈ పనికి నాకు శక్తి అవసరం అవుతుంది.","I need fuel for this one."
"249","ఈ పని చేయడానికి చాలా గంటల సమయం పడుతుంది, ఇది ఒక మాల్వేర్ ని వదులుతుంది, ఇది చాలా సమర్థవంతమైన పద్ధతి అన్నమాట, కానీ అలా చేయాలంటే ఎవరైనా ఈమెయిల్ తెరవాలి, కాబట్టి థ్యాంక్స్, స్టాండిష్. డబుల్ స్ట్రాంగ్ కాఫీ తీసుకురా.","An SQL injection attack will take hours, which leaves a malware bomb as the most effective method, but that needs someone to open an email, so Cheers, Standish. Double espresso."
"251","నువ్వు దేన్ని అయినా హ్యాక్ చేయగలవు అనుకున్నానే.","I thought you could hack anything."
"252","నేను చేయగలను.","I can."
"253","నేను చేయలేనని అనడం లేదు. కానీ దానికి కొంత సమయం పడుతుంది.","I'm not saying I can't do it. Just that it will take some time."
"254","ఎంత సమయం కావాలి, హో?","How much time do you need, Ho?"
"255","ఎందుకంటే, ఆ కుర్రాడిని ఇంకో రెండున్నర గంటల్లో చంపేస్తారు.","Because the kid's gonna get beheaded in about, , two and a half hours."
"256","నేను త్వరగా ఏం చేయగలనో చెప్పనా?","I'll tell you what I can do real quick."
"257","నీ సెర్చ్ హిస్టరీని చెక్ చేసి, నువ్వు ఏ రకమైన పార్న్ ని చూస్తావో అందరికీ చెప్పగలను.","Check your search history and tell everyone what porn you look at."
"258","అలాగే కానివ్వు, నేనేమీ చూడట్లేదు.","Fine, 'cause I've got nothing to hide."
"259","మూసుకొని కూర్చో. హేయ్.","Don't you fucking dare. Hey."
"260","ఆపండి. ఆపండి. ఏమైంది నీకు?","Stop it. Stop it. Stop it. What's wrong with you?"
"261","చిన్నపిల్లోడిలా ప్రవర్తిస్తున్నావు. ఏమన్నావు? నా కాఫీ ఎక్కడ?","You're eight years old. Pardon? Where's my coffee?"
"262","నేను నీకు కాఫీ తేలేదు. రిజిస్ట్రేషన్ నంబరును తెచ్చాను.","I didn't get you a coffee. I got you the registration number."
"263","డీఈ15 సీజీకే.","DE15 CGK."
"264","ఏంటి? ఎలా సంపాదించావు? ఫోన్ చేసి కనుకున్నా.","What? How? Well, I rang them up."
"265","ఫోన్ చేసి ""అనేక డేటా రక్షణా చట్టాలను ఉల్లంఘించగలరా?"" అని అడిగావా?","And said what? ""Do you mind breaking multiple data protection laws?"""
"266","లేదు, వారి వాహనం వల్ల నాకు యాక్సిడెంట్ అయిందని, నాకు డ్రైవర్ పేరు తెలుసు కానీ, బాగా కంగారుపడిపోవడం వలన, నేను రిజిస్ట్రేషన్ నంబరును సరిగ్గా అర్థమయ్యేలా రాయలేకపోయానని చెప్పాను.","No, I said th-that I'd had an accident with one of their vehicles and I had the driver's name, but because I was so shaken, I couldn't read the registration number I'd written down."
"267","హో, ఇప్పుడు నువ్వు ఏం చెప్పాలంటే, అది కూడా మొట్టమొదటిసారి అన్నమాట, ""సూపర్ పని చేశావు,"" లేదా ""థ్యాంక్యూ.""","I think the words you're looking for, Ho, and these would be a first for you, are, ""Well done"" and ""Thank you."""
"268","పార్క్ ఈ బండి మీద కూడా ఓ కన్నేసి ఉంచుతోంది.","It's on the list of vehicles the Park are looking for."
"269","అయితే ఆ వాహనం మీద వాళ్లు మరింత దృష్టి పెట్టేలా మనం చేయాలి.","Then we need to get them to focus on that vehicle."
"270","కానీ మనం అలా చేస్తే, పార్క్ వాళ్లకి మనల్ని ట్రాక్ చేసేస్తారు కదా?","How do we let the Park know that without them tracking us?"
"271","ఓరి దేవుడా. మిన్, అక్కడ ఒక కుర్రాడి ప్రాణాలు పోయేలా ఉన్నాయి.",", my God. Min, a kid's life is at stake."
"272","నాకు తెలుసు, కానీ దొరక్కుండా ఉండమని మనకి ల్యాంబ్ చెప్పాడు కదా.","I know, but Lamb Lamb told us not to get caught."
"273","పోనీ మనమే ఆ బండిని ట్రాక్ చేయలేమా?","Can't we track it ourselves?"
"275","ఆపు! ఆపు!","Oi! Stop! Stop!"
"276","ఆపు! ఆపు!","Stop! Stop!"
"277","బండిలోనే ఉండండి.","Stay in the vehicle."
"278","అవును, నాకు తెలుసులే ఉంటానని నీ కోసం కష్టపడే మనిషిని అవుతాను","♪ Yes, I know I'm gonna be ♪ ♪ I'm gonna be the man Who's working hard for you ♪"
"280","నేను చేసే పనికి కదలవద్దు.","♪ And when the money ♪ Stay there."
"281","డబ్బు వచ్చినప్పుడు అందులోని పైసా పైసా నీకే ఇస్తాను","♪ Comes in for the work I do I'll pass almost every penny on to you ♪"
"283","పదండి! వెళ్దాం పదండి!","Move! Move! Come on, let's go!"
"284","పదండి!","Move!"
"285","పదండి. పదండి. అవును, నాకు తెలుసులే ఉంటానని నీ కోసం కష్టపడే మనిషిని అవుతాను కానీ నేను 500 కిలోమీటర్లు నడవగలను ఇంకో 500 కిలోమీటర్లు నడవగలను","Go. Go. Go. Move. ♪ Well, I know I'm gonna be ♪ ♪ I'm gonna be the man Who's growing old with you ♪ ♪ But I would walk 500 miles ♪ ♪ And I would walk 500 more ♪"
"287","దయచేసి బండి నుండి దిగుతారా, మిస్టర్ ల్యాంబ్?","Can you get out of the vehicle, please, Mr. Lamb?"
"288","లేదు, లేదు. నాకు ఇక్కడే బాగుంది.","No, no, no. I'm quite comfortable where I am."
"289","సీట్లు చాలా బాగున్నాయి. వెచ్చగా ఉన్నాయి కూడా.","These seats are lovely. And they're heated too."
"290","వెంటనే బండి నుండి దిగండి. లేదు, నాకు ఇక్కడే బాగుంది.","Step out of the vehicle now. Nah, I'm I'm I'm okay where I am."
"291","వెళ్లి నీ బాస్ కి చెప్పు, అతని బండిని తెచ్చానని, కారును అలా తీసుకున్నందుకు ఫీల్ అవ్వవద్దని.","You go fetch your boss and tell him I've brought the car back, but we need to go over the damage waiver."
"292","పెట్రోల్ పట్టడంలో, పడవ దగ్గరకు చేరుకోవడంలో నువ్వు మాకు సహకరించు, అప్పుడు మేము నిన్ను వదిలేస్తాం. నేను మాట ఇస్తున్నా.","You help us get petrol, you help us get to the boat, and we will let you go. I swear."
"293","సరేనా? అలాగే.","Yeah? Okay."
"294","చూడు, కంగారు పడకు. సరేనా? వాడు మన ముఖాలని చూశాడు, బాసూ. వాడిని మనం చంపేయాలి.","Listen, be cool. Okay? He's seen all our faces, man. He has got to go."
"295","లేదు! చెప్పేది జాగ్రత్తగా విను. నువ్వు నన్ను సీరియస్ గా ఎందుకు తీసుకోవడం లేదు?","No! Listen. Why aren't you taking me seriously?"
"296","తుపాకీ నీ దగ్గర ఉందా, నా దగ్గర ఉందా?","'Cause I'm the one with the fucking gun, remember?"
"297","అతను చెప్పినదాన్లో నిజం ఉంది. నాకు కూడా అది నచ్చలేదు, కానీ అతను చెప్పింది నిజమే.","He's got a point. Look, I don't like it either, but he's right."
"298","దయచేసి నేను చెప్పేది వినండి. మీ ముఖాలను చూశాను అని గానీ, మీ గొంతులను విన్నానని గానీ నేను చెప్పను, కంగారుతో అంతా మర్చిపోయానని చెప్తాను.","Please, please. I'll say I never saw your faces or I never heard your voices or I blanked it out from stress."
"299","ఇప్పుడు ఏమైనా చెప్తాడులే.",", right now he'll say anything."
"300","నా బాబాయ్ దగ్గర చాలా డబ్బు ఉంది.","My uncle's got money."
"301","చూశారా, ఏం చెప్తున్నాడో!","Proving my point."
"302","లేదు, నిజమే చెప్తున్నా. మా బాబాయ్ దగ్గర చాలా డబ్బు ఉంది.","No, straight up. My uncle's rich."
"303","చూడండి, పారిపోవడానికి మీరు వేసిన ప్లాన్ అది పని చేయకపోవచ్చు, కానీ మా బాబాయ్ దాన్ని చూసుకుంటాడు.","Look, your exit plan, it it might not work, but my uncle, he can sort that."
"304","అతను మీకు సాయపడగలడు. అతను ఏమైనా నీ అబద్ధాలు ఆపరా చచ్చినోడా!","He can help you. He can make something You little fucking lying rat!"
"305","హేయ్! హేయ్! ఇక ఆపు!","Hey! Hey! Fucking stop it!"
"306","మీ బాబాయ్.","Your uncle."
"307","అతను ఎక్కడ ఉన్నాడు?","Where is he?"
"308","ఇస్లామాబాదులో.","Islamabad."
"309","ఎక్కడ?","Where?"
"310","పాకిస్తాన్.","Pakistan."
"311","మనకి అది ఎలా ఉపయోగపడుతుంది?","What the fuck use is that to us?"
"312","మీరు డబ్బు తీసుకొని పరారీ అయిపోవచ్చు. ఇది అంతా పరమ సోదిలా ఉంది.","You get your money and you disappear. This is such fucking bullshit."
"313","అతను నీతో మైండ్ గేమ్స్ ఆడుతున్నాడు. నీ సోది ఆపు. నేను ఆలోచిస్తున్నాను, సరేనా?","He's messing with ya. Fucking stop it. I'm thinking, okay?"
"314","అలా అయితే చాలా సమయం పడుతుందిలే. హేయ్.","That should take a while. Hey."
"315","మూసుకో. సరేనా? మూసుకో.","Fucking don't. Okay? Don't."
"317","ఓసారి ప్రయత్నించి చూస్తే ఏమవుతుంది?","It's gotta be worth a shot, yeah."
"318","సరేనా? కానీ నువ్వు కూడా మాతో పడవలో వస్తావు, మాకు డబ్బు అందేదాకా నువ్వు మాతోనే ఉండాలి.","Yeah? But you're coming on the boat too, and you stay with us till we get the money."
"319","ల ల లా లా లా ల ల ల లా లా లా ల డ డ డ డమ్ ల ల లా లా లా ల కారు దిగు. ఏంటి?","♪ La la la, la la la La la la, la la la ♪ ♪ La la la, la la la ♪ Get out of the car. What?"
"320","కారు దిగు.","Get out of the car."
"322","నీకు ఇది జోక్ గా ఉందా?","Is this a joke?"
"323","అదేం లేదు, నేను ప్రొక్లేయిమర్స్ పాట వింటున్నా.","No, it's the Proclaimers."
"324","కారు దిగు నిక్, శాంతించు. నేను కారు తెచ్చేశాను.","Get out of the Nick, relax. I brought the car back."
"325","నువ్వు నాపై తుపాకీ ఎక్కుపెట్టాను.","You pulled a gun on me."
"326","లేదు, నేను వేరే వాళ్ల చేత పెట్టించాను. ఏ న్యాయస్థానం అయినా నీకు ఆ రెంటి మధ్య తేడా చెప్తుంది.",", no, I delegated that. An And any court of law will tell you there's a difference."
"327","ఇంకా తను తుపాకీ ఎక్కు పెట్టింది నీపై కాదు. తను మీ ఏజెంట్ పై ఎక్కు పెట్టింది.","And she didn't pull a gun on you. She pulled a gun on on your boy."
"328","కారు దిగు.","Get out of the car."
"329","నన్ను కాల్చుతావా?","Are you gonna shoot me?"
"330","ఇప్పుడు కాదు. మరి మీ వాళ్లు కాల్చితే?","Not right now. Yeah, well, what about one of your lads?"
"331","మీ వాళ్లు నన్ను కాల్చాలని తహతహలాడుతున్నట్టున్నారు.","Hair triggers make natural scratching posts for itchy indexes."
"332","నువ్వు ఏదైనా చేస్తే తప్ప వాళ్లు ఏమీ చేయరు.","They're not gonna do anything unless you do."
"333","నా మాట నమ్ము. ఇక కారు దిగు.","You got my word on that. Now get out of the fucking car."
"334","సరే. అలాగే.","All right. Good."
"335","ఎందుకంటే నేను డయానా మహారాణితో మాట్లాడాలనుకుంటున్నాను.","'Cause I was wanting a little word with Lady Di."
"337","సరే మరి, తుపాకీ కోసం చేతులు పెట్టానంతే.","All right, Just reaching for a peashooter."
"338","ఇదుగో.","Here you go."
