Index,Details,Telugu,English,Status
9,t(3)-e(2) | ... vs ..,ఇది చూడు. నీకు క్యూ.ఆర్. కోడ్ ఉంది.,[sighs] Look at that. You got a QR code.,MISMATCH
188,t(3)-e(2) | ... vs ..,నాకు ఒక సెకను టైమ్ ఇవ్వు. అమ్మ శక్తి. నేను వెళ్లాలి.,[Vanessa] Give me a second. Mommy power. I've gotta [laughing],MISMATCH
266,t(3)-e(2) | ... vs ..,చాలా తెలివైన వాడు. ఎన్.పి.ఆర్. లో నేను అతని ఇంటర్వ్యూ చూశాను.,He's very smart. I heard him interviewed on NPR.,MISMATCH
304,t(2)-e(3) | .. vs ...,"ఇంకా అందరికీ డబ్బు అంటే ఎందుకు అంత పిచ్చి? తేలికగా తీసుకో. వెనక్కి తగ్గు, అలెగ్జాండ్రియా కోర్టాజియో-కోర్టెజ్.","And Why is everyone so obsessed with money? Whoa. Take it easy. Back up, Alexandria Cortazio-Cortez.",MISMATCH
349,t(3)-e(4) | ... vs ....,బాగానే అనేది చెత్త. నేను ఇంకా బాగా ఉండాలి. ఆ విషయం నీకు కూడా తెలుసు.,[sighs] Fuck fine. I want more than fine. Goddamn it. You know this.,MISMATCH
357,t(3)-e(4) | ?.. vs .?..,"హేయ్, ఒమర్, ఇక్కడ ఈ ట్యాంకుని ఖాళీ చేయడంలో నాకు సాయం చేస్తావా? అలాగే. థాంక్యూ.","Hey, Omar. Will you help me, , empty this tank over here? , yeah. Thank you.",MISMATCH
421,t(2)-e(3) | ?. vs .?.,ఏం జరుగుతోంది? వాటిని తంతున్నాను.,"Whoa, whoa, whoa. What's happening? Toss 'em.",MISMATCH
449,t(2)-e(3) | .. vs ...,"హేయ్, వెనెసా. చార్లీ పని చేసే సంస్థలోనే నేను భాగస్వామిని.",Hey. Vanessa. I'm a partner at the same firm as Charlie.,MISMATCH
