"Index","Start Time","End Time","Telugu Text","Mapped English Text"
"267","00:15:30,889","00:15:36,103","హో, ఇప్పుడు నువ్వు ఏం చెప్పాలంటే, అది కూడా మొట్టమొదటిసారి అన్నమాట, ""సూపర్ పని చేశావు,"" లేదా ""థ్యాంక్యూ.""","I think the words you're looking for, Ho, and these would be a first for you, are, ""Well done"" and ""Thank you."""
"268","00:15:37,312","00:15:39,690","పార్క్ ఈ బండి మీద కూడా ఓ కన్నేసి ఉంచుతోంది.","It's on the list of vehicles the Park are looking for."
"269","00:15:39,690","00:15:41,984","అయితే ఆ వాహనం మీద వాళ్లు మరింత దృష్టి పెట్టేలా మనం చేయాలి.","Then we need to get them to focus on that vehicle."
"270","00:15:41,984","00:15:43,944","కానీ మనం అలా చేస్తే, పార్క్ వాళ్లకి మనల్ని ట్రాక్ చేసేస్తారు కదా?","How do we let the Park know that without them tracking us?"
"271","00:15:43,944","00:15:46,280","ఓరి దేవుడా. మిన్, అక్కడ ఒక కుర్రాడి ప్రాణాలు పోయేలా ఉన్నాయి.","Oh, my God. Min, a kid's life is at stake."
"272","00:15:46,280","00:15:49,241","నాకు తెలుసు, కానీ దొరక్కుండా ఉండమని మనకి ల్యాంబ్ చెప్పాడు కదా.","I know, but Lamb... Lamb told us not to get caught."
"273","00:15:50,450","00:15:51,994","పోనీ మనమే ఆ బండిని ట్రాక్ చేయలేమా?","Can't we track it ourselves?"
"274","00:15:53,704","00:15:57,415","**[NO TELUGU MATCH FOUND]**","[sighs]"
"275","00:15:57,499","00:16:11,305","- ఆపు! - ఆపు!","[""I'm Gonna Be (500 Miles)"" playing on stereo] - [Dog 1] Oi! Stop! - [Dog 2] Stop!"
"276","00:16:11,305","00:16:14,766","ఆపు! ఆపు!","- [Dog 1] Stop! - [indistinct chatter] - [indistinct radio chatter] - [Dog 1] Stop!"
"277","00:16:14,850","00:16:17,019","బండిలోనే ఉండండి.","[Dog 2] Stay in the vehicle."
"278","00:16:19,104","00:16:23,275","అవును, నాకు తెలుసులే ఉంటానని నీ కోసం కష్టపడే మనిషిని అవుతాను","[mouthing lyrics] ♪ Yes, I know I'm gonna be ♪ ♪ I'm gonna be the man Who's working hard for you ♪"
"279","00:16:23,358","00:16:24,609","**[NO TELUGU MATCH FOUND]**","[shouting continues]"
"280","00:16:24,693","00:16:27,321","నేను చేసే పనికి కదలవద్దు.","♪ And when the money ♪ [Dog 1] Stay there."
"281","00:16:27,321","00:16:31,116","డబ్బు వచ్చినప్పుడు అందులోని పైసా పైసా నీకే ఇస్తాను","♪ Comes in for the work I do I'll pass almost every penny on to you ♪"
"282","00:16:30,240","00:16:32,242","**[NO TELUGU MATCH FOUND]**","[loud beeping]"
"283","00:16:32,326","00:16:34,912","- పదండి! - వెళ్దాం పదండి!","- [Dog 3] Move! Move! - [Dog 4] Come on, let's go!"
"284","00:16:34,912","00:16:37,247","పదండి!","- [shouting indistinctly] - [Dog 3] Move!"
"285","00:16:37,331","00:16:54,389","పదండి. పదండి. అవును, నాకు తెలుసులే ఉంటానని నీ కోసం కష్టపడే మనిషిని అవుతాను కానీ నేను 500 కిలోమీటర్లు నడవగలను ఇంకో 500 కిలోమీటర్లు నడవగలను","- [Dog 3] Go. Go. Go. Move. - [beeping continues, stops] [mouthing lyrics] ♪ Well, I know I'm gonna be ♪ ♪ I'm gonna be the man Who's growing old with you ♪ ♪ But I would walk 500 miles ♪ - ♪ And I would walk 500 more ♪ - [tapping]"
"286","00:16:54,473","00:16:57,308","**[NO TELUGU MATCH FOUND]**","[song continues on stereo]"
"287","00:16:57,392","00:16:59,561","దయచేసి బండి నుండి దిగుతారా, మిస్టర్ ల్యాంబ్?","Can you get out of the vehicle, please, Mr. Lamb?"
"288","00:17:00,270","00:17:02,314","లేదు, లేదు. నాకు ఇక్కడే బాగుంది.","No, no, no. I'm quite comfortable where I am."
"289","00:17:02,314","00:17:05,858","సీట్లు చాలా బాగున్నాయి. వెచ్చగా ఉన్నాయి కూడా.","These seats are lovely. And they're heated too."
"290","00:17:05,943","00:17:09,279","- వెంటనే బండి నుండి దిగండి. - లేదు, నాకు ఇక్కడే బాగుంది.","- Step out of the vehicle now. - Nah, I'm... I'm... I'm okay where I am."
"291","00:17:09,363","00:17:15,536","వెళ్లి నీ బాస్ కి చెప్పు, అతని బండిని తెచ్చానని, కారును అలా తీసుకున్నందుకు ఫీల్ అవ్వవద్దని.","You go fetch your boss and tell him I've brought the car back, but we need to go over the damage waiver."
"292","00:17:22,125","00:17:27,214","పెట్రోల్ పట్టడంలో, పడవ దగ్గరకు చేరుకోవడంలో నువ్వు మాకు సహకరించు, అప్పుడు మేము నిన్ను వదిలేస్తాం. నేను మాట ఇస్తున్నా.","You help us get petrol, you help us get to the boat, and we will let you go. I swear."
"293","00:17:28,924","00:17:31,093","సరేనా? అలాగే.","Yeah? Okay."
"294","00:17:31,093","00:17:36,807","చూడు, కంగారు పడకు. సరేనా? వాడు మన ముఖాలని చూశాడు, బాసూ. వాడిని మనం చంపేయాలి.","- Listen, be cool. Okay? - [coughing] [Curly] He's seen all our faces, man. He has got to go."
"295","00:17:36,807","00:17:40,185","లేదు! చెప్పేది జాగ్రత్తగా విను. నువ్వు నన్ను సీరియస్ గా ఎందుకు తీసుకోవడం లేదు?","No! Listen. Why aren't you taking me seriously?"
"296","00:17:40,269","00:17:42,020","తుపాకీ నీ దగ్గర ఉందా, నా దగ్గర ఉందా?","'Cause I'm the one with the fucking gun, remember?"
"297","00:17:42,104","00:17:44,731","అతను చెప్పినదాన్లో నిజం ఉంది. నాకు కూడా అది నచ్చలేదు, కానీ అతను చెప్పింది నిజమే.","He's got a point. Look, I don't like it either, but he's right."
"298","00:17:44,815","00:17:50,445","దయచేసి నేను చెప్పేది వినండి. మీ ముఖాలను చూశాను అని గానీ, మీ గొంతులను విన్నానని గానీ నేను చెప్పను, కంగారుతో అంతా మర్చిపోయానని చెప్తాను.","Please, please. I'll say I never saw your faces or I never heard your voices or I blanked it out from stress."
"299","00:17:50,529","00:17:52,865","ఇప్పుడు ఏమైనా చెప్తాడులే.","Oh, right now he'll say anything."
"300","00:17:53,574","00:17:55,242","నా బాబాయ్ దగ్గర చాలా డబ్బు ఉంది.","My uncle's got money."
"301","00:17:55,242","00:17:56,451","చూశారా, ఏం చెప్తున్నాడో!","Proving my point."
"302","00:17:56,535","00:17:58,287","లేదు, నిజమే చెప్తున్నా. మా బాబాయ్ దగ్గర చాలా డబ్బు ఉంది.","No, straight up. My uncle's rich."
"303","00:17:58,287","00:18:01,874","చూడండి, పారిపోవడానికి మీరు వేసిన ప్లాన్... అది పని చేయకపోవచ్చు, కానీ మా బాబాయ్ దాన్ని చూసుకుంటాడు.","Look, your exit plan, it... it might not work, but my uncle, he can sort that."
"304","00:18:01,874","00:18:05,544","- అతను మీకు సాయపడగలడు. అతను ఏమైనా... - నీ అబద్ధాలు ఆపరా చచ్చినోడా!","- He can help you. He can make something... - You little fucking lying rat!"
"305","00:18:05,544","00:18:08,005","హేయ్! హేయ్! ఇక ఆపు!","Hey! Hey! Fucking stop it!"
"306","00:18:11,383","00:18:12,968","మీ బాబాయ్.","- [pants] - Your uncle."
"307","00:18:13,802","00:18:15,012","అతను ఎక్కడ ఉన్నాడు?","Where is he?"
"308","00:18:16,013","00:18:17,014","ఇస్లామాబాదులో.","Islamabad."
"309","00:18:18,015","00:18:19,183","ఎక్కడ?","Where?"
"310","00:18:19,183","00:18:20,350","పాకిస్తాన్.","Pakistan."
"311","00:18:20,434","00:18:22,269","మనకి అది ఎలా ఉపయోగపడుతుంది?","- [chuckles] - What the fuck use is that to us?"
"312","00:18:22,269","00:18:24,813","- మీరు డబ్బు తీసుకొని పరారీ అయిపోవచ్చు. - ఇది అంతా పరమ సోదిలా ఉంది.","- You get your money and you disappear. - This is such fucking bullshit."
"313","00:18:24,897","00:18:27,649","- అతను నీతో మైండ్ గేమ్స్ ఆడుతున్నాడు. - నీ సోది ఆపు. నేను ఆలోచిస్తున్నాను, సరేనా?","- He's messing with ya. - Fucking stop it. I'm thinking, okay?"
"314","00:18:27,733","00:18:29,943","- అలా అయితే చాలా సమయం పడుతుందిలే. - హేయ్.","- That should take a while. - [laughs] Hey."
"315","00:18:30,694","00:18:33,488","మూసుకో. సరేనా? మూసుకో.","[pants] Fucking don't. Okay? Don't."
"316","00:18:33,572","00:18:34,948","**[NO TELUGU MATCH FOUND]**","[breathing heavily]"
"317","00:18:40,329","00:18:42,206","ఓసారి ప్రయత్నించి చూస్తే ఏమవుతుంది?","It's gotta be worth a shot, yeah."
"318","00:18:43,498","00:18:50,631","సరేనా? కానీ నువ్వు కూడా మాతో పడవలో వస్తావు, మాకు డబ్బు అందేదాకా నువ్వు మాతోనే ఉండాలి.","- Yeah? - [scoffs] But you're coming on the boat too, and you stay with us till we get the money."
"319","00:19:01,475","00:19:16,156","ల ల లా లా లా ల ల ల లా లా లా ల డ డ డ డమ్ ల ల లా లా లా ల కారు దిగు. ఏంటి?","- [song continues on stereo] - [loud beeping] ♪ La la la, la la la La la la, la la la ♪ ♪ La la la, la la la ♪ - Get out of the car. - [continues singing] What?"
"320","00:19:16,240","00:19:17,741","కారు దిగు.","Get out of the car."
"321","00:19:17,824","00:19:19,826","**[NO TELUGU MATCH FOUND]**","[song continues on stereo]"
"322","00:19:19,910","00:19:21,662","నీకు ఇది జోక్ గా ఉందా?","Is this a joke?"
"323","00:19:21,662","00:19:23,539","అదేం లేదు, నేను ప్రొక్లేయిమర్స్ పాట వింటున్నా.","No, it's the Proclaimers."
"324","00:19:23,539","00:19:31,672","కారు దిగు... నిక్, శాంతించు. నేను కారు తెచ్చేశాను.","- Get out of the... - [stereo stops] Nick, relax. I brought the car back."
"325","00:19:31,672","00:19:33,298","నువ్వు నాపై తుపాకీ ఎక్కుపెట్టాను.","You pulled a gun on me."
"326","00:19:33,382","00:19:37,845","లేదు, నేను వేరే వాళ్ల చేత పెట్టించాను. ఏ న్యాయస్థానం అయినా నీకు ఆ రెంటి మధ్య తేడా చెప్తుంది.","Uh, no, I delegated that. An... And any court of law will tell you there's a difference."
"327","00:19:37,845","00:19:41,557","ఇంకా తను తుపాకీ ఎక్కు పెట్టింది నీపై కాదు. తను మీ ఏజెంట్ పై ఎక్కు పెట్టింది.","And she didn't pull a gun on you. She pulled a gun on... on your boy."
"328","00:19:41,557","00:19:43,684","కారు దిగు.","Get out of the car."
"329","00:19:45,602","00:19:46,645","నన్ను కాల్చుతావా?","Are you gonna shoot me?"
"330","00:19:46,645","00:19:49,773","- ఇప్పుడు కాదు. - మరి మీ వాళ్లు కాల్చితే?","- Not right now. - Yeah, well, what about one of your lads?"
"331","00:19:49,857","00:19:54,862","మీ వాళ్లు నన్ను కాల్చాలని తహతహలాడుతున్నట్టున్నారు.","Hair triggers make natural scratching posts for itchy indexes."
"332","00:19:55,487","00:19:57,072","నువ్వు ఏదైనా చేస్తే తప్ప వాళ్లు ఏమీ చేయరు.","They're not gonna do anything unless you do."
"333","00:19:57,072","00:19:59,533","నా మాట నమ్ము. ఇక కారు దిగు.","You got my word on that. Now get out of the fucking car."
"334","00:19:59,533","00:20:00,784","సరే. అలాగే.","All right. Good."
"335","00:20:01,994","00:20:04,538","ఎందుకంటే నేను డయానా మహారాణితో మాట్లాడాలనుకుంటున్నాను.","'Cause I was wanting a little word with Lady Di."
"336","00:20:07,291","00:20:09,167","**[NO TELUGU MATCH FOUND]**","[weapons cocking]"
"337","00:20:09,251","00:20:15,257","సరే మరి, తుపాకీ కోసం చేతులు పెట్టానంతే.","All right, ah. [Grunts] Just reaching for a peashooter."
"338","00:20:15,257","00:20:16,341","ఇదుగో.","Here you go."
"339","00:20:20,179","00:20:21,346","కారుని బేస్మెంట్ లో పార్క్ చేయ్.","Park it downstairs."
"340","00:20:21,430","00:20:23,265","నాకు కాఫీ ఇస్తే తాగి పెడతా.","I could... I could murder a coffee."
"341","00:20:23,765","00:20:47,581","ఇక్కడ క్యాంటీన్ బాగానే ఉంటుందా? డాగ్స్ స్క్వాడ్ వస్తుంది. స్టాండ్ బై. నీ ప్లాన్ ఏంటి, కెప్టెన్?","What's the canteen like in this gaff? - [Lead Dog] Dogs en route. Stand by. - [siren wailing] What's your plan then, big man?"
"342","00:20:49,041","00:20:53,045","హేయ్, నువ్వు బండి దిగు.పెట్రోల్ పట్టు.","Hey, you get out. You fill up the van."
"343","00:20:53,045","00:20:54,671","తల ఊపు.","Nod, nod, nod."
"344","00:20:54,755","00:20:58,884","నువ్వు పెట్రోల్ పట్టు, మనందరం ఇక్కడి నుండి వెళ్లిపోదాం.","You fill up the van, and we all get the fuck out of here."
"345","00:20:58,884","00:21:01,220","సరేనా?","Yes? [Breathes heavily]"
"346","00:21:02,471","00:21:03,680","**[NO TELUGU MATCH FOUND]**","Oi."
"347","00:21:04,973","00:21:06,308","వాడికి డబ్బులు ఇవ్వు.","Give him some money."
"348","00:21:08,435","00:21:14,566","వాడు ఒకవేళ పారిపోతే? హేయ్, విను. నువ్వు... నువ్వు మళ్లీ వచ్చేయాలి.","- How do you know he won't do a runner? - [Zeppo breathes heavily] Hey, listen, kid. You've got... You've gotta come back."
"349","00:21:14,650","00:21:16,485","అక్కడ పెట్రోల్ పట్టుకుంటున్న మహిళని చూశావా?","[Curly] See that lady in the front filling up?"
"350","00:21:16,485","00:21:18,320","కారులో ఇద్దరు పిల్లలు కూడా ఉన్నారు, చూశావా?","The one with the two kids in the car?"
"351","00:21:19,404","00:21:20,405","హేయ్!","Hey!"
"352","00:21:21,240","00:21:22,658","ఆ మహిళ కనిపిస్తోందా?","Do you see that woman?"
"353","00:21:26,912","00:21:31,542","ఏదైనా వేషాలు వేస్తే, నేను బండి వెనుక ఉన్న గొడ్డలిని బయటకు తీస్తా.","If you do anything wrong, I'll walk round to the back of the van, and I'll get my axe out."
"354","00:21:31,542","00:21:34,211","ఆవిడ ముందే తన పిల్లల తలలని నరికేస్తా.","And I'll cut her kids' heads off in front of her."
"355","00:21:34,211","00:21:36,797","ఆ తర్వాత నీ తలని కూడా నరికేస్తా.","Then I'll cut her head off, then yours."
"356","00:21:37,381","00:21:38,715","నేను అలా ఖచ్చితంగా చేస్తానని నీకు తెలుసు కదా?","And you know I'll do that, right?"
"357","00:21:39,842","00:21:41,093","తెలుసు.","[breathes shakily] Yeah."
"358","00:21:52,396","00:21:54,606","హేయ్. దీన్ని గడబిడ చేయకు.","Hey, kid. Don't fuck this up."
"359","00:22:03,323","00:22:06,535","**[NO TELUGU MATCH FOUND]**","[breathing heavily]"
"360","00:22:09,162","00:22:10,914","**[NO TELUGU MATCH FOUND]**","[cap clattering]"
"361","00:22:11,748","00:22:12,916","**[NO TELUGU MATCH FOUND]**","[thud]"
"362","00:22:15,377","00:22:16,545","డీజిల్ పట్టు, సరేనా?","Diesel, yeah?"
"363","00:22:18,505","00:22:21,341","దరిద్రుడు. వాడి మీద ఓ కన్నేసి ఉంచు.","Knobhead. Keep your eye on him."
"364","00:22:24,303","00:22:26,179","**[NO TELUGU MATCH FOUND]**","[cap clattering]"
"365","00:22:26,263","00:22:27,347","**[NO TELUGU MATCH FOUND]**","[pump whirring]"
"366","00:22:27,389","00:22:30,267","ఏవండి. హలో.","[customer] Excuse me. Hello."
"367","00:22:30,350","00:22:33,353","- నీ దుంప దెగ. - అబ్బా.","- [Curly] Oh, for fuck's sake. - [Zeppo] No, no, no."
"368","00:22:33,437","00:22:36,190","- అయ్య బాబోయ్. - నన్ను మన్నించండి. నాకు మీ సాయం కావాలి.","- Oh, fuck off. - I... I'm sorry, I-I-I need your help. Uh..."
"369","00:22:36,190","00:22:39,109","నా పెట్రోల్ ట్యాంక్ మూతని నేను పెట్టుకోలేకపోతున్నాను.","Can't get me, um... me petrol cap back on."
"370","00:22:41,195","00:22:43,155","ఇక్కడ ఉన్న సహాయకుడు ఎవరైనా సాయపడగలరేమో.","Maybe the attendant can help."
"371","00:22:44,615","00:22:50,537","లేదు. అతను అద్దానికి అటు వైపు ఉన్నాడు, అదీగాక... - ఆమె ఏం అంటోంది? - ...నేను అతని దగ్గరకు వెళ్లి... అబ్బా.","Oh, no. 'Cause he's stuck behind glass and, you know… - What's she saying? - …the only way I can get… Fuck this."
"372","00:22:50,621","00:22:52,539","...నేను మళ్లీ త్వరగా బయలుదేరాలి.","…I gotta get moving again soon. [Chuckles]"
"373","00:22:55,584","00:23:03,300","కానీ, నేను... కానీ, నేను... నేనే ఎలాగో చేసుకుంటాలే.","But I'll, um… But I'll, um... No, I'll... I'm... I'll work it out."
"374","00:23:04,009","00:23:06,929","హేయ్, మెర్విన్. పాపం ఆవిడకి చేయి అందించు.","Hey, Mervin. Help the poor woman."
"375","00:23:08,805","00:23:10,307","హేయ్, చూడండి, వాడిని పట్టించుకోకండి.","Hey, look, I'm sorry about him."
"376","00:23:11,433","00:23:14,645","ఇంకొన్ని రోజుల్లో ఆనందంతో వెలిగి పోతాడు అనుకుంటా. ఏడు రోజుల్లో వాడి పెళ్లి ఉంది.","Think he'd be a lot happier. He's getting married in seven days."
"377","00:23:17,814","00:23:19,441","ఈ వికెండ్ బ్యాచిలర్స్ పార్టీ చేసుకుంటున్నాం.","It's a stag weekend."
"378","00:23:20,108","00:23:23,987","అయ్యయ్యో. క్షమించండి.","Oh. [Chuckling] Oh, God. Sorry."
"379","00:23:24,071","00:23:26,406","ఏమైంది అంటే...","It's... It's just 'cause you, um..."
"380","00:23:26,490","00:23:28,575","మీరు, మీరు అచ్చం...","You know, you look like that, uh..."
"381","00:23:29,159","00:23:31,661","అదే...","You know, the... That... [stammers]"
"382","00:23:31,745","00:23:34,414","- అదే... - అవునవును. నాకు తెలుసు. అంటే...","- You know, the, um... The... The fell... - Oh, yeah. Yeah, I know. The..."
"383","00:23:34,498","00:23:37,584","- కిడ్నాప్ అయిన పాకిస్తాన్ కుర్రాడిలాగా ఉన్నాను. - అవును.","- The Pakistani boy that was kidnapped. - Yeah."
"384","00:23:37,668","00:23:39,211","అవును, నేను అర్థం చేసుకోగలనులే.","Yeah, I get it."
"385","00:23:39,211","00:23:41,087","ఇవాళ జనాలు అందరూ అదే అంటున్నారు.","- Had it all bloody day. - Oh. [Chuckles]"
"386","00:23:41,171","00:23:43,571","కానీ మీకు మేమందరమూ ఒకేలా ఉంటాం అనుకుంటా, అంతే కదా?","But I suppose we all just look the same to you people, right?"
"387","00:23:44,716","00:23:47,845","అయ్యో, అదేం లేదు. నా ఉద్దేశం... నేనేం అనుకున్నానంటే...","No. No, I wasn't... I wasn't... I... It's just 'cause... [stammers] I was thinking..."
"388","00:23:47,845","00:23:50,180","హేయ్, నేను జోక్ వేశానంతే.","Oh, hey, uh... I was just joking."
"389","00:23:50,264","00:23:52,057","అవును.","- Oh. [Chuckles, groans] - Yeah."
"390","00:23:52,641","00:23:53,767","క్షమించండి.","Sorry."
"391","00:23:53,851","00:23:55,519","మీ ట్యాంక్ మూత పెట్టనా?","How about I look at that cap for you, yeah?"
"392","00:23:55,519","00:23:57,980","సరే, అది చాలా... అలాగే, థ్యాంక్యూ.","Yeah, that'd be, um... Yeah, thank you."
"393","00:23:58,063","00:23:59,189","**[NO TELUGU MATCH FOUND]**","[sniffs]"
"394","00:24:06,154","00:24:08,323","హేయ్. ఆపు.","- [blows raspberry] - Hey. Knock that off now."
"395","00:24:09,324","00:24:10,367","మన్నించాలి, వారు లేచారు.","I'm sorry they're up."
"396","00:24:10,367","00:24:12,619","- లేదు, లేదు! - పర్వాలేదు. అందులో మీ తప్పేం లేదు కదా.","- It's all right. It's not your fault. - [giggles] Nah, nah!"
"397","00:24:12,703","00:24:14,996","ఇది బాగా ఇరుక్కుపోయినట్టుందే?","Oh, that's really stuck in there, isn't it? [Grunts]"
"398","00:24:15,080","00:24:16,373","పెట్టేశా.","There you go. [Sighs]"
"399","00:24:16,373","00:24:18,958","హేయ్, థ్యాంక్యూ. హ్యాపీ మ్యారేజ్.","- Hey, thank you. Have a good wedding. - Huh?"
"400","00:24:19,042","00:24:21,211","అలాగే, థ్యాంక్స్.","Oh. Yeah, thanks."
"401","00:24:21,295","00:24:24,381","ముందు ఈ వీకెండ్, ఈ సన్నాసులతో గడపాలి.","Just gotta get through a weekend with these miserable morons first."
"402","00:24:24,464","00:24:25,716","**[NO TELUGU MATCH FOUND]**","[chuckles]"
"403","00:24:38,562","00:24:39,771","**[NO TELUGU MATCH FOUND]**","[pump whirring stops]"
"404","00:24:43,150","00:24:44,610","వెళ్లి డబ్బులు కట్టిరా.","[Larry] Go and pay the man."
"405","00:24:50,824","00:24:51,825","**[NO TELUGU MATCH FOUND]**","[sighs]"
"406","00:24:51,909","00:24:53,827","హేయ్, నీకు ఇంకోసారి థ్యాంక్స్ చెప్పకుండా ఉండలేకపోతున్నాను.","[customer] Hey, thank you again, love."
"407","00:24:56,705","00:25:01,460","హాయ్. తను వెళ్లిపోతోంది.","Hi… [speaks indistinctly] She's leaving."
