"Index","Start Time","End Time","Telugu Text","Mapped English Text"
"136","00:08:00,022","00:08:03,192","- అవును. - నాకు తెలిసి అతనికి మన కన్నా ఆమె మీదే ఎక్కువ అసహ్యం అనుకుంటా.","- Exactly. - I think he's got even more contempt for her than he does for us."
"137","00:08:03,192","00:08:05,152","వావ్, చిన్నా చితకా అసహ్యం కాదు.","Wow, that's a skip-load of contempt."
"138","00:08:05,152","00:08:06,403","ఈ లోపు, మనం ఏం చేయాలి?","And meanwhile, we what?"
"139","00:08:06,403","00:08:08,655","ప్రస్తుతం ఈ విషయానికి సంబంధించి నైతిక అంశాల గురించి చర్చిద్దామా?","[reporter] Can we talk about the ethics of this for a moment?"
"140","00:08:08,739","00:08:16,121","ఎందుకంటే, కిడ్నాపర్లు, వాళ్లు అన్నట్టు హసాన్ తలని ఉదయం 6:30కి నరికివేస్తే, జనాలు నిజంగానే దాన్ని చూస్తారా?","Because if they are going to behead Hassan at 6:30 a.m., as they say they are, are people really going to watch?"
"141","00:08:16,205","00:08:18,081","ఒకవేళ చూస్తే, వాళ్లు చేసేది నైతికపరంగా సరైనదే అంటారా?","And if they do, are they not complicit?"
"142","00:08:18,165","00:08:20,209","రాడీ, హసాన్ విషయంలో పార్క్ వాళ్లు ఎక్కడి దాకా వచ్చారు?","Roddy, where are the Park on Hassan?"
"143","00:08:21,126","00:08:23,921","సంఘటనా స్థలి నుండి బయలుదేరిన బండ్లలో ఇప్పుడు పది బండ్లను ట్రాక్ చేస్తున్నారు.","[Roddy] They've just narrowed it down to ten vehicles that have left the area."
"144","00:08:23,921","00:08:31,345","ఈ విషయంలో మనం చేయగల విషయం ఏంటంటే, మనకి అలన్ బ్లాక్ తెలుసు, కాబట్టి... అతని గురించి మనకు ఏం తెలుసో చర్చించుకుందామా?","The one thing that we can bring to this is that we knew Alan Black, so… [inhales deeply] …what do we remember about him?"
"145","00:08:31,345","00:08:35,682","అండర్ కవర్ లో ఉండగా వెనిజ్వేలా రాయబారి భార్యతో పడక పంచుకున్నందుకు అతడిని స్లో హౌస్ లో వేశారు.","[chuckles] He was sent to Slough House for sleeping with the Venezuelan ambassador's wife while undercover."
"146","00:08:35,682","00:08:37,518","అది కాకుండా.","Ap... Apart from that."
"147","00:08:37,518","00:08:39,727","ఎప్పుడూ సణుగుతూనే ఉండేవాడు. ఒక్క బిస్కెట్ కూడా తెచ్చేవాడు కాదు.","He moaned a lot. Never bought biscuits."
"148","00:08:39,811","00:08:41,730","- ఓరి దేవుడా. - ఏమైంది? మనకి అనిపించినవి చెప్పేస్తున్నాం కదా.","- Oh, my God. - Sorry, what? We're free-forming."
"149","00:08:41,730","00:08:43,732","- ఇక్కడ పనికిమాలిన ఐడియాలు ఏవీ ఉండవు. - అతను పరమ బద్ధకస్తుడు.","- There's no bad ideas here. - He was really lazy."
"150","00:08:43,732","00:08:45,609","నేను చెప్పినదాని కన్నా అదేమైనా గొప్ప విషయమా?","Oh, and that... that's better than what I said, is it?"
"151","00:08:45,609","00:08:52,324","చూడండి, అతను సన్స్ ఆఫ్ ఆల్బియన్ దగ్గర అండర్ కవర్ గా ఉన్నాడు కదా, అంటే, అతనికి ఒక బర్త్ సర్టిఫికెట్, పాస్ పోర్ట్, క్రెడిట్ కార్డులు, ఇంకా చాలా చాలా ఉండుంటాయి కదా.","Listen, he was undercover with the Sons of Albion, so there would have been a birth certificate, passport, credit cards, the full legend."
"152","00:08:52,407","00:08:54,284","అవును. అండర్ కవర్ లో ఉండటానికి చాలా ఖర్చు అవుతుంది.","Mmm. Yeah. Deep cover's expensive."
"153","00:08:54,368","00:08:57,746","అతని ఆర్థిక స్థితి అంత బాగా లేదు, కాబట్టి మళ్లీ నకిలీవి సృష్టించాలని అనుకోడు.","He was tight, so he definitely wouldn't want to have to front that."
"154","00:08:57,746","00:09:00,457","అదీగాక, అలాంటివి అధికారికంగా ఉండటం టావెర్నర్ కి ఇష్టం ఉండదు.","More than that. Taverner won't want any of it to show up on the books."
"155","00:09:00,541","00:09:02,960","కాబట్టి, అతను పాత ఐడీని ఉపయోగించి ఉండవచ్చు.","So he could have used an old ID."
"156","00:09:03,710","00:09:04,711","రాడీ?","Roddy?"
"157","00:09:06,171","00:09:07,923","నాకు రెండు నిమిషాల సమయం ఇవ్వండి, అమ్మాయిలూ.","If you'll give me a few minutes, ladies."
"158","00:09:07,923","00:09:09,049","ఇక్కడ ఒక అబ్బాయి కూడా ఉన్నాడు.","And gentleman."
"159","00:09:09,132","00:09:10,467","**[NO TELUGU MATCH FOUND]**","[typing]"
"160","00:09:10,551","00:09:56,013","అమ్మాయిలే. హో గాడి ఖాతాలో మరో అద్భుతం.","- Ladies. - [scoffs] And that's another ""Ho-me"" run."
"161","00:09:56,096","00:09:58,891","ఇతను డెర్మట్ రాడ్ క్లిఫ్.","[chuckles] Meet Dermot Radcliffe."
"162","00:09:58,891","00:10:01,143","అలియాస్ అలన్ బ్లాక్.","AKA Alan Black."
"163","00:10:01,143","00:10:02,519","ఫుట్ బాల్ గొడవలకి మంచి పేరు ఉంది మనోడికి.","[Min] Legend for a football hooligan."
"164","00:10:02,603","00:10:03,896","సైన్యంలో కూడా పని చేశాడు.","[Louisa] Ex-forces too."
"165","00:10:03,896","00:10:05,898","బ్రిటీష్ వాళ్లకి అది చాలు కదా.","That's catnip for British nationalists."
"166","00:10:05,898","00:10:08,150","డెర్మట్ ఈమధ్య ఏమేం చేశాడో చూద్దాం.","Let's see what Dermot's been up to recently."
"167","00:10:26,126","00:10:28,253","మన్నించు, జెడ్. ఇదంతా ల్యాంబ్ ఐడియా.","Sorry, Jed. [Pants] Lamb's idea."
"168","00:10:37,596","00:10:39,681","- ల్యాంబ్, ఇంకా స్టాండిష్... - వాళ్లని తీసుకురాలేకపోయాం.","- Lamb and Standish... - Have not been apprehended."
"169","00:10:39,765","00:10:41,767","- అది నాకు తెలుస్తూనే ఉంది. - ల్యాంబ్ తుపాకీ బయటకు తీశాడు.","- Yes, I can see that. - Lamb pulled a gun."
"170","00:10:41,767","00:10:43,310","అతడిని మీరు చెక్ చేయలేదా?","You didn't frisk him?"
"171","00:10:43,310","00:10:44,520","అది స్టాండిష్ బ్యాగులో ఉండింది.","It was in Standish's bag."
"172","00:10:46,688","00:10:48,023","వీళ్లేనా కీడ్నాపర్స్?","This is them?"
"173","00:10:48,023","00:10:50,275","రౌపెల్ స్ట్రీట్ ఇంట్లో లభించిన వేలి ముద్రలు వీళ్లవే.","Fingerprints match those at the Roupell Street house."
"174","00:10:50,359","00:10:52,945","వీళ్లందరూ ఇంతకు ముందు అరెస్ట్ అయినవాళ్లే. దాడులు, తీవ్రమైన దాడులు, దొంగతనం.","They all have priors. ABH, GBH, burglary."
"175","00:10:52,945","00:10:57,699","- వాహనాల తనిఖీ విషయం ఎంత దాకా వచ్చింది? - ఇంకా ఎనిమిది వాహనాల ఆచూకీ తెలియాల్సి ఉంది, కానీ వాళ్లు సీసీటీవీలు ఉన్న రోడ్లలో ప్రయాణిస్తూ ఉండకపోవచ్చు.","- How we doing on the vehicles? - Still have eight to locate, but they might be avoiding roads with CCTV."
"176","00:10:57,783","00:10:59,034","వాహనాలను మారుస్తూ వెళ్తున్నారేమో.","They may have swapped vehicles."
"177","00:10:59,034","00:11:01,203","అన్ని వాహన చోరీల కేసులనూ చెక్ చేస్తున్నాం.","We're following up on all reported vehicle thefts."
"178","00:11:01,203","00:11:02,496","- మేడమ్. - ఇప్పుడు కాదు.","- Ma'am. - Not now."
"179","00:11:04,248","00:11:05,665","**[NO TELUGU MATCH FOUND]**","[alert dings]"
"180","00:11:05,749","00:11:06,834","భలే భలే.","[Curly] Showtime."
"181","00:11:07,709","00:11:09,169","పెట్రోల్ అయిపోవస్తోంది.","We're running out of petrol."
"182","00:11:09,670","00:11:10,671","అబ్బా.","No."
"183","00:11:11,171","00:11:13,090","దుంప దెగ!","Oh, fuck off!"
"184","00:11:13,090","00:11:15,050","అయితే ఏమైంది? పెట్రోల్ బంక దగ్గర ఆగుదాం.","So what? Stop at the garage."
"185","00:11:15,050","00:11:17,553","- మన మీద రక్తపు మరకలు ఉన్నాయి. - ఏదో నేరం చేశామని అనుకుంటారు.","- [Larry] We're covered in fucking blood. - [Curly] Bit of a giveaway."
"186","00:11:17,553","00:11:19,012","అక్కడి సీసీటీవీలో పడతాం.","[Larry] We'll end up on the CCTV."
"187","00:11:19,096","00:11:20,681","మనం మాస్కులని తెచ్చుకొని ఉండాల్సింది.","[Curly] Shouldn't have left the balaclavas behind."
"188","00:11:20,681","00:11:24,184","పెట్రోల్ లేకపోతే - పడవ దాకా వెళ్లలేం కదా? - శాంతించండి. నా దగ్గర ఒక ప్లాన్ ఉంది.","- Ah. F... - Well, we can't make the boat - without petrol, can we? - Just calm down. I've got a plan."
"189","00:11:24,268","00:11:29,189","- ఏంటది? - పెట్రోల్ అయ్యేదాకా నడుపుదాం, ఆ తర్వాత వాడి తలని నరికేద్దాం.","- Yeah? - We drive until we run out, - and then we're gonna chop his head off. - [Larry] Oh, f..."
"190","00:11:29,273","00:11:31,233","నీకేమైనా తిక్కా?","[Zeppo chuckles] What the fuck is wrong with you?"
"191","00:11:31,233","00:11:33,151","- ఒకసారి ఆలోచిద్దాం. - మనకి ఇంకో దారి లేదు.","- Yeah, let's just think about this. - We don't have options."
"192","00:11:33,235","00:11:35,779","ఉంది. నరకకుండా ఉండవచ్చు.","Yeah, we do. We have the option not to fucking do that."
"193","00:11:35,863","00:11:37,531","ఇంత చేసీ వృథా అయిపోవలసిందేనా?","And have all this for nothing?"
"194","00:11:37,531","00:11:42,369","వాళ్లు మనల్ని ఇరికించే పని చేశారు, ఇప్పుడు మనం చేస్తామన్న పని చేయకపోతే వెధవలం అయిపోతాం.","While they set us up and make us look like twats and we don't even do the thing that we said we were gonna do."
"195","00:11:42,369","00:11:44,663","నేను అలా అస్సలు జరగనివ్వను.","No, I can't have that."
"196","00:11:45,330","00:11:46,999","మనం జోకర్లు అయిపోతాం.","We'll be a fucking joke."
"197","00:11:46,999","00:11:48,917","జనానికి మనమంటే భయం, గౌరవం ఉండాలి.","People need to fear and respect us."
"198","00:11:49,001","00:11:52,129","మనం ఒకటి చెప్పామంటే, అది చేసి తీరతామని వాళ్లకి తెలియాలి.","They need to know that we mean what we say when we say it."
"199","00:11:52,212","00:11:53,046","**[NO TELUGU MATCH FOUND]**","[stifled crying]"
"200","00:11:53,130","00:11:55,883","ఇప్పటిదాకా జరిగిన ఘోరాలు చాలు. ఇది మన దేశం, దీన్ని మనం...","Enough is enough, man. This is our country, and we want it..."
"201","00:11:55,883","00:11:57,176","కాస్త నోర్నూసుకో!","[Zeppo] Fucking shut up!"
"202","00:11:57,259","00:11:59,469","**[NO TELUGU MATCH FOUND]**","- [tires squealing] - [Larry] Whoa, whoa, whoa."
"203","00:11:59,553","00:12:05,017","ఇక నేను భరించలేను. సరేనా? - అది నీకు ఎక్కడిది? - వీడు తల నరికేశాడే, అతనిది.","- I've had enough. Okay? - [horn honks] - Where'd you get that? - On the guy whose head he cut off, eh?"
"204","00:12:05,017","00:12:07,769","వాడు ఏజెంట్ అన్నావు కదా, మరి వాడి జేబుల్లో ఏముందో చూడవా?","He said he was a spy, but you didn't check his pockets, did ya?"
"205","00:12:07,853","00:12:09,229","మళ్లీ నేను పిచ్చోడిని అంటుంటావు.","And I'm the dumb one, aren't I?"
"206","00:12:09,313","00:12:12,232","వాడిని చంపడం కన్నా, నువ్వు సాటి బ్రిటీషోడిని చంపాలనుకుంటున్నావు, నువ్వు ఒక దేశద్రోహివి.","You'd rather spill my British blood than his, then you're a traitor."
"207","00:12:12,316","00:12:16,361","సరే. వెనక్కి వెళ్లి, వాడు బాగానే ఉన్నాడో లేదో చూడు.","- [Larry] Yeah. - [thumping] Get in the back. Check he's okay."
"208","00:12:16,445","00:12:18,238","నువ్వు సిగ్గుచేటు పనులన్నీ చేస్తున్నావు.","F... You're a fucking embarrassment, man."
"209","00:12:18,322","00:12:20,032","వాడికి వాంతి వస్తోంది అనుకుంటా.","I think he's being sick."
"210","00:12:20,032","00:12:22,159","అవును. బాగా వస్తున్నట్టుంది.","Yep. He's choking on his sick."
"211","00:12:22,159","00:12:24,036","- అదీలెక్క. - హేయ్.","- Result. - Hey."
"212","00:12:24,036","00:12:26,455","బండిని ఆపు. ఆపెహే.","Pull over. Chop-chop."
"213","00:12:38,050","00:12:39,051","దిగు.","Get out."
"214","00:12:40,177","00:12:41,178","దిగు.","Go on."
"215","00:12:41,929","00:12:43,347","దిగరా, చచ్చినోడా.","I said get out, now."
"216","00:12:44,056","00:12:45,682","రా. దిగు.","Come on. Move it."
"217","00:12:48,685","00:12:51,188","పద. తలుపు తెరువు.","Just move it. Open the door."
"218","00:12:52,814","00:12:54,316","సరే. వాడిని బయటకు తీసుకురా.","Right. Lift him up."
"219","00:12:55,067","00:12:58,153","వాడి మొహం నుండి ఆ టేపును తీసేయండి.","And get that fucking tape off his face."
"220","00:12:59,321","00:13:00,447","బాబోయ్.","- [vomits] - [Zeppo] Ah, fuck."
"221","00:13:00,531","00:13:01,990","వామ్మోయ్. సరే మరి.","[Larry] Whoa. Okay."
"222","00:13:03,867","00:13:06,286","వాడి నోట్లో ఏదైనా పెట్టండి.","- [Hassan groans, coughs] - Put something in his mouth."
"223","00:13:06,370","00:13:07,371","లేకపోతే అరుస్తాడేమో.","In case he screams."
"224","00:13:07,371","00:13:09,456","వాడిని బెదిరించకుండా నన్ను బెదిరిస్తావే, చెత్త వెధవా?","Why aren't you threatening him, you fucking pussy?"
"225","00:13:09,540","00:13:11,333","నువ్వు వాడిని చంపను అని చెప్పావు కదా, అందుకా?","Oh, you told him you're not gonna kill him, didn't ya?"
"226","00:13:11,333","00:13:14,294","నన్ను రెచ్చగొట్టకు, సరేనా?","Don't fucking push me. Okay?"
"227","00:13:14,378","00:13:15,504","రెచ్చగొట్టకు!","- [Hassan groans] - Don't!"
"228","00:13:16,713","00:13:19,216","పెట్రోల్ లేదు. ఎక్కడికీ వెళ్లలేని పరిస్థితి.","No fuel. Nowhere to go."
"229","00:13:19,216","00:13:21,718","నీ ప్లాన్ ఏంటో చెప్పు, కెప్టెన్?","What's the plan now, eh, Captain?"
"230","00:13:21,802","00:13:25,681","పెట్రోల్ పట్టించుకుందాం.","- Eh? - [breathing heavily] We get some petrol, right?"
"231","00:13:27,224","00:13:32,145","పడవ దగ్గరికి వెళ్దాం... - అక్కడికి వెళ్లాక ఈ కుర్రాడిని వదిలేద్దాం. - మరి పెట్రోల్ ఎవరు పడతారు?","We get to the boat… [panting] - …and we let the kid go. - Who's gonna get the petrol?"
"232","00:13:32,229","00:13:34,397","**[NO TELUGU MATCH FOUND]**","[panting heavily]"
"233","00:13:34,481","00:13:35,482","ఏంటి?","What?"
"234","00:13:35,566","00:13:37,150","ఒకసారి అద్దంలో చూసుకున్నావా?","Have you looked in the mirror?"
"235","00:13:38,026","00:13:39,570","బండి నుండి ఎవరు దిగి పెట్రోల్ పడతారు?","Who's gonna get out of the van?"
"236","00:13:39,653","00:13:42,280","**[NO TELUGU MATCH FOUND]**","[panting heavily]"
"237","00:13:42,364","00:13:44,449","ఏదైతే అది అయింది!","Ah, fuck it. Fuck it."
"238","00:13:44,533","00:13:47,035","**[NO TELUGU MATCH FOUND]**","[stifled grunting, crying]"
"239","00:13:48,579","00:13:50,038","వీడు పెట్రోల్ పడతాడు.","He is."
"240","00:13:50,122","00:13:51,748","**[NO TELUGU MATCH FOUND]**","[chuckles]"
"241","00:13:52,291","00:13:57,462","ట్రిపుల్-డీ కార్ మరియు వ్యాన్ అద్దె సర్వీస్ దొరికాడు. ఈ హో ఉచ్చు నుండి ఎవరూ ప్రాణాలతో తప్పించుకోలేరు.","Got him. Like a rat in a trap that I will kill with a hammer. [Chuckles]"
"242","00:13:57,546","00:14:00,132","""ట్రిపుల్-డీ కార్ అద్దె సర్వీస్."" లీడ్ లో ఉంది ఇది.","""Triple-D Car Hire."" Leeds address."
"243","00:14:00,132","00:14:01,466","రిజిస్ట్రేషన్ నంబర్?","Registration number?"
"244","00:14:01,550","00:14:02,926","**[NO TELUGU MATCH FOUND]**","[newscast plays indistinctly]"
"245","00:14:03,010","00:14:04,094","దానికి కొంత సమయం పడుతుంది.","That will take a while."
"246","00:14:04,178","00:14:05,554","**[NO TELUGU MATCH FOUND]**","[sighs]"
"247","00:14:07,264","00:14:08,891","నాకు ఒక కాఫీ తీసుకురండి.","[Roddy] Get me a coffee."
"248","00:14:12,352","00:14:13,896","ఈ పనికి నాకు శక్తి అవసరం అవుతుంది.","I need fuel for this one."
"249","00:14:13,896","00:14:26,825","ఈ పని చేయడానికి చాలా గంటల సమయం పడుతుంది, ఇది ఒక మాల్వేర్ ని వదులుతుంది, ఇది చాలా సమర్థవంతమైన పద్ధతి అన్నమాట, కానీ అలా చేయాలంటే ఎవరైనా ఈమెయిల్ తెరవాలి, కాబట్టి... థ్యాంక్స్, స్టాండిష్. డబుల్ స్ట్రాంగ్ కాఫీ తీసుకురా.","An SQL injection attack will take hours, which leaves a malware bomb as the most effective method, but that needs someone to open an email, so… Cheers, Standish. Double espresso."
"250","00:14:32,748","00:14:34,249","**[NO TELUGU MATCH FOUND]**","[mumbles]"
"251","00:14:37,920","00:14:40,047","నువ్వు దేన్ని అయినా హ్యాక్ చేయగలవు అనుకున్నానే.","[Louisa] I thought you could hack anything."
"252","00:14:40,047","00:14:41,548","నేను చేయగలను.","I can."
"253","00:14:41,632","00:14:44,343","నేను చేయలేనని అనడం లేదు. కానీ దానికి కొంత సమయం పడుతుంది.","I'm not saying I can't do it. Just that it will take some time."
"254","00:14:44,343","00:14:45,844","ఎంత సమయం కావాలి, హో?","How much time do you need, Ho?"
"255","00:14:45,928","00:14:48,805","ఎందుకంటే, ఆ కుర్రాడిని ఇంకో రెండున్నర గంటల్లో చంపేస్తారు.","Because the kid's gonna get beheaded in about, oh, two and a half hours."
"256","00:14:50,432","00:14:52,684","నేను త్వరగా ఏం చేయగలనో చెప్పనా?","I'll tell you what I can do real quick."
"257","00:14:52,768","00:14:56,104","నీ సెర్చ్ హిస్టరీని చెక్ చేసి, నువ్వు ఏ రకమైన పార్న్ ని చూస్తావో అందరికీ చెప్పగలను.","Check your search history and tell everyone what porn you look at."
"258","00:14:56,188","00:14:57,689","అలాగే కానివ్వు, నేనేమీ చూడట్లేదు.","Fine, 'cause I've got nothing to hide."
"259","00:14:57,773","00:15:03,612","- మూసుకొని కూర్చో. - హేయ్.","- [scoffs, chuckles] - [typing] - Don't you fucking dare. - [chuckles] Hey."
"260","00:15:03,612","00:15:06,281","- ఆపండి. ఆపండి. - ఏమైంది నీకు?","- Stop it. Stop it. Stop it. - What's wrong with you?"
"261","00:15:06,365","00:15:10,202","చిన్నపిల్లోడిలా ప్రవర్తిస్తున్నావు. - ఏమన్నావు? - నా కాఫీ ఎక్కడ?","- You're eight years old. - [mumbles] - [Louisa] Pardon? - Where's my coffee?"
"262","00:15:10,202","00:15:13,413","నేను నీకు కాఫీ తేలేదు. రిజిస్ట్రేషన్ నంబరును తెచ్చాను.","I didn't get you a coffee. I got you the registration number."
"263","00:15:13,497","00:15:15,165","డీఈ15 సీజీకే.","DE15 CGK."
"264","00:15:15,249","00:15:17,042","- ఏంటి? ఎలా సంపాదించావు? - ఫోన్ చేసి కనుకున్నా.","- [Roddy] What? How? - Well, I rang them up."
"265","00:15:17,042","00:15:20,128","ఫోన్ చేసి ""అనేక డేటా రక్షణా చట్టాలను ఉల్లంఘించగలరా?"" అని అడిగావా?","And said what? ""Do you mind breaking multiple data protection laws?"""
"266","00:15:20,212","00:15:29,638","లేదు, వారి వాహనం వల్ల నాకు యాక్సిడెంట్ అయిందని, నాకు డ్రైవర్ పేరు తెలుసు కానీ, బాగా కంగారుపడిపోవడం వలన, నేను రిజిస్ట్రేషన్ నంబరును సరిగ్గా అర్థమయ్యేలా రాయలేకపోయానని చెప్పాను.","No, I said th-that I'd had an accident with one of their vehicles and I had the driver's name, but because I was so shaken, I couldn't read the registration number I'd written down."
