Source Filename,Original First Index,Original Last Index,Original First Timestamp,Original Last Timestamp,New Index,New Timestamp,Original Second Text,New Text (Full)
4e.srt,177,178,"00:19:33,674 --> 00:19:38,428","00:19:39,054 --> 00:19:41,765",158,"00:19:33,674 --> 00:19:41,765",which can provide both a heat and a light source.,"Also, for your comfort and safety, torches, which can provide both a heat and a light source."
4e.srt,206,207,"00:22:06,618 --> 00:22:09,037","00:22:09,746 --> 00:22:12,332",186,"00:22:06,618 --> 00:22:12,332",though the hollow's pool was primed for bathing.,"[Mr. Milchick] ""Dieter lay unwashed in his bedroll, though the hollow's pool was primed for bathing."
4e.srt,208,209,"00:22:13,417 --> 00:22:15,334","00:22:15,335 --> 00:22:19,381",187,"00:22:13,417 --> 00:22:19,381",and told each other rhyming jokes till our gullets ached.,We ate of the hare we'd caught and told each other rhyming jokes till our gullets ached.
4e.srt,216,217,"00:22:52,122 --> 00:22:53,749","00:22:54,625 --> 00:22:59,213",194,"00:22:52,122 --> 00:22:59,213",driven by a sudden torrent of pus from his skull.,"It popped from the socket, driven by a sudden torrent of pus from his skull."
4e.srt,218,219,"00:23:01,715 --> 00:23:04,800","00:23:04,801 --> 00:23:09,389",195,"00:23:01,715 --> 00:23:09,389","which was suddenly moss that tore easily from his bleeding scalp.""","And he reached up to grasp at his hair, which was suddenly moss that tore easily from his bleeding scalp."""
4e.srt,221,223,"00:23:11,600 --> 00:23:15,853","00:23:21,360 --> 00:23:26,532",197,"00:23:11,600 --> 00:23:26,532","I turned from my gargling brother and walked to the pool of the hollow,","[Mr. Milchick] ""And as the pus from his eye thickened into sap, I turned from my gargling brother and walked to the pool of the hollow, where I knew the waterfall would drown out my brother's cries."""
4e.srt,225,226,"00:23:30,118 --> 00:23:35,082","00:23:36,291 --> 00:23:41,713",199,"00:23:30,118 --> 00:23:41,713","a gaunt bride, half the height of a natural woman.","""And it was here that I first encountered the temper Woe, a gaunt bride, half the height of a natural woman."
4e.srt,227,228,"00:24:00,649 --> 00:24:04,111","00:24:05,445 --> 00:24:06,738",200,"00:24:00,649 --> 00:24:06,738",'This is your doing.,"She spoke to me directly from her eyes and said, 'This is your doing."
4e.srt,231,232,"00:24:15,247 --> 00:24:17,499","00:24:27,759 --> 00:24:28,760",203,"00:24:15,247 --> 00:24:28,760",The end.,"Only chaos's whore.'"" The end."
4e.srt,248,249,"00:25:31,281 --> 00:25:33,783","00:25:33,784 --> 00:25:36,745",219,"00:25:31,281 --> 00:25:36,745",Right? He jerked off in front of his brother...,- [Mark laughing] - [Dylan chuckles] Right? He jerked off in front of his brother...
4e.srt,259,260,"00:26:24,585 --> 00:26:27,838","00:26:28,505 --> 00:26:30,632",229,"00:26:24,585 --> 00:26:30,632","Now, Miss Huang.","- [gasps] Mr. Milchick, come on. - [Helly scoffs] Now, Miss Huang."
4e.srt,261,262,"00:26:34,386 --> 00:26:36,179","00:26:36,180 --> 00:26:37,347",230,"00:26:34,386 --> 00:26:37,347",Why?,"- [Helly, laughing] Oh, my... - [Mark gasps] Why?"
4e.srt,268,269,"00:27:06,543 --> 00:27:08,295","00:27:09,087 --> 00:27:11,047",236,"00:27:06,543 --> 00:27:11,047","Hey, what do you think his dick turned into?","- [Mark] Oh, my God. - [Helly laughs] Hey, what do you think his dick turned into?"
4e.srt,273,274,"00:27:20,933 --> 00:27:23,851","00:27:23,852 --> 00:27:26,062",240,"00:27:20,933 --> 00:27:26,062","- [Irving] Well, it's not. - Okay.","- Oh, I don't know. It's pretty funny. - [Helly laughs] - [Irving] Well, it's not. - Okay."
4e.srt,277,278,"00:27:34,404 --> 00:27:35,989","00:27:38,492 --> 00:27:40,077",243,"00:27:34,404 --> 00:27:40,077","Just tell us, Helly.","- ""Goo-goo eyes""? - [Helly laughs] Just tell us, Helly."
4e.srt,294,295,"00:28:21,660 --> 00:28:24,496","00:28:25,205 --> 00:28:27,874",259,"00:28:21,660 --> 00:28:27,874",while your outie's wife rots away somewhere.,Using your pupils to make love to her while your outie's wife rots away somewhere.
4e.srt,381,382,"00:43:03,292 --> 00:43:05,085","00:43:06,253 --> 00:43:07,588",345,"00:43:03,292 --> 00:43:07,588",it was cruel.,"What you said to me last night, it was cruel."
4e.srt,394,395,"00:43:56,470 --> 00:43:58,304","00:43:58,305 --> 00:44:01,349",357,"00:43:56,470 --> 00:44:01,349","- Irving. Stop. Irving, no. - Mr. Milchick!","- [Helly] No! - [Irving straining] - Irving. Stop. Irving, no. - Mr. Milchick!"
4e.srt,396,397,"00:44:01,350 --> 00:44:03,351","00:44:03,352 --> 00:44:04,436",358,"00:44:01,350 --> 00:44:04,436",Help!,"- Please, stop. - [Irving groans] Help!"
4e.srt,413,414,"00:44:44,226 --> 00:44:46,477","00:44:46,478 --> 00:44:48,062",374,"00:44:44,226 --> 00:44:48,062",ever since she came back!,"- Stop! - She's been an outie the whole time, ever since she came back!"
4e.srt,416,417,"00:44:51,775 --> 00:44:53,442","00:44:53,443 --> 00:44:55,403",376,"00:44:51,775 --> 00:44:55,403",She's a fucking mole!,"- [Mr. Milchick] Irving, stop this! - [shrieks] She's a fucking mole!"
4e.srt,420,421,"00:44:59,032 --> 00:45:00,408","00:45:00,409 --> 00:45:02,411",379,"00:44:59,032 --> 00:45:02,411",[Mr. Milchick] Irving! Irving! Irving!,- [Helly screaming] - [Irving shouts] [Mr. Milchick] Irving! Irving! Irving!
4e.srt,423,424,"00:45:06,123 --> 00:45:08,207","00:45:08,208 --> 00:45:09,710",381,"00:45:06,123 --> 00:45:09,710",She's an Eagan!,"- [groans] She's not Helly! - [Helly gasps, panting] She's an Eagan!"
4e.srt,438,439,"00:45:51,043 --> 00:45:53,377","00:45:53,378 --> 00:45:56,757",395,"00:45:51,043 --> 00:45:56,757",[breathing heavily] What's happening? [gasps],"- I'm s... so sorry, Helly. - [Helly coughs] [breathing heavily] What's happening? [gasps]"
4e.srt,455,457,"00:47:03,365 --> 00:47:05,825","00:47:09,872 --> 00:47:11,289",411,"00:47:03,365 --> 00:47:11,289","as you are no longer authorized to consort with any severed employee,","Please refrain from any further speech, as you are no longer authorized to consort with any severed employee, nor they with you."
4e.srt,463,464,"00:48:30,410 --> 00:48:32,328","00:48:32,329 --> 00:48:35,957",417,"00:48:30,410 --> 00:48:35,957",and any personal items discarded.,Your workspace will be cleared and any personal items discarded.
4e.srt,465,467,"00:48:35,958 --> 00:48:40,545","00:48:41,964 --> 00:48:45,759",418,"00:48:35,958 --> 00:48:45,759","and personal relations,","Your file, including any and all professional interactions and personal relations, will be purged and destroyed."
4e.srt,468,470,"00:48:46,760 --> 00:48:50,137","00:48:52,516 --> 00:48:56,770",419,"00:48:46,760 --> 00:48:56,770",never even existed,"It will be as if you, Irving B., never even existed nor drew a single breath upon this Earth."
5e.srt,1,2,"00:00:21,563 --> 00:00:24,566","00:00:57,933 --> 00:00:59,059",1,"00:00:21,563 --> 00:00:59,059",[doctor] Do you have them?,"[whistling ""Wreck of the Edmund Fitzgerald""] [doctor] Do you have them?"
5e.srt,6,7,"00:01:43,896 --> 00:01:45,272","00:01:49,151 --> 00:01:52,154",5,"00:01:43,896 --> 00:01:52,154","[resumes whistling ""Wreck of the Edmund Fitzgerald""]","- [card beeps] - [door buzzes] [resumes whistling ""Wreck of the Edmund Fitzgerald""]"
5e.srt,22,23,"00:04:28,477 --> 00:04:31,479","00:04:31,480 --> 00:04:34,482",20,"00:04:28,477 --> 00:04:34,482","Uh, just keep trying, I guess.","- Okay. So, what do we do? - [sniffs] Uh, just keep trying, I guess."
5e.srt,25,26,"00:04:37,486 --> 00:04:40,029","00:04:40,030 --> 00:04:42,532",22,"00:04:37,486 --> 00:04:42,532","Uh, hey, I'm sorry. I gotta get to work.","- [door closes] - [footsteps approaching] Uh, hey, I'm sorry. I gotta get to work."
5e.srt,108,109,"00:10:25,292 --> 00:10:29,505","00:10:30,923 --> 00:10:33,717",104,"00:10:25,292 --> 00:10:33,717","and in so doing, he nearly drowned you.","Irving had no knowledge of what management's intention was in this action, and in so doing, he nearly drowned you."
5e.srt,119,121,"00:11:32,401 --> 00:11:34,902","00:11:38,365 --> 00:11:41,702",114,"00:11:32,401 --> 00:11:41,702",was known to go incognito amongst his people,"In ancient times, the king of Sweden himself was known to go incognito amongst his people in the hopes of learning their true grievances."
5e.srt,122,124,"00:11:43,328 --> 00:11:47,749","00:11:51,628 --> 00:11:55,465",115,"00:11:43,328 --> 00:11:55,465","the name for which he was remembered,","He would don an old, gray robe, a Gråkappan, the name for which he was remembered, to disguise his royal vestments."
5e.srt,125,126,"00:11:56,466 --> 00:12:00,469","00:12:00,470 --> 00:12:06,018",116,"00:11:56,466 --> 00:12:06,018",and Ms. Eagan was carrying on this noble tradition.,"Kier Eagan himself was known to do so in his ether factories, and Ms. Eagan was carrying on this noble tradition."
5e.srt,138,139,"00:13:06,453 --> 00:13:08,455","00:13:10,249 --> 00:13:12,709",128,"00:13:06,453 --> 00:13:12,709",and help reacclimate you to your work environment.,Allow me to escort you to MDR and help reacclimate you to your work environment.
5e.srt,147,148,"00:14:02,426 --> 00:14:04,428","00:14:06,513 --> 00:14:12,728",136,"00:14:02,426 --> 00:14:12,728","Well, the ORTBO was a challenge for us all in ways expected and non.","- [computer beeping] - [switches clicking] Well, the ORTBO was a challenge for us all in ways expected and non."
5e.srt,152,153,"00:14:34,541 --> 00:14:36,083","00:14:36,084 --> 00:14:38,629",140,"00:14:34,541 --> 00:14:38,629",have been moved to your new work tri-stations.,"As you can see, all of your items have been moved to your new work tri-stations."
5e.srt,158,159,"00:14:48,138 --> 00:14:49,223","00:14:50,474 --> 00:14:51,850",145,"00:14:48,138 --> 00:14:51,850",we'd like to have a funeral.,"So, we'd like to have a funeral."
5e.srt,184,185,"00:16:24,234 --> 00:16:26,944","00:16:26,945 --> 00:16:28,029",170,"00:16:24,234 --> 00:16:28,029",- I'm coming in. - [door opens],- I'm gonna come in. - [inhales sharply] - I'm coming in. - [door opens]
5e.srt,231,232,"00:19:45,519 --> 00:19:47,436","00:19:47,437 --> 00:19:51,275",216,"00:19:45,519 --> 00:19:51,275","we hold a retirement party, which they attend.","Normally, when an innie goes to be with Kier, we hold a retirement party, which they attend."
5e.srt,233,234,"00:19:52,609 --> 00:19:56,321","00:19:57,281 --> 00:19:58,574",217,"00:19:52,609 --> 00:19:58,574",that's not feasible.,"But given the sudden and frigid events which brought us here, that's not feasible."
5e.srt,235,236,"00:20:00,117 --> 00:20:02,493","00:20:02,494 --> 00:20:07,583",218,"00:20:00,117 --> 00:20:07,583",to silently remember Irving and thank Kier for our time with him.,"As such, let us each take nine seconds to silently remember Irving and thank Kier for our time with him."
5e.srt,243,244,"00:20:50,501 --> 00:20:53,754","00:20:54,379 --> 00:20:56,715",225,"00:20:50,501 --> 00:20:56,715",so he put toner in my water cup.,"One time, he was pissed at me for watering down the toner, so he put toner in my water cup."
5e.srt,249,250,"00:21:19,112 --> 00:21:21,113","00:21:21,114 --> 00:21:25,702",230,"00:21:19,112 --> 00:21:25,702",he would have been totally justified in telling me to suck my own fuck.,"And in his final moments, he would have been totally justified in telling me to suck my own fuck."
5e.srt,257,258,"00:21:56,567 --> 00:22:00,737","00:22:01,446 --> 00:22:04,741",237,"00:21:56,567 --> 00:22:04,741",whose dark hair is courtesy of the Black Beauty Watermelon.,"You may now briefly partake in Irving's fruit head, whose dark hair is courtesy of the Black Beauty Watermelon."
5e.srt,284,285,"00:23:55,769 --> 00:23:58,522","00:24:00,566 --> 00:24:01,567",263,"00:23:55,769 --> 00:24:01,567",[Helly] Mark.,"- No, it's pretty crazy. - [door opens] [Helly] Mark."
5e.srt,300,302,"00:24:37,144 --> 00:24:39,770","00:24:42,399 --> 00:24:43,858",278,"00:24:37,144 --> 00:24:43,858","us wandering around, meeting other departments,","Me looking for Ms. Casey, us wandering around, meeting other departments, mapping the floor, all of it."
5e.srt,303,304,"00:24:43,859 --> 00:24:45,818","00:24:45,819 --> 00:24:49,907",279,"00:24:43,859 --> 00:24:49,907",because Helena told them everything we're doing.,They know everything we're doing because Helena told them everything we're doing.
5e.srt,318,319,"00:25:57,599 --> 00:26:00,184","00:26:00,185 --> 00:26:02,396",293,"00:25:57,599 --> 00:26:02,396",I was wondering if I could have a word with you.,"Natalie, just before we begin, I was wondering if I could have a word with you."
5e.srt,324,325,"00:26:27,671 --> 00:26:29,964","00:26:29,965 --> 00:26:33,927",298,"00:26:27,671 --> 00:26:33,927",how you felt when you received the paintings.,I was just wondering if you could share with me a little how you felt when you received the paintings.
5e.srt,326,329,"00:26:34,887 --> 00:26:35,888","00:26:44,438 --> 00:26:48,859",299,"00:26:34,887 --> 00:26:48,859","our experiences here have been similar in some ways,","Because I'm thinking our experiences here have been similar in some ways, we face similar challenges, and perhaps the paintings and the somewhat complicated feelings they evoke."
5e.srt,339,340,"00:28:41,305 --> 00:28:43,764","00:28:43,765 --> 00:28:47,602",309,"00:28:41,305 --> 00:28:47,602",depending on the number of atonements and approbations required.,"This review can take anywhere from two to six hours, depending on the number of atonements and approbations required."
5e.srt,341,342,"00:28:47,603 --> 00:28:50,271","00:28:50,272 --> 00:28:54,567",310,"00:28:47,603 --> 00:28:54,567","there will be a break for lunch, with the order taken in advance.","If the review is to take longer than four hours, there will be a break for lunch, with the order taken in advance."
5e.srt,349,351,"00:29:21,386 --> 00:29:23,971","00:29:28,685 --> 00:29:31,104",317,"00:29:21,386 --> 00:29:31,104",there have been three contentions reported anonymously,"[Drummond] Alternatively and sadly, there have been three contentions reported anonymously which have been investigated and confirmed."
5e.srt,357,359,"00:29:46,495 --> 00:29:50,623","00:29:53,752 --> 00:29:58,298",323,"00:29:46,495 --> 00:29:58,298","the paper clip was installed back to front,","Two: on several of your daily logs, the paper clip was installed back to front, which led to a confusion as to where in the document to begin reading."
5e.srt,366,367,"00:30:18,527 --> 00:30:23,739","00:30:23,740 --> 00:30:28,286",330,"00:30:18,527 --> 00:30:28,286",deterred curiosity or idling by the team once they returned.,"Kindness reforms that seemed to have, in no way, deterred curiosity or idling by the team once they returned."
5e.srt,368,371,"00:30:28,287 --> 00:30:32,790","00:30:38,714 --> 00:30:41,758",331,"00:30:28,287 --> 00:30:41,758","which resulted in the termination of one employee,","You arranged an outdoor retreat and team-building occurrence which resulted in the termination of one employee, and the discovery of the true identity of another at great risk and harm to the Eagan name."
5e.srt,373,374,"00:31:05,157 --> 00:31:06,532","00:31:06,533 --> 00:31:10,370",333,"00:31:05,157 --> 00:31:10,370",as one of the greatest moments in the history of this planet.,will be remembered as one of the greatest moments in the history of this planet.
5e.srt,387,388,"00:32:42,171 --> 00:32:43,964","00:32:53,265 --> 00:32:54,266",346,"00:32:42,171 --> 00:32:54,266","[Milchick] Hi, Mark.","- [card beeps] - [elevator bell dings] [Milchick] Hi, Mark."
5e.srt,400,401,"00:33:33,847 --> 00:33:37,767","00:33:37,768 --> 00:33:40,728",358,"00:33:33,847 --> 00:33:40,728",and look forward to some productive workdays ahead.,"Hopefully, now we can put all this grief and tumult behind us and look forward to some productive workdays ahead."
5e.srt,410,411,"00:34:14,012 --> 00:34:15,389","00:34:16,473 --> 00:34:18,684",367,"00:34:14,012 --> 00:34:18,684",leader-in-waiting of this company.,"Helena Eagan, leader-in-waiting of this company."
5e.srt,414,416,"00:34:48,880 --> 00:34:51,091","00:34:54,261 --> 00:34:56,138",370,"00:34:48,880 --> 00:34:56,138","[Devon] ""The workers were diligent,","- [employees chattering] - [Mark coughs] [Devon] ""The workers were diligent, focused on the task at hand."
5e.srt,418,419,"00:35:02,769 --> 00:35:05,772","00:35:06,356 --> 00:35:09,193",372,"00:35:02,769 --> 00:35:09,193",just hands and numbers and cogs and purpose.,"They simply referenced a large standard clock near the door, just hands and numbers and cogs and purpose."
5e.srt,420,421,"00:35:10,110 --> 00:35:13,237","00:35:13,238 --> 00:35:16,992",373,"00:35:10,110 --> 00:35:16,992","but you get to enjoy its ticking and thus should be happy.""","Your sovereign boss may own the clock that greets you from the wall, but you get to enjoy its ticking and thus should be happy."""
5e.srt,429,431,"00:35:35,969 --> 00:35:40,598","00:35:42,351 --> 00:35:45,186",381,"00:35:35,969 --> 00:35:45,186","and once that is established,","She said that innies tend to thrive in an environment of structure, and once that is established, then they are more open to self-expansion."
5e.srt,435,436,"00:35:52,986 --> 00:35:56,489","00:35:56,490 --> 00:35:59,617",385,"00:35:52,986 --> 00:35:59,617",it might beget a revolution.,"If I can get my ideas to severed workers all across the world, it might beget a revolution."
5e.srt,441,443,"00:36:07,292 --> 00:36:10,545","00:36:12,756 --> 00:36:14,173",390,"00:36:07,292 --> 00:36:14,173","so they can use it for their fucking propaganda,","Okay, Lumon hurts people, you know that, and if you want to water down your work so they can use it for their fucking propaganda, then you're hurting people too."
5e.srt,446,448,"00:36:20,931 --> 00:36:23,433","00:36:28,522 --> 00:36:30,524",393,"00:36:20,931 --> 00:36:30,524",this is a fiscal and creative opportunity,"And also, this is a fiscal and creative opportunity unlike any I have yet seen."
5e.srt,450,451,"00:36:36,697 --> 00:36:40,074","00:36:40,075 --> 00:36:44,705",395,"00:36:36,697 --> 00:36:44,705",and the life that that manages to give us has somehow lost its appeal for you.,[chuckles] Unless me selling millions of copies of my book and the life that that manages to give us has somehow lost its appeal for you.
5e.srt,475,476,"00:39:03,844 --> 00:39:05,178","00:39:05,179 --> 00:39:10,266",419,"00:39:03,844 --> 00:39:10,266","they said my innie had an unsanctioned, erotic entanglement with another worker.","When I pressed them for a reason, they said my innie had an unsanctioned, erotic entanglement with another worker."
5e.srt,518,520,"00:42:02,439 --> 00:42:03,523","00:42:09,530 --> 00:42:11,030",461,"00:42:02,439 --> 00:42:11,030",- like everywhere else in Kier. - [coughing],"On the payroll, - like everywhere else in Kier. - [coughing] You feel all right?"
5e.srt,541,542,"00:44:35,676 --> 00:44:39,596","00:44:40,639 --> 00:44:43,892",482,"00:44:35,676 --> 00:44:43,892",but they must be the same flavor.,"Your outie prefers two scoops of ice cream in a serving, but they must be the same flavor."
6e.srt,18,19,"00:01:24,251 --> 00:01:28,921","00:01:28,922 --> 00:01:34,970",18,"00:01:24,251 --> 00:01:34,970",and all the ways you'd change to get that person back.,"You think about all the things you'd do, and all the ways you'd change to get that person back."
6e.srt,25,26,"00:02:05,626 --> 00:02:07,418","00:02:07,419 --> 00:02:09,880",24,"00:02:05,626 --> 00:02:09,880",with a black elevator that only goes down.,"[Dylan] It was a sketch of a black hallway, with a black elevator that only goes down."
6e.srt,41,42,"00:02:51,255 --> 00:02:54,382","00:02:54,383 --> 00:02:56,259",39,"00:02:51,255 --> 00:02:56,259",- and then we can start after lunch. - Yeah. Maybe.,"Okay. Well, I still have a hall pass, so I can go to the break room now, - and then we can start after lunch. - Yeah. Maybe."
6e.srt,57,59,"00:05:46,054 --> 00:05:48,056","00:05:50,142 --> 00:05:53,270",54,"00:05:46,054 --> 00:05:53,270",you cannot graduate from this fellowship,"I feel I should remind you, you cannot graduate from this fellowship until I have deemed you Wintertide material."
6e.srt,60,61,"00:05:58,317 --> 00:06:02,821","00:06:03,572 --> 00:06:06,825",55,"00:05:58,317 --> 00:06:06,825",and eradicating from your essence childish folly.,"This will mean using your time well, focusing on your own duties, and eradicating from your essence childish folly."
6e.srt,73,74,"00:06:55,749 --> 00:06:57,375","00:06:57,376 --> 00:06:59,919",67,"00:06:55,749 --> 00:06:59,919",because they know what will happen if we do. I'm gonna go get that map.,"It's so that we won't work together, because they know what will happen if we do. I'm gonna go get that map."
6e.srt,88,89,"00:07:55,893 --> 00:08:02,440","00:08:02,441 --> 00:08:04,734",81,"00:07:55,893 --> 00:08:04,734","like, before the OTC.","Uh, 'cause, you know, I've been having those feelings since, like, before the OTC."
6e.srt,120,121,"00:10:58,408 --> 00:11:01,702","00:11:01,703 --> 00:11:04,289",112,"00:10:58,408 --> 00:11:04,289",and stare at your face.,"I just, like, wanna hear about all my offspring and stare at your face."
6e.srt,262,263,"00:25:05,881 --> 00:25:07,466","00:25:10,719 --> 00:25:13,763",253,"00:25:05,881 --> 00:25:13,763",Fields is tending the ham.,- What the heck? - [Irving stammers] Fields is tending the ham.
6e.srt,276,277,"00:25:40,916 --> 00:25:45,420","00:25:46,463 --> 00:25:48,090",266,"00:25:40,916 --> 00:25:48,090",is beyond me.,What your innie ever saw in this Philistine is beyond me.
6e.srt,304,305,"00:27:11,215 --> 00:27:14,926","00:27:14,927 --> 00:27:16,720",293,"00:27:11,215 --> 00:27:16,720",do I think I'm going to heaven?,"So, one Sunday at breakfast, Fields asked me point blank, do I think I'm going to heaven?"
6e.srt,309,310,"00:27:33,362 --> 00:27:36,489","00:27:36,490 --> 00:27:40,034",297,"00:27:33,362 --> 00:27:40,034",and it so happens the sermon that day is about severance...,"- I see. - So we hop on the train to church, and it so happens the sermon that day is about severance..."
6e.srt,313,315,"00:27:44,665 --> 00:27:48,210","00:27:53,841 --> 00:27:59,137",300,"00:27:44,665 --> 00:27:59,137","he said the church's stance is that innies are, you know,","As if he'd been listening to our conversation, he said the church's stance is that innies are, you know, complete individuals, with souls..."
6e.srt,320,321,"00:28:18,991 --> 00:28:22,451","00:28:22,452 --> 00:28:26,748",305,"00:28:18,991 --> 00:28:26,748",it may be a way for part of Burt to...,"But we... we figured that if it were true, it may be a way for part of Burt to..."
6e.srt,418,419,"00:37:16,445 --> 00:37:18,613","00:37:18,614 --> 00:37:22,617",402,"00:37:16,445 --> 00:37:22,617",then about ten years ago that became Attila.,"We used to call each other hon, then about ten years ago that became Attila."
6e.srt,441,442,"00:38:53,876 --> 00:38:56,335","00:38:56,336 --> 00:39:03,010",424,"00:38:53,876 --> 00:39:03,010",and I... I believe that innies deserve to experience love.,"I've been talking to Pastor Gale about this, and I... I believe that innies deserve to experience love."
6e.srt,470,471,"00:43:17,139 --> 00:43:20,224","00:43:20,225 --> 00:43:22,465",452,"00:43:17,139 --> 00:43:22,465",- [breathing heavily] - You have to keep your head still.,- Don't move like that. - [groaning] - [breathing heavily] - You have to keep your head still.
6e.srt,473,474,"00:43:24,438 --> 00:43:25,689","00:43:27,441 --> 00:43:28,442",454,"00:43:24,438 --> 00:43:28,442",Ignore it.,- [knocking] - [gasps] Ignore it.
6e.srt,476,478,"00:43:30,319 --> 00:43:32,070","00:43:35,949 --> 00:43:37,783",456,"00:43:30,319 --> 00:43:37,783",- [Devon] Mark? - [groaning],- [groaning] - [knocking continues] - [Devon] Mark? - [groaning] My car's in the driveway. She knows I'm here.
6e.srt,494,495,"00:44:08,106 --> 00:44:10,066","00:44:10,067 --> 00:44:12,444",472,"00:44:08,106 --> 00:44:12,444",I'm already trying something else.,"- I was thinking... - Yeah. Look, uh, I'm already trying something else."
6e.srt,521,522,"00:45:39,281 --> 00:45:41,324","00:45:41,325 --> 00:45:44,911",498,"00:45:39,281 --> 00:45:44,911","which is, of course, before severance even existed.","Like saying I worked at Lumon 20 years ago, which is, of course, before severance even existed."
6e.srt,531,532,"00:46:16,527 --> 00:46:18,612","00:46:24,117 --> 00:46:25,577",507,"00:46:16,527 --> 00:46:25,577","- Good night, Burt. - Good night.","- Good. [chuckles] - [chuckles] - Good night, Burt. - Good night."
7e.srt,6,7,"00:01:13,907 --> 00:01:15,788","00:01:15,868 --> 00:01:17,077",6,"00:01:13,907 --> 00:01:17,077",What about you?,"- Oh, my God. Spoiler alert, please. - [chuckles] What about you?"
7e.srt,8,9,"00:01:17,578 --> 00:01:20,330","00:01:20,414 --> 00:01:22,291",7,"00:01:17,578 --> 00:01:22,291","Oh, yeah, this is a real treat.","- Are you reading… - Me? Uh, well… It's… Oh, yeah, this is a real treat."
7e.srt,10,11,"00:01:22,374 --> 00:01:25,002","00:01:25,711 --> 00:01:28,672",8,"00:01:22,374 --> 00:01:28,672","Drug Use by Enlisted Soldiers during World War I.""","""All Quiet on the Western Blunt: Drug Use by Enlisted Soldiers during World War I."""
7e.srt,14,15,"00:01:33,552 --> 00:01:36,096","00:01:39,558 --> 00:01:40,893",11,"00:01:33,552 --> 00:01:40,893",I'm sorry. Who are you?,- I couldn't agree more. [chuckles] - [chuckles] I'm sorry. Who are you?
7e.srt,37,40,"00:04:06,872 --> 00:04:08,210","00:04:13,587 --> 00:04:15,756",33,"00:04:06,872 --> 00:04:15,756","so forgive me if I say this, like, super plainly,","I can tell that you're smarter than me, so forgive me if I say this, like, super plainly, but if you give one solitary thought to messing with my brother again, I will throw you off a fucking bridge."
