"Index","Telugu Text","Mapped English Text"
"1","ఎక్కడో ఆఫ్రికాలో సీతాకోకచిలుక రెక్కలు ఆడిస్తే, కొన్ని నెలల తర్వాత మయామీలో తుఫాను సంభవిస్తుంది అనేది మనందరం వినే ఉంటాం.","[person] We've all heard that thing about the butterfly flapping its wings in Africa, and months later there's a hurricane in Miami."
"2","వినకుండా ఉంటే, ఓసారి తెలుసుకోండి.","Well, if you haven't, look it up."
"3","సంబంధం ఉండవు అని మనం అనుకొనేవాటి మధ్య సంబంధం ఉంటుందని దాని అర్థం.","It means things you don't think are connected actually are."
"4","నాకు ఈ అమ్మాయి ఎవరో తెలీదు.","I never knew this girl."
"5","తనని ఎప్పుడూ కలుసుకోలేదు.","Never met her."
"6","ఇది తన జీవితం.","This is the life she knew."
"8","ఇది నా జీవితం.","And this is the life I knew."
"10","అదుగో నేను.","[friend 1] There I am."
"10","బుడ్డోడు అక్కడ ఉన్నాడు.","There's the kid."
"11","నిన్ను నువ్వు ""బుడ్డోడు"" అని పిలుచుకున్నావే?","[friend 2] Did you just call yourself ""the kid""?"
"12","ఆగు, ఈ ఆటలోనే కదా నువ్వు ఒక క్వార్టరులోనే మూడు సార్లు బాల్ ని జారవిడిచేసింది?","Wait, isn't this the game you fumbled three times in one quarter?"
"13","ఈ ఆటలోనే, నేను ఇది కూడా చేశాన్రా, సన్నాసీ.","This is also the game where I did this, motherfucker."
"14","మీకు సంబంధం ఉండదని అనిపించవచ్చు, కానీ సంబంధం ఉంటుంది.","[person] You wouldn't think so, but it is all connected."
"15","ఈ సన్నాసులు, ఆ సైకిల్ తొక్కే అమ్మాయి.","These knuckleheads. That girl on the bike."
"16","ఒక్క నిమిషం.","Wait."
"16","పక్కన బట్టలు విప్పేసి పరుగెత్తుతున్న ఆ మనిషి ఎవరు?","Wait, who's that streaking down the sideline?"
"17","కాంకకీ ముద్దు బిడ్డ.","Kankakee's favorite son."
"18","నేను, నా సిరులొలికే చిరునవ్వు.","[person] Me, with my million-dollar smile."
"19","ఇప్పటికీ చెరగని కాలేజీ రికార్డులకు అధిపతి.","[friend 2] Owner of grad school records that still stand."
"20","ఒకటి కాదు, రెండు కాదు, మూడుసార్లు ఉపకారవేతనం సంపాదించాడు.","[friend 3] Given not one, not two, but three fucking scholarship offers."
"21","నిజానికి, నాలుగుసార్లు సంపాదించాను.","Hey, it was four, actually."
"22","బాబోయ్, జిమ్మీ, నువ్వు మామూలోడివి కాదు.","Christ, Jimmy, you really were something."
"23","మరి నా సంగతేంటి?","[friend 1] What about me?"
"24","వాడి వల్ల నువ్వు కూడా పిస్తావే అయ్యావులే.","Well, he made even you look good."
"25","కాంకకీ గారాల బిడ్డ.","[friend 2] Pride and joy of Kankakee."
"26","చూశారా?","See?"
"26","సరే మరి.","[Jimmy] Okay."
"27","ఇంటిని నాశనం చేయకుండా ఉండండి, ఈసారి తాళం వేయడం మర్చిపోకండి.","Try not to burn the place down, and remember to lock up this time."
"28","సరే.","Yeah."
"28","ఓయ్, ఆ దిండు ఏంటి?","Wait, what's with the pillow?"
"29","డానీ ఏమైనా కాల్ చేశాడా?","Anybody heard from Danny?"
"30","అసలైన ఆట ఇప్పుడు మొదలవుతుంది.","[friend 1] Here's the real play."
"30","చూడండి.","Watch this shit."
"31","అక్కడే.","Right here."
"31","సరిగ్గా అక్కడే.",", right there."
"32","అందగాడివే.","[friend 2] You fucking has-been pretty boy."
"34","అప్పుడప్పుడూ మనం ఒకటి అనుకుంటే ఇంకొకటి జరుగుతుంటుంది కదా?","[Jimmy] You know those times where you think something's gonna go one way, but it goes sideways?"
"35","అలా నాకు ఎప్పుడైనా జరిగిందా అని ఎవరైనా అడిగితే, ఆ జరగడం ప్రారంభమైంది ఇక్కడి నుండే అని చెప్తాను.","If I had to pick the moment, here's where it all started to go sideways for me."
"36","అంటే, నా బతుకు పూర్తిగా బస్టాండ్ అయిపోవడం అన్నమాట.","Like, for fucking ever."
"37","హాయ్, జిమ్మీ.","Hiya, Jimmy."
"38","హాయ్, రాజ్.","Hi, Rog."
"38","వచ్చి ఎక్కు.","Hop in."
"39","ఆ దిండు ఏంటి?","What's with the pillow?"
"40","పోయినసారి కలిసినప్పుడు, నీ మెడ ఊరకూరకే పట్టేస్తుందని అన్నావు కదా, నా మెడ కూడా పట్టేసేది.","Well, last time I saw you, you said you kept getting cricks in your neck. I used to get 'em too."
"41","ఈ దిండు వాడాను.","Discovered this pillow."
"42","తర్వాత నా మెడ ఎప్పుడూ పట్టేయలేదు.","Never got 'em again."
"43","నువ్వు మామూలు మంచోడివి కాదురో.","You are the most profoundly considerate motherfucker I've ever met."
"44","ధన్యవాదాలు, మహానుభావా.","I thank you, my good man."
"45","వెనుకె పెట్టేయ్.","Put it in the back."
"47","ఆ ఆరెంజ్ తుపాకీ ఎందుకు?","What's with the orange shotgun?"
"48","కొన్ని హానికరం కాని బుల్లెట్లను తెప్పించాను.","I got a shipment of bean bags."
"49","పోలీసులు, అల్లర్ల సమయంలో వాడుతుంటారు కదా, అలాంటివే.","You know the kind cops fire at riots and shit?"
"50","తుపాకులకు వింత వింత రంగులు పూస్తారు, నిరసనల సమయంలో నిజమైన బుల్లెట్లను లోడ్ చేయకుండా, కేవలం మమ్మల్ని మనుషుల్లా చూడండి అని నిరసన తెలిపే వ్యక్తికి ఏం కాకుండా ఉండాలని అన్నమాట.","They trick the guns out with weird colors so they don't load live rounds during protests, kill some poor fucker who's just asking to be treated like a human being. [chuckles]"
"51","దీన్ని చూసుకోవడానికి స్వయంగా వచ్చినందుకు ధన్యవాదాలు.","So appreciative you came in person to deal with this."
"51","అది.","That it."
"52","నన్ను ఎక్కడో టచ్ చేశావు.","Touches me in a deep place."
"53","కిందటి సరుకు విషయంలో జరిగినదానికి క్షమించు.","I'm so sorry about that last shipment."
"54","పొరపాట్లు జరగుతుంటాయి.","Mistakes happen."
"55","మొత్తం కిలో అంటే, అది మారీ దారుణం.","Not a whole kilo, man."
"55","నేను.","I've."
"56","నా తల కొట్టేసినట్టు అయింది.","[tires screech] It's fucking embarrassing."
"57","ఒకటి అనుకున్నాక, దాని కన్నా తక్కువ నేనెప్పుడూ ఇవ్వలేదు.","I mean, I've never been light before."
"58","నా సరుకులో కనీసం ఒక్క గ్రాము తేడా కూడా ఉండదు.","Not so much as a gram with anyone, ever."
"59","మరి తక్కువ వచ్చిందని నేను ఎందుకు అంటాను?","Why would I claim I got shorted?"
"60","మనుషుల మనస్సులో ఏముందో తెలుసుకోవడం కష్టం.","Hard to know a man's heart."
"61","పద.","Come on now."
"62","నేనే తక్కువ ఇచ్చానని నీకు ఎందుకు అనిపించింది?","How did you know the shortage was on my end?"
"63","నా మనిషి చెప్పాడు కాబట్టి.","I know because my guy told me."
"63","అది చెప్పింది నేను నమ్మే డానీ కాబట్టి.","And I trust my guy, Danny."
"64","ఎందుకు డానీ మీద నీకు అంత నమ్మకం, బాసూ?","And why do you trust Danny, man?"
"65","మేమిద్దరం చిన్ననాటి స్నేహితులం.","We grew up together."
"66","సెంటిమెంటల్ గా బాగుంది.","That's adorable."
"68","జిమ్మీ.","[Danny sobbing] Jimmy."
"68","నన్ను క్షమించు, జిమ్.","I I'm sorry, Jim."
"69","డానీ.","Danny."
"69","జిమ్మీ, నన్ను క్షమించు.","Jimmy, I'm so sorry."
"70","ఏం చేశావు నువ్వు?","What did you do?"
"72","చెప్పు.","[Rog] Tell him."
"73","చెప్పు.","Tell him."
"73","నీ డ్రగ్స్ నుండి ఒక కిలో దొంగిలించాను.","[Danny sniffles, groans] I stole your key, man."
"74","బర్న్స్ మనుషులకి బాకీ తీర్చాల్సి ఉండింది.","I needed to get right with Bern's people. [sobs]"
"75","తప్పు మా వైపు లేదని మాకు తెలుసు.","We knew it wasn't us."
"76","దీని గురించి నాకు అస్సలు తెలీదు.","I had no idea."
"77","ఆ ముక్క వాడు చెప్పాడులే.","He told me that."
"78","వద్దు, రాజ్, వద్దు!","No, Rog, no!"
"79","సరే.","Okay."
"79","హానికరం కాని బుల్లెట్.","Bean bag."
"79","సరే, వాడు ఒక కిలో ఎత్తేశాడు.","Okay, he clipped the key."
"80","సరేనా?","Okay?"
"80","ఇదుగో ఆ ఒక కిలో.","Here's a key."
"82","ఇదుగో ఇంకోటి.","[Danny sobs] A And a second."
"83","నీకు కలిగిన సమస్యకు.","For your trouble."
"85","వద్దు, వద్దు!","[Danny gasps] No, no!"
"86","అబ్బా! సరే. ఇది నిజమైన బుల్లెటే.","Fuck, man! ! Okay. Okay. [Danny sobbing] Not a bean bag."
"87","మన స్నేహానికి గుర్తుగా ఇంకోటి.","And a third for our friendship."
"88","ఇది కేవలం డబ్బుకు సంబంధించినది మాత్రమే కాదు.","You know, this isn't just about the money."
"89","అబ్బా.",", come on."
"89","ప్రతీదానిలో కూడా డబ్బు కాకుండా ఇంకేదో ఉంటుంది, కానీ చాలా వరకు డబ్బుకు సంబంధించినవే.","Nothing's just about money, but they mostly are."
"90","వాడు నా దగ్గర దొంగిలించాడు.","He stole from me."
"91","లేదు, వాడు దొంగిలించింది నా నుండి.","No, he stole from me."
"91","దానికి నేను నీకు మూల్యం చెల్లించా కూడా.","I'd already paid you."
"92","ఏదైనా పొరపాటు జరిగి ఉంటే, అందుకు నాకు పరిహారం లభిస్తుందని ఇక్కడికి వచ్చాను, కానీ ఏ పొరపాటూ జరగలేదు.","I came here today to be compensated if there had been some kind of mistake, but there wasn't."
"93","ఈ దరిద్రుడు నా దగ్గరి నుండి దొంగిలించాడు, అంతే.","Just this asshole stealing from me."
"94","కానీ తప్పు నాది అన్నాడు.","But blaming me."
"94","నేను అలా అస్సలు అనలేదు.","No, I never blamed you."
"95","నేను నోర్మూయ్!","I didn't Shut the fuck up!"
"97","రాజ్.","Rog."
"97","వీడు నాకు ఫస్ట్ క్లాసు నుండి తెలుసు.","This guy, I've known him since first grade."
"97","నా కుటుంబంలో ఒకడు అని చెప్పవచ్చు.","He's like family."
"98","నీ తమ్ముడిని ఇక మర్చిపో అని నిన్ను అడిగితే ఎలా ఉంటుందో చెప్పు!","Be like if you were asked to give up your own brother."
"99","ఏది ఏమైనా, నువ్వు ఆ పని చేయలేవు కదా?","No matter what, could you do it?"
"100","ఇంకా నీ దగ్గర సగం బ్యాగ్ నిండా ఉన్నాయి.","You still have half the bag."
"101","నా కుటుంబాన్ని కాపాడుకోవడానికి నేను మొత్తం బ్యాగుని ఇచ్చేస్తాను.","My family would be worth the whole bag."
"103","మన కుటుంబాలు వేర్వేరు అనుకుంటా.","I think we come from different types of family."
"104","అంటే, వాడి ప్రాణం ఖరీదు మూడు కిలోలే అంటావా?","So, you're saying his life is only worth three kilos?"
"105","వాడి ప్రాణం ఖరీదు, నువ్వు ఎంత పోగొట్టుకున్నావో, దానికి మూడింతలు, ఎందుకంటే, నువ్వేమీ పోగొట్టుకోలేదు!","[groans] His life is worth three times what you lost, because you lost nothing!"
"106","వీడి ప్రాణం ఖరీదు మూడు కిలోలేనా?","He's only worth three kilos?"
"107","అవును! నాకు వీడి ప్రాణం ఖరీదు మూడు కిలోలే!","Yes! Okay, his life is only worth three kilos to me!"
"111","నాతో యవ్వారం చేసే వాళ్లు నిజాయితీగా ఉండటమే నాకు కావాలి.","All I ask of the people I do business with is their authentic self."
"112","కలిసినందుకు సంతోషంగా ఉంది, జిమ్మీ.","[sighs] Nice to see you, Jimmy."
"113","ఈ కుర్ర కుంకను కారు దాకా తీసుకెళ్లడానికి ఆ బండిని వాడుకో.","You can use the cart to, , transport that young rascal to the car."
"116","మెనూ చూశారా, సర్?","[server] Have you had a look at the menu, sir?"
"118","అయ్యో, ఇంకా చూడలేదు. మన్నించండి రొషెల్.","Jesus. No. I'm sorry Rochelle."
"119","నాకు మంచి నీరు తీసుకువస్తారా?","Could I get a water, please?"
"120","మీరు వచ్చినప్పుడు ఆర్డర్ చెప్తాను.","And I'll have an answer for you by the time you're back?"
"121","అలాగే, సర్.","Of course, sir."
"122","నా పేరు జిమ్మీ.","Jimmy."
"123","సరే, జిమ్మీ.","Of course, Jimmy."
"124","అంతే.","[Rochelle moaning] [""Don't Let Him Go"" playing] Yeah."
"127","చేతులు గాల్లో పెట్టరా, చచ్చినోడా!","Hands, motherfucker! Hands!"
"129","నవ్వు వస్తోందా, సన్నాసీ?","[chuckles] You smiling now, bitch?"
"133","ఇక నేను లేవవచ్చా?","Can I get up now, please?"
"134","ఇలాగే ఉండి, అంతా నాకేయ్.","You just lie there and take it."
"136","అంతా క్లియర్.","[agent 1] We're clear."
"137","దాన్ని ఆపేయండి.","[agent 2] Turn it off. [music stops]"
"140","బాబోయ్, జింబో.","Damn, Jimbo."
"140","నిన్న రాత్రి ఏం చేశావేంటి?","What you get up to last night?"
"142","కనీసం నీకు తన పేరేంటో తెలుసా?","You even know her name?"
"143","రొషెల్.","[Jimmy] Rochelle."
"144","మరి ఇంటి పేరు?","Her last name?"
"145","ఏదైనా స్థానిక స్కూలుకు వెళ్లి కాల్పులు జరుపుదామని ప్లాన్ చేస్తున్నావా ఏంటి?","Planning to shoot up a local middle school?"
"146","అది ఎఫ్.బీ.ఐ విషయం.","[agent 1] That's federal."
"148","ఇదేంటి, జింబో?","Fuck is this, Jimbo?"
"149","నా పేరు జిమ్మీ. అది ఏకే47.","Jimmy. It's an AK-47. [FBI agent]"
"150","దీని వల్ల నీకు పడే శిక్ష తగ్గే అవకాశం అస్సలు లేదు.","It's a ""no possibility of reduced sentence."""
"151","నా దగ్గర మంచి మంచి లాయర్లు ఉన్నారు.","I got great lawyers."
"152","వారికి మాయమంత్రాలేమైనా తెలుసా ఏంటి?","They turn water into wine?"
"156","హేయ్! నిన్ను కలవడానికి ఎవరో వచ్చారు.","[guard 1] Hey! You got a visitor."
"158","ఒకటవ కిటికీ!","[guard 2] Window one!"
"159","అది పోయినసారి ప్రయత్నించారు కీన్, తర్వాత నువ్వే, రెండవ విండో దగ్గరకు వెళ్లు.","They tried that last time [guard 2] Keene. Next up, window two."
"161","మూడవ విండో వద్దకి వెళ్లు.","[guard 2] Window three, you're up."
"162","నువ్వు బాగానే ఉన్నావా?","You okay?"
"163","చూడటానికి మీ అమ్మ ఏమైనా వచ్చిందా?","Did your mother come visit you yet?"
"164","అప్పుడు జరిగినదానిలో నా వల్ల టిమ్ ఇరుక్కునందుకు ఆమెకి ఇంకా కోపం తగ్గలేదు.","She's still pissed I got Tim mixed up in that thing a while back. [sighs]"
"165","కనీసం నీ తమ్ముడైనా విడుదల అవ్వబోతున్నాడులే.","Well at least your brother's gonna walk."
"166","నేను విడుదల అవ్వట్లేదా?","I'm not?"
"167","నేను కొందరితో మాట్లాడాను.","I talked to some of the guys."
"168","నిన్ను అడ్డుపెట్టుకొని ప్రాసిక్యూటర్, బోమోంట్ ఏదో నిరూపించుకోవాలని ప్రయత్నిస్తున్నాడట.","They said the prosecutor, Beaumont, he's trying to prove something with you."
"169","ఏం నిరూపించుకోవాలనుకుంటున్నాడు?","Prove what?"
"170","అతనికి డ్రగ్స్ మాఫియాతో సంబంధాలు లేవని.","That he's not part of the machine."
"171","నాకు కూడా సంబంధాలు లేవు.","I'm not part of the machine."
"172","కానీ ఒకప్పుడు నాకు ఉండేవి.","I was."
"173","నా కుటుంబానికి ఉండేవి.","My family."
"174","మీ అమ్మ కుటుంబానికి ఉండేవి.","Your mother's family."
"175","దీని నుండి బయటపడే మార్గం ఉంది కదా?","Tell me there's a way out of this."
"176","త్వరగా అయ్యేది లేదు.","Not a quick one."
"177","నాల్గవ విండో వారికి సమయం అయిపోయింది.","[sighs] [guard 2] Window four, that's it."
"178","నీకు అయిదేళ్ళ శిక్ష పడుతుంది.","[Jimmy's dad] You'll get five years."
"179","అయిదు.","Five."
"180","సత్ప్రవర్తనతో నాలుగు ఏళ్లు.","Four with good behavior."
"181","కనీస శిక్షాకాలం విషయానికి వస్తే, నువ్వు నేరాన్ని అంగీకరిస్తే, రెండేళ్ళ శిక్ష పడుతుంది.","The low end of the sentencing guidelines is if you take the plea, you get two years."
"182","కానీ వాళ్లు శిక్షని రెండేళ్లకే పరిమితం చేస్తారని నేను అనుకోను.","They're not gonna give you two years."
"183","ఎందుకని?","Why not?"
"184","తుపాకుల వల్ల.","The guns."
"185","నువ్వు కారులో తిరుగుతూ ముసలాళ్లను కాల్చి పారేసే రకం కాదు.","You're not some homey who's running around capping grandmothers, doing a drive-by."
"186","నువ్వు డ్రగ్స్ అమ్మలేదు, సరేనా?","You didn't sell crack, right?"
"187","నువ్వు నేరాలకు దూరంగా బతుకుతున్న మంచివాడివి.","You're a good kid who strayed off the path."
"188","నువ్వు మధ్యస్థ శిక్ష స్థాయికి ఒప్పుకోవాలి.","You'll have to do the midrange."
"189","అలా అని నువ్వు ఎలా చెప్పగలవు?","How do you know?"
"191","నేను పోలీసుగా 23 ఏళ్లు పని చేశాను.","I was a cop for 23 years."
"192","నేను అందరినీ వాకబు చేశాను, అందరూ ఇదే చెప్పారు.","And I asked around, and they all said the same thing."
"193","మధ్యస్థ శిక్షాకాలానికి ఒప్పుకోవాలి.","Midrange of the guidelines."
"194","అయిదు ఏళ్ళు.","Five."
"195","నాలుగేళ్లలో బయటకు వచ్చేయవచ్చు.","Out in four."
"196","నేను నీకు ఈ గతి పట్టాలని నేనెప్పుడూ కోరుకోలేదు.","I, um I never wanted this for you."
"197","నీ జీవితం వేరుగా ఉండాలని కోరుకున్నాను.","I wanted a totally different deal."
"198","వేరుగా అంటే?","Like what?"
"199","ఇదివరకే చెప్పా కదా.","Like I said."
"200","లేదు.","No."
"201","ఏంటి?","What?"
"202","నువ్వు, అదే అదంటే ఏంటి?","For you to have, you know No, I don't."
"203","భార్యాపిల్లలతో ఉండాలని.","A wife. Kids."
"204","ఆడుకోవడానికి కుక్క ఒకటి ఉండాలని.","A fucking dog to play Frisbee with."
"205","స్థిరమైన జీతం వచ్చే ఉద్యోగం ఉండాలని.","And a steady paycheck."
"206","రిటైర్ అయ్యాక పెన్షన్ ఉండాలని.","Pension at the end."
"207","నేను.","I do."
"208","నేను ఏంటి?","I couldn't have What?"
"209","ఆ జీవితంలో ఉండుంటే నీకు సాయపడగలిగి ఉండేవాడినే కాదు.","[breathes shakily] helped you if I lived that life."
"210","అయినా కానీ నువ్వు ఆ జీవితం గడపడమే నాకు కావాలి.","I still wanted it for you."
"211","నాకు తెలుసు.","I I know. [breathes shakily]"
"212","నీకు కావలసింది అదే అని తెలుసు, నాన్నా.","I know you did, Dad."
