"Index","Telugu Text","Mapped English Text"
"213","కానీ నువ్వు ఎప్పుడూ ఆ విషయం నాకు చెప్పలేదు.","You just never mentioned it before."
"214","నాల్గవ విండో! మీ సమయం అయిపోయింది.","[guard 2] Four! Window four, all done."
"215","ఆ ఒప్పందాన్ని ఒప్పుకో.","T Take the deal."
"215","సరేనా?","Okay?"
"215","ఒప్పుకో.","Plea out."
"217","సరే మరి.","Okay."
"217","యునైటెడ్ స్టేట్స్ వర్సెస్ జేమ్స్ కీన్ కేసులో మిస్టర్ బోమోంట్, మీతో ప్రతివాది ఒక ఒప్పందాంగీకారానికి వచ్చారని నేను భావించవచ్చా?","In the case of the United States versus James Keene Mr. Beaumont, am I to understand that the defendant has entered into a plea agreement with your office?"
"218","అవును, యువర్ హానర్.","He has, Your Honor."
"219","మరి మిస్టర్ స్టయిన్బెక్, దేనికి అంగీకరిస్తున్నారో మీ క్లయింట్ కి పూర్తిగా తెలుసు కదా?","[judge] And Mr. Steinbeck, is your client fully aware of what he's pleading to today?"
"220","తెలుసు, యువర్ హానర్.","He is, Your Honor."
"221","మిస్టర్ కీన్.","[judge] Mr. Keene."
"222","మీ నాన్నగారు మాజీ పోలీసు కదా?","Police officer's son, correct?"
"223","అవును, సర్.","Yes, sir."
"224","కాంకకీ హై స్కూలులో ఉన్నప్పుడు మేటి క్రీడాకారులు మీరు.","Star athlete at Kankakee High."
"225","కొన్ని స్థానిక చారిటీలకు ఉదారంగానే విరాళాలు ఇచ్చినట్టు కూడా ఉన్నారు.","I see you're quite generous with a few local charities."
"226","కానీ నేడు మాదక ద్రవ్యాల అమ్మకానికి, వర్తకానికి పాల్పడుతున్నట్టు, అలాగే వాటికి కావలసిన సామాగ్రి మీ దగ్గర ఉన్నట్టు, ఇంకా అనేక చట్టవిరుద్ధ తుపాకులు ఉన్నట్టు మీరు అంగీకరిస్తున్నారు.","But what you're pleading guilty to today is the sale and trafficking of narcotics, the possession of paraphernalia associated with the same, and possession of multiple illegal firearms."
"227","వీటన్నింటికీ ఒప్పుకుంటున్నారా?","So, how plead you?"
"228","నేరాన్ని అంగీకరిస్తున్నాను.","Guilty."
"229","మిస్టర్ కీన్, మీ వద్ద మాదక ద్రవ్యాలు ఎంత మొత్తంలో లభించాయంటే, అవి చాలు మీకు పాతికేళ్ల శిక్షని విధించడానికి.","The sheer amount of narcotics that you trafficked in, Mr. Keene, is enough to push your sentence to 25 years."
"230","మీ కేసే కనుక విచారణకు వెళ్లుంటే, మీకు కనీసం ఆ పాతికేళ్ల శిక్ష పడి ఉండేది.","Which you most certainly would have gotten at minimum if your case had gone to trial."
"231","కానీ ఇవాళ మీరు తెలివిగా నేరాన్ని అంగీకరించారు.","But you did the smart thing today. You pled."
"232","అయినా కూడా, ఇవి గాక మీ దగ్గర ఆయుధాలు దొరికాయి, మీ మాదకద్రవ్యాలను కాపాడుకోవడానికి వాటిని ఇతరుల మీద ప్రయోగించడానికే అవి మీ దగ్గర ఉన్నాయని భావిస్తున్నాం.","Still, there are the weapons, which one presumes you were prepared to use against other human beings to protect your narcotics."
"233","కాబట్టి, ప్రతివాదిని యునైటెడ్ స్టేట్స్ అటార్నీ జనరల్ కస్టడీకి గానీ, లేదా ఆమె అధికారిక ప్రతినిధి కస్టడీకి గానీ, కనీసం 120 నెలల శిక్షాకాలనికి అప్పగించవలసిందిగా ఈ కోర్టు తీర్పు ఇస్తోంది.","Therefore, it is the judgment of the court the defendant be committed to the custody of the attorney general of the United States, or her authorized representative, for the minimum guideline term of 120 months."
"234","బంట్రోతు.","[judge] Bailiff."
"235","పదేళ్ళా?","Ten years?"
"236","పది ఏళ్లా?","Ten fucking years?"
"236","కామెడీయా?","Are you kidding me?"
"237","నువ్వు అబద్ధమాడావు, బోమోంట్! నాతో పచ్చి అబద్ధమాడావు!","You lied to me, Beaumont! You fucking lied to me!"
"240","ఇది ఎందుకో తెలుసా?","You know what this is about?"
"244","బేడీలు ఉంచాలా, తీసేయాలా?","[guard 2] On or off?"
"245","తీసేయాలి.","Off."
"247","నేను స్పెషల్ ఏజెంట్ లారెన్ మెక్ కాలీని.","I'm Special Agent Lauren McCauley."
"248","అలా అయినా పిలవవచ్చు, లారెన్ అని అయినా పిలవవచ్చు.","You can call me that or Lauren."
"249","నీకు జింబో అని పిలవడం ఇష్టం లేదనుకుంటా.","I remember you don't like ""Jimbo."""
"250","జిమ్మీ అని పిలవండి.","Jimmy, please."
"251","నీకు మిస్టర్ బోమోంట్ తెలుసు కదా!","And you know Mr. Beaumont."
"252","మిస్టర్ బోమోంట్, నాకు పదేళ్ళ శిక్ష పడుతుందని తెలిసి కూడా అయిదేళ్లని అబద్దం చెప్పి నాచేత నేరాంగీకరం చేయించాడు.","Mr. Beaumont sandbagged me into accepting a five-year plea when he knew I'd get ten."
"253","నీకు గుర్తుంది అన్నమాట?","So you remember it?"
"254","పరోల్ కి కూడా దిక్కు లేదు.","[Jimmy] No possibility of parole."
"255","ఆ ఒప్పందానికి ఎవరైనా ఒప్పుకుంటారా?","Who takes that deal?"
"256","నువ్వు ఒప్పుకున్నావుగా.","You. [chuckles]"
"257","నువ్వు డ్రగ్స్ వ్యాపారివి.","You're a drug dealer."
"258","మాతో పెట్టుకున్నావు, ఇలా అనుభవిస్తున్నావు.","And you played chicken with us, and you lost."
"259","ఆ విషయాన్ని అంగీకరించు.","Embrace that concept."
"260","ఇక కూర్చో.","Now, sit down."
"263","జైలులో బాగానే నెట్టుకువస్తున్నావని విన్నానే.","I hear you're making a real go of prison."
"264","పెద్ద పెద్ద గొడవల్లో దూరడం లేదు.","No major beefs."
"265","పెద్ద పెద్ద ముఠాలతో సఖ్యంగానే ఉంటున్నట్టున్నావు, ఇంకా తెలియని ముఠాల జోలికి వెళ్లకుండా బాగానే తప్పించుకుంటున్నావు కూడా.","Seem to get along with most of the dominant gangs and successfully avoid the ones you don't know yet."
"266","ఇంకా ఒక సైడ్ బిజినెస్ కూడా చేస్తున్నావే?","And you've developed a sideline in here?"
"267","సూపర్ అంటే సూపర్.","No shit."
"268","అది కూడా అక్కడ రాసుందా?","That's in there?"
"269","నీకు వచ్చే లాభాల నుండి కూరగాయలను, కొవ్వు తీసేసిన మాంసాన్ని కొంటున్నావా?","You use your profits to buy fresh vegetables and lean cuts of meat?"
"270","జైలు ఆహారం చండాలంగా ఉంటుంది.","Prison food sucks."
"271","జైలు జీవితం కూడా అలాగే ఉంటుంది, కానీ నువ్వు అయితే ఇక్కడ కూడా బాగా లాగిస్తున్నట్టున్నావు.","So does prison life, but you seem to have grabbed it by the balls."
"272","ఇంతకీ ఈ సైడ్ బిజినెస్ ఏంటి?","[sniffs] What is this sideline, by the way?"
"273","ఒక సేవ, అంతే.","Just a service."
"274","అయ్యో, గొప్పలు చెప్పుకోవడం ఇష్టం లేదే పాపం.",", he's so modest."
"275","నువ్వు పోర్న్ మ్యాగజీన్స్ ని అద్దెకి ఇస్తావు, కదా?","You rent porno mags, right?"
"276","""హస్లర్."" ""పెంట్ హౌస్."" ""బేర్లీ లీగల్.""","Hustler. Penthouse. Barely Legal."
"277","ఇంతకీ అది ఎలా చేస్తున్నావు ఏంటి?","How's that work?"
"278","అర్ధ గంట పాటు అద్దెకి ఇస్తాను.","They pay for half-hour blocks."
"279","అలా అయితే చాలా రిటైల్ వాణిజ్యంలో దాన్ని ఏమంటారు?","Must be a lot of What do they call it in retail?"
"279","బ్రేకేజా?","Breakage?"
"280","నా వస్తువులను నేను మారుస్తూ ఉంటాను.","I turn my inventory over a lot."
"281","డ్రగ్స్ ని కూడా నువ్వు అలానే పిలిచావు. నీ ""వస్తువులు"" అని.","That's what you called drugs too. Your ""inventory."""
"282","టేపులలో నేను అలానే విన్నానులే.","At least on the tapes I heard."
"283","నువ్వు ఇక్కడ బాగానే విజృంభిస్తున్నావు, జిమ్మీ.","I'm not surprised you're thriving in here, Jimmy."
"284","నేనేమీ విజృంభించడం లేదు.","I'm not thriving."
"285","ఎంతైనా నీది ఆకట్టుకొనే వ్యక్తిత్వం.","Because you're a charming guy."
"285","అందరికీ నచ్చేస్తావు.","Everyone likes you."
"286","ఎల్మ్ వుడ్ పార్క్ సోషల్ క్లబ్ లో నువ్వు మెక్సికన్ డ్రగ్ డీలర్స్ తో, కబ్రీనీ-గ్రీన్ బ్యాంగర్స్ తో, ఇంకా ట్రాక్ సూట్లలో ఉన్న స్థానిక గూంబాలతో మాట్లాడావని విన్నాను.","I've heard you talk to Mexican cartel guys, Cabrini-Green bangers, Outfit goombahs in their tracksuits at the Elmwood Park Social Club."
"287","అందరితో బాగా కలసిపోతావు.","You get along with everyone."
"288","నీలోని ఇంకో గుణాన్ని కూడా నేను గమనించాను.","I've noticed something else."
"289","కొంత సమయం గడిచాక, ఎక్కువగా వాళ్లే మాట్లాడతారు.","After a certain point, they do most of the talking."
"290","ఏమన్నారు?","I'm sorry?"
"291","నువ్వు చెప్పాలనుకున్న ఒకట్రెండు సరదా కథలను చెప్పేస్తావు, ఆ తర్వాత నువ్వు నింపాదిగా కూర్చుంటావు, వాళ్లు మాత్రం లొడాలొడా వాగడం కొనసాగిస్తారు.","You've got your patter, your funny story or two, but then you settle back and just let them run their mouths."
"292","నన్నే తీసుకో.","Take me."
"293","నీ కళ్లలోనే ఏదో మాయ ఉంది.","Something in those soulful eyes of yours."
"294","కదలకుండా, ప్రశాంతంగా కూర్చుంటావు.","The way you sit so still, so at peace with yourself."
"295","దానితో ఏదోకటి చెప్పేయాలని, అన్ని నిజాలను కక్కేయాలని నాకు అనిపిస్తుంది.","It makes me want to babble, man. Unlock myself."
"296","మీరు ఇంతకు ముందు ఏదో అన్నారే?","You mentioned a point a while back?"
"297","నీకేమైనా అర్జంట్ పని ఉందా?","You in a rush?"
"297","అలా అయితే నువ్వు ఆ పని చూసుకోవచ్చు.","'Cause we can let you get back to it."
"298","ఏం పర్వాలేదు.","No. I'm fine."
"299","పోర్న్ అమ్ముతున్నావు, కూరగాయాలు కొనుక్కుంటున్నావు, ఇంకా నీ శిక్షాకాలంలో కేవలం తొమ్మిదేళ్ల మూడు నెలలే ఉన్నాయి.","You got porn to sell, veggies to procure, and only, , nine years, three months left on your sentence?"
"300","మీకేం కావాలో చెప్పండి.","Just tell me what you want."
"300","నీ పనికి ఆటంకం కలిగించాలని మాకు లేదు.","I don't wanna hold you up."
"301","నన్ను ఇక్కడికి ఎందుకు రమ్మన్నారో, అది చెప్పండి చాలు.","Just fucking tell me why I'm here."
"302","కోపం.","Temper."
"303","ఇతను అనుకుంటున్నంత ప్రశాంతమైనవాడేమీ కాదు.","Not as cool as he thinks."
"305","నువ్వు వేరే జైలుకు బదిలీ అవ్వాలి, అక్కడ ఒకరిని మచ్చిక చేసుకొని, నేరాన్ని ఒప్పుకొనేలా చేయాలి.","We would like you to transfer to another prison and befriend someone to elicit a confession."
"306","మాకు శవం ఉండే ఖచ్చితమైన చోటు కావాలి.","We need the precise location of a dead body."
"307","మీకు కావాలా?","You need it?"
"308","నువ్వు చదవబోయే ఆ ఫైలులో ఉన్న వ్యక్తి పద్నాలుగు మంది మహిళలని చంపాడని, మేము అనుమానిస్తున్నాం. ఆ లెక్క ఇంకా ఎక్కువే ఉండవచ్చు కూడా.","We suspect that the man that you'll read about in that file has killed 14 women, maybe more."
"309","కానీ అతను కేవలం రెండే హత్యలు చేసినట్టు మేము రుజువు చేయగలిగాం.","But we only tied him to two. And we only have one of the bodies."
"310","మాకు మరో శవం ఆచూకీ కావాలి.","We'd like to find the other one."
"310","మిగతా 12 శవాల ఆచూకీ దొరికినా పర్వాలేదు.","And maybe 12 more."
"311","ఇంతకీ ఇతను ఏ జైల్లో ఉన్నాడు?","And this prison where the guy is?"
"312","మిస్సోరీలో ఉన్న స్ప్రింగ్ ఫీల్డ్ లో.","It's in Springfield, Missouri."
"313","భద్రత కట్టుదిట్టంగా ఉంటుంది, తీవ్రమైన నేరాలకు పాల్పడినవారిని అక్కడ ఉంచుతారు.","Maximum security, specializing in the criminally insane."
"315","అయితే నన్ను నరకంలోకి అడుగుపెట్టమని, ఒక రాక్షసుడితో స్నేహం చేయమని, ఆ తర్వాత నింపాదిగా, ""హేయ్, ఆ 13 శవాలను ఎక్కడ పూడ్చి పెట్టావు?"" అని అడగమంటున్నారా?","So you want me to check in to hell, cozy up to a fucking demon, and ask him all casual, ""Hey, so where'd you bury 13 bodies?"""
"316","అంతేనా?","Is that right?"
"318","ఎంత డబ్బు ఇచ్చినా ఆ పని చేయను.","Not for all the fucking money in the world."
"319","మరి నీకు స్వేచ్ఛ ఇస్తామంటే?","How about freedom?"
"320","నీ జైలు శిక్ష మొత్తం రద్దు చేయబడుతుంది.","A complete commutation of your sentence."
"321","నేను ఆ జైలుకు బదిలీ అయితే?","If I transfer?"
"322","నువ్వు బదిలీ అవ్వాలి.","If you transfer."
"323","ఇంకా పట్రీషియా రైట్లర్ శవం ఎక్కడ ఉందో నువ్వు మాకు చెప్పాలి.","And if you get the location of Patricia Reitler's body."
"324","శవం దొరక్కపోతే, విడుదల కాలేవు.","No body, no release."
"325","శవం దిరికితేనే విడుదల.","No body, no release. [sighs]"
"326","నేను ఒప్పుకోను.","No."
"327","ఒప్పుకోవా?","[Lauren] No?"
"327","లేదు.","/ [Jimmy] No."
"328","అతను పైకోర్టుకు అప్పీలు పెట్టుకున్నాడు.","[Lauren] His conviction's on appeal."
"328","అది గెలిచి, విడుదల అయ్యి వెళ్లిపోగలడు.","He could win and walk."
"329","అదే జరిగితే, అతను ఏదోక తప్పు చేసి పట్టుబడేదాకా, మళ్లీ హత్యలు జరుగుతాయి.","If he walks, he'll kill again and again until he fucks up and gets caught."
"330","ఇప్పటికే పట్టుబడక ముందు పద్నాలుగు మంది అమ్మాయిలను చంపాడు.","The last time, he killed 14 girls before he got caught."
"331","వాటికి, నాకు ఏ సంబంధమూ ఉండదు కదా.","And it won't have anything to do with me."
"332","తప్పకుండా ఉంటుంది.","[Lauren] It will."
"333","అతడిని అడ్డుకొనే అవకాశం నీకు వచ్చినా నువ్వు అందుకోలేదు.","You had the chance to stop him, and you didn't take it."
"334","చూడండి, ఈ మహిళల విషయంలో జరిగినదానికి నేను చింతిస్తున్నాను, కానీ వాళ్లెవరో నాకు తెలీదు.","Look, I'm sorry about these women, but I don't know them."
"335","అతను విడుదలైనా కానీ, నన్ను అయితే చంపడు కదా.","And if he gets out, I won't know the next ones he kills."
"336","అది నాకు బాధాకరంగానే అనిపించవచ్చు, కానీ ఇలాంటి అదృష్టం ఒక్కసారే తలుపు తడుతుంది.","I might be sad about it, but This kind of deal won't walk through the door twice."
"337","కాబట్టి, ఒప్పందానికి ఎందుకు ఒప్పుకోలేదా అని పదేళ్లు బాధపడుతూ కూర్చొనే ముందు ఫైలును ఒక్కసారి చూడు.","So, before you spend the next ten years wondering why you didn't take it look at the file."
"338","ఎంతైనా, అది చదవడానికి చాలా ఆసక్తికరంగా ఉంటుంది.","At the very least, it'll make unique reading material."
"339","నీ లాయర్ దగ్గర మా కాంటాక్ట్ సమాచారం ఉంది.","Your attorney has our contact info."
"345","అదరగొట్టేయ్, బ్రూక్! జార్జ్ టౌన్, ఇల్లినాయి!","Come on, Brooke!"
"346","సెప్టెంబర్ 10, 1993 నాలుగు సంవత్సరాల ముందు బాగా ఆడు, బ్రూకీ!","[spectator] Come on, Brookie!"
"347","భలే పట్టేసుకుందే.","She hung onto it."
"347","దేవుడా.","Holy shit."
"347","అవును!","She did!"
"348","సరే, ఓహ్.","Okay, o."
"349","హనీ, నువ్వు వెళ్లాల్సింది ఇటు పక్కకి! హనీ, ఇటు పక్కకి వెళ్లు!","Honey, you're going the wrong direction! Honey, the other way!"
"350","అటు కాదు వెళ్లాల్సింది! ఇటు వైపుకు పద!","Wrong direction! The other way!"
"352","చాలా వేగంగా పరుగెత్తుతోంది.","Well, she runs pretty fast."
"353","అవును.","[chuckles] Yeah."
"353","బాగా పరుగెత్తుతుంది, కదా?","Not bad, right?"
"355","డిన్నర్ కి ఇంటికి వస్తాడా?","Will he be home for dinner?"
"356","రాకపోవచ్చు.","Not likely."
"357","జెస్సికా రోచ్ శవం దొరికింది.","We found Jessica Roach."
"358","ఎవరి స్థానాల్లో వారు ఉండండి.","Line it up."
"358","బాల్ పెడుతున్నాను.","Here we go."
"358","ఫస్ట్ డౌన్.","First down."
"364","అక్కడ.","Over there."
"364","అవును.","Yeah."
"366","అతను ఇక్కడే ఎక్కడో దిగాడు.","He stepped out right about here."
"367","చూడటానికి ఎలా ఉంటాడు?","What did he look like?"
"368","తెల్లజాతీయుడు.","[witness] He was white."
"368","నాకు అంతకన్నా ఇంకేమీ కనిపించలేదు.","That's about all I saw."
"369","పొట్టివాడా?","Was he short?"
"369","పొడగరా?","Tall?"
"369","బట్ట తలనా?","Bald?"
"369","కాదా?","Not bald?"
"370","అంత బాగా నేను గమనించలేదు.","I didn't get a good look at him."
"370","అతను వ్యాన్ ఎక్కేసి వెళ్లిపోయాడు.","He hopped in a van and drove off."
"371","ఆ వ్యాన్ రంగు ఏంటి?","What color van?"
"372","బూడిద రంగో, గోధుమ రంగో.","It was like a gray or brown."
"373","అది రాత్రి కదా.","It was night."
"373","పచ్చదో, నలుపుదో కూడా అయ్యుండవచ్చు.","It could have been green too, or black."
"374","కానీ అది ఖచ్చితంగా డాడ్జ్ కంపెనీదే.","I know it was a Dodge, for sure."
"375","వ్యాన్ రంగు తెలీదు కానీ, అది ఏ కంపెనీదో నేను మెకానిక్ ని.","You don't know the color of the van, but you know I'm a mechanic."
"375","డాడ్జ్ ని చూడగానే చెప్పేయగలను.","I know a Dodge when I see one."
"377","వర్మిలియన్ కౌంటీ షెరిఫ్ డిపార్టుమెంట్. నేను మీకు ఏమైనా సాయపడగలనా? పదమూడు నెలల అనంతరం?","[receptionist] Vermilion County Sheriff's Department. Can I help you?"
"378","ఉన్నారు.","He sure is. [speaks indistinctly]"
"380","హేయ్, లెన్.","Hey, Len."
"380","విటియర్ లో నువ్వు రెండు వారాల క్రితం అసభ్య ప్రవర్తన అని ఒక రిపోర్ట్ ఫైల్ చేశావు కదా?",", you filed a report a couple of weeks ago on a possible 647 over at Whittier?"
"381","అవును.","Yep."
